PID,sess,firstBlock,block,type,questionId,wait_duration,answer,question
A03172343NB8PHOPICC1,1,general,corona,Not useful,C_08_NU,8,Lombardy,What is the name of the county in Italy that had the first coronavirus outbreak?
A03172343NB8PHOPICC1,1,general,corona,Not useful,C_17_NU,16,"Locations, people, or animals","The name for the new disease COVID-19 adheres to WHO best practices in disease naming, which include guidelines to not name disease after what?"
A03172343NB8PHOPICC1,1,general,corona,Not useful,C_22_NU,12,Contact tracing,What is the name of the process health authorities use to understand the sources of infection and to prevent further transmission?
A03172343NB8PHOPICC1,1,general,corona,Not useful,C_24_NU,8,Contagion,"According to media reports, which 2011 movie has seen a large increase in popularity in the wake of the new coronavirus?"
A03172343NB8PHOPICC1,1,general,corona,Useful,C_35_U,16,"The virus spreads through coughs and sneezes, there are no reports of transmission through mosquito bites.",Can the new coronavirus be transmitted through mosquito bites?
A03172343NB8PHOPICC1,1,general,corona,Useful,C_38_U,4,People of all ages can be infected by the new coronavirus. Older people appear to be more vulnerable to becoming severely ill with the virus.,"Does the new coronavirus affect older people, or are younger people also susceptible?"
A03172343NB8PHOPICC1,1,general,general,Not useful,NC_02_NU,8,Tiger Woods,"Who's the only two-time Sports Illustrated Sportsman of the Year, so named in 1996 and 2000?"
A03172343NB8PHOPICC1,1,general,general,Useful,NC_33_U,8,Below eye level,Where in the supermarket can you usually find the cheaper items?
A03172343NB8PHOPICC1,1,general,third,MTurk,TB_29_MT,12,"There are a few helpful techniques. One is to imagine that you climb on top of a high building, and ""look down"" at your life. Second, to try to think about issues in novel ways. ",How to stay calm in adversity?
A03172343NB8PHOPICC1,1,general,third,MTurk,TB_35_MT,16,Prototypes already exist. Technological estimates suggest that definitely within the next twenty years -- although the challenges are great.,When will we have flying cars?
A03172343NB8PHOPICC1,1,general,third,MTurk,TB_43_MT,16,"Planets likely start off as grains of dust that then combine to form bigger rocks. They clear material from their path, leaving tracks of space empty but for fine dust.",How do planets form?
A03172343NB8PHOPICC1,1,general,third,Trivia,TB_05_TR,12,Hong Kong,What city's harbor is overlooked by Victoria Peak?
A03172343NB8PHOPICC1,1,general,third,Trivia,TB_10_TR,16,George VI,Who was the last British Monarch to also be an emperor?
A03172343NB8PHOPICC1,1,general,third,Trivia,TB_16_TR,8,Jim Lovell,Alan Shepard was scheduled to command the ill-fated Apollo 13 before switching missions with what astronaut?
