PID,sess,firstBlock,block,type,questionId,wait_duration,answer,question
A09354962P34U7ILOPYKP,1,general,corona,Not useful,C_07_NU,16,Pink,What color latex gloves did Naomi Campbell wear to protect herself from coronavirus?
A09354962P34U7ILOPYKP,1,general,corona,Not useful,C_12_NU,8,Diamond Princess,What was the name of the British cruise ship that was quarantined in Japanese waters?
A09354962P34U7ILOPYKP,1,general,corona,Not useful,C_13_NU,16,"The initial cases of the disease are thought to have been among people with a connection to a seafood wholesale market, which also sold live animals","Why is the virus believed to have zoonotic origin, i.e., to have potentially come from animals?"
A09354962P34U7ILOPYKP,1,general,corona,Not useful,C_22_NU,16,Contact tracing,What is the name of the process health authorities use to understand the sources of infection and to prevent further transmission?
A09354962P34U7ILOPYKP,1,general,corona,Not useful,C_26_NU,12,Severe acute respiratory syndrome,The official name of the new coronavirus is SARS-CoV-2. What does SARS stand for?
A09354962P34U7ILOPYKP,1,general,corona,Useful,C_39_U,16,"No, antibiotics do not work against viruses, only bacteria.",Are antibiotics effective in preventing and treating the new coronavirus?
A09354962P34U7ILOPYKP,1,general,corona,Useful,C_49_U,12,"Approved filtering facemask respirators, such as the N95 respirator.","It is recommended that healthcare professionals who may be working in contact with people with the virus wear what, in addition to personal protective equipment on their hands and bodies?"
A09354962P34U7ILOPYKP,1,general,general,Not useful,NC_04_NU,4,Edward Albee,"Who wrote ""Who's Afraid of Virginia Woolf?"""
A09354962P34U7ILOPYKP,1,general,general,Not useful,NC_15_NU,16,Albert Einstein,Who beat out FDR and Gandhi to be named Time's Person of the Century in 1999?
A09354962P34U7ILOPYKP,1,general,general,Not useful,NC_20_NU,16,Russia,Which country has the most public libraries?
A09354962P34U7ILOPYKP,1,general,general,Not useful,NC_26_NU,12,Dark Side of the Moon,What album spent a record 741 weeks on Billboard's Top 200 Albums chart?
A09354962P34U7ILOPYKP,1,general,general,Useful,NC_30_U,8,Floormats - put them under the wheels for traction,What item that can be found in any car can help you extract your car from mud or snow?
A09354962P34U7ILOPYKP,1,general,general,Useful,NC_40_U,8,Squint your eyes,How do you make your smile look more genuine in photographs?
A09354962P34U7ILOPYKP,1,general,general,Useful,NC_42_U,16,"Deprive it of oxygen by covering, pouring baking soda if the fire is small, or using a fire extinguisher if it's large.",How do you put out a grease fire? 
A09354962P34U7ILOPYKP,1,general,general,Useful,NC_52_U,16,"Tie your hair into a tight ponytail at the front of your head, and cut it.",How can you give yourself a layered haircut?
A09354962P34U7ILOPYKP,1,general,third,MTurk,TB_32_MT,16,Sophisticated equipment is either lowered to the sea bottom or directly attached to submersible buoys and transmits to a research vessel that is equipped with state-of-the-art navigational instruments.,What are undersea researchers doing to explore the ocean floor?
A09354962P34U7ILOPYKP,1,general,third,MTurk,TB_34_MT,16,Evolution is usually very slow. Think about the similarities between apes and people. Future people are going to be as similar to us as we are to apes. ,What will future humans look like?
A09354962P34U7ILOPYKP,1,general,third,MTurk,TB_42_MT,4,"Galaxy formation occured in the aftermath of the Big Bang. Clustering and merging allows galaxies to accumulate mass, determining both their shape and structure. ",How do galaxies form?
A09354962P34U7ILOPYKP,1,general,third,Trivia,TB_05_TR,12,Hong Kong,What city's harbor is overlooked by Victoria Peak?
A09354962P34U7ILOPYKP,1,general,third,Trivia,TB_12_TR,4,It sits beside the Finger Lakes,"Why is Oneida Lake, near Syracuse, New York, sometimes called ""the thumb""?"
A09354962P34U7ILOPYKP,1,general,third,Trivia,TB_18_TR,16,Orville Wright,Who was flying the plane in which the first US airplane fatality occurred?
A09354962P34U7ILOPYKP,1,general,third,Trivia,TB_21_TR,16,New York,Which state has the zip code 12345?
