PID,sess,firstBlock,block,type,questionId,wait_duration,answer,question
A104V8NZIQFN2F,1,corona,corona,Not useful,C_04_NU,16,"It stands for ""COronaVIrus Disease 2019""","Why is the new coronavirus called ""COVID-19""? "
A104V8NZIQFN2F,1,corona,corona,Not useful,C_14_NU,12,"January 30, 2020",On what date did the World Health Organization declare the new coronavirus outbreak to be a Public Health Emergency of International Concern?
A104V8NZIQFN2F,1,corona,corona,Not useful,C_15_NU,4,7.5 days,"In the early stages of the new coronavirus, the number of new cases doubled approximately every how many days?"
A104V8NZIQFN2F,1,corona,corona,Not useful,C_20_NU,8,"Rear Adm. Ziemer led the global health security team, responsible for leading the US response to pandemics.","In May 2018, Rear Admiral Timothy Ziemer left the White House staff and was not replaced. What was Rear Adm. Ziemer's responsibility in the White House?"
A104V8NZIQFN2F,1,corona,corona,Not useful,C_26_NU,4,Severe acute respiratory syndrome,The official name of the new coronavirus is SARS-CoV-2. What does SARS stand for?
A104V8NZIQFN2F,1,corona,corona,Useful,C_29_U,4,Not for at least several months from now,How soon is a vaccine for the coronavirus likely to be available?
A104V8NZIQFN2F,1,corona,corona,Useful,C_40_U,4,"The incubation period - the time between catching the virus and beginning to have symptoms of the disease - is estimated to range from 1-14 days, most commonly around five days.",How long is the incubation period for the new coronavirus?
A104V8NZIQFN2F,1,corona,corona,Useful,C_41_U,8,Studies suggest that coronaviruses (including preliminary information on the new virus) may persist on surfaces for a few hours or up to several days.,How long does the new coronavirus survive on surfaces?
A104V8NZIQFN2F,1,corona,corona,Useful,C_42_U,4,"Fever, cough, shortness of breath.",What are the most common symptoms of the new coronavirus?
A104V8NZIQFN2F,1,corona,corona,Useful,C_50_U,4,Washington,The first US death from the new coronavirus occurred in which state?
A104V8NZIQFN2F,1,corona,general,Not useful,NC_03_NU,16,Red River,"What name is shared by the rivers that run through Denison, TX and Hanoi, Vietnam?"
A104V8NZIQFN2F,1,corona,general,Not useful,NC_14_NU,8,Rod Serling,What famed TV personality wrote the screenplay for 1968's Planet of the Apes?
A104V8NZIQFN2F,1,corona,general,Not useful,NC_19_NU,16,Smoke,"in 1908, New York City passed the Sullivan Ordinance which made it illegal for women to do what in public?"
A104V8NZIQFN2F,1,corona,general,Useful,NC_32_U,12,Take a picture of your fridge before leaving the house,What's a simple trick for telling whether your out of something when you're grocery shopping?
A104V8NZIQFN2F,1,corona,general,Useful,NC_35_U,4,Wrap a wet paper towel around the bottle and put in the fridge,How can you cool beverages more quickly?
A104V8NZIQFN2F,1,corona,general,Useful,NC_38_U,8,"Camu Camu, a cherry-like fruit from Brazil",What fruit has the highest content of vitamin C?
A104V8NZIQFN2F,1,corona,general,Useful,NC_47_U,4,"Add baking soda, soak in advance, use a preassure cooker",What can you do to make dry beans cook faster?
A104V8NZIQFN2F,1,corona,general,Useful,NC_51_U,4,White vinegar,What salad dressing ingredient is also an efficient weed killer?
A104V8NZIQFN2F,1,corona,third,MTurk,TB_39_MT,8,"There is radio emission around black holes. Scientists created a network of telescopes, capturing an image of a black hole by improving upon a technique that allows for the imaging of far-away objects",How was the recent picture of a black hole made?
A104V8NZIQFN2F,1,corona,third,MTurk,TB_41_MT,4,"Deep learning-based machines, that can process unparalleled amount of information will allow AI to accomplish goals that were unimaginable until very recently. ",What are the most recent developments in artificial intelligence?
A104V8NZIQFN2F,1,corona,third,MTurk,TB_43_MT,12,"Planets likely start off as grains of dust that then combine to form bigger rocks. They clear material from their path, leaving tracks of space empty but for fine dust.",How do planets form?
A104V8NZIQFN2F,1,corona,third,Trivia,TB_01_TR,12,Canada,"What country is home to Roots, the company that outfits the U.S. Olympic team?"
A104V8NZIQFN2F,1,corona,third,Trivia,TB_02_TR,16,Ivory Coast's,"The world's largest church is Our Lady of Peace Basilica in Yamoussoukro, what nation's capital?"
A104V8NZIQFN2F,1,corona,third,Trivia,TB_10_TR,8,George VI,Who was the last British Monarch to also be an emperor?
A104V8NZIQFN2F,1,corona,third,Trivia,TB_23_TR,8,Tooth,What is the only part of the body that can't repair itself?
