PID,sess,firstBlock,block,type,questionId,wait_duration,answer,question
A105SDLUKIJZV4,1,general,corona,Not useful,C_07_NU,12,Pink,What color latex gloves did Naomi Campbell wear to protect herself from coronavirus?
A105SDLUKIJZV4,1,general,corona,Not useful,C_09_NU,12,Hubei,What is the name of the province in China in which this new coronavirus was first discovered?
A105SDLUKIJZV4,1,general,corona,Not useful,C_17_NU,16,"Locations, people, or animals","The name for the new disease COVID-19 adheres to WHO best practices in disease naming, which include guidelines to not name disease after what?"
A105SDLUKIJZV4,1,general,corona,Useful,C_30_U,8,More similar to the symptoms of the ful,"Are the new coronavirus symptoms more similar to the symptoms of flu, or of seasonal allergies?"
A105SDLUKIJZV4,1,general,corona,Useful,C_33_U,16,Soft surfaces are less likely to transmit the virus than hard surfaces.,Can the new coronavirus be transmitted by touching a soft surface like carpets or fabric?
A105SDLUKIJZV4,1,general,corona,Useful,C_43_U,16,Quarantine themselves for 14 days to make sure they are not infected.,"Currently, people who  may have been in contact with someone with the new coronavirus are recommended to do what?"
A105SDLUKIJZV4,1,general,general,Not useful,NC_05_NU,8,Matthew,Which of the four biblical Gospels was written by a tax collector?
A105SDLUKIJZV4,1,general,general,Not useful,NC_09_NU,12,Captain Cook,"Who christened Hawaii ""the Sandwich Islands"" in 1778?"
A105SDLUKIJZV4,1,general,general,Not useful,NC_25_NU,12,Shark,"What animal is thought to be immune to most all diseases, including cancer?"
A105SDLUKIJZV4,1,general,general,Useful,NC_27_U,16,White vinegar,What can you use instead of fabric softner to soften sheets and remove odours?
A105SDLUKIJZV4,1,general,general,Useful,NC_28_U,8,Microwave next to a glass of water,How can you soften brown sugar that has hardened into a lump?
A105SDLUKIJZV4,1,general,general,Useful,NC_42_U,16,"Deprive it of oxygen by covering, pouring baking soda if the fire is small, or using a fire extinguisher if it's large.",How do you put out a grease fire? 
A105SDLUKIJZV4,1,general,general,Useful,NC_47_U,8,"Add baking soda, soak in advance, use a preassure cooker",What can you do to make dry beans cook faster?
