PID,sess,firstBlock,block,type,questionId,wait_duration,answer,question
A106X5YTVYPF43,1,general,corona,Not useful,C_10_NU,4,11 million people,"What is the population of Wuhan, the city in which coronavirus was first identified?"
A106X5YTVYPF43,1,general,corona,Not useful,C_11_NU,12,The Chicago of China,"Wuhan, China, the city in which the coronavirus was first identified, is commonly referred to as the chinese version of what American city?"
A106X5YTVYPF43,1,general,corona,Not useful,C_21_NU,16,An epidemic that has spread around the world,An epidemic is the outbreak of a disease that affects many people at the same time. What does pandemic mean?
A106X5YTVYPF43,1,general,corona,Useful,C_30_U,8,More similar to the symptoms of the ful,"Are the new coronavirus symptoms more similar to the symptoms of flu, or of seasonal allergies?"
A106X5YTVYPF43,1,general,corona,Useful,C_35_U,8,"The virus spreads through coughs and sneezes, there are no reports of transmission through mosquito bites.",Can the new coronavirus be transmitted through mosquito bites?
A106X5YTVYPF43,1,general,corona,Useful,C_36_U,12,No. There is no evidence that regularly rinsing the nose with saline has protected people from infection with the new coronavirus.,Can regularly rinsing your nose with saline help prevent infection with the new coronavirus?
A106X5YTVYPF43,1,general,corona,Useful,C_46_U,16,Remdesivir,"Which drug, which has been used as a treatment for the Ebola and Marburg viruses, might be promising as a treatment for this new coronavirus?"
A106X5YTVYPF43,1,general,general,Not useful,NC_03_NU,8,Red River,"What name is shared by the rivers that run through Denison, TX and Hanoi, Vietnam?"
A106X5YTVYPF43,1,general,general,Not useful,NC_04_NU,16,Edward Albee,"Who wrote ""Who's Afraid of Virginia Woolf?"""
A106X5YTVYPF43,1,general,general,Not useful,NC_16_NU,12,Newborns,The apgar score is used to measure the color and condition of what?
A106X5YTVYPF43,1,general,general,Not useful,NC_18_NU,4,A truce,What was put in place by the Ancient Greeks before and during all Olympic festivals?
A106X5YTVYPF43,1,general,general,Not useful,NC_24_NU,4,State quarters,What's been released five times a year from January 1999 to fall 2008?
A106X5YTVYPF43,1,general,general,Useful,NC_29_U,12,"Freeze before chopping, or hold a piece of bread in your mouth, half sticking out",How to chop an onion without crying?
A106X5YTVYPF43,1,general,general,Useful,NC_32_U,8,Take a picture of your fridge before leaving the house,What's a simple trick for telling whether your out of something when you're grocery shopping?
A106X5YTVYPF43,1,general,general,Useful,NC_38_U,4,"Camu Camu, a cherry-like fruit from Brazil",What fruit has the highest content of vitamin C?
A106X5YTVYPF43,1,general,general,Useful,NC_41_U,8,"April 8th, 2024",When is the next total solar eclipse visible in North America projected to occur? 
A106X5YTVYPF43,1,general,third,MTurk,TB_30_MT,8,"The ""no hair theorem"" states that a black hole has only three properties: electric charge, angular momentum, and mass.",What is the composition of a black hole?
A106X5YTVYPF43,1,general,third,MTurk,TB_35_MT,4,Prototypes already exist. Technological estimates suggest that definitely within the next twenty years -- although the challenges are great.,When will we have flying cars?
A106X5YTVYPF43,1,general,third,MTurk,TB_38_MT,8,"As a rule, yes. Restaurants have to cover rent, salaries and taxes. These are all included in the prices.",Is it really cheaper to cook at home vs. eating out?
A106X5YTVYPF43,1,general,third,MTurk,TB_43_MT,16,"Planets likely start off as grains of dust that then combine to form bigger rocks. They clear material from their path, leaving tracks of space empty but for fine dust.",How do planets form?
A106X5YTVYPF43,1,general,third,Trivia,TB_05_TR,4,Hong Kong,What city's harbor is overlooked by Victoria Peak?
A106X5YTVYPF43,1,general,third,Trivia,TB_09_TR,12,The first email,"What did Ray Tomlinson send in Cambridge, Massachusetts, in late 1971?"
A106X5YTVYPF43,1,general,third,Trivia,TB_15_TR,4,Portia,The United States' first law school for woman was named for what cross-dressing Shakespearean character?
A106X5YTVYPF43,1,general,third,Trivia,TB_20_TR,16,Rafflesia (corpse lily),What is the largest flower in the world?
