PID,sess,firstBlock,block,type,questionId,wait_duration,answer,question
A1118RXX666MLC,1,general,corona,Not useful,C_01_NU,4,"Animals, probably bats",What is the source of coronavirus in humans?
A1118RXX666MLC,1,general,corona,Not useful,C_05_NU,4,University of Washington,Which was the first US University to cancel classes becuase of the new coronavirus?
A1118RXX666MLC,1,general,corona,Not useful,C_07_NU,8,Pink,What color latex gloves did Naomi Campbell wear to protect herself from coronavirus?
A1118RXX666MLC,1,general,corona,Not useful,C_15_NU,12,7.5 days,"In the early stages of the new coronavirus, the number of new cases doubled approximately every how many days?"
A1118RXX666MLC,1,general,corona,Useful,C_30_U,16,More similar to the symptoms of the ful,"Are the new coronavirus symptoms more similar to the symptoms of flu, or of seasonal allergies?"
A1118RXX666MLC,1,general,corona,Useful,C_33_U,4,Soft surfaces are less likely to transmit the virus than hard surfaces.,Can the new coronavirus be transmitted by touching a soft surface like carpets or fabric?
A1118RXX666MLC,1,general,corona,Useful,C_36_U,4,No. There is no evidence that regularly rinsing the nose with saline has protected people from infection with the new coronavirus.,Can regularly rinsing your nose with saline help prevent infection with the new coronavirus?
A1118RXX666MLC,1,general,general,Not useful,NC_04_NU,8,Edward Albee,"Who wrote ""Who's Afraid of Virginia Woolf?"""
A1118RXX666MLC,1,general,general,Not useful,NC_08_NU,4,The guppy,What common aquarium fish is named for the naturalist who discovered it in Trinidad in 1876?
A1118RXX666MLC,1,general,general,Not useful,NC_09_NU,4,Captain Cook,"Who christened Hawaii ""the Sandwich Islands"" in 1778?"
A1118RXX666MLC,1,general,general,Not useful,NC_20_NU,4,Russia,Which country has the most public libraries?
A1118RXX666MLC,1,general,general,Not useful,NC_22_NU,16,Steamboat Geyser,"Which Yellowstone geyser, with eruptions 100 fee taller than Old Faithful's, is the world's tallest?"
A1118RXX666MLC,1,general,general,Useful,NC_32_U,4,Take a picture of your fridge before leaving the house,What's a simple trick for telling whether your out of something when you're grocery shopping?
A1118RXX666MLC,1,general,general,Useful,NC_37_U,8,"Over the past 150 year, real estate, if you rent it out",What's a better investment: stocks or real estate?
A1118RXX666MLC,1,general,general,Useful,NC_40_U,8,Squint your eyes,How do you make your smile look more genuine in photographs?
A1118RXX666MLC,1,general,general,Useful,NC_41_U,8,"April 8th, 2024",When is the next total solar eclipse visible in North America projected to occur? 
A1118RXX666MLC,1,general,third,MTurk,TB_33_MT,12,"For SpaceX — the cheapest of NASA's new carriers — each pound costs approximately $27,000. So an average person of 160 pounds costs over $4,320,000.",How much does it cost to launch a person into space?
A1118RXX666MLC,1,general,third,Trivia,TB_01_TR,8,Canada,"What country is home to Roots, the company that outfits the U.S. Olympic team?"
A1118RXX666MLC,1,general,third,Trivia,TB_02_TR,16,Ivory Coast's,"The world's largest church is Our Lady of Peace Basilica in Yamoussoukro, what nation's capital?"
A1118RXX666MLC,1,general,third,Trivia,TB_12_TR,8,It sits beside the Finger Lakes,"Why is Oneida Lake, near Syracuse, New York, sometimes called ""the thumb""?"
A1118RXX666MLC,1,general,third,Trivia,TB_19_TR,16,Ketchup,The only vegetable ice cream ever produced was what flavor?
