PID,sess,firstBlock,block,type,questionId,wait_duration,answer,question
A11S4VZ3LDZB66,1,corona,corona,Not useful,C_16_NU,12,Bats and pangolins,What other animals have been found to have viruses with highly similar genome sequences as the current coronavirus?
A11S4VZ3LDZB66,1,corona,corona,Useful,C_30_U,16,More similar to the symptoms of the ful,"Are the new coronavirus symptoms more similar to the symptoms of flu, or of seasonal allergies?"
A11S4VZ3LDZB66,1,corona,corona,Useful,C_34_U,8,"The virus lives for up to a few days on surfaces, and so packages cannot transmit the virus.",Can the new coronavirus be transmitted on a package from an infected country?
A11S4VZ3LDZB66,1,corona,general,Not useful,NC_01_NU,4,Mike Powell,"In 1991, who finally broke Bob Beamon's decades-old long jump record?"
A11S4VZ3LDZB66,1,corona,general,Not useful,NC_06_NU,4,David Livingstone,Who discovered the Victoria Falls?
A11S4VZ3LDZB66,1,corona,general,Useful,NC_36_U,8,Potatos: rub a cut potato over your windshield before a frost to prevent freezing,What vegetable can prevent your windshield from freezing over in winter?
A11S4VZ3LDZB66,1,corona,general,Useful,NC_50_U,12,Spread beeswax over them and then blow dry until you can't see the beeswax anymore,What's an easy way to waterproof canvas shoes?
A11S4VZ3LDZB66,1,corona,third,MTurk,TB_26_MT,8,"Sometimes, it is easy to know, but science revealed that self-insight is prblematic. It is often very helpful to ask friends and family ",How do you know if you're happy?
A11S4VZ3LDZB66,1,corona,third,Trivia,TB_17_TR,4,"Third finger, left hand",What part of his body did Keith Richards insure for a million pounds?
