PID,sess,firstBlock,block,type,questionId,wait_duration,answer,question
A11SWJL3M0TTLA,1,general,corona,Not useful,C_01_NU,4,"Animals, probably bats",What is the source of coronavirus in humans?
A11SWJL3M0TTLA,1,general,corona,Not useful,C_05_NU,12,University of Washington,Which was the first US University to cancel classes becuase of the new coronavirus?
A11SWJL3M0TTLA,1,general,corona,Not useful,C_11_NU,4,The Chicago of China,"Wuhan, China, the city in which the coronavirus was first identified, is commonly referred to as the chinese version of what American city?"
A11SWJL3M0TTLA,1,general,corona,Not useful,C_26_NU,16,Severe acute respiratory syndrome,The official name of the new coronavirus is SARS-CoV-2. What does SARS stand for?
A11SWJL3M0TTLA,1,general,corona,Useful,C_32_U,16,"In public settings where other social distancing measures are difficult to maintain (e.g., grocery stores and pharmacies).",The CDC recommend people wear cloth masks in what situations?
A11SWJL3M0TTLA,1,general,corona,Useful,C_49_U,4,"Approved filtering facemask respirators, such as the N95 respirator.","It is recommended that healthcare professionals who may be working in contact with people with the virus wear what, in addition to personal protective equipment on their hands and bodies?"
A11SWJL3M0TTLA,1,general,corona,Useful,C_50_U,8,Washington,The first US death from the new coronavirus occurred in which state?
A11SWJL3M0TTLA,1,general,general,Not useful,NC_03_NU,4,Red River,"What name is shared by the rivers that run through Denison, TX and Hanoi, Vietnam?"
A11SWJL3M0TTLA,1,general,general,Not useful,NC_04_NU,8,Edward Albee,"Who wrote ""Who's Afraid of Virginia Woolf?"""
A11SWJL3M0TTLA,1,general,general,Not useful,NC_09_NU,12,Captain Cook,"Who christened Hawaii ""the Sandwich Islands"" in 1778?"
A11SWJL3M0TTLA,1,general,general,Not useful,NC_15_NU,8,Albert Einstein,Who beat out FDR and Gandhi to be named Time's Person of the Century in 1999?
A11SWJL3M0TTLA,1,general,general,Not useful,NC_24_NU,4,State quarters,What's been released five times a year from January 1999 to fall 2008?
A11SWJL3M0TTLA,1,general,general,Useful,NC_37_U,12,"Over the past 150 year, real estate, if you rent it out",What's a better investment: stocks or real estate?
A11SWJL3M0TTLA,1,general,general,Useful,NC_44_U,4,Doritos,What popular snack food is effective to use as kindling to start a fire?
A11SWJL3M0TTLA,1,general,general,Useful,NC_47_U,8,"Add baking soda, soak in advance, use a preassure cooker",What can you do to make dry beans cook faster?
A11SWJL3M0TTLA,1,general,general,Useful,NC_48_U,12,"Drop it from a 3 inch height. If it bounces, it's dead.",How can you tell if a battery is dead without using any tools?
A11SWJL3M0TTLA,1,general,third,MTurk,TB_30_MT,4,"The ""no hair theorem"" states that a black hole has only three properties: electric charge, angular momentum, and mass.",What is the composition of a black hole?
A11SWJL3M0TTLA,1,general,third,MTurk,TB_32_MT,16,Sophisticated equipment is either lowered to the sea bottom or directly attached to submersible buoys and transmits to a research vessel that is equipped with state-of-the-art navigational instruments.,What are undersea researchers doing to explore the ocean floor?
A11SWJL3M0TTLA,1,general,third,MTurk,TB_38_MT,8,"As a rule, yes. Restaurants have to cover rent, salaries and taxes. These are all included in the prices.",Is it really cheaper to cook at home vs. eating out?
A11SWJL3M0TTLA,1,general,third,MTurk,TB_44_MT,12,"In all U.S states, same-sex marriage is now legal. Also, the number of kids per family has decreased and so ""middle"" childreen, between the eldest and youngest, are getting rarer. ",How have families changed over time?
A11SWJL3M0TTLA,1,general,third,Trivia,TB_01_TR,4,Canada,"What country is home to Roots, the company that outfits the U.S. Olympic team?"
A11SWJL3M0TTLA,1,general,third,Trivia,TB_13_TR,16,Java,On what namesake Asian island are the first Homo erectus fossils found?
A11SWJL3M0TTLA,1,general,third,Trivia,TB_14_TR,16,James Brown,"When asked to define ""cool,"" what two words did James Brown use?"
