PID,sess,firstBlock,block,type,questionId,wait_duration,answer,question
A11U1B6RB71MGE,1,corona,corona,Not useful,C_12_NU,4,Diamond Princess,What was the name of the British cruise ship that was quarantined in Japanese waters?
A11U1B6RB71MGE,1,corona,corona,Not useful,C_14_NU,8,"January 30, 2020",On what date did the World Health Organization declare the new coronavirus outbreak to be a Public Health Emergency of International Concern?
A11U1B6RB71MGE,1,corona,corona,Not useful,C_15_NU,8,7.5 days,"In the early stages of the new coronavirus, the number of new cases doubled approximately every how many days?"
A11U1B6RB71MGE,1,corona,corona,Not useful,C_19_NU,16,Strategic National Stockpile,What is the name of the repository of drugs and supplies the U.S. government is supposed to maintain in case of a public health emergency?
A11U1B6RB71MGE,1,corona,corona,Not useful,C_20_NU,4,"Rear Adm. Ziemer led the global health security team, responsible for leading the US response to pandemics.","In May 2018, Rear Admiral Timothy Ziemer left the White House staff and was not replaced. What was Rear Adm. Ziemer's responsibility in the White House?"
A11U1B6RB71MGE,1,corona,corona,Not useful,C_24_NU,8,Contagion,"According to media reports, which 2011 movie has seen a large increase in popularity in the wake of the new coronavirus?"
A11U1B6RB71MGE,1,corona,corona,Useful,C_37_U,16,There is no evidence from the current outbreak that eating garlic has protected people from the new coronavirus.,Can eating garlic help prevent infection with the new coronavirus?
A11U1B6RB71MGE,1,corona,corona,Useful,C_41_U,4,Studies suggest that coronaviruses (including preliminary information on the new virus) may persist on surfaces for a few hours or up to several days.,How long does the new coronavirus survive on surfaces?
A11U1B6RB71MGE,1,corona,general,Not useful,NC_16_NU,16,Newborns,The apgar score is used to measure the color and condition of what?
A11U1B6RB71MGE,1,corona,general,Not useful,NC_17_NU,8,Gilbert Van Camp,What Indianapolis grocer made his name by selling canned pork and beans to U.S. troops during the Civil War?
A11U1B6RB71MGE,1,corona,general,Not useful,NC_20_NU,12,Russia,Which country has the most public libraries?
A11U1B6RB71MGE,1,corona,general,Not useful,NC_26_NU,16,Dark Side of the Moon,What album spent a record 741 weeks on Billboard's Top 200 Albums chart?
A11U1B6RB71MGE,1,corona,general,Useful,NC_44_U,16,Doritos,What popular snack food is effective to use as kindling to start a fire?
A11U1B6RB71MGE,1,corona,third,MTurk,TB_24_MT,16,"Deep sea creatures must survive in extremely harsh conditions. They include the giant spider crab, frilled shark, and the atlantic wolffish",Which creatures live in deep sea?
A11U1B6RB71MGE,1,corona,third,MTurk,TB_31_MT,12,Scientists estimate that at the moment it is not. But with global warming it might become more feasilbe later in the 21st century.,How feasible would it be to colonize Antarctica?
A11U1B6RB71MGE,1,corona,third,Trivia,TB_02_TR,4,Ivory Coast's,"The world's largest church is Our Lady of Peace Basilica in Yamoussoukro, what nation's capital?"
A11U1B6RB71MGE,1,corona,third,Trivia,TB_07_TR,16,Tuxedo Club,What New York country club lent its name to the kind of dinner jacket first worn there in 1886?
A11U1B6RB71MGE,1,corona,third,Trivia,TB_16_TR,8,Jim Lovell,Alan Shepard was scheduled to command the ill-fated Apollo 13 before switching missions with what astronaut?
A11U1B6RB71MGE,1,corona,third,Trivia,TB_19_TR,8,Ketchup,The only vegetable ice cream ever produced was what flavor?
