PID,sess,firstBlock,block,type,questionId,wait_duration,answer,question
A1230L5QMQ9TSG,1,general,corona,Not useful,C_17_NU,12,"Locations, people, or animals","The name for the new disease COVID-19 adheres to WHO best practices in disease naming, which include guidelines to not name disease after what?"
A1230L5QMQ9TSG,1,general,corona,Not useful,C_23_NU,16,They falsely claimed to cure or prevent coronavirus,"At the end of February, Amazon banned over a million products because of what?"
A1230L5QMQ9TSG,1,general,corona,Not useful,C_25_NU,4,The viruses have spikes on their outer surface that look like a crown (or corona in Latin),What is the supposed origin of the name coronavirus?
A1230L5QMQ9TSG,1,general,general,Not useful,NC_15_NU,16,Albert Einstein,Who beat out FDR and Gandhi to be named Time's Person of the Century in 1999?
A1230L5QMQ9TSG,1,general,general,Not useful,NC_18_NU,8,A truce,What was put in place by the Ancient Greeks before and during all Olympic festivals?
A1230L5QMQ9TSG,1,general,general,Not useful,NC_23_NU,16,The Netherlands,In 1568 the Catholic Church sentenced the entire population of which nation to death as heretics?
A1230L5QMQ9TSG,1,general,general,Not useful,NC_26_NU,12,Dark Side of the Moon,What album spent a record 741 weeks on Billboard's Top 200 Albums chart?
A1230L5QMQ9TSG,1,general,general,Useful,NC_29_U,16,"Freeze before chopping, or hold a piece of bread in your mouth, half sticking out",How to chop an onion without crying?
A1230L5QMQ9TSG,1,general,general,Useful,NC_36_U,8,Potatos: rub a cut potato over your windshield before a frost to prevent freezing,What vegetable can prevent your windshield from freezing over in winter?
A1230L5QMQ9TSG,1,general,general,Useful,NC_44_U,8,Doritos,What popular snack food is effective to use as kindling to start a fire?
A1230L5QMQ9TSG,1,general,general,Useful,NC_51_U,4,White vinegar,What salad dressing ingredient is also an efficient weed killer?
A1230L5QMQ9TSG,1,general,third,MTurk,TB_36_MT,4,"For two reasons. One, they are too heavy. For example, the Space Shuttle weighed 2 thousand tons, yet a Boeing can only carry about 120 tons. Second, the thrust is likely to be too strong.",Why don't space rockets take off from a plane already in the air?
A1230L5QMQ9TSG,1,general,third,Trivia,TB_01_TR,8,Canada,"What country is home to Roots, the company that outfits the U.S. Olympic team?"
A1230L5QMQ9TSG,1,general,third,Trivia,TB_11_TR,4,Mung beans,What kind of bean produces the Asian-style bean sprouts in the produce section of supermarkets?
A1230L5QMQ9TSG,1,general,third,Trivia,TB_12_TR,16,It sits beside the Finger Lakes,"Why is Oneida Lake, near Syracuse, New York, sometimes called ""the thumb""?"
A1230L5QMQ9TSG,1,general,third,Trivia,TB_15_TR,16,Portia,The United States' first law school for woman was named for what cross-dressing Shakespearean character?
A1230L5QMQ9TSG,1,general,third,Trivia,TB_19_TR,8,Ketchup,The only vegetable ice cream ever produced was what flavor?
