PID,sess,firstBlock,block,type,questionId,wait_duration,answer,question
A129CHASJEXB0B,1,corona,corona,Not useful,C_02_NU,8,Three ,How many pandemics were there in the 20th century?
A129CHASJEXB0B,1,corona,corona,Not useful,C_05_NU,12,University of Washington,Which was the first US University to cancel classes becuase of the new coronavirus?
A129CHASJEXB0B,1,corona,corona,Not useful,C_17_NU,4,"Locations, people, or animals","The name for the new disease COVID-19 adheres to WHO best practices in disease naming, which include guidelines to not name disease after what?"
A129CHASJEXB0B,1,corona,corona,Not useful,C_22_NU,16,Contact tracing,What is the name of the process health authorities use to understand the sources of infection and to prevent further transmission?
A129CHASJEXB0B,1,corona,corona,Useful,C_39_U,16,"No, antibiotics do not work against viruses, only bacteria.",Are antibiotics effective in preventing and treating the new coronavirus?
A129CHASJEXB0B,1,corona,corona,Useful,C_46_U,16,Remdesivir,"Which drug, which has been used as a treatment for the Ebola and Marburg viruses, might be promising as a treatment for this new coronavirus?"
A129CHASJEXB0B,1,corona,corona,Useful,C_49_U,16,"Approved filtering facemask respirators, such as the N95 respirator.","It is recommended that healthcare professionals who may be working in contact with people with the virus wear what, in addition to personal protective equipment on their hands and bodies?"
A129CHASJEXB0B,1,corona,general,Not useful,NC_03_NU,16,Red River,"What name is shared by the rivers that run through Denison, TX and Hanoi, Vietnam?"
A129CHASJEXB0B,1,corona,general,Not useful,NC_08_NU,12,The guppy,What common aquarium fish is named for the naturalist who discovered it in Trinidad in 1876?
A129CHASJEXB0B,1,corona,general,Not useful,NC_13_NU,8,Bling bling,What term does rapper B.G. say he wishes he'd patented when he used it for the title of his massive 1999 hit?
A129CHASJEXB0B,1,corona,general,Not useful,NC_21_NU,12,The Pieta,Which was the only one of his sculptures that Michelangelo signed?
A129CHASJEXB0B,1,corona,general,Useful,NC_27_U,16,White vinegar,What can you use instead of fabric softner to soften sheets and remove odours?
A129CHASJEXB0B,1,corona,general,Useful,NC_32_U,4,Take a picture of your fridge before leaving the house,What's a simple trick for telling whether your out of something when you're grocery shopping?
A129CHASJEXB0B,1,corona,general,Useful,NC_33_U,8,Below eye level,Where in the supermarket can you usually find the cheaper items?
A129CHASJEXB0B,1,corona,general,Useful,NC_51_U,8,White vinegar,What salad dressing ingredient is also an efficient weed killer?
A129CHASJEXB0B,1,corona,third,MTurk,TB_29_MT,12,"There are a few helpful techniques. One is to imagine that you climb on top of a high building, and ""look down"" at your life. Second, to try to think about issues in novel ways. ",How to stay calm in adversity?
A129CHASJEXB0B,1,corona,third,MTurk,TB_36_MT,4,"For two reasons. One, they are too heavy. For example, the Space Shuttle weighed 2 thousand tons, yet a Boeing can only carry about 120 tons. Second, the thrust is likely to be too strong.",Why don't space rockets take off from a plane already in the air?
A129CHASJEXB0B,1,corona,third,Trivia,TB_08_TR,16,Library of Congress,"In 1802, John Beckley became the librarian of what collection containing 740 books at the time?"
A129CHASJEXB0B,1,corona,third,Trivia,TB_09_TR,8,The first email,"What did Ray Tomlinson send in Cambridge, Massachusetts, in late 1971?"
A129CHASJEXB0B,1,corona,third,Trivia,TB_18_TR,16,Orville Wright,Who was flying the plane in which the first US airplane fatality occurred?
A129CHASJEXB0B,1,corona,third,Trivia,TB_22_TR,4,Cheetah,Which is the only cat that cannot retract its claws?
