PID,sess,firstBlock,block,type,questionId,wait_duration,answer,question
A12IHTKQFQIPD1,1,corona,corona,Not useful,C_16_NU,8,Bats and pangolins,What other animals have been found to have viruses with highly similar genome sequences as the current coronavirus?
A12IHTKQFQIPD1,1,corona,corona,Not useful,C_23_NU,8,They falsely claimed to cure or prevent coronavirus,"At the end of February, Amazon banned over a million products because of what?"
A12IHTKQFQIPD1,1,corona,corona,Useful,C_32_U,8,"Healthcare professionals treating patients, in-home caregivers, and those who are already sick with the new coronavirus",Which three groups of people does the CDC recommend masks for?
A12IHTKQFQIPD1,1,corona,general,Not useful,NC_13_NU,4,Bling bling,What term does rapper B.G. say he wishes he'd patented when he used it for the title of his massive 1999 hit?
A12IHTKQFQIPD1,1,corona,general,Not useful,NC_24_NU,16,State quarters,What's been released five times a year from January 1999 to fall 2008?
A12IHTKQFQIPD1,1,corona,general,Not useful,NC_25_NU,16,Shark,"What animal is thought to be immune to most all diseases, including cancer?"
A12IHTKQFQIPD1,1,corona,general,Useful,NC_28_U,4,Microwave next to a glass of water,How can you soften brown sugar that has hardened into a lump?
A12IHTKQFQIPD1,1,corona,general,Useful,NC_29_U,8,"Freeze before chopping, or hold a piece of bread in your mouth, half sticking out",How to chop an onion without crying?
A12IHTKQFQIPD1,1,corona,third,MTurk,TB_25_MT,12,"Scientists estimate that we are likely to see flying cars, and that computers may be able to read people's thoughts and emotions ",What will be the new technologies of future?
A12IHTKQFQIPD1,1,corona,third,MTurk,TB_34_MT,8,Evolution is usually very slow. Think about the similarities between apes and people. Future people are going to be as similar to us as we are to apes. ,What will future humans look like?
A12IHTKQFQIPD1,1,corona,third,Trivia,TB_03_TR,16,Mrs. Doubtfire's,What 1993 film's title character has the first name Euphegenia?
A12IHTKQFQIPD1,1,corona,third,Trivia,TB_17_TR,8,"Third finger, left hand",What part of his body did Keith Richards insure for a million pounds?
A12IHTKQFQIPD1,1,corona,third,Trivia,TB_21_TR,16,New York,Which state has the zip code 12345?
