PID,sess,firstBlock,block,type,questionId,wait_duration,answer,question
A12V9E1PFJB558,1,general,corona,Not useful,C_12_NU,4,Diamond Princess,What was the name of the British cruise ship that was quarantined in Japanese waters?
A12V9E1PFJB558,1,general,corona,Not useful,C_19_NU,12,Strategic National Stockpile,What is the name of the repository of drugs and supplies the U.S. government is supposed to maintain in case of a public health emergency?
A12V9E1PFJB558,1,general,corona,Useful,C_32_U,16,"Healthcare professionals treating patients, in-home caregivers, and those who are already sick with the new coronavirus",Which three groups of people does the CDC recommend masks for?
A12V9E1PFJB558,1,general,corona,Useful,C_33_U,16,Soft surfaces are less likely to transmit the virus than hard surfaces.,Can the new coronavirus be transmitted by touching a soft surface like carpets or fabric?
A12V9E1PFJB558,1,general,corona,Useful,C_37_U,4,There is no evidence from the current outbreak that eating garlic has protected people from the new coronavirus.,Can eating garlic help prevent infection with the new coronavirus?
A12V9E1PFJB558,1,general,corona,Useful,C_46_U,8,Remdesivir,"Which drug, which has been used as a treatment for the Ebola and Marburg viruses, might be promising as a treatment for this new coronavirus?"
A12V9E1PFJB558,1,general,general,Not useful,NC_07_NU,8,Salt Lake City,In what city could you see the Seagull Monument at Temple Square?
A12V9E1PFJB558,1,general,general,Not useful,NC_16_NU,4,Newborns,The apgar score is used to measure the color and condition of what?
A12V9E1PFJB558,1,general,general,Not useful,NC_21_NU,16,The Pieta,Which was the only one of his sculptures that Michelangelo signed?
A12V9E1PFJB558,1,general,general,Not useful,NC_24_NU,12,State quarters,What's been released five times a year from January 1999 to fall 2008?
A12V9E1PFJB558,1,general,general,Not useful,NC_26_NU,8,Dark Side of the Moon,What album spent a record 741 weeks on Billboard's Top 200 Albums chart?
A12V9E1PFJB558,1,general,general,Useful,NC_30_U,4,Floormats - put them under the wheels for traction,What item that can be found in any car can help you extract your car from mud or snow?
A12V9E1PFJB558,1,general,general,Useful,NC_35_U,4,Wrap a wet paper towel around the bottle and put in the fridge,How can you cool beverages more quickly?
A12V9E1PFJB558,1,general,general,Useful,NC_52_U,8,"Tie your hair into a tight ponytail at the front of your head, and cut it.",How can you give yourself a layered haircut?
A12V9E1PFJB558,1,general,third,MTurk,TB_31_MT,4,Scientists estimate that at the moment it is not. But with global warming it might become more feasilbe later in the 21st century.,How feasible would it be to colonize Antarctica?
A12V9E1PFJB558,1,general,third,MTurk,TB_34_MT,4,Evolution is usually very slow. Think about the similarities between apes and people. Future people are going to be as similar to us as we are to apes. ,What will future humans look like?
A12V9E1PFJB558,1,general,third,MTurk,TB_37_MT,12,Engineers and architects agree that the answer is positive. Houses for the non-rich are much better built today than they were built 500 years ago.,Are houses built better than they used to be?
A12V9E1PFJB558,1,general,third,Trivia,TB_01_TR,12,Canada,"What country is home to Roots, the company that outfits the U.S. Olympic team?"
A12V9E1PFJB558,1,general,third,Trivia,TB_05_TR,16,Hong Kong,What city's harbor is overlooked by Victoria Peak?
A12V9E1PFJB558,1,general,third,Trivia,TB_09_TR,8,The first email,"What did Ray Tomlinson send in Cambridge, Massachusetts, in late 1971?"
A12V9E1PFJB558,1,general,third,Trivia,TB_14_TR,12,James Brown,"When asked to define ""cool,"" what two words did James Brown use?"
