PID,sess,firstBlock,block,type,questionId,wait_duration,answer,question
A1362Z1A98OYI0,1,general,corona,Not useful,C_03_NU,12,"Fuburary 1st, 2020",When was the molecular structure of the coronovirus identfied?
A1362Z1A98OYI0,1,general,corona,Useful,C_27_U,16,Washing your hands frequently,What is the most effective measure to prevent infection with the coronavirus?
A1362Z1A98OYI0,1,general,corona,Useful,C_40_U,4,"The incubation period - the time between catching the virus and beginning to have symptoms of the disease - is estimated to range from 1-14 days, most commonly around five days.",How long is the incubation period for the new coronavirus?
A1362Z1A98OYI0,1,general,corona,Useful,C_41_U,12,Studies suggest that coronaviruses (including preliminary information on the new virus) may persist on surfaces for a few hours or up to several days.,How long does the new coronavirus survive on surfaces?
A1362Z1A98OYI0,1,general,corona,Useful,C_49_U,4,"Approved filtering facemask respirators, such as the N95 respirator.","It is recommended that healthcare professionals who may be working in contact with people with the virus wear what, in addition to personal protective equipment on their hands and bodies?"
A1362Z1A98OYI0,1,general,general,Not useful,NC_01_NU,4,Mike Powell,"In 1991, who finally broke Bob Beamon's decades-old long jump record?"
A1362Z1A98OYI0,1,general,general,Not useful,NC_03_NU,4,Red River,"What name is shared by the rivers that run through Denison, TX and Hanoi, Vietnam?"
A1362Z1A98OYI0,1,general,general,Useful,NC_43_U,16,Between 105 and 54 days before the scheduled trip.,How far in advance of a trip is the most cost effective time to purchase a plane ticket? 
A1362Z1A98OYI0,1,general,general,Useful,NC_46_U,12,"Dish soap, peroxide, and baking soda","While tomato juice probably will not work, what does work to remove skunk odor? "
A1362Z1A98OYI0,1,general,general,Useful,NC_47_U,4,"Add baking soda, soak in advance, use a preassure cooker",What can you do to make dry beans cook faster?
A1362Z1A98OYI0,1,general,general,Useful,NC_49_U,8,"Roll it along its long side. If it stops immediately, it's raw.",How can you tell if an egg is cooked without breaking it?
A1362Z1A98OYI0,1,general,third,MTurk,TB_26_MT,8,"Sometimes, it is easy to know, but science revealed that self-insight is prblematic. It is often very helpful to ask friends and family ",How do you know if you're happy?
A1362Z1A98OYI0,1,general,third,MTurk,TB_28_MT,16,"Futurist Diamandis argues that due to improved powers of computation we are likely to see AI, improved medicine, and new ways of communicating.",What is to happen ten years from now?
A1362Z1A98OYI0,1,general,third,MTurk,TB_46_MT,12,"Scientists are still figuring it out. It seems that passive use is slightly bad, but active use is not.",How does social media influence our mental health?
A1362Z1A98OYI0,1,general,third,Trivia,TB_15_TR,16,Portia,The United States' first law school for woman was named for what cross-dressing Shakespearean character?
