PID,sess,firstBlock,block,type,questionId,wait_duration,answer,question
A137J62UJA804S,1,corona,corona,Not useful,C_15_NU,4,7.5 days,"In the early stages of the new coronavirus, the number of new cases doubled approximately every how many days?"
A137J62UJA804S,1,corona,corona,Not useful,C_18_NU,4,They are able to filter out at least 95% of airborne particles,Why are N95 respirator face masks so named?
A137J62UJA804S,1,corona,corona,Not useful,C_23_NU,4,They falsely claimed to cure or prevent coronavirus,"At the end of February, Amazon banned over a million products because of what?"
A137J62UJA804S,1,corona,corona,Not useful,C_24_NU,16,Contagion,"According to media reports, which 2011 movie has seen a large increase in popularity in the wake of the new coronavirus?"
A137J62UJA804S,1,corona,corona,Useful,C_29_U,12,Not for at least several months from now,How soon is a vaccine for the new coronavirus likely to be available?
A137J62UJA804S,1,corona,corona,Useful,C_32_U,12,"In public settings where other social distancing measures are difficult to maintain (e.g., grocery stores and pharmacies).",The CDC recommend people wear cloth masks in what situations?
A137J62UJA804S,1,corona,corona,Useful,C_37_U,8,There is no evidence from the current outbreak that eating garlic has protected people from the new coronavirus.,Can eating garlic help prevent infection with the new coronavirus?
A137J62UJA804S,1,corona,corona,Useful,C_51_U,8,Nasal or orab swab or a sample of sputum,What sort of specimen is needed to test for the new coronavirus? 
A137J62UJA804S,1,corona,general,Not useful,NC_19_NU,16,Smoke,"in 1908, New York City passed the Sullivan Ordinance which made it illegal for women to do what in public?"
A137J62UJA804S,1,corona,general,Useful,NC_32_U,8,Take a picture of your fridge before leaving the house,What's a simple trick for telling whether your out of something when you're grocery shopping?
A137J62UJA804S,1,corona,general,Useful,NC_34_U,4,"Pineapple, by planting the green leaves",What tropical fruit can be regrown from its scraps?
A137J62UJA804S,1,corona,general,Useful,NC_43_U,8,Between 105 and 54 days before the scheduled trip.,How far in advance of a trip is the most cost effective time to purchase a plane ticket? 
A137J62UJA804S,1,corona,general,Useful,NC_48_U,8,"Drop it from a 3 inch height. If it bounces, it's dead.",How can you tell if a battery is dead without using any tools?
A137J62UJA804S,1,corona,general,Useful,NC_50_U,8,Spread beeswax over them and then blow dry until you can't see the beeswax anymore,What's an easy way to waterproof canvas shoes?
A137J62UJA804S,1,corona,third,MTurk,TB_25_MT,8,"Scientists estimate that we are likely to see flying cars, and that computers may be able to read people's thoughts and emotions ",What will be the new technologies of future?
A137J62UJA804S,1,corona,third,MTurk,TB_35_MT,16,Prototypes already exist. Technological estimates suggest that definitely within the next twenty years -- although the challenges are great.,When will we have flying cars?
A137J62UJA804S,1,corona,third,Trivia,TB_13_TR,16,Java,On what namesake Asian island are the first Homo erectus fossils found?
A137J62UJA804S,1,corona,third,Trivia,TB_17_TR,4,"Third finger, left hand",What part of his body did Keith Richards insure for a million pounds?
A137J62UJA804S,1,corona,third,Trivia,TB_20_TR,4,Rafflesia (corpse lily),What is the largest flower in the world?
A137J62UJA804S,1,corona,third,Trivia,TB_21_TR,4,New York,Which state has the zip code 12345?
