PID,sess,firstBlock,block,type,questionId,wait_duration,answer,question
A13CXQGLSH6QY8,1,corona,corona,Not useful,C_02_NU,16,Three ,How many pandemics were there in the 20th century?
A13CXQGLSH6QY8,1,corona,corona,Not useful,C_06_NU,16,Gwyneth Paltrow,"Which celebrity said about the new coronavirus ""I've already been in this movie""?"
A13CXQGLSH6QY8,1,corona,corona,Not useful,C_13_NU,8,"The initial cases of the disease are thought to have been among people with a connection to a seafood wholesale market, which also sold live animals","Why is the virus believed to have zoonotic origin, i.e., to have potentially come from animals?"
A13CXQGLSH6QY8,1,corona,corona,Not useful,C_20_NU,4,"Rear Adm. Ziemer led the global health security team, responsible for leading the US response to pandemics.","In May 2018, Rear Admiral Timothy Ziemer left the White House staff and was not replaced. What was Rear Adm. Ziemer's responsibility in the White House?"
A13CXQGLSH6QY8,1,corona,corona,Useful,C_27_U,8,Washing your hands frequently,What is the most effective measure to prevent infection with the coronavirus?
A13CXQGLSH6QY8,1,corona,corona,Useful,C_31_U,8,Probably not but it's too soon to be sure,Can the coronavirus be transmitted through sexual intercourse?
A13CXQGLSH6QY8,1,corona,corona,Useful,C_32_U,16,"Healthcare professionals treating patients, in-home caregivers, and those who are already sick with the new coronavirus",Which three groups of people does the CDC recommend masks for?
A13CXQGLSH6QY8,1,corona,corona,Useful,C_47_U,12,"Free of fever; no other symptoms, including cough; negative tests on at least two consecutive respiratory specimens at least 24 hours apart.",What are current Centers for Disease Control (CDC) guidelines for releasing someone from isolation?
A13CXQGLSH6QY8,1,corona,general,Not useful,NC_06_NU,4,David Livingstone,Who discovered the Victoria Falls?
A13CXQGLSH6QY8,1,corona,general,Not useful,NC_12_NU,12,Come by her,"The title of the song ""Kumbaya"" is actually a distortion of what three-word phrase?"
A13CXQGLSH6QY8,1,corona,general,Not useful,NC_17_NU,12,Gilbert Van Camp,What Indianapolis grocer made his name by selling canned pork and beans to U.S. troops during the Civil War?
A13CXQGLSH6QY8,1,corona,general,Not useful,NC_25_NU,4,Shark,"What animal is thought to be immune to most all diseases, including cancer?"
A13CXQGLSH6QY8,1,corona,general,Useful,NC_30_U,12,Floormats - put them under the wheels for traction,What item that can be found in any car can help you extract your car from mud or snow?
A13CXQGLSH6QY8,1,corona,general,Useful,NC_33_U,8,Below eye level,Where in the supermarket can you usually find the cheaper items?
A13CXQGLSH6QY8,1,corona,general,Useful,NC_36_U,16,Potatos: rub a cut potato over your windshield before a frost to prevent freezing,What vegetable can prevent your windshield from freezing over in winter?
A13CXQGLSH6QY8,1,corona,general,Useful,NC_44_U,8,Doritos,What popular snack food is effective to use as kindling to start a fire?
A13CXQGLSH6QY8,1,corona,third,MTurk,TB_31_MT,8,Scientists estimate that at the moment it is not. But with global warming it might become more feasilbe later in the 21st century.,How feasible would it be to colonize Antarctica?
A13CXQGLSH6QY8,1,corona,third,MTurk,TB_33_MT,16,"For SpaceX — the cheapest of NASA's new carriers — each pound costs approximately $27,000. So an average person of 160 pounds costs over $4,320,000.",How much does it cost to launch a person into space?
A13CXQGLSH6QY8,1,corona,third,MTurk,TB_36_MT,4,"For two reasons. One, they are too heavy. For example, the Space Shuttle weighed 2 thousand tons, yet a Boeing can only carry about 120 tons. Second, the thrust is likely to be too strong.",Why don't space rockets take off from a plane already in the air?
A13CXQGLSH6QY8,1,corona,third,MTurk,TB_44_MT,12,"In all U.S states, same-sex marriage is now legal. Also, the number of kids per family has decreased and so ""middle"" childreen, between the eldest and youngest, are getting rarer. ",How have families changed over time?
A13CXQGLSH6QY8,1,corona,third,Trivia,TB_04_TR,8,Phil Knight,"In 1964, who founded Blue Ribbon Sports, which later went on to become Nike?"
A13CXQGLSH6QY8,1,corona,third,Trivia,TB_14_TR,4,James Brown,"When asked to define ""cool,"" what two words did James Brown use?"
A13CXQGLSH6QY8,1,corona,third,Trivia,TB_19_TR,12,Ketchup,The only vegetable ice cream ever produced was what flavor?
