PID,sess,firstBlock,block,type,questionId,wait_duration,answer,question
A14EYTLSMJRPUK,1,corona,corona,Not useful,C_01_NU,4,"Animals, probably bats",What is the source of coronavirus in humans?
A14EYTLSMJRPUK,1,corona,corona,Not useful,C_21_NU,16,An epidemic that has spread around the world,An epidemic is the outbreak of a disease that affects many people at the same time. What does pandemic mean?
A14EYTLSMJRPUK,1,corona,corona,Not useful,C_22_NU,4,Contact tracing,What is the name of the process health authorities use to understand the sources of infection and to prevent further transmission?
A14EYTLSMJRPUK,1,corona,corona,Not useful,C_24_NU,4,Contagion,"According to media reports, which 2011 movie has seen a large increase in popularity in the wake of the new coronavirus?"
A14EYTLSMJRPUK,1,corona,corona,Useful,C_33_U,16,Soft surfaces are less likely to transmit the virus than hard surfaces.,Can the new coronavirus be transmitted by touching a soft surface like carpets or fabric?
A14EYTLSMJRPUK,1,corona,corona,Useful,C_47_U,12,"Free of fever; no other symptoms, including cough; negative tests on at least two consecutive respiratory specimens at least 24 hours apart.",What are current Centers for Disease Control (CDC) guidelines for releasing someone from isolation?
A14EYTLSMJRPUK,1,corona,general,Not useful,NC_02_NU,16,Tiger Woods,"Who's the only two-time Sports Illustrated Sportsman of the Year, so named in 1996 and 2000?"
A14EYTLSMJRPUK,1,corona,general,Not useful,NC_15_NU,12,Albert Einstein,Who beat out FDR and Gandhi to be named Time's Person of the Century in 1999?
A14EYTLSMJRPUK,1,corona,general,Not useful,NC_19_NU,12,Smoke,"in 1908, New York City passed the Sullivan Ordinance which made it illegal for women to do what in public?"
A14EYTLSMJRPUK,1,corona,general,Useful,NC_27_U,4,White vinegar,What can you use instead of fabric softner to soften sheets and remove odours?
A14EYTLSMJRPUK,1,corona,general,Useful,NC_34_U,12,"Pineapple, by planting the green leaves",What tropical fruit can be regrown from its scraps?
A14EYTLSMJRPUK,1,corona,general,Useful,NC_51_U,16,White vinegar,What salad dressing ingredient is also an efficient weed killer?
A14EYTLSMJRPUK,1,corona,general,Useful,NC_52_U,8,"Tie your hair into a tight ponytail at the front of your head, and cut it.",How can you give yourself a layered haircut?
A14EYTLSMJRPUK,1,corona,third,MTurk,TB_24_MT,12,"Deep sea creatures must survive in extremely harsh conditions. They include the giant spider crab, frilled shark, and the atlantic wolffish",Which creatures live in deep sea?
A14EYTLSMJRPUK,1,corona,third,MTurk,TB_31_MT,16,Scientists estimate that at the moment it is not. But with global warming it might become more feasilbe later in the 21st century.,How feasible would it be to colonize Antarctica?
A14EYTLSMJRPUK,1,corona,third,MTurk,TB_32_MT,8,Sophisticated equipment is either lowered to the sea bottom or directly attached to submersible buoys and transmits to a research vessel that is equipped with state-of-the-art navigational instruments.,What are undersea researchers doing to explore the ocean floor?
A14EYTLSMJRPUK,1,corona,third,MTurk,TB_35_MT,8,Prototypes already exist. Technological estimates suggest that definitely within the next twenty years -- although the challenges are great.,When will we have flying cars?
A14EYTLSMJRPUK,1,corona,third,Trivia,TB_09_TR,4,The first email,"What did Ray Tomlinson send in Cambridge, Massachusetts, in late 1971?"
A14EYTLSMJRPUK,1,corona,third,Trivia,TB_14_TR,8,James Brown,"When asked to define ""cool,"" what two words did James Brown use?"
A14EYTLSMJRPUK,1,corona,third,Trivia,TB_17_TR,8,"Third finger, left hand",What part of his body did Keith Richards insure for a million pounds?
A14EYTLSMJRPUK,1,corona,third,Trivia,TB_18_TR,16,Orville Wright,Who was flying the plane in which the first US airplane fatality occurred?
