PID,sess,firstBlock,block,type,questionId,wait_duration,answer,question
A14EVJ76ZAKIZA,1,general,corona,Not useful,C_02_NU,8,Three ,How many pandemics were there in the 20th century?
A14EVJ76ZAKIZA,1,general,corona,Not useful,C_11_NU,4,The Chicago of China,"Wuhan, China, the city in which the coronavirus was first identified, is commonly referred to as the chinese version of what American city?"
A14EVJ76ZAKIZA,1,general,corona,Not useful,C_13_NU,12,"The initial cases of the disease are thought to have been among people with a connection to a seafood wholesale market, which also sold live animals","Why is the virus believed to have zoonotic origin, i.e., to have potentially come from animals?"
A14EVJ76ZAKIZA,1,general,corona,Not useful,C_17_NU,16,"Locations, people, or animals","The name for the new disease COVID-19 adheres to WHO best practices in disease naming, which include guidelines to not name disease after what?"
A14EVJ76ZAKIZA,1,general,general,Not useful,NC_04_NU,4,Edward Albee,"Who wrote ""Who's Afraid of Virginia Woolf?"""
A14EVJ76ZAKIZA,1,general,general,Not useful,NC_07_NU,8,Salt Lake City,In what city could you see the Seagull Monument at Temple Square?
A14EVJ76ZAKIZA,1,general,general,Not useful,NC_14_NU,4,Rod Serling,What famed TV personality wrote the screenplay for 1968's Planet of the Apes?
A14EVJ76ZAKIZA,1,general,general,Not useful,NC_20_NU,4,Russia,Which country has the most public libraries?
A14EVJ76ZAKIZA,1,general,general,Not useful,NC_25_NU,12,Shark,"What animal is thought to be immune to most all diseases, including cancer?"
A14EVJ76ZAKIZA,1,general,general,Not useful,NC_26_NU,8,Dark Side of the Moon,What album spent a record 741 weeks on Billboard's Top 200 Albums chart?
A14EVJ76ZAKIZA,1,general,general,Useful,NC_43_U,4,Between 105 and 54 days before the scheduled trip.,How far in advance of a trip is the most cost effective time to purchase a plane ticket? 
A14EVJ76ZAKIZA,1,general,general,Useful,NC_44_U,16,Doritos,What popular snack food is effective to use as kindling to start a fire?
A14EVJ76ZAKIZA,1,general,general,Useful,NC_52_U,12,"Tie your hair into a tight ponytail at the front of your head, and cut it.",How can you give yourself a layered haircut?
A14EVJ76ZAKIZA,1,general,third,MTurk,TB_29_MT,8,"There are a few helpful techniques. One is to imagine that you climb on top of a high building, and ""look down"" at your life. Second, to try to think about issues in novel ways. ",How to stay calm in adversity?
A14EVJ76ZAKIZA,1,general,third,MTurk,TB_35_MT,12,Prototypes already exist. Technological estimates suggest that definitely within the next twenty years -- although the challenges are great.,When will we have flying cars?
A14EVJ76ZAKIZA,1,general,third,Trivia,TB_05_TR,16,Hong Kong,What city's harbor is overlooked by Victoria Peak?
A14EVJ76ZAKIZA,1,general,third,Trivia,TB_13_TR,16,Java,On what namesake Asian island are the first Homo erectus fossils found?
A14EVJ76ZAKIZA,1,general,third,Trivia,TB_23_TR,12,Tooth,What is the only part of the body that can't repair itself?
