PID,sess,firstBlock,block,type,questionId,wait_duration,answer,question
A14VD24TWW6NXW,1,general,corona,Not useful,C_03_NU,16,"Fuburary 1st, 2020",When was the molecular structure of the coronovirus identfied?
A14VD24TWW6NXW,1,general,corona,Not useful,C_08_NU,12,Lombardy,What is the name of the county in Italy that had the first coronavirus outbreak?
A14VD24TWW6NXW,1,general,corona,Not useful,C_10_NU,4,11 million people,"What is the population of Wuhan, the city in which coronavirus was first identified?"
A14VD24TWW6NXW,1,general,corona,Not useful,C_19_NU,16,Strategic National Stockpile,What is the name of the repository of drugs and supplies the U.S. government is supposed to maintain in case of a public health emergency?
A14VD24TWW6NXW,1,general,corona,Useful,C_35_U,16,"The virus spreads through coughs and sneezes, there are no reports of transmission through mosquito bites.",Can the new coronavirus be transmitted through mosquito bites?
A14VD24TWW6NXW,1,general,corona,Useful,C_39_U,8,"No, antibiotics do not work against viruses, only bacteria.",Are antibiotics effective in preventing and treating the new coronavirus?
A14VD24TWW6NXW,1,general,corona,Useful,C_51_U,8,Nasal or orab swab or a sample of sputum,What sort of specimen is needed to test for the new coronavirus? 
A14VD24TWW6NXW,1,general,general,Not useful,NC_04_NU,12,Edward Albee,"Who wrote ""Who's Afraid of Virginia Woolf?"""
A14VD24TWW6NXW,1,general,general,Not useful,NC_09_NU,4,Captain Cook,"Who christened Hawaii ""the Sandwich Islands"" in 1778?"
A14VD24TWW6NXW,1,general,general,Not useful,NC_15_NU,4,Albert Einstein,Who beat out FDR and Gandhi to be named Time's Person of the Century in 1999?
A14VD24TWW6NXW,1,general,general,Not useful,NC_22_NU,16,Steamboat Geyser,"Which Yellowstone geyser, with eruptions 100 fee taller than Old Faithful's, is the world's tallest?"
A14VD24TWW6NXW,1,general,general,Useful,NC_36_U,8,Potatos: rub a cut potato over your windshield before a frost to prevent freezing,What vegetable can prevent your windshield from freezing over in winter?
A14VD24TWW6NXW,1,general,general,Useful,NC_42_U,8,"Deprive it of oxygen by covering, pouring baking soda if the fire is small, or using a fire extinguisher if it's large.",How do you put out a grease fire? 
A14VD24TWW6NXW,1,general,general,Useful,NC_44_U,4,Doritos,What popular snack food is effective to use as kindling to start a fire?
A14VD24TWW6NXW,1,general,general,Useful,NC_47_U,4,"Add baking soda, soak in advance, use a preassure cooker",What can you do to make dry beans cook faster?
A14VD24TWW6NXW,1,general,general,Useful,NC_51_U,12,White vinegar,What salad dressing ingredient is also an efficient weed killer?
A14VD24TWW6NXW,1,general,third,MTurk,TB_26_MT,16,"Sometimes, it is easy to know, but science revealed that self-insight is prblematic. It is often very helpful to ask friends and family ",How do you know if you're happy?
A14VD24TWW6NXW,1,general,third,MTurk,TB_29_MT,4,"There are a few helpful techniques. One is to imagine that you climb on top of a high building, and ""look down"" at your life. Second, to try to think about issues in novel ways. ",How to stay calm in adversity?
A14VD24TWW6NXW,1,general,third,MTurk,TB_43_MT,4,"Planets likely start off as grains of dust that then combine to form bigger rocks. They clear material from their path, leaving tracks of space empty but for fine dust.",How do planets form?
A14VD24TWW6NXW,1,general,third,Trivia,TB_05_TR,4,Hong Kong,What city's harbor is overlooked by Victoria Peak?
A14VD24TWW6NXW,1,general,third,Trivia,TB_08_TR,8,Library of Congress,"In 1802, John Beckley became the librarian of what collection containing 740 books at the time?"
A14VD24TWW6NXW,1,general,third,Trivia,TB_12_TR,8,It sits beside the Finger Lakes,"Why is Oneida Lake, near Syracuse, New York, sometimes called ""the thumb""?"
A14VD24TWW6NXW,1,general,third,Trivia,TB_13_TR,4,Java,On what namesake Asian island are the first Homo erectus fossils found?
A14VD24TWW6NXW,1,general,third,Trivia,TB_14_TR,8,James Brown,"When asked to define ""cool,"" what two words did James Brown use?"
