PID,sess,firstBlock,block,type,questionId,wait_duration,answer,question
A15LPXZLC6NUHT,1,corona,corona,Not useful,C_02_NU,12,Three ,How many pandemics were there in the 20th century?
A15LPXZLC6NUHT,1,corona,corona,Not useful,C_17_NU,16,"Locations, people, or animals","The name for the new disease COVID-19 adheres to WHO best practices in disease naming, which include guidelines to not name disease after what?"
A15LPXZLC6NUHT,1,corona,corona,Not useful,C_18_NU,8,They are able to filter out at least 95% of airborne particles,Why are N95 respirator face masks so named?
A15LPXZLC6NUHT,1,corona,corona,Useful,C_31_U,4,"The virus is probably not sexually tansmissible, but infection does occurs when kissing.",Can the coronavirus be transmitted through sexual intercourse?
A15LPXZLC6NUHT,1,corona,corona,Useful,C_35_U,4,"The virus spreads through coughs and sneezes, there are no reports of transmission through mosquito bites.",Can the new coronavirus be transmitted through mosquito bites?
A15LPXZLC6NUHT,1,corona,corona,Useful,C_36_U,8,No. There is no evidence that regularly rinsing the nose with saline has protected people from infection with the new coronavirus.,Can regularly rinsing your nose with saline help prevent infection with the new coronavirus?
A15LPXZLC6NUHT,1,corona,corona,Useful,C_40_U,16,"The incubation period - the time between catching the virus and beginning to have symptoms of the disease - is estimated to range from 1-14 days, most commonly around five days.",How long is the incubation period for the new coronavirus?
A15LPXZLC6NUHT,1,corona,corona,Useful,C_41_U,8,Studies suggest that coronaviruses (including preliminary information on the new virus) may persist on surfaces for a few hours or up to several days.,How long does the new coronavirus survive on surfaces?
A15LPXZLC6NUHT,1,corona,general,Not useful,NC_12_NU,4,Come by her,"The title of the song ""Kumbaya"" is actually a distortion of what three-word phrase?"
A15LPXZLC6NUHT,1,corona,general,Not useful,NC_16_NU,16,Newborns,The apgar score is used to measure the color and condition of what?
A15LPXZLC6NUHT,1,corona,general,Not useful,NC_19_NU,4,Smoke,"in 1908, New York City passed the Sullivan Ordinance which made it illegal for women to do what in public?"
A15LPXZLC6NUHT,1,corona,general,Useful,NC_27_U,4,White vinegar,What can you use instead of fabric softner to soften sheets and remove odours?
A15LPXZLC6NUHT,1,corona,general,Useful,NC_32_U,16,Take a picture of your fridge before leaving the house,What's a simple trick for telling whether your out of something when you're grocery shopping?
A15LPXZLC6NUHT,1,corona,general,Useful,NC_34_U,4,"Pineapple, by planting the green leaves",What tropical fruit can be regrown from its scraps?
A15LPXZLC6NUHT,1,corona,general,Useful,NC_39_U,4,"At least $2,467 according to current research",How much money should I keep as an emergency fund?
A15LPXZLC6NUHT,1,corona,general,Useful,NC_48_U,8,"Drop it from a 3 inch height. If it bounces, it's dead.",How can you tell if a battery is dead without using any tools?
A15LPXZLC6NUHT,1,corona,third,MTurk,TB_34_MT,4,Evolution is usually very slow. Think about the similarities between apes and people. Future people are going to be as similar to us as we are to apes. ,What will future humans look like?
A15LPXZLC6NUHT,1,corona,third,MTurk,TB_38_MT,8,"As a rule, yes. Restaurants have to cover rent, salaries and taxes. These are all included in the prices.",Is it really cheaper to cook at home vs. eating out?
A15LPXZLC6NUHT,1,corona,third,MTurk,TB_40_MT,12,"NASA plans another crewed mission to the Moon by 2024, followed by a sustained presence  by 2028.  Russia is planning to begin building a human colony by 2037.",When could a lunar base be established?
A15LPXZLC6NUHT,1,corona,third,MTurk,TB_45_MT,4,"The amygdala (from Greek, 'almond') is one of two almond-shaped clusters of nuclei located deep and medially within the temporal lobes of the brain in complex vertebrates, including humans.",What is the amygdala?
A15LPXZLC6NUHT,1,corona,third,MTurk,TB_46_MT,8,"Scientists are still figuring it out. It seems that passive use is slightly bad, but active use is not.",How does social media influence our mental health?
A15LPXZLC6NUHT,1,corona,third,Trivia,TB_16_TR,4,Jim Lovell,Alan Shepard was scheduled to command the ill-fated Apollo 13 before switching missions with what astronaut?
A15LPXZLC6NUHT,1,corona,third,Trivia,TB_19_TR,12,Ketchup,The only vegetable ice cream ever produced was what flavor?
