PID,sess,firstBlock,block,type,questionId,wait_duration,answer,question
A15ZVBPW77R3RU,1,general,general,Not useful,NC_20_NU,4,Russia,Which country has the most public libraries?
A15ZVBPW77R3RU,1,general,general,Useful,NC_32_U,12,Take a picture of your fridge before leaving the house,What's a simple trick for telling whether your out of something when you're grocery shopping?
A15ZVBPW77R3RU,1,general,general,Useful,NC_36_U,4,Potatos: rub a cut potato over your windshield before a frost to prevent freezing,What vegetable can prevent your windshield from freezing over in winter?
A15ZVBPW77R3RU,1,general,general,Useful,NC_40_U,16,Squint your eyes,How do you make your smile look more genuine in photographs?
A15ZVBPW77R3RU,1,general,third,MTurk,TB_30_MT,12,"The ""no hair theorem"" states that a black hole has only three properties: electric charge, angular momentum, and mass.",What is the composition of a black hole?
A15ZVBPW77R3RU,1,general,third,MTurk,TB_39_MT,4,"There is radio emission around black holes. Scientists created a network of telescopes, capturing an image of a black hole by improving upon a technique that allows for the imaging of far-away objects",How was the recent picture of a black hole made?
A15ZVBPW77R3RU,1,general,third,MTurk,TB_40_MT,4,"NASA plans another crewed mission to the Moon by 2024, followed by a sustained presence  by 2028.  Russia is planning to begin building a human colony by 2037.",When could a lunar base be established?
A15ZVBPW77R3RU,1,general,third,Trivia,TB_07_TR,12,Tuxedo Club,What New York country club lent its name to the kind of dinner jacket first worn there in 1886?
A15ZVBPW77R3RU,1,general,third,Trivia,TB_23_TR,4,Tooth,What is the only part of the body that can't repair itself?
