PID,sess,firstBlock,block,type,questionId,wait_duration,answer,question
A16XDO6MW9ZKMI,1,corona,corona,Not useful,C_01_NU,8,"Animals, probably bats",What is the source of coronavirus in humans?
A16XDO6MW9ZKMI,1,corona,corona,Not useful,C_03_NU,4,"Fuburary 1st, 2020",When was the molecular structure of the coronovirus identfied?
A16XDO6MW9ZKMI,1,corona,corona,Not useful,C_11_NU,4,The Chicago of China,"Wuhan, China, the city in which the coronavirus was first identified, is commonly referred to as the chinese version of what American city?"
A16XDO6MW9ZKMI,1,corona,corona,Not useful,C_13_NU,16,"The initial cases of the disease are thought to have been among people with a connection to a seafood wholesale market, which also sold live animals","Why is the virus believed to have zoonotic origin, i.e., to have potentially come from animals?"
A16XDO6MW9ZKMI,1,corona,corona,Not useful,C_19_NU,4,Strategic National Stockpile,What is the name of the repository of drugs and supplies the U.S. government is supposed to maintain in case of a public health emergency?
A16XDO6MW9ZKMI,1,corona,corona,Not useful,C_24_NU,8,Contagion,"According to media reports, which 2011 movie has seen a large increase in popularity in the wake of the new coronavirus?"
A16XDO6MW9ZKMI,1,corona,corona,Useful,C_40_U,16,"The incubation period - the time between catching the virus and beginning to have symptoms of the disease - is estimated to range from 1-14 days, most commonly around five days.",How long is the incubation period for the new coronavirus?
A16XDO6MW9ZKMI,1,corona,general,Not useful,NC_25_NU,16,Shark,"What animal is thought to be immune to most all diseases, including cancer?"
A16XDO6MW9ZKMI,1,corona,general,Useful,NC_34_U,4,"Pineapple, by planting the green leaves",What tropical fruit can be regrown from its scraps?
A16XDO6MW9ZKMI,1,corona,general,Useful,NC_40_U,4,Squint your eyes,How do you make your smile look more genuine in photographs?
A16XDO6MW9ZKMI,1,corona,general,Useful,NC_46_U,12,"Dish soap, peroxide, and baking soda","While tomato juice probably will not work, what does work to remove skunk odor? "
A16XDO6MW9ZKMI,1,corona,third,MTurk,TB_27_MT,4,"We do not know, of course. Yet, it is important to realize that there is no scientific proof for God's existence.  ",Does God exist?
A16XDO6MW9ZKMI,1,corona,third,MTurk,TB_28_MT,4,"Futurist Diamandis argues that due to improved powers of computation we are likely to see AI, improved medicine, and new ways of communicating.",What is to happen ten years from now?
A16XDO6MW9ZKMI,1,corona,third,MTurk,TB_40_MT,16,"NASA plans another crewed mission to the Moon by 2024, followed by a sustained presence  by 2028.  Russia is planning to begin building a human colony by 2037.",When could a lunar base be established?
A16XDO6MW9ZKMI,1,corona,third,MTurk,TB_41_MT,8,"Deep learning-based machines, that can process unparalleled amount of information will allow AI to accomplish goals that were unimaginable until very recently. ",What are the most recent developments in artificial intelligence?
A16XDO6MW9ZKMI,1,corona,third,MTurk,TB_43_MT,12,"Planets likely start off as grains of dust that then combine to form bigger rocks. They clear material from their path, leaving tracks of space empty but for fine dust.",How do planets form?
A16XDO6MW9ZKMI,1,corona,third,Trivia,TB_15_TR,8,Portia,The United States' first law school for woman was named for what cross-dressing Shakespearean character?
