PID,sess,firstBlock,block,type,questionId,wait_duration,answer,question
A1728CZYSQQT2R,1,general,corona,Not useful,C_06_NU,4,Gwyneth Paltrow,"Which celebrity said about the new coronavirus ""I've already been in this movie""?"
A1728CZYSQQT2R,1,general,corona,Not useful,C_13_NU,4,"The initial cases of the disease are thought to have been among people with a connection to a seafood wholesale market, which also sold live animals","Why is the virus believed to have zoonotic origin, i.e., to have potentially come from animals?"
A1728CZYSQQT2R,1,general,corona,Not useful,C_25_NU,16,The viruses have spikes on their outer surface that look like a crown (or corona in Latin),What is the supposed origin of the name coronavirus?
A1728CZYSQQT2R,1,general,corona,Useful,C_28_U,8,"Yes, by boosting the immune system",Does sleep make you more resistant to coronavirus infections?
A1728CZYSQQT2R,1,general,corona,Useful,C_42_U,16,"Fever, cough, shortness of breath.",What are the most common symptoms of the new coronavirus?
A1728CZYSQQT2R,1,general,corona,Useful,C_47_U,12,"Free of fever; no other symptoms, including cough; negative tests on at least two consecutive respiratory specimens at least 24 hours apart.",What are current Centers for Disease Control (CDC) guidelines for releasing someone from isolation?
A1728CZYSQQT2R,1,general,general,Not useful,NC_03_NU,12,Red River,"What name is shared by the rivers that run through Denison, TX and Hanoi, Vietnam?"
A1728CZYSQQT2R,1,general,general,Not useful,NC_11_NU,8,Endeavour,What is the name of the ship that carried Captain Cook to Australia?
A1728CZYSQQT2R,1,general,general,Not useful,NC_12_NU,4,Come by her,"The title of the song ""Kumbaya"" is actually a distortion of what three-word phrase?"
A1728CZYSQQT2R,1,general,general,Not useful,NC_18_NU,16,A truce,What was put in place by the Ancient Greeks before and during all Olympic festivals?
A1728CZYSQQT2R,1,general,general,Not useful,NC_19_NU,12,Smoke,"in 1908, New York City passed the Sullivan Ordinance which made it illegal for women to do what in public?"
A1728CZYSQQT2R,1,general,general,Not useful,NC_21_NU,4,The Pieta,Which was the only one of his sculptures that Michelangelo signed?
A1728CZYSQQT2R,1,general,general,Not useful,NC_23_NU,8,The Netherlands,In 1568 the Catholic Church sentenced the entire population of which nation to death as heretics?
A1728CZYSQQT2R,1,general,general,Useful,NC_34_U,8,"Pineapple, by planting the green leaves",What tropical fruit can be regrown from its scraps?
A1728CZYSQQT2R,1,general,general,Useful,NC_49_U,4,"Roll it along its long side. If it stops immediately, it's raw.",How can you tell if an egg is cooked without breaking it?
A1728CZYSQQT2R,1,general,general,Useful,NC_50_U,16,Spread beeswax over them and then blow dry until you can't see the beeswax anymore,What's an easy way to waterproof canvas shoes?
A1728CZYSQQT2R,1,general,third,MTurk,TB_32_MT,4,Sophisticated equipment is either lowered to the sea bottom or directly attached to submersible buoys and transmits to a research vessel that is equipped with state-of-the-art navigational instruments.,What are undersea researchers doing to explore the ocean floor?
A1728CZYSQQT2R,1,general,third,MTurk,TB_40_MT,4,"NASA plans another crewed mission to the Moon by 2024, followed by a sustained presence  by 2028.  Russia is planning to begin building a human colony by 2037.",When could a lunar base be established?
A1728CZYSQQT2R,1,general,third,MTurk,TB_42_MT,8,"Galaxy formation occured in the aftermath of the Big Bang. Clustering and merging allows galaxies to accumulate mass, determining both their shape and structure. ",How do galaxies form?
A1728CZYSQQT2R,1,general,third,MTurk,TB_44_MT,8,"In all U.S states, same-sex marriage is now legal. Also, the number of kids per family has decreased and so ""middle"" childreen, between the eldest and youngest, are getting rarer. ",How have families changed over time?
A1728CZYSQQT2R,1,general,third,Trivia,TB_01_TR,4,Canada,"What country is home to Roots, the company that outfits the U.S. Olympic team?"
A1728CZYSQQT2R,1,general,third,Trivia,TB_10_TR,12,George VI,Who was the last British Monarch to also be an emperor?
A1728CZYSQQT2R,1,general,third,Trivia,TB_14_TR,4,James Brown,"When asked to define ""cool,"" what two words did James Brown use?"
A1728CZYSQQT2R,1,general,third,Trivia,TB_17_TR,16,"Third finger, left hand",What part of his body did Keith Richards insure for a million pounds?
A1728CZYSQQT2R,1,general,third,Trivia,TB_23_TR,4,Tooth,What is the only part of the body that can't repair itself?
