PID,sess,firstBlock,block,type,questionId,wait_duration,answer,question
A17LRY89BBPCUG,1,general,corona,Not useful,C_12_NU,16,Diamond Princess,What was the name of the British cruise ship that was quarantined in Japanese waters?
A17LRY89BBPCUG,1,general,corona,Not useful,C_21_NU,8,An epidemic that has spread around the world,An epidemic is the outbreak of a disease that affects many people at the same time. What does pandemic mean?
A17LRY89BBPCUG,1,general,corona,Not useful,C_25_NU,12,The viruses have spikes on their outer surface that look like a crown (or corona in Latin),What is the supposed origin of the name coronavirus?
A17LRY89BBPCUG,1,general,corona,Not useful,C_26_NU,12,Severe acute respiratory syndrome,The official name of the new coronavirus is SARS-CoV-2. What does SARS stand for?
A17LRY89BBPCUG,1,general,corona,Useful,C_27_U,16,Washing your hands frequently,What is the most effective measure to prevent infection with the coronavirus?
A17LRY89BBPCUG,1,general,corona,Useful,C_29_U,16,Not for at least several months from now,How soon is a vaccine for the new coronavirus likely to be available?
A17LRY89BBPCUG,1,general,general,Not useful,NC_03_NU,4,Red River,"What name is shared by the rivers that run through Denison, TX and Hanoi, Vietnam?"
A17LRY89BBPCUG,1,general,general,Not useful,NC_24_NU,4,State quarters,What's been released five times a year from January 1999 to fall 2008?
A17LRY89BBPCUG,1,general,general,Not useful,NC_26_NU,8,Dark Side of the Moon,What album spent a record 741 weeks on Billboard's Top 200 Albums chart?
A17LRY89BBPCUG,1,general,general,Useful,NC_32_U,12,Take a picture of your fridge before leaving the house,What's a simple trick for telling whether your out of something when you're grocery shopping?
A17LRY89BBPCUG,1,general,general,Useful,NC_34_U,4,"Pineapple, by planting the green leaves",What tropical fruit can be regrown from its scraps?
A17LRY89BBPCUG,1,general,general,Useful,NC_42_U,12,"Deprive it of oxygen by covering, pouring baking soda if the fire is small, or using a fire extinguisher if it's large.",How do you put out a grease fire? 
A17LRY89BBPCUG,1,general,general,Useful,NC_51_U,8,White vinegar,What salad dressing ingredient is also an efficient weed killer?
A17LRY89BBPCUG,1,general,third,MTurk,TB_30_MT,8,"The ""no hair theorem"" states that a black hole has only three properties: electric charge, angular momentum, and mass.",What is the composition of a black hole?
A17LRY89BBPCUG,1,general,third,MTurk,TB_32_MT,12,Sophisticated equipment is either lowered to the sea bottom or directly attached to submersible buoys and transmits to a research vessel that is equipped with state-of-the-art navigational instruments.,What are undersea researchers doing to explore the ocean floor?
A17LRY89BBPCUG,1,general,third,MTurk,TB_35_MT,8,Prototypes already exist. Technological estimates suggest that definitely within the next twenty years -- although the challenges are great.,When will we have flying cars?
A17LRY89BBPCUG,1,general,third,Trivia,TB_02_TR,8,Ivory Coast's,"The world's largest church is Our Lady of Peace Basilica in Yamoussoukro, what nation's capital?"
A17LRY89BBPCUG,1,general,third,Trivia,TB_05_TR,12,Hong Kong,What city's harbor is overlooked by Victoria Peak?
A17LRY89BBPCUG,1,general,third,Trivia,TB_11_TR,16,Mung beans,What kind of bean produces the Asian-style bean sprouts in the produce section of supermarkets?
A17LRY89BBPCUG,1,general,third,Trivia,TB_15_TR,16,Portia,The United States' first law school for woman was named for what cross-dressing Shakespearean character?
