PID,sess,firstBlock,block,type,questionId,wait_duration,answer,question
A18RZQ35649XKD,1,corona,corona,Not useful,C_06_NU,16,Gwyneth Paltrow,"Which celebrity said about the new coronavirus ""I've already been in this movie""?"
A18RZQ35649XKD,1,corona,corona,Not useful,C_09_NU,4,Hubei,What is the name of the province in China in which this new coronavirus was first discovered?
A18RZQ35649XKD,1,corona,corona,Not useful,C_11_NU,16,The Chicago of China,"Wuhan, China, the city in which the coronavirus was first identified, is commonly referred to as the chinese version of what American city?"
A18RZQ35649XKD,1,corona,corona,Useful,C_32_U,8,"Healthcare professionals treating patients, in-home caregivers, and those who are already sick with the new coronavirus",Which three groups of people does the CDC recommend masks for?
A18RZQ35649XKD,1,corona,general,Not useful,NC_12_NU,12,Come by her,"The title of the song ""Kumbaya"" is actually a distortion of what three-word phrase?"
A18RZQ35649XKD,1,corona,general,Not useful,NC_20_NU,4,Russia,Which country has the most public libraries?
A18RZQ35649XKD,1,corona,general,Not useful,NC_21_NU,12,The Pieta,Which was the only one of his sculptures that Michelangelo signed?
A18RZQ35649XKD,1,corona,general,Not useful,NC_23_NU,12,The Netherlands,In 1568 the Catholic Church sentenced the entire population of which nation to death as heretics?
A18RZQ35649XKD,1,corona,general,Not useful,NC_25_NU,8,Shark,"What animal is thought to be immune to most all diseases, including cancer?"
A18RZQ35649XKD,1,corona,general,Useful,NC_37_U,8,"Over the past 150 year, real estate, if you rent it out",What's a better investment: stocks or real estate?
A18RZQ35649XKD,1,corona,third,MTurk,TB_30_MT,16,"The ""no hair theorem"" states that a black hole has only three properties: electric charge, angular momentum, and mass.",What is the composition of a black hole?
A18RZQ35649XKD,1,corona,third,MTurk,TB_34_MT,12,Evolution is usually very slow. Think about the similarities between apes and people. Future people are going to be as similar to us as we are to apes. ,What will future humans look like?
A18RZQ35649XKD,1,corona,third,Trivia,TB_02_TR,8,Ivory Coast's,"The world's largest church is Our Lady of Peace Basilica in Yamoussoukro, what nation's capital?"
A18RZQ35649XKD,1,corona,third,Trivia,TB_07_TR,4,Tuxedo Club,What New York country club lent its name to the kind of dinner jacket first worn there in 1886?
A18RZQ35649XKD,1,corona,third,Trivia,TB_12_TR,12,It sits beside the Finger Lakes,"Why is Oneida Lake, near Syracuse, New York, sometimes called ""the thumb""?"
A18RZQ35649XKD,1,corona,third,Trivia,TB_15_TR,4,Portia,The United States' first law school for woman was named for what cross-dressing Shakespearean character?
