PID,sess,firstBlock,block,type,questionId,wait_duration,answer,question
A18WPTVQPM9LBH,1,corona,corona,Not useful,C_24_NU,12,Contagion,"According to media reports, which 2011 movie has seen a large increase in popularity in the wake of the new coronavirus?"
A18WPTVQPM9LBH,1,corona,corona,Useful,C_32_U,8,"Healthcare professionals treating patients, in-home caregivers, and those who are already sick with the new coronavirus",Which three groups of people does the CDC recommend masks for?
A18WPTVQPM9LBH,1,corona,corona,Useful,C_36_U,12,No. There is no evidence that regularly rinsing the nose with saline has protected people from infection with the new coronavirus.,Can regularly rinsing your nose with saline help prevent infection with the new coronavirus?
A18WPTVQPM9LBH,1,corona,corona,Useful,C_41_U,4,Studies suggest that coronaviruses (including preliminary information on the new virus) may persist on surfaces for a few hours or up to several days.,How long does the new coronavirus survive on surfaces?
A18WPTVQPM9LBH,1,corona,corona,Useful,C_48_U,16,"Regular face masks are not considered effective, and reserves need to be saved for people who are infected and for healthcare professionals.",Why does the CDC currently recommend that healthy people do not wear face masks?
A18WPTVQPM9LBH,1,corona,corona,Useful,C_51_U,8,Nasal or orab swab or a sample of sputum,What sort of specimen is needed to test for the new coronavirus? 
A18WPTVQPM9LBH,1,corona,corona,Useful,C_52_U,12,No. To protect yourself against the new coronavirus washing your hands is the best preventive measure.,Are hand dryers effective in killing the new coronavirus?
A18WPTVQPM9LBH,1,corona,general,Not useful,NC_05_NU,8,Matthew,Which of the four biblical Gospels was written by a tax collector?
A18WPTVQPM9LBH,1,corona,general,Not useful,NC_07_NU,16,Salt Lake City,In what city could you see the Seagull Monument at Temple Square?
A18WPTVQPM9LBH,1,corona,general,Not useful,NC_12_NU,16,Come by her,"The title of the song ""Kumbaya"" is actually a distortion of what three-word phrase?"
A18WPTVQPM9LBH,1,corona,general,Useful,NC_33_U,16,Below eye level,Where in the supermarket can you usually find the cheaper items?
A18WPTVQPM9LBH,1,corona,general,Useful,NC_50_U,8,Spread beeswax over them and then blow dry until you can't see the beeswax anymore,What's an easy way to waterproof canvas shoes?
A18WPTVQPM9LBH,1,corona,third,MTurk,TB_26_MT,12,"Sometimes, it is easy to know, but science revealed that self-insight is prblematic. It is often very helpful to ask friends and family ",How do you know if you're happy?
A18WPTVQPM9LBH,1,corona,third,MTurk,TB_33_MT,16,"For SpaceX — the cheapest of NASA's new carriers — each pound costs approximately $27,000. So an average person of 160 pounds costs over $4,320,000.",How much does it cost to launch a person into space?
A18WPTVQPM9LBH,1,corona,third,MTurk,TB_44_MT,8,"In all U.S states, same-sex marriage is now legal. Also, the number of kids per family has decreased and so ""middle"" childreen, between the eldest and youngest, are getting rarer. ",How have families changed over time?
A18WPTVQPM9LBH,1,corona,third,Trivia,TB_04_TR,4,Phil Knight,"In 1964, who founded Blue Ribbon Sports, which later went on to become Nike?"
A18WPTVQPM9LBH,1,corona,third,Trivia,TB_07_TR,16,Tuxedo Club,What New York country club lent its name to the kind of dinner jacket first worn there in 1886?
A18WPTVQPM9LBH,1,corona,third,Trivia,TB_15_TR,4,Portia,The United States' first law school for woman was named for what cross-dressing Shakespearean character?
A18WPTVQPM9LBH,1,corona,third,Trivia,TB_18_TR,12,Orville Wright,Who was flying the plane in which the first US airplane fatality occurred?
