PID,sess,firstBlock,block,type,questionId,wait_duration,answer,question
A191V7PT3DQKDP,1,general,corona,Not useful,C_20_NU,4,"Rear Adm. Ziemer led the global health security team, responsible for leading the US response to pandemics.","In May 2018, Rear Admiral Timothy Ziemer left the White House staff and was not replaced. What was Rear Adm. Ziemer's responsibility in the White House?"
A191V7PT3DQKDP,1,general,corona,Not useful,C_24_NU,4,Contagion,"According to media reports, which 2011 movie has seen a large increase in popularity in the wake of the new coronavirus?"
A191V7PT3DQKDP,1,general,corona,Not useful,C_26_NU,16,Severe acute respiratory syndrome,The official name of the new coronavirus is SARS-CoV-2. What does SARS stand for?
A191V7PT3DQKDP,1,general,corona,Useful,C_42_U,12,"Fever, cough, shortness of breath.",What are the most common symptoms of the new coronavirus?
A191V7PT3DQKDP,1,general,corona,Useful,C_45_U,12,"Pre-existing health conditions, including cardiovascular diseases and diabetes.",What did 75% of the people who have died from the new coronavirus have?
A191V7PT3DQKDP,1,general,general,Not useful,NC_17_NU,4,Gilbert Van Camp,What Indianapolis grocer made his name by selling canned pork and beans to U.S. troops during the Civil War?
A191V7PT3DQKDP,1,general,general,Not useful,NC_25_NU,8,Shark,"What animal is thought to be immune to most all diseases, including cancer?"
A191V7PT3DQKDP,1,general,general,Useful,NC_29_U,4,"Freeze before chopping, or hold a piece of bread in your mouth, half sticking out",How to chop an onion without crying?
A191V7PT3DQKDP,1,general,general,Useful,NC_31_U,8,Sign up for a free USAA membership,How can people under 25 rent a car without paying extra fees?
A191V7PT3DQKDP,1,general,general,Useful,NC_33_U,8,Below eye level,Where in the supermarket can you usually find the cheaper items?
A191V7PT3DQKDP,1,general,general,Useful,NC_36_U,4,Potatos: rub a cut potato over your windshield before a frost to prevent freezing,What vegetable can prevent your windshield from freezing over in winter?
A191V7PT3DQKDP,1,general,general,Useful,NC_38_U,12,"Camu Camu, a cherry-like fruit from Brazil",What fruit has the highest content of vitamin C?
A191V7PT3DQKDP,1,general,third,MTurk,TB_25_MT,8,"Scientists estimate that we are likely to see flying cars, and that computers may be able to read people's thoughts and emotions ",What will be the new technologies of future?
A191V7PT3DQKDP,1,general,third,MTurk,TB_34_MT,4,Evolution is usually very slow. Think about the similarities between apes and people. Future people are going to be as similar to us as we are to apes. ,What will future humans look like?
A191V7PT3DQKDP,1,general,third,MTurk,TB_35_MT,8,Prototypes already exist. Technological estimates suggest that definitely within the next twenty years -- although the challenges are great.,When will we have flying cars?
A191V7PT3DQKDP,1,general,third,MTurk,TB_37_MT,4,Engineers and architects agree that the answer is positive. Houses for the non-rich are much better built today than they were built 500 years ago.,Are houses built better than they used to be?
A191V7PT3DQKDP,1,general,third,MTurk,TB_38_MT,16,"As a rule, yes. Restaurants have to cover rent, salaries and taxes. These are all included in the prices.",Is it really cheaper to cook at home vs. eating out?
A191V7PT3DQKDP,1,general,third,MTurk,TB_41_MT,4,"Deep learning-based machines, that can process unparalleled amount of information will allow AI to accomplish goals that were unimaginable until very recently. ",What are the most recent developments in artificial intelligence?
