PID,sess,firstBlock,block,type,questionId,wait_duration,answer,question
A19U33UC2XZ6G9,1,general,corona,Not useful,C_01_NU,12,"Animals, probably bats",What is the source of coronavirus in humans?
A19U33UC2XZ6G9,1,general,corona,Not useful,C_10_NU,12,11 million people,"What is the population of Wuhan, the city in which coronavirus was first identified?"
A19U33UC2XZ6G9,1,general,corona,Useful,C_37_U,16,There is no evidence from the current outbreak that eating garlic has protected people from the new coronavirus.,Can eating garlic help prevent infection with the new coronavirus?
A19U33UC2XZ6G9,1,general,corona,Useful,C_52_U,12,No. To protect yourself against the new coronavirus washing your hands is the best preventive measure.,Are hand dryers effective in killing the new coronavirus?
A19U33UC2XZ6G9,1,general,general,Not useful,NC_15_NU,4,Albert Einstein,Who beat out FDR and Gandhi to be named Time's Person of the Century in 1999?
A19U33UC2XZ6G9,1,general,general,Not useful,NC_24_NU,4,State quarters,What's been released five times a year from January 1999 to fall 2008?
A19U33UC2XZ6G9,1,general,general,Not useful,NC_25_NU,4,Shark,"What animal is thought to be immune to most all diseases, including cancer?"
A19U33UC2XZ6G9,1,general,general,Useful,NC_32_U,4,Take a picture of your fridge before leaving the house,What's a simple trick for telling whether your out of something when you're grocery shopping?
A19U33UC2XZ6G9,1,general,general,Useful,NC_36_U,8,Potatos: rub a cut potato over your windshield before a frost to prevent freezing,What vegetable can prevent your windshield from freezing over in winter?
A19U33UC2XZ6G9,1,general,general,Useful,NC_45_U,12,"Grapes or raisins, onions, avocado","In addition to chocolate, what other foods can be very harmful to dogs? "
A19U33UC2XZ6G9,1,general,general,Useful,NC_49_U,16,"Roll it along its long side. If it stops immediately, it's raw.",How can you tell if an egg is cooked without breaking it?
A19U33UC2XZ6G9,1,general,third,MTurk,TB_25_MT,12,"Scientists estimate that we are likely to see flying cars, and that computers may be able to read people's thoughts and emotions ",What will be the new technologies of future?
A19U33UC2XZ6G9,1,general,third,MTurk,TB_28_MT,8,"Futurist Diamandis argues that due to improved powers of computation we are likely to see AI, improved medicine, and new ways of communicating.",What is to happen ten years from now?
A19U33UC2XZ6G9,1,general,third,MTurk,TB_33_MT,16,"For SpaceX — the cheapest of NASA's new carriers — each pound costs approximately $27,000. So an average person of 160 pounds costs over $4,320,000.",How much does it cost to launch a person into space?
A19U33UC2XZ6G9,1,general,third,MTurk,TB_44_MT,16,"In all U.S states, same-sex marriage is now legal. Also, the number of kids per family has decreased and so ""middle"" childreen, between the eldest and youngest, are getting rarer. ",How have families changed over time?
A19U33UC2XZ6G9,1,general,third,Trivia,TB_12_TR,4,It sits beside the Finger Lakes,"Why is Oneida Lake, near Syracuse, New York, sometimes called ""the thumb""?"
A19U33UC2XZ6G9,1,general,third,Trivia,TB_21_TR,8,New York,Which state has the zip code 12345?
