PID,sess,firstBlock,block,type,questionId,wait_duration,answer,question
A1AZV2XOQK7RSW,1,corona,corona,Not useful,C_02_NU,4,Three ,How many pandemics were there in the 20th century?
A1AZV2XOQK7RSW,1,corona,corona,Not useful,C_20_NU,8,"Rear Adm. Ziemer led the global health security team, responsible for leading the US response to pandemics.","In May 2018, Rear Admiral Timothy Ziemer left the White House staff and was not replaced. What was Rear Adm. Ziemer's responsibility in the White House?"
A1AZV2XOQK7RSW,1,corona,corona,Not useful,C_22_NU,8,Contact tracing,What is the name of the process health authorities use to understand the sources of infection and to prevent further transmission?
A1AZV2XOQK7RSW,1,corona,corona,Not useful,C_23_NU,4,They falsely claimed to cure or prevent coronavirus,"At the end of February, Amazon banned over a million products because of what?"
A1AZV2XOQK7RSW,1,corona,corona,Useful,C_35_U,12,"The virus spreads through coughs and sneezes, there are no reports of transmission through mosquito bites.",Can the new coronavirus be transmitted through mosquito bites?
A1AZV2XOQK7RSW,1,corona,corona,Useful,C_51_U,8,Nasal or orab swab or a sample of sputum,What sort of specimen is needed to test for the new coronavirus? 
A1AZV2XOQK7RSW,1,corona,general,Not useful,NC_03_NU,16,Red River,"What name is shared by the rivers that run through Denison, TX and Hanoi, Vietnam?"
A1AZV2XOQK7RSW,1,corona,general,Not useful,NC_10_NU,16,K.D. Lang,What Canadian singer appeared on the first cover of Entertainment Weekly?
A1AZV2XOQK7RSW,1,corona,general,Not useful,NC_13_NU,8,Bling bling,What term does rapper B.G. say he wishes he'd patented when he used it for the title of his massive 1999 hit?
A1AZV2XOQK7RSW,1,corona,general,Not useful,NC_24_NU,16,State quarters,What's been released five times a year from January 1999 to fall 2008?
A1AZV2XOQK7RSW,1,corona,general,Not useful,NC_26_NU,16,Dark Side of the Moon,What album spent a record 741 weeks on Billboard's Top 200 Albums chart?
A1AZV2XOQK7RSW,1,corona,third,MTurk,TB_33_MT,4,"For SpaceX — the cheapest of NASA's new carriers — each pound costs approximately $27,000. So an average person of 160 pounds costs over $4,320,000.",How much does it cost to launch a person into space?
A1AZV2XOQK7RSW,1,corona,third,Trivia,TB_05_TR,8,Hong Kong,What city's harbor is overlooked by Victoria Peak?
A1AZV2XOQK7RSW,1,corona,third,Trivia,TB_13_TR,8,Java,On what namesake Asian island are the first Homo erectus fossils found?
A1AZV2XOQK7RSW,1,corona,third,Trivia,TB_14_TR,16,James Brown,"When asked to define ""cool,"" what two words did James Brown use?"
A1AZV2XOQK7RSW,1,corona,third,Trivia,TB_18_TR,12,Orville Wright,Who was flying the plane in which the first US airplane fatality occurred?
A1AZV2XOQK7RSW,1,corona,third,Trivia,TB_22_TR,8,Cheetah,Which is the only cat that cannot retract its claws?
