PID,sess,firstBlock,block,type,questionId,wait_duration,answer,question
A1BGW6IPXQQJ0R,1,corona,corona,Not useful,C_02_NU,8,Three ,How many pandemics were there in the 20th century?
A1BGW6IPXQQJ0R,1,corona,corona,Not useful,C_14_NU,4,"January 30, 2020",On what date did the World Health Organization declare the new coronavirus outbreak to be a Public Health Emergency of International Concern?
A1BGW6IPXQQJ0R,1,corona,corona,Not useful,C_24_NU,4,Contagion,"According to media reports, which 2011 movie has seen a large increase in popularity in the wake of the new coronavirus?"
A1BGW6IPXQQJ0R,1,corona,corona,Useful,C_32_U,16,"In public settings where other social distancing measures are difficult to maintain (e.g., grocery stores and pharmacies).",The CDC recommend people wear cloth masks in what situations?
A1BGW6IPXQQJ0R,1,corona,corona,Useful,C_34_U,8,"The virus lives for up to a few days on surfaces, and so packages cannot transmit the virus.",Can the new coronavirus be transmitted on a package from an infected country?
A1BGW6IPXQQJ0R,1,corona,corona,Useful,C_46_U,8,Remdesivir,"Which drug, which has been used as a treatment for the Ebola and Marburg viruses, might be promising as a treatment for this new coronavirus?"
A1BGW6IPXQQJ0R,1,corona,general,Not useful,NC_03_NU,16,Red River,"What name is shared by the rivers that run through Denison, TX and Hanoi, Vietnam?"
A1BGW6IPXQQJ0R,1,corona,general,Not useful,NC_24_NU,12,State quarters,What's been released five times a year from January 1999 to fall 2008?
A1BGW6IPXQQJ0R,1,corona,general,Not useful,NC_25_NU,12,Shark,"What animal is thought to be immune to most all diseases, including cancer?"
A1BGW6IPXQQJ0R,1,corona,general,Useful,NC_36_U,12,Potatos: rub a cut potato over your windshield before a frost to prevent freezing,What vegetable can prevent your windshield from freezing over in winter?
A1BGW6IPXQQJ0R,1,corona,general,Useful,NC_38_U,12,"Camu Camu, a cherry-like fruit from Brazil",What fruit has the highest content of vitamin C?
A1BGW6IPXQQJ0R,1,corona,third,MTurk,TB_37_MT,8,Engineers and architects agree that the answer is positive. Houses for the non-rich are much better built today than they were built 500 years ago.,Are houses built better than they used to be?
A1BGW6IPXQQJ0R,1,corona,third,MTurk,TB_39_MT,16,"There is radio emission around black holes. Scientists created a network of telescopes, capturing an image of a black hole by improving upon a technique that allows for the imaging of far-away objects",How was the recent picture of a black hole made?
A1BGW6IPXQQJ0R,1,corona,third,MTurk,TB_40_MT,16,"NASA plans another crewed mission to the Moon by 2024, followed by a sustained presence  by 2028.  Russia is planning to begin building a human colony by 2037.",When could a lunar base be established?
A1BGW6IPXQQJ0R,1,corona,third,MTurk,TB_41_MT,8,"Deep learning-based machines, that can process unparalleled amount of information will allow AI to accomplish goals that were unimaginable until very recently. ",What are the most recent developments in artificial intelligence?
