PID,sess,firstBlock,block,type,questionId,wait_duration,answer,question
A1C0PXPJXTO6L3,1,general,corona,Not useful,C_01_NU,8,"Animals, probably bats",What is the source of coronavirus in humans?
A1C0PXPJXTO6L3,1,general,corona,Not useful,C_24_NU,4,Contagion,"According to media reports, which 2011 movie has seen a large increase in popularity in the wake of the new coronavirus?"
A1C0PXPJXTO6L3,1,general,corona,Useful,C_37_U,16,There is no evidence from the current outbreak that eating garlic has protected people from the new coronavirus.,Can eating garlic help prevent infection with the new coronavirus?
A1C0PXPJXTO6L3,1,general,general,Not useful,NC_17_NU,8,Gilbert Van Camp,What Indianapolis grocer made his name by selling canned pork and beans to U.S. troops during the Civil War?
A1C0PXPJXTO6L3,1,general,general,Not useful,NC_18_NU,4,A truce,What was put in place by the Ancient Greeks before and during all Olympic festivals?
A1C0PXPJXTO6L3,1,general,general,Not useful,NC_20_NU,8,Russia,Which country has the most public libraries?
A1C0PXPJXTO6L3,1,general,general,Not useful,NC_21_NU,4,The Pieta,Which was the only one of his sculptures that Michelangelo signed?
A1C0PXPJXTO6L3,1,general,general,Not useful,NC_26_NU,8,Dark Side of the Moon,What album spent a record 741 weeks on Billboard's Top 200 Albums chart?
A1C0PXPJXTO6L3,1,general,general,Useful,NC_36_U,16,Potatos: rub a cut potato over your windshield before a frost to prevent freezing,What vegetable can prevent your windshield from freezing over in winter?
A1C0PXPJXTO6L3,1,general,general,Useful,NC_41_U,4,"April 8th, 2024",When is the next total solar eclipse visible in North America projected to occur? 
A1C0PXPJXTO6L3,1,general,third,MTurk,TB_28_MT,4,"Futurist Diamandis argues that due to improved powers of computation we are likely to see AI, improved medicine, and new ways of communicating.",What is to happen ten years from now?
A1C0PXPJXTO6L3,1,general,third,MTurk,TB_43_MT,16,"Planets likely start off as grains of dust that then combine to form bigger rocks. They clear material from their path, leaving tracks of space empty but for fine dust.",How do planets form?
A1C0PXPJXTO6L3,1,general,third,Trivia,TB_15_TR,8,Portia,The United States' first law school for woman was named for what cross-dressing Shakespearean character?
A1C0PXPJXTO6L3,1,general,third,Trivia,TB_21_TR,16,New York,Which state has the zip code 12345?
