PID,sess,firstBlock,block,type,questionId,wait_duration,answer,question
A1CSDIX05PK9V,1,general,corona,Not useful,C_12_NU,16,Diamond Princess,What was the name of the British cruise ship that was quarantined in Japanese waters?
A1CSDIX05PK9V,1,general,corona,Not useful,C_13_NU,12,"The initial cases of the disease are thought to have been among people with a connection to a seafood wholesale market, which also sold live animals","Why is the virus believed to have zoonotic origin, i.e., to have potentially come from animals?"
A1CSDIX05PK9V,1,general,corona,Not useful,C_16_NU,16,Bats and pangolins,What other animals have been found to have viruses with highly similar genome sequences as the current coronavirus?
A1CSDIX05PK9V,1,general,corona,Not useful,C_17_NU,16,"Locations, people, or animals","The name for the new disease COVID-19 adheres to WHO best practices in disease naming, which include guidelines to not name disease after what?"
A1CSDIX05PK9V,1,general,corona,Useful,C_38_U,16,People of all ages can be infected by the new coronavirus. Older people appear to be more vulnerable to becoming severely ill with the virus.,"Does the new coronavirus affect older people, or are younger people also susceptible?"
A1CSDIX05PK9V,1,general,general,Not useful,NC_11_NU,12,Endeavour,What is the name of the ship that carried Captain Cook to Australia?
A1CSDIX05PK9V,1,general,general,Not useful,NC_16_NU,8,Newborns,The apgar score is used to measure the color and condition of what?
A1CSDIX05PK9V,1,general,general,Not useful,NC_17_NU,4,Gilbert Van Camp,What Indianapolis grocer made his name by selling canned pork and beans to U.S. troops during the Civil War?
A1CSDIX05PK9V,1,general,general,Not useful,NC_25_NU,12,Shark,"What animal is thought to be immune to most all diseases, including cancer?"
A1CSDIX05PK9V,1,general,general,Useful,NC_29_U,16,"Freeze before chopping, or hold a piece of bread in your mouth, half sticking out",How to chop an onion without crying?
A1CSDIX05PK9V,1,general,general,Useful,NC_40_U,4,Squint your eyes,How do you make your smile look more genuine in photographs?
A1CSDIX05PK9V,1,general,general,Useful,NC_41_U,8,"April 8th, 2024",When is the next total solar eclipse visible in North America projected to occur? 
A1CSDIX05PK9V,1,general,general,Useful,NC_52_U,12,"Tie your hair into a tight ponytail at the front of your head, and cut it.",How can you give yourself a layered haircut?
A1CSDIX05PK9V,1,general,third,MTurk,TB_27_MT,16,"We do not know, of course. Yet, it is important to realize that there is no scientific proof for God's existence.  ",Does God exist?
A1CSDIX05PK9V,1,general,third,MTurk,TB_34_MT,12,Evolution is usually very slow. Think about the similarities between apes and people. Future people are going to be as similar to us as we are to apes. ,What will future humans look like?
A1CSDIX05PK9V,1,general,third,MTurk,TB_39_MT,8,"There is radio emission around black holes. Scientists created a network of telescopes, capturing an image of a black hole by improving upon a technique that allows for the imaging of far-away objects",How was the recent picture of a black hole made?
A1CSDIX05PK9V,1,general,third,MTurk,TB_41_MT,12,"Deep learning-based machines, that can process unparalleled amount of information will allow AI to accomplish goals that were unimaginable until very recently. ",What are the most recent developments in artificial intelligence?
A1CSDIX05PK9V,1,general,third,Trivia,TB_08_TR,8,Library of Congress,"In 1802, John Beckley became the librarian of what collection containing 740 books at the time?"
A1CSDIX05PK9V,1,general,third,Trivia,TB_17_TR,4,"Third finger, left hand",What part of his body did Keith Richards insure for a million pounds?
A1CSDIX05PK9V,1,general,third,Trivia,TB_18_TR,12,Orville Wright,Who was flying the plane in which the first US airplane fatality occurred?
