PID,sess,firstBlock,block,type,questionId,wait_duration,answer,question
A1D2ZSPIHOI23K,1,corona,corona,Not useful,C_16_NU,8,Bats and pangolins,What other animals have been found to have viruses with highly similar genome sequences as the current coronavirus?
A1D2ZSPIHOI23K,1,corona,corona,Useful,C_29_U,12,Not for at least several months from now,How soon is a vaccine for the coronavirus likely to be available?
A1D2ZSPIHOI23K,1,corona,corona,Useful,C_36_U,4,No. There is no evidence that regularly rinsing the nose with saline has protected people from infection with the new coronavirus.,Can regularly rinsing your nose with saline help prevent infection with the new coronavirus?
A1D2ZSPIHOI23K,1,corona,general,Not useful,NC_13_NU,12,Bling bling,What term does rapper B.G. say he wishes he'd patented when he used it for the title of his massive 1999 hit?
A1D2ZSPIHOI23K,1,corona,general,Not useful,NC_18_NU,12,A truce,What was put in place by the Ancient Greeks before and during all Olympic festivals?
