PID,sess,firstBlock,block,type,questionId,wait_duration,answer,question
A1DXH9HLH4NXSX,1,corona,corona,Not useful,C_17_NU,12,"Locations, people, or animals","The name for the new disease COVID-19 adheres to WHO best practices in disease naming, which include guidelines to not name disease after what?"
A1DXH9HLH4NXSX,1,corona,corona,Not useful,C_25_NU,16,The viruses have spikes on their outer surface that look like a crown (or corona in Latin),What is the supposed origin of the name coronavirus?
A1DXH9HLH4NXSX,1,corona,corona,Useful,C_35_U,16,"The virus spreads through coughs and sneezes, there are no reports of transmission through mosquito bites.",Can the new coronavirus be transmitted through mosquito bites?
A1DXH9HLH4NXSX,1,corona,corona,Useful,C_45_U,12,"Pre-existing health conditions, including cardiovascular diseases and diabetes.",What did 75% of the people who have died from the new coronavirus have?
A1DXH9HLH4NXSX,1,corona,general,Not useful,NC_12_NU,4,Come by her,"The title of the song ""Kumbaya"" is actually a distortion of what three-word phrase?"
A1DXH9HLH4NXSX,1,corona,general,Useful,NC_35_U,12,Wrap a wet paper towel around the bottle and put in the fridge,How can you cool beverages more quickly?
A1DXH9HLH4NXSX,1,corona,general,Useful,NC_36_U,12,Potatos: rub a cut potato over your windshield before a frost to prevent freezing,What vegetable can prevent your windshield from freezing over in winter?
A1DXH9HLH4NXSX,1,corona,general,Useful,NC_41_U,4,"April 8th, 2024",When is the next total solar eclipse visible in North America projected to occur? 
A1DXH9HLH4NXSX,1,corona,general,Useful,NC_45_U,12,"Grapes or raisins, onions, avocado","In addition to chocolate, what other foods can be very harmful to dogs? "
A1DXH9HLH4NXSX,1,corona,general,Useful,NC_50_U,4,Spread beeswax over them and then blow dry until you can't see the beeswax anymore,What's an easy way to waterproof canvas shoes?
A1DXH9HLH4NXSX,1,corona,third,MTurk,TB_33_MT,8,"For SpaceX — the cheapest of NASA's new carriers — each pound costs approximately $27,000. So an average person of 160 pounds costs over $4,320,000.",How much does it cost to launch a person into space?
A1DXH9HLH4NXSX,1,corona,third,MTurk,TB_34_MT,8,Evolution is usually very slow. Think about the similarities between apes and people. Future people are going to be as similar to us as we are to apes. ,What will future humans look like?
A1DXH9HLH4NXSX,1,corona,third,MTurk,TB_37_MT,16,Engineers and architects agree that the answer is positive. Houses for the non-rich are much better built today than they were built 500 years ago.,Are houses built better than they used to be?
A1DXH9HLH4NXSX,1,corona,third,MTurk,TB_39_MT,8,"There is radio emission around black holes. Scientists created a network of telescopes, capturing an image of a black hole by improving upon a technique that allows for the imaging of far-away objects",How was the recent picture of a black hole made?
A1DXH9HLH4NXSX,1,corona,third,MTurk,TB_46_MT,12,"Scientists are still figuring it out. It seems that passive use is slightly bad, but active use is not.",How does social media influence our mental health?
