PID,sess,firstBlock,block,type,questionId,wait_duration,answer,question
A1EH9BPKYXFBS5,1,corona,corona,Not useful,C_03_NU,8,"Fuburary 1st, 2020",When was the molecular structure of the coronovirus identfied?
A1EH9BPKYXFBS5,1,corona,corona,Not useful,C_05_NU,8,University of Washington,Which was the first US University to cancel classes becuase of the new coronavirus?
A1EH9BPKYXFBS5,1,corona,corona,Not useful,C_06_NU,16,Gwyneth Paltrow,"Which celebrity said about the new coronavirus ""I've already been in this movie""?"
A1EH9BPKYXFBS5,1,corona,corona,Not useful,C_08_NU,4,Lombardy,What is the name of the county in Italy that had the first coronavirus outbreak?
A1EH9BPKYXFBS5,1,corona,corona,Not useful,C_23_NU,12,They falsely claimed to cure or prevent coronavirus,"At the end of February, Amazon banned over a million products because of what?"
A1EH9BPKYXFBS5,1,corona,corona,Useful,C_51_U,12,Nasal or orab swab or a sample of sputum,What sort of specimen is needed to test for the new coronavirus? 
A1EH9BPKYXFBS5,1,corona,general,Not useful,NC_21_NU,16,The Pieta,Which was the only one of his sculptures that Michelangelo signed?
A1EH9BPKYXFBS5,1,corona,general,Useful,NC_35_U,8,Wrap a wet paper towel around the bottle and put in the fridge,How can you cool beverages more quickly?
A1EH9BPKYXFBS5,1,corona,general,Useful,NC_46_U,16,"Dish soap, peroxide, and baking soda","While tomato juice probably will not work, what does work to remove skunk odor? "
A1EH9BPKYXFBS5,1,corona,general,Useful,NC_48_U,8,"Drop it from a 3 inch height. If it bounces, it's dead.",How can you tell if a battery is dead without using any tools?
A1EH9BPKYXFBS5,1,corona,general,Useful,NC_51_U,16,White vinegar,What salad dressing ingredient is also an efficient weed killer?
A1EH9BPKYXFBS5,1,corona,general,Useful,NC_52_U,8,"Tie your hair into a tight ponytail at the front of your head, and cut it.",How can you give yourself a layered haircut?
A1EH9BPKYXFBS5,1,corona,third,MTurk,TB_29_MT,12,"There are a few helpful techniques. One is to imagine that you climb on top of a high building, and ""look down"" at your life. Second, to try to think about issues in novel ways. ",How to stay calm in adversity?
A1EH9BPKYXFBS5,1,corona,third,MTurk,TB_41_MT,8,"Deep learning-based machines, that can process unparalleled amount of information will allow AI to accomplish goals that were unimaginable until very recently. ",What are the most recent developments in artificial intelligence?
A1EH9BPKYXFBS5,1,corona,third,MTurk,TB_42_MT,4,"Galaxy formation occured in the aftermath of the Big Bang. Clustering and merging allows galaxies to accumulate mass, determining both their shape and structure. ",How do galaxies form?
A1EH9BPKYXFBS5,1,corona,third,MTurk,TB_45_MT,8,"The amygdala (from Greek, 'almond') is one of two almond-shaped clusters of nuclei located deep and medially within the temporal lobes of the brain in complex vertebrates, including humans.",What is the amygdala?
A1EH9BPKYXFBS5,1,corona,third,Trivia,TB_02_TR,12,Ivory Coast's,"The world's largest church is Our Lady of Peace Basilica in Yamoussoukro, what nation's capital?"
A1EH9BPKYXFBS5,1,corona,third,Trivia,TB_16_TR,12,Jim Lovell,Alan Shepard was scheduled to command the ill-fated Apollo 13 before switching missions with what astronaut?
A1EH9BPKYXFBS5,1,corona,third,Trivia,TB_17_TR,16,"Third finger, left hand",What part of his body did Keith Richards insure for a million pounds?
