PID,sess,firstBlock,block,type,questionId,wait_duration,answer,question
A1ETEW9WH37WDS,1,corona,corona,Not useful,C_19_NU,8,Strategic National Stockpile,What is the name of the repository of drugs and supplies the U.S. government is supposed to maintain in case of a public health emergency?
A1ETEW9WH37WDS,1,corona,corona,Useful,C_31_U,4,"The virus is probably not sexually tansmissible, but infection does occurs when kissing.",Can the coronavirus be transmitted through sexual intercourse?
A1ETEW9WH37WDS,1,corona,general,Useful,NC_28_U,4,Microwave next to a glass of water,How can you soften brown sugar that has hardened into a lump?
A1ETEW9WH37WDS,1,corona,general,Useful,NC_35_U,4,Wrap a wet paper towel around the bottle and put in the fridge,How can you cool beverages more quickly?
A1ETEW9WH37WDS,1,corona,general,Useful,NC_47_U,12,"Add baking soda, soak in advance, use a preassure cooker",What can you do to make dry beans cook faster?
A1ETEW9WH37WDS,1,corona,general,Useful,NC_48_U,16,"Drop it from a 3 inch height. If it bounces, it's dead.",How can you tell if a battery is dead without using any tools?
A1ETEW9WH37WDS,1,corona,general,Useful,NC_49_U,4,"Roll it along its long side. If it stops immediately, it's raw.",How can you tell if an egg is cooked without breaking it?
A1ETEW9WH37WDS,1,corona,general,Useful,NC_52_U,4,"Tie your hair into a tight ponytail at the front of your head, and cut it.",How can you give yourself a layered haircut?
A1ETEW9WH37WDS,1,corona,third,MTurk,TB_25_MT,4,"Scientists estimate that we are likely to see flying cars, and that computers may be able to read people's thoughts and emotions ",What will be the new technologies of future?
A1ETEW9WH37WDS,1,corona,third,MTurk,TB_26_MT,4,"Sometimes, it is easy to know, but science revealed that self-insight is prblematic. It is often very helpful to ask friends and family ",How do you know if you're happy?
A1ETEW9WH37WDS,1,corona,third,MTurk,TB_32_MT,8,Sophisticated equipment is either lowered to the sea bottom or directly attached to submersible buoys and transmits to a research vessel that is equipped with state-of-the-art navigational instruments.,What are undersea researchers doing to explore the ocean floor?
A1ETEW9WH37WDS,1,corona,third,MTurk,TB_34_MT,4,Evolution is usually very slow. Think about the similarities between apes and people. Future people are going to be as similar to us as we are to apes. ,What will future humans look like?
A1ETEW9WH37WDS,1,corona,third,MTurk,TB_35_MT,4,Prototypes already exist. Technological estimates suggest that definitely within the next twenty years -- although the challenges are great.,When will we have flying cars?
