PID,sess,firstBlock,block,type,questionId,wait_duration,answer,question
A1ETJBNTO9ZWZ8,1,corona,corona,Not useful,C_01_NU,4,"Animals, probably bats",What is the source of coronavirus in humans?
A1ETJBNTO9ZWZ8,1,corona,corona,Not useful,C_02_NU,4,Three ,How many pandemics were there in the 20th century?
A1ETJBNTO9ZWZ8,1,corona,corona,Not useful,C_04_NU,8,"It stands for ""COronaVIrus Disease 2019""","Why is the new coronavirus called ""COVID-19""? "
A1ETJBNTO9ZWZ8,1,corona,corona,Not useful,C_10_NU,4,11 million people,"What is the population of Wuhan, the city in which coronavirus was first identified?"
A1ETJBNTO9ZWZ8,1,corona,corona,Not useful,C_16_NU,4,Bats and pangolins,What other animals have been found to have viruses with highly similar genome sequences as the current coronavirus?
A1ETJBNTO9ZWZ8,1,corona,corona,Not useful,C_25_NU,4,The viruses have spikes on their outer surface that look like a crown (or corona in Latin),What is the supposed origin of the name coronavirus?
A1ETJBNTO9ZWZ8,1,corona,corona,Useful,C_31_U,4,Probably not but it's too soon to be sure,Can the coronavirus be transmitted through sexual intercourse?
A1ETJBNTO9ZWZ8,1,corona,general,Not useful,NC_13_NU,16,Bling bling,What term does rapper B.G. say he wishes he'd patented when he used it for the title of his massive 1999 hit?
A1ETJBNTO9ZWZ8,1,corona,general,Not useful,NC_21_NU,12,The Pieta,Which was the only one of his sculptures that Michelangelo signed?
A1ETJBNTO9ZWZ8,1,corona,general,Not useful,NC_24_NU,8,State quarters,What's been released five times a year from January 1999 to fall 2008?
A1ETJBNTO9ZWZ8,1,corona,general,Useful,NC_27_U,4,White vinegar,What can you use instead of fabric softner to soften sheets and remove odours?
A1ETJBNTO9ZWZ8,1,corona,general,Useful,NC_36_U,4,Potatos: rub a cut potato over your windshield before a frost to prevent freezing,What vegetable can prevent your windshield from freezing over in winter?
A1ETJBNTO9ZWZ8,1,corona,general,Useful,NC_50_U,4,Spread beeswax over them and then blow dry until you can't see the beeswax anymore,What's an easy way to waterproof canvas shoes?
A1ETJBNTO9ZWZ8,1,corona,general,Useful,NC_52_U,4,"Tie your hair into a tight ponytail at the front of your head, and cut it.",How can you give yourself a layered haircut?
A1ETJBNTO9ZWZ8,1,corona,third,MTurk,TB_33_MT,4,"For SpaceX — the cheapest of NASA's new carriers — each pound costs approximately $27,000. So an average person of 160 pounds costs over $4,320,000.",How much does it cost to launch a person into space?
A1ETJBNTO9ZWZ8,1,corona,third,MTurk,TB_45_MT,8,"The amygdala (from Greek, 'almond') is one of two almond-shaped clusters of nuclei located deep and medially within the temporal lobes of the brain in complex vertebrates, including humans.",What is the amygdala?
A1ETJBNTO9ZWZ8,1,corona,third,Trivia,TB_03_TR,16,Mrs. Doubtfire's,What 1993 film's title character has the first name Euphegenia?
A1ETJBNTO9ZWZ8,1,corona,third,Trivia,TB_09_TR,8,The first email,"What did Ray Tomlinson send in Cambridge, Massachusetts, in late 1971?"
A1ETJBNTO9ZWZ8,1,corona,third,Trivia,TB_19_TR,4,Ketchup,The only vegetable ice cream ever produced was what flavor?
A1ETJBNTO9ZWZ8,1,corona,third,Trivia,TB_21_TR,4,New York,Which state has the zip code 12345?
A1ETJBNTO9ZWZ8,1,corona,third,Trivia,TB_22_TR,4,Cheetah,Which is the only cat that cannot retract its claws?
