PID,sess,firstBlock,block,type,questionId,wait_duration,answer,question
A1EUNZ1PHBHMU0,1,general,corona,Not useful,C_18_NU,8,They are able to filter out at least 95% of airborne particles,Why are N95 respirator face masks so named?
A1EUNZ1PHBHMU0,1,general,corona,Not useful,C_24_NU,12,Contagion,"According to media reports, which 2011 movie has seen a large increase in popularity in the wake of the new coronavirus?"
A1EUNZ1PHBHMU0,1,general,corona,Useful,C_40_U,12,"The incubation period - the time between catching the virus and beginning to have symptoms of the disease - is estimated to range from 1-14 days, most commonly around five days.",How long is the incubation period for the new coronavirus?
A1EUNZ1PHBHMU0,1,general,corona,Useful,C_52_U,12,No. To protect yourself against the new coronavirus washing your hands is the best preventive measure.,Are hand dryers effective in killing the new coronavirus?
A1EUNZ1PHBHMU0,1,general,general,Not useful,NC_05_NU,16,Matthew,Which of the four biblical Gospels was written by a tax collector?
A1EUNZ1PHBHMU0,1,general,general,Not useful,NC_06_NU,4,David Livingstone,Who discovered the Victoria Falls?
A1EUNZ1PHBHMU0,1,general,general,Not useful,NC_16_NU,8,Newborns,The apgar score is used to measure the color and condition of what?
A1EUNZ1PHBHMU0,1,general,general,Not useful,NC_25_NU,4,Shark,"What animal is thought to be immune to most all diseases, including cancer?"
A1EUNZ1PHBHMU0,1,general,general,Useful,NC_33_U,12,Below eye level,Where in the supermarket can you usually find the cheaper items?
A1EUNZ1PHBHMU0,1,general,general,Useful,NC_37_U,12,"Over the past 150 year, real estate, if you rent it out",What's a better investment: stocks or real estate?
A1EUNZ1PHBHMU0,1,general,general,Useful,NC_40_U,16,Squint your eyes,How do you make your smile look more genuine in photographs?
A1EUNZ1PHBHMU0,1,general,general,Useful,NC_52_U,16,"Tie your hair into a tight ponytail at the front of your head, and cut it.",How can you give yourself a layered haircut?
A1EUNZ1PHBHMU0,1,general,third,MTurk,TB_27_MT,8,"We do not know, of course. Yet, it is important to realize that there is no scientific proof for God's existence.  ",Does God exist?
A1EUNZ1PHBHMU0,1,general,third,Trivia,TB_06_TR,12,Xanadu,What 1980 film is named for the legendary square-shaped capital of Kublai Khan?
A1EUNZ1PHBHMU0,1,general,third,Trivia,TB_14_TR,4,James Brown,"When asked to define ""cool,"" what two words did James Brown use?"
A1EUNZ1PHBHMU0,1,general,third,Trivia,TB_17_TR,16,"Third finger, left hand",What part of his body did Keith Richards insure for a million pounds?
A1EUNZ1PHBHMU0,1,general,third,Trivia,TB_19_TR,12,Ketchup,The only vegetable ice cream ever produced was what flavor?
A1EUNZ1PHBHMU0,1,general,third,Trivia,TB_22_TR,4,Cheetah,Which is the only cat that cannot retract its claws?
