PID,sess,firstBlock,block,type,questionId,wait_duration,answer,question
A1EVH06U8IJ6PW,1,general,corona,Not useful,C_08_NU,4,Lombardy,What is the name of the county in Italy that had the first coronavirus outbreak?
A1EVH06U8IJ6PW,1,general,corona,Not useful,C_11_NU,4,The Chicago of China,"Wuhan, China, the city in which the coronavirus was first identified, is commonly referred to as the chinese version of what American city?"
A1EVH06U8IJ6PW,1,general,corona,Not useful,C_15_NU,16,7.5 days,"In the early stages of the new coronavirus, the number of new cases doubled approximately every how many days?"
A1EVH06U8IJ6PW,1,general,corona,Not useful,C_20_NU,16,"Rear Adm. Ziemer led the global health security team, responsible for leading the US response to pandemics.","In May 2018, Rear Admiral Timothy Ziemer left the White House staff and was not replaced. What was Rear Adm. Ziemer's responsibility in the White House?"
A1EVH06U8IJ6PW,1,general,corona,Useful,C_27_U,12,Washing your hands frequently,What is the most effective measure to prevent infection with the coronavirus?
A1EVH06U8IJ6PW,1,general,corona,Useful,C_31_U,12,"The virus is probably not sexually tansmissible, but infection does occurs when kissing.",Can the coronavirus be transmitted through sexual intercourse?
A1EVH06U8IJ6PW,1,general,corona,Useful,C_50_U,4,Washington,The first US death from the new coronavirus occurred in which state?
A1EVH06U8IJ6PW,1,general,general,Not useful,NC_05_NU,12,Matthew,Which of the four biblical Gospels was written by a tax collector?
A1EVH06U8IJ6PW,1,general,general,Not useful,NC_16_NU,8,Newborns,The apgar score is used to measure the color and condition of what?
A1EVH06U8IJ6PW,1,general,general,Not useful,NC_20_NU,4,Russia,Which country has the most public libraries?
A1EVH06U8IJ6PW,1,general,general,Not useful,NC_23_NU,8,The Netherlands,In 1568 the Catholic Church sentenced the entire population of which nation to death as heretics?
A1EVH06U8IJ6PW,1,general,general,Useful,NC_31_U,12,Sign up for a free USAA membership,How can people under 25 rent a car without paying extra fees?
A1EVH06U8IJ6PW,1,general,general,Useful,NC_47_U,8,"Add baking soda, soak in advance, use a preassure cooker",What can you do to make dry beans cook faster?
A1EVH06U8IJ6PW,1,general,general,Useful,NC_48_U,8,"Drop it from a 3 inch height. If it bounces, it's dead.",How can you tell if a battery is dead without using any tools?
A1EVH06U8IJ6PW,1,general,general,Useful,NC_49_U,8,"Roll it along its long side. If it stops immediately, it's raw.",How can you tell if an egg is cooked without breaking it?
A1EVH06U8IJ6PW,1,general,general,Useful,NC_50_U,8,Spread beeswax over them and then blow dry until you can't see the beeswax anymore,What's an easy way to waterproof canvas shoes?
A1EVH06U8IJ6PW,1,general,third,MTurk,TB_30_MT,12,"The ""no hair theorem"" states that a black hole has only three properties: electric charge, angular momentum, and mass.",What is the composition of a black hole?
A1EVH06U8IJ6PW,1,general,third,MTurk,TB_36_MT,12,"For two reasons. One, they are too heavy. For example, the Space Shuttle weighed 2 thousand tons, yet a Boeing can only carry about 120 tons. Second, the thrust is likely to be too strong.",Why don't space rockets take off from a plane already in the air?
A1EVH06U8IJ6PW,1,general,third,MTurk,TB_37_MT,8,Engineers and architects agree that the answer is positive. Houses for the non-rich are much better built today than they were built 500 years ago.,Are houses built better than they used to be?
A1EVH06U8IJ6PW,1,general,third,MTurk,TB_40_MT,8,"NASA plans another crewed mission to the Moon by 2024, followed by a sustained presence  by 2028.  Russia is planning to begin building a human colony by 2037.",When could a lunar base be established?
A1EVH06U8IJ6PW,1,general,third,Trivia,TB_01_TR,8,Canada,"What country is home to Roots, the company that outfits the U.S. Olympic team?"
A1EVH06U8IJ6PW,1,general,third,Trivia,TB_10_TR,16,George VI,Who was the last British Monarch to also be an emperor?
A1EVH06U8IJ6PW,1,general,third,Trivia,TB_15_TR,8,Portia,The United States' first law school for woman was named for what cross-dressing Shakespearean character?
A1EVH06U8IJ6PW,1,general,third,Trivia,TB_18_TR,4,Orville Wright,Who was flying the plane in which the first US airplane fatality occurred?
