PID,sess,firstBlock,block,type,questionId,wait_duration,answer,question
A1F669OTXWIJW0,1,general,general,Not useful,NC_07_NU,4,Salt Lake City,In what city could you see the Seagull Monument at Temple Square?
A1F669OTXWIJW0,1,general,general,Not useful,NC_09_NU,12,Captain Cook,"Who christened Hawaii ""the Sandwich Islands"" in 1778?"
A1F669OTXWIJW0,1,general,general,Not useful,NC_11_NU,8,Endeavour,What is the name of the ship that carried Captain Cook to Australia?
A1F669OTXWIJW0,1,general,general,Not useful,NC_12_NU,12,Come by her,"The title of the song ""Kumbaya"" is actually a distortion of what three-word phrase?"
A1F669OTXWIJW0,1,general,general,Not useful,NC_17_NU,8,Gilbert Van Camp,What Indianapolis grocer made his name by selling canned pork and beans to U.S. troops during the Civil War?
A1F669OTXWIJW0,1,general,general,Not useful,NC_23_NU,8,The Netherlands,In 1568 the Catholic Church sentenced the entire population of which nation to death as heretics?
A1F669OTXWIJW0,1,general,general,Useful,NC_29_U,4,"Freeze before chopping, or hold a piece of bread in your mouth, half sticking out",How to chop an onion without crying?
A1F669OTXWIJW0,1,general,general,Useful,NC_33_U,12,Below eye level,Where in the supermarket can you usually find the cheaper items?
A1F669OTXWIJW0,1,general,general,Useful,NC_47_U,4,"Add baking soda, soak in advance, use a preassure cooker",What can you do to make dry beans cook faster?
A1F669OTXWIJW0,1,general,general,Useful,NC_51_U,16,White vinegar,What salad dressing ingredient is also an efficient weed killer?
A1F669OTXWIJW0,1,general,third,MTurk,TB_36_MT,12,"For two reasons. One, they are too heavy. For example, the Space Shuttle weighed 2 thousand tons, yet a Boeing can only carry about 120 tons. Second, the thrust is likely to be too strong.",Why don't space rockets take off from a plane already in the air?
A1F669OTXWIJW0,1,general,third,MTurk,TB_43_MT,4,"Planets likely start off as grains of dust that then combine to form bigger rocks. They clear material from their path, leaving tracks of space empty but for fine dust.",How do planets form?
A1F669OTXWIJW0,1,general,third,Trivia,TB_20_TR,16,Rafflesia (corpse lily),What is the largest flower in the world?
