PID,sess,firstBlock,block,type,questionId,wait_duration,answer,question
A1FRIJ62EBRXKB,1,general,corona,Not useful,C_03_NU,8,"Fuburary 1st, 2020",When was the molecular structure of the coronovirus identfied?
A1FRIJ62EBRXKB,1,general,corona,Not useful,C_14_NU,4,"January 30, 2020",On what date did the World Health Organization declare the new coronavirus outbreak to be a Public Health Emergency of International Concern?
A1FRIJ62EBRXKB,1,general,corona,Not useful,C_18_NU,8,They are able to filter out at least 95% of airborne particles,Why are N95 respirator face masks so named?
A1FRIJ62EBRXKB,1,general,corona,Useful,C_52_U,8,No. To protect yourself against the new coronavirus washing your hands is the best preventive measure.,Are hand dryers effective in killing the new coronavirus?
A1FRIJ62EBRXKB,1,general,general,Not useful,NC_24_NU,12,State quarters,What's been released five times a year from January 1999 to fall 2008?
A1FRIJ62EBRXKB,1,general,general,Useful,NC_44_U,12,Doritos,What popular snack food is effective to use as kindling to start a fire?
A1FRIJ62EBRXKB,1,general,third,MTurk,TB_28_MT,8,"Futurist Diamandis argues that due to improved powers of computation we are likely to see AI, improved medicine, and new ways of communicating.",What is to happen ten years from now?
A1FRIJ62EBRXKB,1,general,third,MTurk,TB_33_MT,8,"For SpaceX — the cheapest of NASA's new carriers — each pound costs approximately $27,000. So an average person of 160 pounds costs over $4,320,000.",How much does it cost to launch a person into space?
A1FRIJ62EBRXKB,1,general,third,Trivia,TB_18_TR,12,Orville Wright,Who was flying the plane in which the first US airplane fatality occurred?
