PID,sess,firstBlock,block,type,questionId,wait_duration,answer,question
A1GNV8C2792XF,1,corona,corona,Not useful,C_01_NU,8,"Animals, probably bats",What is the source of coronavirus in humans?
A1GNV8C2792XF,1,corona,corona,Not useful,C_02_NU,8,Three ,How many pandemics were there in the 20th century?
A1GNV8C2792XF,1,corona,corona,Not useful,C_05_NU,8,University of Washington,Which was the first US University to cancel classes becuase of the new coronavirus?
A1GNV8C2792XF,1,corona,corona,Not useful,C_13_NU,4,"The initial cases of the disease are thought to have been among people with a connection to a seafood wholesale market, which also sold live animals","Why is the virus believed to have zoonotic origin, i.e., to have potentially come from animals?"
A1GNV8C2792XF,1,corona,corona,Not useful,C_15_NU,4,7.5 days,"In the early stages of the new coronavirus, the number of new cases doubled approximately every how many days?"
A1GNV8C2792XF,1,corona,corona,Not useful,C_18_NU,16,They are able to filter out at least 95% of airborne particles,Why are N95 respirator face masks so named?
A1GNV8C2792XF,1,corona,corona,Useful,C_47_U,12,"Free of fever; no other symptoms, including cough; negative tests on at least two consecutive respiratory specimens at least 24 hours apart.",What are current Centers for Disease Control (CDC) guidelines for releasing someone from isolation?
A1GNV8C2792XF,1,corona,general,Not useful,NC_01_NU,16,Mike Powell,"In 1991, who finally broke Bob Beamon's decades-old long jump record?"
A1GNV8C2792XF,1,corona,general,Not useful,NC_02_NU,4,Tiger Woods,"Who's the only two-time Sports Illustrated Sportsman of the Year, so named in 1996 and 2000?"
A1GNV8C2792XF,1,corona,general,Not useful,NC_10_NU,4,K.D. Lang,What Canadian singer appeared on the first cover of Entertainment Weekly?
A1GNV8C2792XF,1,corona,general,Not useful,NC_15_NU,4,Albert Einstein,Who beat out FDR and Gandhi to be named Time's Person of the Century in 1999?
A1GNV8C2792XF,1,corona,general,Not useful,NC_20_NU,4,Russia,Which country has the most public libraries?
A1GNV8C2792XF,1,corona,general,Not useful,NC_26_NU,8,Dark Side of the Moon,What album spent a record 741 weeks on Billboard's Top 200 Albums chart?
A1GNV8C2792XF,1,corona,general,Useful,NC_41_U,16,"April 8th, 2024",When is the next total solar eclipse visible in North America projected to occur? 
A1GNV8C2792XF,1,corona,general,Useful,NC_47_U,8,"Add baking soda, soak in advance, use a preassure cooker",What can you do to make dry beans cook faster?
A1GNV8C2792XF,1,corona,general,Useful,NC_51_U,12,White vinegar,What salad dressing ingredient is also an efficient weed killer?
A1GNV8C2792XF,1,corona,third,MTurk,TB_33_MT,4,"For SpaceX — the cheapest of NASA's new carriers — each pound costs approximately $27,000. So an average person of 160 pounds costs over $4,320,000.",How much does it cost to launch a person into space?
A1GNV8C2792XF,1,corona,third,Trivia,TB_01_TR,12,Canada,"What country is home to Roots, the company that outfits the U.S. Olympic team?"
A1GNV8C2792XF,1,corona,third,Trivia,TB_07_TR,12,Tuxedo Club,What New York country club lent its name to the kind of dinner jacket first worn there in 1886?
A1GNV8C2792XF,1,corona,third,Trivia,TB_15_TR,12,Portia,The United States' first law school for woman was named for what cross-dressing Shakespearean character?
A1GNV8C2792XF,1,corona,third,Trivia,TB_16_TR,4,Jim Lovell,Alan Shepard was scheduled to command the ill-fated Apollo 13 before switching missions with what astronaut?
A1GNV8C2792XF,1,corona,third,Trivia,TB_18_TR,12,Orville Wright,Who was flying the plane in which the first US airplane fatality occurred?
A1GNV8C2792XF,1,corona,third,Trivia,TB_21_TR,4,New York,Which state has the zip code 12345?
A1GNV8C2792XF,1,corona,third,Trivia,TB_22_TR,8,Cheetah,Which is the only cat that cannot retract its claws?
