PID,sess,firstBlock,block,type,questionId,wait_duration,answer,question
A1GWYEIX5S6JU4,1,corona,corona,Not useful,C_23_NU,8,They falsely claimed to cure or prevent coronavirus,"At the end of February, Amazon banned over a million products because of what?"
A1GWYEIX5S6JU4,1,corona,corona,Useful,C_32_U,8,"Healthcare professionals treating patients, in-home caregivers, and those who are already sick with the new coronavirus",Which three groups of people does the CDC recommend masks for?
A1GWYEIX5S6JU4,1,corona,general,Not useful,NC_01_NU,16,Mike Powell,"In 1991, who finally broke Bob Beamon's decades-old long jump record?"
A1GWYEIX5S6JU4,1,corona,general,Not useful,NC_04_NU,16,Edward Albee,"Who wrote ""Who's Afraid of Virginia Woolf?"""
A1GWYEIX5S6JU4,1,corona,general,Not useful,NC_21_NU,4,The Pieta,Which was the only one of his sculptures that Michelangelo signed?
A1GWYEIX5S6JU4,1,corona,third,Trivia,TB_19_TR,12,Ketchup,The only vegetable ice cream ever produced was what flavor?
