PID,sess,firstBlock,block,type,questionId,wait_duration,answer,question
A1H6PVWRCYN0E4,1,corona,corona,Not useful,C_02_NU,8,Three ,How many pandemics were there in the 20th century?
A1H6PVWRCYN0E4,1,corona,corona,Not useful,C_06_NU,12,Gwyneth Paltrow,"Which celebrity said about the new coronavirus ""I've already been in this movie""?"
A1H6PVWRCYN0E4,1,corona,corona,Not useful,C_12_NU,12,Diamond Princess,What was the name of the British cruise ship that was quarantined in Japanese waters?
A1H6PVWRCYN0E4,1,corona,corona,Not useful,C_16_NU,4,Bats and pangolins,What other animals have been found to have viruses with highly similar genome sequences as the current coronavirus?
A1H6PVWRCYN0E4,1,corona,corona,Not useful,C_18_NU,4,They are able to filter out at least 95% of airborne particles,Why are N95 respirator face masks so named?
A1H6PVWRCYN0E4,1,corona,corona,Useful,C_43_U,12,Quarantine themselves for 14 days to make sure they are not infected.,"Currently, people who have traveled to a high-risk area or who may have been in contact with someone with the new coronavirus are recommended to do what?"
A1H6PVWRCYN0E4,1,corona,corona,Useful,C_47_U,8,"Free of fever; no other symptoms, including cough; negative tests on at least two consecutive respiratory specimens at least 24 hours apart.",What are current Centers for Disease Control (CDC) guidelines for releasing someone from isolation?
A1H6PVWRCYN0E4,1,corona,corona,Useful,C_49_U,4,"Approved filtering facemask respirators, such as the N95 respirator.","It is recommended that healthcare professionals who may be working in contact with people with the virus wear what, in addition to personal protective equipment on their hands and bodies?"
A1H6PVWRCYN0E4,1,corona,corona,Useful,C_51_U,8,Nasal or orab swab or a sample of sputum,What sort of specimen is needed to test for the new coronavirus? 
A1H6PVWRCYN0E4,1,corona,general,Not useful,NC_02_NU,16,Tiger Woods,"Who's the only two-time Sports Illustrated Sportsman of the Year, so named in 1996 and 2000?"
A1H6PVWRCYN0E4,1,corona,general,Not useful,NC_13_NU,4,Bling bling,What term does rapper B.G. say he wishes he'd patented when he used it for the title of his massive 1999 hit?
A1H6PVWRCYN0E4,1,corona,general,Not useful,NC_22_NU,8,Steamboat Geyser,"Which Yellowstone geyser, with eruptions 100 fee taller than Old Faithful's, is the world's tallest?"
A1H6PVWRCYN0E4,1,corona,general,Useful,NC_30_U,8,Floormats - put them under the wheels for traction,What item that can be found in any car can help you extract your car from mud or snow?
A1H6PVWRCYN0E4,1,corona,general,Useful,NC_31_U,16,Sign up for a free USAA membership,How can people under 25 rent a car without paying extra fees?
A1H6PVWRCYN0E4,1,corona,general,Useful,NC_32_U,4,Take a picture of your fridge before leaving the house,What's a simple trick for telling whether your out of something when you're grocery shopping?
A1H6PVWRCYN0E4,1,corona,general,Useful,NC_45_U,8,"Grapes or raisins, onions, avocado","In addition to chocolate, what other foods can be very harmful to dogs? "
A1H6PVWRCYN0E4,1,corona,third,MTurk,TB_26_MT,4,"Sometimes, it is easy to know, but science revealed that self-insight is prblematic. It is often very helpful to ask friends and family ",How do you know if you're happy?
A1H6PVWRCYN0E4,1,corona,third,MTurk,TB_36_MT,8,"For two reasons. One, they are too heavy. For example, the Space Shuttle weighed 2 thousand tons, yet a Boeing can only carry about 120 tons. Second, the thrust is likely to be too strong.",Why don't space rockets take off from a plane already in the air?
A1H6PVWRCYN0E4,1,corona,third,MTurk,TB_41_MT,16,"Deep learning-based machines, that can process unparalleled amount of information will allow AI to accomplish goals that were unimaginable until very recently. ",What are the most recent developments in artificial intelligence?
A1H6PVWRCYN0E4,1,corona,third,MTurk,TB_42_MT,4,"Galaxy formation occured in the aftermath of the Big Bang. Clustering and merging allows galaxies to accumulate mass, determining both their shape and structure. ",How do galaxies form?
A1H6PVWRCYN0E4,1,corona,third,Trivia,TB_01_TR,16,Canada,"What country is home to Roots, the company that outfits the U.S. Olympic team?"
A1H6PVWRCYN0E4,1,corona,third,Trivia,TB_16_TR,8,Jim Lovell,Alan Shepard was scheduled to command the ill-fated Apollo 13 before switching missions with what astronaut?
A1H6PVWRCYN0E4,1,corona,third,Trivia,TB_19_TR,12,Ketchup,The only vegetable ice cream ever produced was what flavor?
