PID,sess,firstBlock,block,type,questionId,wait_duration,answer,question
A1HB8WVP9ZWLXV,1,general,corona,Not useful,C_03_NU,16,"Fuburary 1st, 2020",When was the molecular structure of the coronovirus identfied?
A1HB8WVP9ZWLXV,1,general,corona,Not useful,C_14_NU,8,"January 30, 2020",On what date did the World Health Organization declare the new coronavirus outbreak to be a Public Health Emergency of International Concern?
A1HB8WVP9ZWLXV,1,general,corona,Not useful,C_25_NU,4,The viruses have spikes on their outer surface that look like a crown (or corona in Latin),What is the supposed origin of the name coronavirus?
A1HB8WVP9ZWLXV,1,general,corona,Useful,C_33_U,8,Soft surfaces are less likely to transmit the virus than hard surfaces.,Can the new coronavirus be transmitted by touching a soft surface like carpets or fabric?
A1HB8WVP9ZWLXV,1,general,corona,Useful,C_48_U,8,Reserves need to be saved for people who are infected and for healthcare professionals.,Why does the CDC currently recommend that healthy people do not wear N95 face masks?
A1HB8WVP9ZWLXV,1,general,corona,Useful,C_50_U,4,Washington,The first US death from the new coronavirus occurred in which state?
A1HB8WVP9ZWLXV,1,general,general,Not useful,NC_03_NU,4,Red River,"What name is shared by the rivers that run through Denison, TX and Hanoi, Vietnam?"
A1HB8WVP9ZWLXV,1,general,general,Not useful,NC_04_NU,4,Edward Albee,"Who wrote ""Who's Afraid of Virginia Woolf?"""
A1HB8WVP9ZWLXV,1,general,general,Not useful,NC_11_NU,4,Endeavour,What is the name of the ship that carried Captain Cook to Australia?
A1HB8WVP9ZWLXV,1,general,general,Not useful,NC_17_NU,8,Gilbert Van Camp,What Indianapolis grocer made his name by selling canned pork and beans to U.S. troops during the Civil War?
A1HB8WVP9ZWLXV,1,general,general,Not useful,NC_19_NU,8,Smoke,"in 1908, New York City passed the Sullivan Ordinance which made it illegal for women to do what in public?"
A1HB8WVP9ZWLXV,1,general,general,Not useful,NC_20_NU,12,Russia,Which country has the most public libraries?
A1HB8WVP9ZWLXV,1,general,general,Useful,NC_44_U,12,Doritos,What popular snack food is effective to use as kindling to start a fire?
A1HB8WVP9ZWLXV,1,general,general,Useful,NC_48_U,16,"Drop it from a 3 inch height. If it bounces, it's dead.",How can you tell if a battery is dead without using any tools?
A1HB8WVP9ZWLXV,1,general,third,MTurk,TB_28_MT,4,"Futurist Diamandis argues that due to improved powers of computation we are likely to see AI, improved medicine, and new ways of communicating.",What is to happen ten years from now?
A1HB8WVP9ZWLXV,1,general,third,MTurk,TB_38_MT,4,"As a rule, yes. Restaurants have to cover rent, salaries and taxes. These are all included in the prices.",Is it really cheaper to cook at home vs. eating out?
A1HB8WVP9ZWLXV,1,general,third,Trivia,TB_03_TR,8,Mrs. Doubtfire's,What 1993 film's title character has the first name Euphegenia?
A1HB8WVP9ZWLXV,1,general,third,Trivia,TB_08_TR,16,Library of Congress,"In 1802, John Beckley became the librarian of what collection containing 740 books at the time?"
A1HB8WVP9ZWLXV,1,general,third,Trivia,TB_23_TR,12,Tooth,What is the only part of the body that can't repair itself?
