PID,sess,firstBlock,block,type,questionId,wait_duration,answer,question
A1HHKQZNE4MUBC,1,general,corona,Not useful,C_21_NU,4,An epidemic that has spread around the world,An epidemic is the outbreak of a disease that affects many people at the same time. What does pandemic mean?
A1HHKQZNE4MUBC,1,general,corona,Not useful,C_24_NU,12,Contagion,"According to media reports, which 2011 movie has seen a large increase in popularity in the wake of the new coronavirus?"
A1HHKQZNE4MUBC,1,general,corona,Not useful,C_25_NU,16,The viruses have spikes on their outer surface that look like a crown (or corona in Latin),What is the supposed origin of the name coronavirus?
A1HHKQZNE4MUBC,1,general,corona,Useful,C_30_U,16,Similar,"Are the coronavirus symptoms similar to, or different from, seasonal flu?"
A1HHKQZNE4MUBC,1,general,corona,Useful,C_32_U,12,"Healthcare professionals treating patients, in-home caregivers, and those who are already sick with the new coronavirus",Which three groups of people does the CDC recommend masks for?
A1HHKQZNE4MUBC,1,general,corona,Useful,C_47_U,16,"Free of fever; no other symptoms, including cough; negative tests on at least two consecutive respiratory specimens at least 24 hours apart.",What are current Centers for Disease Control (CDC) guidelines for releasing someone from isolation?
A1HHKQZNE4MUBC,1,general,general,Not useful,NC_01_NU,4,Mike Powell,"In 1991, who finally broke Bob Beamon's decades-old long jump record?"
A1HHKQZNE4MUBC,1,general,general,Not useful,NC_05_NU,4,Matthew,Which of the four biblical Gospels was written by a tax collector?
A1HHKQZNE4MUBC,1,general,general,Not useful,NC_06_NU,16,David Livingstone,Who discovered the Victoria Falls?
A1HHKQZNE4MUBC,1,general,general,Not useful,NC_11_NU,4,Endeavour,What is the name of the ship that carried Captain Cook to Australia?
A1HHKQZNE4MUBC,1,general,general,Not useful,NC_15_NU,12,Albert Einstein,Who beat out FDR and Gandhi to be named Time's Person of the Century in 1999?
A1HHKQZNE4MUBC,1,general,general,Useful,NC_29_U,16,"Freeze before chopping, or hold a piece of bread in your mouth, half sticking out",How to chop an onion without crying?
A1HHKQZNE4MUBC,1,general,general,Useful,NC_36_U,8,Potatos: rub a cut potato over your windshield before a frost to prevent freezing,What vegetable can prevent your windshield from freezing over in winter?
A1HHKQZNE4MUBC,1,general,general,Useful,NC_45_U,12,"Grapes or raisins, onions, avocado","In addition to chocolate, what other foods can be very harmful to dogs? "
A1HHKQZNE4MUBC,1,general,general,Useful,NC_48_U,4,"Drop it from a 3 inch height. If it bounces, it's dead.",How can you tell if a battery is dead without using any tools?
A1HHKQZNE4MUBC,1,general,third,MTurk,TB_28_MT,12,"Futurist Diamandis argues that due to improved powers of computation we are likely to see AI, improved medicine, and new ways of communicating.",What is to happen ten years from now?
A1HHKQZNE4MUBC,1,general,third,MTurk,TB_31_MT,4,Scientists estimate that at the moment it is not. But with global warming it might become more feasilbe later in the 21st century.,How feasible would it be to colonize Antarctica?
A1HHKQZNE4MUBC,1,general,third,MTurk,TB_44_MT,12,"In all U.S states, same-sex marriage is now legal. Also, the number of kids per family has decreased and so ""middle"" childreen, between the eldest and youngest, are getting rarer. ",How have families changed over time?
A1HHKQZNE4MUBC,1,general,third,MTurk,TB_46_MT,12,"Scientists are still figuring it out. It seems that passive use is slightly bad, but active use is not.",How does social media influence our mental health?
A1HHKQZNE4MUBC,1,general,third,Trivia,TB_06_TR,4,Xanadu,What 1980 film is named for the legendary square-shaped capital of Kublai Khan?
A1HHKQZNE4MUBC,1,general,third,Trivia,TB_21_TR,4,New York,Which state has the zip code 12345?
A1HHKQZNE4MUBC,1,general,third,Trivia,TB_22_TR,8,Cheetah,Which is the only cat that cannot retract its claws?
A1HHKQZNE4MUBC,1,general,third,Trivia,TB_23_TR,8,Tooth,What is the only part of the body that can't repair itself?
