PID,sess,firstBlock,block,type,questionId,wait_duration,answer,question
A1I7URHRM80OJ9,1,general,corona,Not useful,C_02_NU,8,Three ,How many pandemics were there in the 20th century?
A1I7URHRM80OJ9,1,general,corona,Not useful,C_05_NU,8,University of Washington,Which was the first US University to cancel classes becuase of the new coronavirus?
A1I7URHRM80OJ9,1,general,corona,Not useful,C_07_NU,4,Pink,What color latex gloves did Naomi Campbell wear to protect herself from coronavirus?
A1I7URHRM80OJ9,1,general,corona,Not useful,C_09_NU,16,Hubei,What is the name of the province in China in which this new coronavirus was first discovered?
A1I7URHRM80OJ9,1,general,corona,Useful,C_32_U,4,"Healthcare professionals treating patients, in-home caregivers, and those who are already sick with the new coronavirus",Which three groups of people does the CDC recommend masks for?
A1I7URHRM80OJ9,1,general,corona,Useful,C_37_U,4,There is no evidence from the current outbreak that eating garlic has protected people from the new coronavirus.,Can eating garlic help prevent infection with the new coronavirus?
A1I7URHRM80OJ9,1,general,corona,Useful,C_40_U,4,"The incubation period - the time between catching the virus and beginning to have symptoms of the disease - is estimated to range from 1-14 days, most commonly around five days.",How long is the incubation period for the new coronavirus?
A1I7URHRM80OJ9,1,general,corona,Useful,C_48_U,12,"Regular face masks are not considered effective, and reserves need to be saved for people who are infected and for healthcare professionals.",Why does the CDC currently recommend that healthy people do not wear face masks?
A1I7URHRM80OJ9,1,general,corona,Useful,C_51_U,16,Nasal or orab swab or a sample of sputum,What sort of specimen is needed to test for the new coronavirus? 
A1I7URHRM80OJ9,1,general,general,Not useful,NC_06_NU,12,David Livingstone,Who discovered the Victoria Falls?
A1I7URHRM80OJ9,1,general,general,Not useful,NC_16_NU,4,Newborns,The apgar score is used to measure the color and condition of what?
A1I7URHRM80OJ9,1,general,general,Not useful,NC_17_NU,16,Gilbert Van Camp,What Indianapolis grocer made his name by selling canned pork and beans to U.S. troops during the Civil War?
A1I7URHRM80OJ9,1,general,general,Not useful,NC_19_NU,16,Smoke,"in 1908, New York City passed the Sullivan Ordinance which made it illegal for women to do what in public?"
A1I7URHRM80OJ9,1,general,general,Not useful,NC_22_NU,4,Steamboat Geyser,"Which Yellowstone geyser, with eruptions 100 fee taller than Old Faithful's, is the world's tallest?"
A1I7URHRM80OJ9,1,general,general,Useful,NC_29_U,8,"Freeze before chopping, or hold a piece of bread in your mouth, half sticking out",How to chop an onion without crying?
A1I7URHRM80OJ9,1,general,general,Useful,NC_40_U,12,Squint your eyes,How do you make your smile look more genuine in photographs?
A1I7URHRM80OJ9,1,general,general,Useful,NC_41_U,8,"April 8th, 2024",When is the next total solar eclipse visible in North America projected to occur? 
A1I7URHRM80OJ9,1,general,general,Useful,NC_45_U,4,"Grapes or raisins, onions, avocado","In addition to chocolate, what other foods can be very harmful to dogs? "
A1I7URHRM80OJ9,1,general,general,Useful,NC_49_U,12,"Roll it along its long side. If it stops immediately, it's raw.",How can you tell if an egg is cooked without breaking it?
A1I7URHRM80OJ9,1,general,third,MTurk,TB_30_MT,16,"The ""no hair theorem"" states that a black hole has only three properties: electric charge, angular momentum, and mass.",What is the composition of a black hole?
A1I7URHRM80OJ9,1,general,third,MTurk,TB_40_MT,12,"NASA plans another crewed mission to the Moon by 2024, followed by a sustained presence  by 2028.  Russia is planning to begin building a human colony by 2037.",When could a lunar base be established?
A1I7URHRM80OJ9,1,general,third,MTurk,TB_41_MT,16,"Deep learning-based machines, that can process unparalleled amount of information will allow AI to accomplish goals that were unimaginable until very recently. ",What are the most recent developments in artificial intelligence?
A1I7URHRM80OJ9,1,general,third,Trivia,TB_03_TR,16,Mrs. Doubtfire's,What 1993 film's title character has the first name Euphegenia?
A1I7URHRM80OJ9,1,general,third,Trivia,TB_13_TR,8,Java,On what namesake Asian island are the first Homo erectus fossils found?
A1I7URHRM80OJ9,1,general,third,Trivia,TB_18_TR,12,Orville Wright,Who was flying the plane in which the first US airplane fatality occurred?
