PID,sess,firstBlock,block,type,questionId,wait_duration,answer,question
A1I7GXF2RVPBAK,1,corona,corona,Not useful,C_10_NU,12,11 million people,"What is the population of Wuhan, the city in which coronavirus was first identified?"
A1I7GXF2RVPBAK,1,corona,corona,Not useful,C_16_NU,8,Bats and pangolins,What other animals have been found to have viruses with highly similar genome sequences as the current coronavirus?
A1I7GXF2RVPBAK,1,corona,corona,Not useful,C_20_NU,4,"Rear Adm. Ziemer led the global health security team, responsible for leading the US response to pandemics.","In May 2018, Rear Admiral Timothy Ziemer left the White House staff and was not replaced. What was Rear Adm. Ziemer's responsibility in the White House?"
A1I7GXF2RVPBAK,1,corona,corona,Not useful,C_24_NU,16,Contagion,"According to media reports, which 2011 movie has seen a large increase in popularity in the wake of the new coronavirus?"
A1I7GXF2RVPBAK,1,corona,corona,Useful,C_27_U,12,Washing your hands frequently,What is the most effective measure to prevent infection with the coronavirus?
A1I7GXF2RVPBAK,1,corona,corona,Useful,C_32_U,8,"Healthcare professionals treating patients, in-home caregivers, and those who are already sick with the new coronavirus",Which three groups of people does the CDC recommend masks for?
A1I7GXF2RVPBAK,1,corona,corona,Useful,C_35_U,12,"The virus spreads through coughs and sneezes, there are no reports of transmission through mosquito bites.",Can the new coronavirus be transmitted through mosquito bites?
A1I7GXF2RVPBAK,1,corona,corona,Useful,C_45_U,4,"Pre-existing health conditions, including cardiovascular diseases and diabetes.",What did 75% of the people who have died from the new coronavirus have?
A1I7GXF2RVPBAK,1,corona,corona,Useful,C_52_U,12,No. To protect yourself against the new coronavirus washing your hands is the best preventive measure.,Are hand dryers effective in killing the new coronavirus?
A1I7GXF2RVPBAK,1,corona,general,Not useful,NC_02_NU,4,Tiger Woods,"Who's the only two-time Sports Illustrated Sportsman of the Year, so named in 1996 and 2000?"
A1I7GXF2RVPBAK,1,corona,general,Not useful,NC_07_NU,16,Salt Lake City,In what city could you see the Seagull Monument at Temple Square?
A1I7GXF2RVPBAK,1,corona,general,Not useful,NC_17_NU,16,Gilbert Van Camp,What Indianapolis grocer made his name by selling canned pork and beans to U.S. troops during the Civil War?
A1I7GXF2RVPBAK,1,corona,general,Not useful,NC_24_NU,8,State quarters,What's been released five times a year from January 1999 to fall 2008?
A1I7GXF2RVPBAK,1,corona,general,Useful,NC_28_U,12,Microwave next to a glass of water,How can you soften brown sugar that has hardened into a lump?
A1I7GXF2RVPBAK,1,corona,general,Useful,NC_36_U,4,Potatos: rub a cut potato over your windshield before a frost to prevent freezing,What vegetable can prevent your windshield from freezing over in winter?
A1I7GXF2RVPBAK,1,corona,general,Useful,NC_37_U,4,"Over the past 150 year, real estate, if you rent it out",What's a better investment: stocks or real estate?
A1I7GXF2RVPBAK,1,corona,general,Useful,NC_46_U,8,"Dish soap, peroxide, and baking soda","While tomato juice probably will not work, what does work to remove skunk odor? "
A1I7GXF2RVPBAK,1,corona,third,MTurk,TB_35_MT,12,Prototypes already exist. Technological estimates suggest that definitely within the next twenty years -- although the challenges are great.,When will we have flying cars?
A1I7GXF2RVPBAK,1,corona,third,MTurk,TB_37_MT,12,Engineers and architects agree that the answer is positive. Houses for the non-rich are much better built today than they were built 500 years ago.,Are houses built better than they used to be?
A1I7GXF2RVPBAK,1,corona,third,MTurk,TB_44_MT,4,"In all U.S states, same-sex marriage is now legal. Also, the number of kids per family has decreased and so ""middle"" childreen, between the eldest and youngest, are getting rarer. ",How have families changed over time?
A1I7GXF2RVPBAK,1,corona,third,Trivia,TB_02_TR,12,Ivory Coast's,"The world's largest church is Our Lady of Peace Basilica in Yamoussoukro, what nation's capital?"
A1I7GXF2RVPBAK,1,corona,third,Trivia,TB_06_TR,12,Xanadu,What 1980 film is named for the legendary square-shaped capital of Kublai Khan?
A1I7GXF2RVPBAK,1,corona,third,Trivia,TB_13_TR,16,Java,On what namesake Asian island are the first Homo erectus fossils found?
A1I7GXF2RVPBAK,1,corona,third,Trivia,TB_18_TR,12,Orville Wright,Who was flying the plane in which the first US airplane fatality occurred?
