PID,sess,firstBlock,block,type,questionId,wait_duration,answer,question
A1IRLAHEZA0SBT,1,general,general,Useful,NC_34_U,8,"Pineapple, by planting the green leaves",What tropical fruit can be regrown from its scraps?
A1IRLAHEZA0SBT,1,general,general,Useful,NC_40_U,16,Squint your eyes,How do you make your smile look more genuine in photographs?
A1IRLAHEZA0SBT,1,general,general,Useful,NC_46_U,4,"Dish soap, peroxide, and baking soda","While tomato juice probably will not work, what does work to remove skunk odor? "
A1IRLAHEZA0SBT,1,general,general,Useful,NC_50_U,4,Spread beeswax over them and then blow dry until you can't see the beeswax anymore,What's an easy way to waterproof canvas shoes?
A1IRLAHEZA0SBT,1,general,third,MTurk,TB_30_MT,4,"The ""no hair theorem"" states that a black hole has only three properties: electric charge, angular momentum, and mass.",What is the composition of a black hole?
A1IRLAHEZA0SBT,1,general,third,MTurk,TB_44_MT,4,"In all U.S states, same-sex marriage is now legal. Also, the number of kids per family has decreased and so ""middle"" childreen, between the eldest and youngest, are getting rarer. ",How have families changed over time?
A1IRLAHEZA0SBT,1,general,third,Trivia,TB_19_TR,4,Ketchup,The only vegetable ice cream ever produced was what flavor?
A1IRLAHEZA0SBT,1,general,third,Trivia,TB_21_TR,4,New York,Which state has the zip code 12345?
