PID,sess,firstBlock,block,type,questionId,wait_duration,answer,question
A1J1PWS99LFVPL,1,corona,corona,Not useful,C_14_NU,8,"January 30, 2020",On what date did the World Health Organization declare the new coronavirus outbreak to be a Public Health Emergency of International Concern?
A1J1PWS99LFVPL,1,corona,corona,Not useful,C_22_NU,4,Contact tracing,What is the name of the process health authorities use to understand the sources of infection and to prevent further transmission?
A1J1PWS99LFVPL,1,corona,corona,Not useful,C_24_NU,4,Contagion,"According to media reports, which 2011 movie has seen a large increase in popularity in the wake of the new coronavirus?"
A1J1PWS99LFVPL,1,corona,corona,Useful,C_29_U,8,Not for at least several months from now,How soon is a vaccine for the coronavirus likely to be available?
A1J1PWS99LFVPL,1,corona,corona,Useful,C_32_U,8,"Healthcare professionals treating patients, in-home caregivers, and those who are already sick with the new coronavirus",Which three groups of people does the CDC recommend masks for?
A1J1PWS99LFVPL,1,corona,corona,Useful,C_36_U,4,No. There is no evidence that regularly rinsing the nose with saline has protected people from infection with the new coronavirus.,Can regularly rinsing your nose with saline help prevent infection with the new coronavirus?
A1J1PWS99LFVPL,1,corona,corona,Useful,C_39_U,16,"No, antibiotics do not work against viruses, only bacteria.",Are antibiotics effective in preventing and treating the new coronavirus?
A1J1PWS99LFVPL,1,corona,corona,Useful,C_52_U,12,No. To protect yourself against the new coronavirus washing your hands is the best preventive measure.,Are hand dryers effective in killing the new coronavirus?
A1J1PWS99LFVPL,1,corona,general,Not useful,NC_04_NU,4,Edward Albee,"Who wrote ""Who's Afraid of Virginia Woolf?"""
A1J1PWS99LFVPL,1,corona,general,Not useful,NC_11_NU,16,Endeavour,What is the name of the ship that carried Captain Cook to Australia?
A1J1PWS99LFVPL,1,corona,general,Not useful,NC_17_NU,4,Gilbert Van Camp,What Indianapolis grocer made his name by selling canned pork and beans to U.S. troops during the Civil War?
A1J1PWS99LFVPL,1,corona,general,Not useful,NC_24_NU,12,State quarters,What's been released five times a year from January 1999 to fall 2008?
A1J1PWS99LFVPL,1,corona,general,Useful,NC_32_U,12,Take a picture of your fridge before leaving the house,What's a simple trick for telling whether your out of something when you're grocery shopping?
A1J1PWS99LFVPL,1,corona,general,Useful,NC_36_U,12,Potatos: rub a cut potato over your windshield before a frost to prevent freezing,What vegetable can prevent your windshield from freezing over in winter?
A1J1PWS99LFVPL,1,corona,general,Useful,NC_47_U,4,"Add baking soda, soak in advance, use a preassure cooker",What can you do to make dry beans cook faster?
A1J1PWS99LFVPL,1,corona,third,MTurk,TB_32_MT,8,Sophisticated equipment is either lowered to the sea bottom or directly attached to submersible buoys and transmits to a research vessel that is equipped with state-of-the-art navigational instruments.,What are undersea researchers doing to explore the ocean floor?
A1J1PWS99LFVPL,1,corona,third,MTurk,TB_33_MT,8,"For SpaceX — the cheapest of NASA's new carriers — each pound costs approximately $27,000. So an average person of 160 pounds costs over $4,320,000.",How much does it cost to launch a person into space?
A1J1PWS99LFVPL,1,corona,third,Trivia,TB_05_TR,16,Hong Kong,What city's harbor is overlooked by Victoria Peak?
A1J1PWS99LFVPL,1,corona,third,Trivia,TB_07_TR,4,Tuxedo Club,What New York country club lent its name to the kind of dinner jacket first worn there in 1886?
A1J1PWS99LFVPL,1,corona,third,Trivia,TB_16_TR,8,Jim Lovell,Alan Shepard was scheduled to command the ill-fated Apollo 13 before switching missions with what astronaut?
A1J1PWS99LFVPL,1,corona,third,Trivia,TB_19_TR,4,Ketchup,The only vegetable ice cream ever produced was what flavor?
A1J1PWS99LFVPL,1,corona,third,Trivia,TB_21_TR,16,New York,Which state has the zip code 12345?
