PID,sess,firstBlock,block,type,questionId,wait_duration,answer,question
A1JEOIZVMJ0M2B,1,general,corona,Not useful,C_13_NU,12,"The initial cases of the disease are thought to have been among people with a connection to a seafood wholesale market, which also sold live animals","Why is the virus believed to have zoonotic origin, i.e., to have potentially come from animals?"
A1JEOIZVMJ0M2B,1,general,corona,Not useful,C_15_NU,4,7.5 days,"In the early stages of the new coronavirus, the number of new cases doubled approximately every how many days?"
A1JEOIZVMJ0M2B,1,general,corona,Not useful,C_25_NU,12,The viruses have spikes on their outer surface that look like a crown (or corona in Latin),What is the supposed origin of the name coronavirus?
A1JEOIZVMJ0M2B,1,general,corona,Useful,C_33_U,16,Soft surfaces are less likely to transmit the virus than hard surfaces.,Can the new coronavirus be transmitted by touching a soft surface like carpets or fabric?
A1JEOIZVMJ0M2B,1,general,corona,Useful,C_45_U,8,"Pre-existing health conditions, including cardiovascular diseases and diabetes.",What did 75% of the people who have died from the new coronavirus have?
A1JEOIZVMJ0M2B,1,general,corona,Useful,C_49_U,16,"Approved filtering facemask respirators, such as the N95 respirator.","It is recommended that healthcare professionals who may be working in contact with people with the virus wear what, in addition to personal protective equipment on their hands and bodies?"
A1JEOIZVMJ0M2B,1,general,general,Not useful,NC_07_NU,4,Salt Lake City,In what city could you see the Seagull Monument at Temple Square?
A1JEOIZVMJ0M2B,1,general,general,Not useful,NC_15_NU,8,Albert Einstein,Who beat out FDR and Gandhi to be named Time's Person of the Century in 1999?
A1JEOIZVMJ0M2B,1,general,general,Not useful,NC_19_NU,16,Smoke,"in 1908, New York City passed the Sullivan Ordinance which made it illegal for women to do what in public?"
A1JEOIZVMJ0M2B,1,general,general,Not useful,NC_23_NU,4,The Netherlands,In 1568 the Catholic Church sentenced the entire population of which nation to death as heretics?
A1JEOIZVMJ0M2B,1,general,general,Useful,NC_33_U,4,Below eye level,Where in the supermarket can you usually find the cheaper items?
A1JEOIZVMJ0M2B,1,general,general,Useful,NC_35_U,16,Wrap a wet paper towel around the bottle and put in the fridge,How can you cool beverages more quickly?
A1JEOIZVMJ0M2B,1,general,general,Useful,NC_43_U,4,Between 105 and 54 days before the scheduled trip.,How far in advance of a trip is the most cost effective time to purchase a plane ticket? 
A1JEOIZVMJ0M2B,1,general,third,MTurk,TB_24_MT,12,"Deep sea creatures must survive in extremely harsh conditions. They include the giant spider crab, frilled shark, and the atlantic wolffish",Which creatures live in deep sea?
A1JEOIZVMJ0M2B,1,general,third,MTurk,TB_30_MT,16,"The ""no hair theorem"" states that a black hole has only three properties: electric charge, angular momentum, and mass.",What is the composition of a black hole?
A1JEOIZVMJ0M2B,1,general,third,Trivia,TB_01_TR,12,Canada,"What country is home to Roots, the company that outfits the U.S. Olympic team?"
A1JEOIZVMJ0M2B,1,general,third,Trivia,TB_05_TR,4,Hong Kong,What city's harbor is overlooked by Victoria Peak?
A1JEOIZVMJ0M2B,1,general,third,Trivia,TB_12_TR,4,It sits beside the Finger Lakes,"Why is Oneida Lake, near Syracuse, New York, sometimes called ""the thumb""?"
A1JEOIZVMJ0M2B,1,general,third,Trivia,TB_13_TR,12,Java,On what namesake Asian island are the first Homo erectus fossils found?
A1JEOIZVMJ0M2B,1,general,third,Trivia,TB_15_TR,4,Portia,The United States' first law school for woman was named for what cross-dressing Shakespearean character?
