PID,sess,firstBlock,block,type,questionId,wait_duration,answer,question
A1JPTRMCGZ2FEL,1,corona,corona,Not useful,C_02_NU,4,Three ,How many pandemics were there in the 20th century?
A1JPTRMCGZ2FEL,1,corona,corona,Not useful,C_12_NU,4,Diamond Princess,What was the name of the British cruise ship that was quarantined in Japanese waters?
A1JPTRMCGZ2FEL,1,corona,corona,Not useful,C_22_NU,12,Contact tracing,What is the name of the process health authorities use to understand the sources of infection and to prevent further transmission?
A1JPTRMCGZ2FEL,1,corona,corona,Not useful,C_23_NU,16,They falsely claimed to cure or prevent coronavirus,"At the end of February, Amazon banned over a million products because of what?"
A1JPTRMCGZ2FEL,1,corona,corona,Useful,C_47_U,8,"Free of fever; no other symptoms, including cough; negative tests on at least two consecutive respiratory specimens at least 24 hours apart.",What are current Centers for Disease Control (CDC) guidelines for releasing someone from isolation?
A1JPTRMCGZ2FEL,1,corona,corona,Useful,C_48_U,12,"Regular face masks are not considered effective, and reserves need to be saved for people who are infected and for healthcare professionals.",Why does the CDC currently recommend that healthy people do not wear face masks?
A1JPTRMCGZ2FEL,1,corona,corona,Useful,C_49_U,8,"Approved filtering facemask respirators, such as the N95 respirator.","It is recommended that healthcare professionals who may be working in contact with people with the virus wear what, in addition to personal protective equipment on their hands and bodies?"
A1JPTRMCGZ2FEL,1,corona,general,Not useful,NC_15_NU,16,Albert Einstein,Who beat out FDR and Gandhi to be named Time's Person of the Century in 1999?
A1JPTRMCGZ2FEL,1,corona,general,Not useful,NC_18_NU,16,A truce,What was put in place by the Ancient Greeks before and during all Olympic festivals?
A1JPTRMCGZ2FEL,1,corona,general,Not useful,NC_24_NU,4,State quarters,What's been released five times a year from January 1999 to fall 2008?
A1JPTRMCGZ2FEL,1,corona,general,Useful,NC_34_U,12,"Pineapple, by planting the green leaves",What tropical fruit can be regrown from its scraps?
A1JPTRMCGZ2FEL,1,corona,general,Useful,NC_44_U,12,Doritos,What popular snack food is effective to use as kindling to start a fire?
A1JPTRMCGZ2FEL,1,corona,general,Useful,NC_45_U,16,"Grapes or raisins, onions, avocado","In addition to chocolate, what other foods can be very harmful to dogs? "
A1JPTRMCGZ2FEL,1,corona,third,MTurk,TB_24_MT,16,"Deep sea creatures must survive in extremely harsh conditions. They include the giant spider crab, frilled shark, and the atlantic wolffish",Which creatures live in deep sea?
A1JPTRMCGZ2FEL,1,corona,third,MTurk,TB_25_MT,8,"Scientists estimate that we are likely to see flying cars, and that computers may be able to read people's thoughts and emotions ",What will be the new technologies of future?
A1JPTRMCGZ2FEL,1,corona,third,MTurk,TB_44_MT,16,"In all U.S states, same-sex marriage is now legal. Also, the number of kids per family has decreased and so ""middle"" childreen, between the eldest and youngest, are getting rarer. ",How have families changed over time?
A1JPTRMCGZ2FEL,1,corona,third,Trivia,TB_04_TR,16,Phil Knight,"In 1964, who founded Blue Ribbon Sports, which later went on to become Nike?"
A1JPTRMCGZ2FEL,1,corona,third,Trivia,TB_16_TR,16,Jim Lovell,Alan Shepard was scheduled to command the ill-fated Apollo 13 before switching missions with what astronaut?
A1JPTRMCGZ2FEL,1,corona,third,Trivia,TB_20_TR,8,Rafflesia (corpse lily),What is the largest flower in the world?
