PID,sess,firstBlock,block,type,questionId,wait_duration,answer,question
A1K48Q7FHSE5HS,1,corona,corona,Not useful,C_03_NU,4,"Fuburary 1st, 2020",When was the molecular structure of the coronovirus identfied?
A1K48Q7FHSE5HS,1,corona,corona,Not useful,C_18_NU,8,They are able to filter out at least 95% of airborne particles,Why are N95 respirator face masks so named?
A1K48Q7FHSE5HS,1,corona,corona,Not useful,C_24_NU,4,Contagion,"According to media reports, which 2011 movie has seen a large increase in popularity in the wake of the new coronavirus?"
A1K48Q7FHSE5HS,1,corona,corona,Not useful,C_25_NU,4,The viruses have spikes on their outer surface that look like a crown (or corona in Latin),What is the supposed origin of the name coronavirus?
A1K48Q7FHSE5HS,1,corona,corona,Useful,C_28_U,8,"Yes, by boosting the immune system",Does sleep make you more resistant to coronavirus infections?
A1K48Q7FHSE5HS,1,corona,corona,Useful,C_31_U,8,"The virus is probably not sexually tansmissible, but infection does occurs when kissing.",Can the coronavirus be transmitted through sexual intercourse?
A1K48Q7FHSE5HS,1,corona,corona,Useful,C_50_U,4,Washington,The first US death from the new coronavirus occurred in which state?
A1K48Q7FHSE5HS,1,corona,general,Not useful,NC_06_NU,16,David Livingstone,Who discovered the Victoria Falls?
A1K48Q7FHSE5HS,1,corona,general,Not useful,NC_09_NU,4,Captain Cook,"Who christened Hawaii ""the Sandwich Islands"" in 1778?"
A1K48Q7FHSE5HS,1,corona,general,Not useful,NC_16_NU,8,Newborns,The apgar score is used to measure the color and condition of what?
A1K48Q7FHSE5HS,1,corona,general,Not useful,NC_21_NU,12,The Pieta,Which was the only one of his sculptures that Michelangelo signed?
A1K48Q7FHSE5HS,1,corona,general,Not useful,NC_25_NU,8,Shark,"What animal is thought to be immune to most all diseases, including cancer?"
A1K48Q7FHSE5HS,1,corona,general,Useful,NC_30_U,16,Floormats - put them under the wheels for traction,What item that can be found in any car can help you extract your car from mud or snow?
A1K48Q7FHSE5HS,1,corona,third,MTurk,TB_25_MT,16,"Scientists estimate that we are likely to see flying cars, and that computers may be able to read people's thoughts and emotions ",What will be the new technologies of future?
A1K48Q7FHSE5HS,1,corona,third,MTurk,TB_35_MT,4,Prototypes already exist. Technological estimates suggest that definitely within the next twenty years -- although the challenges are great.,When will we have flying cars?
A1K48Q7FHSE5HS,1,corona,third,MTurk,TB_36_MT,12,"For two reasons. One, they are too heavy. For example, the Space Shuttle weighed 2 thousand tons, yet a Boeing can only carry about 120 tons. Second, the thrust is likely to be too strong.",Why don't space rockets take off from a plane already in the air?
A1K48Q7FHSE5HS,1,corona,third,Trivia,TB_01_TR,12,Canada,"What country is home to Roots, the company that outfits the U.S. Olympic team?"
A1K48Q7FHSE5HS,1,corona,third,Trivia,TB_02_TR,4,Ivory Coast's,"The world's largest church is Our Lady of Peace Basilica in Yamoussoukro, what nation's capital?"
A1K48Q7FHSE5HS,1,corona,third,Trivia,TB_16_TR,16,Jim Lovell,Alan Shepard was scheduled to command the ill-fated Apollo 13 before switching missions with what astronaut?
