PID,sess,firstBlock,block,type,questionId,wait_duration,answer,question
A1K8VUKRL53OX,1,general,corona,Not useful,C_06_NU,8,Gwyneth Paltrow,"Which celebrity said about the new coronavirus ""I've already been in this movie""?"
A1K8VUKRL53OX,1,general,corona,Not useful,C_20_NU,12,"Rear Adm. Ziemer led the global health security team, responsible for leading the US response to pandemics.","In May 2018, Rear Admiral Timothy Ziemer left the White House staff and was not replaced. What was Rear Adm. Ziemer's responsibility in the White House?"
A1K8VUKRL53OX,1,general,corona,Useful,C_29_U,16,Not for at least several months from now,How soon is a vaccine for the new coronavirus likely to be available?
A1K8VUKRL53OX,1,general,corona,Useful,C_46_U,4,Remdesivir,"Which drug, which has been used as a treatment for the Ebola and Marburg viruses, might be promising as a treatment for this new coronavirus?"
A1K8VUKRL53OX,1,general,corona,Useful,C_50_U,4,Washington,The first US death from the new coronavirus occurred in which state?
A1K8VUKRL53OX,1,general,general,Not useful,NC_03_NU,16,Red River,"What name is shared by the rivers that run through Denison, TX and Hanoi, Vietnam?"
A1K8VUKRL53OX,1,general,general,Not useful,NC_04_NU,4,Edward Albee,"Who wrote ""Who's Afraid of Virginia Woolf?"""
A1K8VUKRL53OX,1,general,general,Not useful,NC_11_NU,4,Endeavour,What is the name of the ship that carried Captain Cook to Australia?
A1K8VUKRL53OX,1,general,general,Not useful,NC_15_NU,12,Albert Einstein,Who beat out FDR and Gandhi to be named Time's Person of the Century in 1999?
A1K8VUKRL53OX,1,general,general,Not useful,NC_18_NU,8,A truce,What was put in place by the Ancient Greeks before and during all Olympic festivals?
A1K8VUKRL53OX,1,general,general,Useful,NC_29_U,8,"Freeze before chopping, or hold a piece of bread in your mouth, half sticking out",How to chop an onion without crying?
A1K8VUKRL53OX,1,general,general,Useful,NC_35_U,12,Wrap a wet paper towel around the bottle and put in the fridge,How can you cool beverages more quickly?
A1K8VUKRL53OX,1,general,third,MTurk,TB_30_MT,8,"The ""no hair theorem"" states that a black hole has only three properties: electric charge, angular momentum, and mass.",What is the composition of a black hole?
A1K8VUKRL53OX,1,general,third,MTurk,TB_34_MT,16,Evolution is usually very slow. Think about the similarities between apes and people. Future people are going to be as similar to us as we are to apes. ,What will future humans look like?
A1K8VUKRL53OX,1,general,third,MTurk,TB_46_MT,4,"Scientists are still figuring it out. It seems that passive use is slightly bad, but active use is not.",How does social media influence our mental health?
A1K8VUKRL53OX,1,general,third,Trivia,TB_11_TR,4,Mung beans,What kind of bean produces the Asian-style bean sprouts in the produce section of supermarkets?
A1K8VUKRL53OX,1,general,third,Trivia,TB_13_TR,8,Java,On what namesake Asian island are the first Homo erectus fossils found?
A1K8VUKRL53OX,1,general,third,Trivia,TB_15_TR,16,Portia,The United States' first law school for woman was named for what cross-dressing Shakespearean character?
