PID,sess,firstBlock,block,type,questionId,wait_duration,answer,question
A1KUSWYPDMM4SH,1,corona,corona,Not useful,C_02_NU,4,Three ,How many pandemics were there in the 20th century?
A1KUSWYPDMM4SH,1,corona,corona,Not useful,C_05_NU,8,University of Washington,Which was the first US University to cancel classes becuase of the new coronavirus?
A1KUSWYPDMM4SH,1,corona,corona,Not useful,C_06_NU,8,Gwyneth Paltrow,"Which celebrity said about the new coronavirus ""I've already been in this movie""?"
A1KUSWYPDMM4SH,1,corona,corona,Not useful,C_15_NU,4,7.5 days,"In the early stages of the new coronavirus, the number of new cases doubled approximately every how many days?"
A1KUSWYPDMM4SH,1,corona,corona,Not useful,C_26_NU,4,Severe acute respiratory syndrome,The official name of the new coronavirus is SARS-CoV-2. What does SARS stand for?
A1KUSWYPDMM4SH,1,corona,corona,Useful,C_37_U,8,There is no evidence from the current outbreak that eating garlic has protected people from the new coronavirus.,Can eating garlic help prevent infection with the new coronavirus?
A1KUSWYPDMM4SH,1,corona,corona,Useful,C_39_U,4,"No, antibiotics do not work against viruses, only bacteria.",Are antibiotics effective in preventing and treating the new coronavirus?
A1KUSWYPDMM4SH,1,corona,corona,Useful,C_41_U,12,Studies suggest that coronaviruses (including preliminary information on the new virus) may persist on surfaces for a few hours or up to several days.,How long does the new coronavirus survive on surfaces?
A1KUSWYPDMM4SH,1,corona,corona,Useful,C_47_U,8,"Free of fever; no other symptoms, including cough; negative tests on at least two consecutive respiratory specimens at least 24 hours apart.",What are current Centers for Disease Control (CDC) guidelines for releasing someone from isolation?
A1KUSWYPDMM4SH,1,corona,general,Not useful,NC_12_NU,4,Come by her,"The title of the song ""Kumbaya"" is actually a distortion of what three-word phrase?"
A1KUSWYPDMM4SH,1,corona,general,Not useful,NC_23_NU,8,The Netherlands,In 1568 the Catholic Church sentenced the entire population of which nation to death as heretics?
A1KUSWYPDMM4SH,1,corona,general,Not useful,NC_25_NU,4,Shark,"What animal is thought to be immune to most all diseases, including cancer?"
A1KUSWYPDMM4SH,1,corona,general,Useful,NC_27_U,8,White vinegar,What can you use instead of fabric softner to soften sheets and remove odours?
A1KUSWYPDMM4SH,1,corona,general,Useful,NC_33_U,12,Below eye level,Where in the supermarket can you usually find the cheaper items?
A1KUSWYPDMM4SH,1,corona,general,Useful,NC_35_U,4,Wrap a wet paper towel around the bottle and put in the fridge,How can you cool beverages more quickly?
A1KUSWYPDMM4SH,1,corona,general,Useful,NC_52_U,4,"Tie your hair into a tight ponytail at the front of your head, and cut it.",How can you give yourself a layered haircut?
A1KUSWYPDMM4SH,1,corona,third,MTurk,TB_34_MT,12,Evolution is usually very slow. Think about the similarities between apes and people. Future people are going to be as similar to us as we are to apes. ,What will future humans look like?
A1KUSWYPDMM4SH,1,corona,third,MTurk,TB_41_MT,8,"Deep learning-based machines, that can process unparalleled amount of information will allow AI to accomplish goals that were unimaginable until very recently. ",What are the most recent developments in artificial intelligence?
A1KUSWYPDMM4SH,1,corona,third,Trivia,TB_11_TR,4,Mung beans,What kind of bean produces the Asian-style bean sprouts in the produce section of supermarkets?
A1KUSWYPDMM4SH,1,corona,third,Trivia,TB_14_TR,4,James Brown,"When asked to define ""cool,"" what two words did James Brown use?"
A1KUSWYPDMM4SH,1,corona,third,Trivia,TB_23_TR,8,Tooth,What is the only part of the body that can't repair itself?
