PID,sess,firstBlock,block,type,questionId,wait_duration,answer,question
A1KX1CMLUCQNFX,1,general,corona,Useful,C_40_U,8,"The incubation period - the time between catching the virus and beginning to have symptoms of the disease - is estimated to range from 1-14 days, most commonly around five days.",How long is the incubation period for the new coronavirus?
A1KX1CMLUCQNFX,1,general,corona,Useful,C_51_U,8,Nasal or orab swab or a sample of sputum,What sort of specimen is needed to test for the new coronavirus? 
A1KX1CMLUCQNFX,1,general,corona,Useful,C_52_U,4,No. To protect yourself against the new coronavirus washing your hands is the best preventive measure.,Are hand dryers effective in killing the new coronavirus?
A1KX1CMLUCQNFX,1,general,general,Not useful,NC_06_NU,8,David Livingstone,Who discovered the Victoria Falls?
A1KX1CMLUCQNFX,1,general,general,Useful,NC_32_U,12,Take a picture of your fridge before leaving the house,What's a simple trick for telling whether your out of something when you're grocery shopping?
A1KX1CMLUCQNFX,1,general,general,Useful,NC_34_U,8,"Pineapple, by planting the green leaves",What tropical fruit can be regrown from its scraps?
A1KX1CMLUCQNFX,1,general,general,Useful,NC_40_U,16,Squint your eyes,How do you make your smile look more genuine in photographs?
A1KX1CMLUCQNFX,1,general,general,Useful,NC_45_U,16,"Grapes or raisins, onions, avocado","In addition to chocolate, what other foods can be very harmful to dogs? "
A1KX1CMLUCQNFX,1,general,third,MTurk,TB_27_MT,4,"We do not know, of course. Yet, it is important to realize that there is no scientific proof for God's existence.  ",Does God exist?
A1KX1CMLUCQNFX,1,general,third,Trivia,TB_14_TR,8,James Brown,"When asked to define ""cool,"" what two words did James Brown use?"
A1KX1CMLUCQNFX,1,general,third,Trivia,TB_19_TR,8,Ketchup,The only vegetable ice cream ever produced was what flavor?
