PID,sess,firstBlock,block,type,questionId,wait_duration,answer,question
A1KZ21TSAYUHO4,1,corona,corona,Not useful,C_04_NU,4,"It stands for ""COronaVIrus Disease 2019""","Why is the new coronavirus called ""COVID-19""? "
A1KZ21TSAYUHO4,1,corona,corona,Not useful,C_22_NU,16,Contact tracing,What is the name of the process health authorities use to understand the sources of infection and to prevent further transmission?
A1KZ21TSAYUHO4,1,corona,corona,Not useful,C_26_NU,12,Severe acute respiratory syndrome,The official name of the new coronavirus is SARS-CoV-2. What does SARS stand for?
A1KZ21TSAYUHO4,1,corona,corona,Useful,C_27_U,8,Washing your hands frequently,What is the most effective measure to prevent infection with the coronavirus?
A1KZ21TSAYUHO4,1,corona,corona,Useful,C_31_U,4,Probably not but it's too soon to be sure,Can the coronavirus be transmitted through sexual intercourse?
A1KZ21TSAYUHO4,1,corona,corona,Useful,C_35_U,8,"The virus spreads through coughs and sneezes, there are no reports of transmission through mosquito bites.",Can the new coronavirus be transmitted through mosquito bites?
A1KZ21TSAYUHO4,1,corona,corona,Useful,C_40_U,8,"The incubation period - the time between catching the virus and beginning to have symptoms of the disease - is estimated to range from 1-14 days, most commonly around five days.",How long is the incubation period for the new coronavirus?
A1KZ21TSAYUHO4,1,corona,corona,Useful,C_48_U,16,"Regular face masks are not considered effective, and reserves need to be saved for people who are infected and for healthcare professionals.",Why does the CDC currently recommend that healthy people do not wear face masks?
A1KZ21TSAYUHO4,1,corona,general,Not useful,NC_04_NU,4,Edward Albee,"Who wrote ""Who's Afraid of Virginia Woolf?"""
A1KZ21TSAYUHO4,1,corona,general,Not useful,NC_10_NU,4,K.D. Lang,What Canadian singer appeared on the first cover of Entertainment Weekly?
A1KZ21TSAYUHO4,1,corona,general,Not useful,NC_11_NU,12,Endeavour,What is the name of the ship that carried Captain Cook to Australia?
A1KZ21TSAYUHO4,1,corona,general,Not useful,NC_25_NU,8,Shark,"What animal is thought to be immune to most all diseases, including cancer?"
A1KZ21TSAYUHO4,1,corona,general,Not useful,NC_26_NU,16,Dark Side of the Moon,What album spent a record 741 weeks on Billboard's Top 200 Albums chart?
A1KZ21TSAYUHO4,1,corona,general,Useful,NC_41_U,16,"April 8th, 2024",When is the next total solar eclipse visible in North America projected to occur? 
A1KZ21TSAYUHO4,1,corona,general,Useful,NC_42_U,8,"Deprive it of oxygen by covering, pouring baking soda if the fire is small, or using a fire extinguisher if it's large.",How do you put out a grease fire? 
A1KZ21TSAYUHO4,1,corona,general,Useful,NC_44_U,8,Doritos,What popular snack food is effective to use as kindling to start a fire?
A1KZ21TSAYUHO4,1,corona,third,MTurk,TB_24_MT,16,"Deep sea creatures must survive in extremely harsh conditions. They include the giant spider crab, frilled shark, and the atlantic wolffish",Which creatures live in deep sea?
A1KZ21TSAYUHO4,1,corona,third,MTurk,TB_31_MT,16,Scientists estimate that at the moment it is not. But with global warming it might become more feasilbe later in the 21st century.,How feasible would it be to colonize Antarctica?
A1KZ21TSAYUHO4,1,corona,third,MTurk,TB_38_MT,4,"As a rule, yes. Restaurants have to cover rent, salaries and taxes. These are all included in the prices.",Is it really cheaper to cook at home vs. eating out?
A1KZ21TSAYUHO4,1,corona,third,MTurk,TB_40_MT,8,"NASA plans another crewed mission to the Moon by 2024, followed by a sustained presence  by 2028.  Russia is planning to begin building a human colony by 2037.",When could a lunar base be established?
A1KZ21TSAYUHO4,1,corona,third,MTurk,TB_46_MT,8,"Scientists are still figuring it out. It seems that passive use is slightly bad, but active use is not.",How does social media influence our mental health?
A1KZ21TSAYUHO4,1,corona,third,Trivia,TB_01_TR,8,Canada,"What country is home to Roots, the company that outfits the U.S. Olympic team?"
A1KZ21TSAYUHO4,1,corona,third,Trivia,TB_17_TR,8,"Third finger, left hand",What part of his body did Keith Richards insure for a million pounds?
A1KZ21TSAYUHO4,1,corona,third,Trivia,TB_18_TR,4,Orville Wright,Who was flying the plane in which the first US airplane fatality occurred?
A1KZ21TSAYUHO4,1,corona,third,Trivia,TB_21_TR,4,New York,Which state has the zip code 12345?
A1KZ21TSAYUHO4,1,corona,third,Trivia,TB_22_TR,8,Cheetah,Which is the only cat that cannot retract its claws?
