PID,sess,firstBlock,block,type,questionId,wait_duration,answer,question
A1L2N1X8U8Z3W7,1,general,corona,Not useful,C_02_NU,8,Three ,How many pandemics were there in the 20th century?
A1L2N1X8U8Z3W7,1,general,corona,Not useful,C_03_NU,4,"Fuburary 1st, 2020",When was the molecular structure of the coronovirus identfied?
A1L2N1X8U8Z3W7,1,general,corona,Not useful,C_06_NU,12,Gwyneth Paltrow,"Which celebrity said about the new coronavirus ""I've already been in this movie""?"
A1L2N1X8U8Z3W7,1,general,corona,Not useful,C_17_NU,8,"Locations, people, or animals","The name for the new disease COVID-19 adheres to WHO best practices in disease naming, which include guidelines to not name disease after what?"
A1L2N1X8U8Z3W7,1,general,corona,Not useful,C_25_NU,4,The viruses have spikes on their outer surface that look like a crown (or corona in Latin),What is the supposed origin of the name coronavirus?
A1L2N1X8U8Z3W7,1,general,corona,Useful,C_32_U,4,"Healthcare professionals treating patients, in-home caregivers, and those who are already sick with the new coronavirus",Which three groups of people does the CDC recommend masks for?
A1L2N1X8U8Z3W7,1,general,general,Not useful,NC_09_NU,4,Captain Cook,"Who christened Hawaii ""the Sandwich Islands"" in 1778?"
A1L2N1X8U8Z3W7,1,general,general,Not useful,NC_12_NU,8,Come by her,"The title of the song ""Kumbaya"" is actually a distortion of what three-word phrase?"
A1L2N1X8U8Z3W7,1,general,general,Not useful,NC_24_NU,12,State quarters,What's been released five times a year from January 1999 to fall 2008?
A1L2N1X8U8Z3W7,1,general,general,Useful,NC_28_U,16,Microwave next to a glass of water,How can you soften brown sugar that has hardened into a lump?
A1L2N1X8U8Z3W7,1,general,general,Useful,NC_34_U,4,"Pineapple, by planting the green leaves",What tropical fruit can be regrown from its scraps?
A1L2N1X8U8Z3W7,1,general,general,Useful,NC_40_U,4,Squint your eyes,How do you make your smile look more genuine in photographs?
A1L2N1X8U8Z3W7,1,general,general,Useful,NC_41_U,4,"April 8th, 2024",When is the next total solar eclipse visible in North America projected to occur? 
A1L2N1X8U8Z3W7,1,general,general,Useful,NC_43_U,12,Between 105 and 54 days before the scheduled trip.,How far in advance of a trip is the most cost effective time to purchase a plane ticket? 
A1L2N1X8U8Z3W7,1,general,general,Useful,NC_44_U,8,Doritos,What popular snack food is effective to use as kindling to start a fire?
A1L2N1X8U8Z3W7,1,general,general,Useful,NC_51_U,12,White vinegar,What salad dressing ingredient is also an efficient weed killer?
A1L2N1X8U8Z3W7,1,general,third,MTurk,TB_31_MT,16,Scientists estimate that at the moment it is not. But with global warming it might become more feasilbe later in the 21st century.,How feasible would it be to colonize Antarctica?
A1L2N1X8U8Z3W7,1,general,third,MTurk,TB_40_MT,4,"NASA plans another crewed mission to the Moon by 2024, followed by a sustained presence  by 2028.  Russia is planning to begin building a human colony by 2037.",When could a lunar base be established?
A1L2N1X8U8Z3W7,1,general,third,MTurk,TB_45_MT,8,"The amygdala (from Greek, 'almond') is one of two almond-shaped clusters of nuclei located deep and medially within the temporal lobes of the brain in complex vertebrates, including humans.",What is the amygdala?
A1L2N1X8U8Z3W7,1,general,third,Trivia,TB_11_TR,8,Mung beans,What kind of bean produces the Asian-style bean sprouts in the produce section of supermarkets?
A1L2N1X8U8Z3W7,1,general,third,Trivia,TB_23_TR,12,Tooth,What is the only part of the body that can't repair itself?
