PID,sess,firstBlock,block,type,questionId,wait_duration,answer,question
A1L8ERUX8LJG6K,1,general,corona,Not useful,C_16_NU,4,Bats and pangolins,What other animals have been found to have viruses with highly similar genome sequences as the current coronavirus?
A1L8ERUX8LJG6K,1,general,corona,Useful,C_33_U,8,Soft surfaces are less likely to transmit the virus than hard surfaces.,Can the new coronavirus be transmitted by touching a soft surface like carpets or fabric?
A1L8ERUX8LJG6K,1,general,corona,Useful,C_35_U,8,"The virus spreads through coughs and sneezes, there are no reports of transmission through mosquito bites.",Can the new coronavirus be transmitted through mosquito bites?
A1L8ERUX8LJG6K,1,general,corona,Useful,C_38_U,16,People of all ages can be infected by the new coronavirus. Older people appear to be more vulnerable to becoming severely ill with the virus.,"Does the new coronavirus affect older people, or are younger people also susceptible?"
A1L8ERUX8LJG6K,1,general,corona,Useful,C_40_U,4,"The incubation period - the time between catching the virus and beginning to have symptoms of the disease - is estimated to range from 1-14 days, most commonly around five days.",How long is the incubation period for the new coronavirus?
A1L8ERUX8LJG6K,1,general,corona,Useful,C_41_U,4,Studies suggest that coronaviruses (including preliminary information on the new virus) may persist on surfaces for a few hours or up to several days.,How long does the new coronavirus survive on surfaces?
A1L8ERUX8LJG6K,1,general,corona,Useful,C_42_U,4,"Fever, cough, shortness of breath.",What are the most common symptoms of the new coronavirus?
A1L8ERUX8LJG6K,1,general,corona,Useful,C_46_U,12,Remdesivir,"Which drug, which has been used as a treatment for the Ebola and Marburg viruses, might be promising as a treatment for this new coronavirus?"
A1L8ERUX8LJG6K,1,general,general,Not useful,NC_16_NU,16,Newborns,The apgar score is used to measure the color and condition of what?
A1L8ERUX8LJG6K,1,general,general,Useful,NC_30_U,4,Floormats - put them under the wheels for traction,What item that can be found in any car can help you extract your car from mud or snow?
A1L8ERUX8LJG6K,1,general,general,Useful,NC_38_U,8,"Camu Camu, a cherry-like fruit from Brazil",What fruit has the highest content of vitamin C?
A1L8ERUX8LJG6K,1,general,general,Useful,NC_44_U,12,Doritos,What popular snack food is effective to use as kindling to start a fire?
A1L8ERUX8LJG6K,1,general,general,Useful,NC_48_U,12,"Drop it from a 3 inch height. If it bounces, it's dead.",How can you tell if a battery is dead without using any tools?
A1L8ERUX8LJG6K,1,general,third,MTurk,TB_29_MT,4,"There are a few helpful techniques. One is to imagine that you climb on top of a high building, and ""look down"" at your life. Second, to try to think about issues in novel ways. ",How to stay calm in adversity?
A1L8ERUX8LJG6K,1,general,third,MTurk,TB_41_MT,12,"Deep learning-based machines, that can process unparalleled amount of information will allow AI to accomplish goals that were unimaginable until very recently. ",What are the most recent developments in artificial intelligence?
A1L8ERUX8LJG6K,1,general,third,Trivia,TB_19_TR,4,Ketchup,The only vegetable ice cream ever produced was what flavor?
