PID,sess,firstBlock,block,type,questionId,wait_duration,answer,question
A1MV5TQDUJG4SO,1,general,corona,Not useful,C_10_NU,12,11 million people,"What is the population of Wuhan, the city in which coronavirus was first identified?"
A1MV5TQDUJG4SO,1,general,corona,Not useful,C_24_NU,4,Contagion,"According to media reports, which 2011 movie has seen a large increase in popularity in the wake of the new coronavirus?"
A1MV5TQDUJG4SO,1,general,corona,Not useful,C_25_NU,16,The viruses have spikes on their outer surface that look like a crown (or corona in Latin),What is the supposed origin of the name coronavirus?
A1MV5TQDUJG4SO,1,general,corona,Not useful,C_26_NU,8,Severe acute respiratory syndrome,The official name of the new coronavirus is SARS-CoV-2. What does SARS stand for?
A1MV5TQDUJG4SO,1,general,corona,Useful,C_49_U,4,"Approved filtering facemask respirators, such as the N95 respirator.","It is recommended that healthcare professionals who may be working in contact with people with the virus wear what, in addition to personal protective equipment on their hands and bodies?"
A1MV5TQDUJG4SO,1,general,general,Not useful,NC_07_NU,4,Salt Lake City,In what city could you see the Seagull Monument at Temple Square?
A1MV5TQDUJG4SO,1,general,general,Not useful,NC_15_NU,12,Albert Einstein,Who beat out FDR and Gandhi to be named Time's Person of the Century in 1999?
A1MV5TQDUJG4SO,1,general,general,Not useful,NC_19_NU,12,Smoke,"in 1908, New York City passed the Sullivan Ordinance which made it illegal for women to do what in public?"
A1MV5TQDUJG4SO,1,general,general,Not useful,NC_24_NU,12,State quarters,What's been released five times a year from January 1999 to fall 2008?
A1MV5TQDUJG4SO,1,general,general,Not useful,NC_25_NU,4,Shark,"What animal is thought to be immune to most all diseases, including cancer?"
A1MV5TQDUJG4SO,1,general,general,Useful,NC_33_U,12,Below eye level,Where in the supermarket can you usually find the cheaper items?
A1MV5TQDUJG4SO,1,general,general,Useful,NC_44_U,12,Doritos,What popular snack food is effective to use as kindling to start a fire?
A1MV5TQDUJG4SO,1,general,third,MTurk,TB_40_MT,4,"NASA plans another crewed mission to the Moon by 2024, followed by a sustained presence  by 2028.  Russia is planning to begin building a human colony by 2037.",When could a lunar base be established?
A1MV5TQDUJG4SO,1,general,third,MTurk,TB_45_MT,12,"The amygdala (from Greek, 'almond') is one of two almond-shaped clusters of nuclei located deep and medially within the temporal lobes of the brain in complex vertebrates, including humans.",What is the amygdala?
A1MV5TQDUJG4SO,1,general,third,Trivia,TB_06_TR,8,Xanadu,What 1980 film is named for the legendary square-shaped capital of Kublai Khan?
A1MV5TQDUJG4SO,1,general,third,Trivia,TB_07_TR,4,Tuxedo Club,What New York country club lent its name to the kind of dinner jacket first worn there in 1886?
A1MV5TQDUJG4SO,1,general,third,Trivia,TB_11_TR,4,Mung beans,What kind of bean produces the Asian-style bean sprouts in the produce section of supermarkets?
A1MV5TQDUJG4SO,1,general,third,Trivia,TB_15_TR,4,Portia,The United States' first law school for woman was named for what cross-dressing Shakespearean character?
A1MV5TQDUJG4SO,1,general,third,Trivia,TB_23_TR,8,Tooth,What is the only part of the body that can't repair itself?
