PID,sess,firstBlock,block,type,questionId,wait_duration,answer,question
A1NIKHUA79SWGD,1,corona,corona,Not useful,C_10_NU,12,11 million people,"What is the population of Wuhan, the city in which coronavirus was first identified?"
A1NIKHUA79SWGD,1,corona,corona,Not useful,C_11_NU,12,The Chicago of China,"Wuhan, China, the city in which the coronavirus was first identified, is commonly referred to as the chinese version of what American city?"
A1NIKHUA79SWGD,1,corona,corona,Not useful,C_18_NU,8,They are able to filter out at least 95% of airborne particles,Why are N95 respirator face masks so named?
A1NIKHUA79SWGD,1,corona,corona,Useful,C_31_U,8,Probably not but it's too soon to be sure,Can the coronavirus be transmitted through sexual intercourse?
A1NIKHUA79SWGD,1,corona,corona,Useful,C_36_U,16,No. There is no evidence that regularly rinsing the nose with saline has protected people from infection with the new coronavirus.,Can regularly rinsing your nose with saline help prevent infection with the new coronavirus?
A1NIKHUA79SWGD,1,corona,corona,Useful,C_50_U,4,Washington,The first US death from the new coronavirus occurred in which state?
A1NIKHUA79SWGD,1,corona,general,Not useful,NC_05_NU,8,Matthew,Which of the four biblical Gospels was written by a tax collector?
A1NIKHUA79SWGD,1,corona,general,Not useful,NC_15_NU,4,Albert Einstein,Who beat out FDR and Gandhi to be named Time's Person of the Century in 1999?
A1NIKHUA79SWGD,1,corona,general,Not useful,NC_21_NU,16,The Pieta,Which was the only one of his sculptures that Michelangelo signed?
A1NIKHUA79SWGD,1,corona,general,Useful,NC_35_U,16,Wrap a wet paper towel around the bottle and put in the fridge,How can you cool beverages more quickly?
A1NIKHUA79SWGD,1,corona,general,Useful,NC_40_U,4,Squint your eyes,How do you make your smile look more genuine in photographs?
A1NIKHUA79SWGD,1,corona,general,Useful,NC_41_U,8,"April 8th, 2024",When is the next total solar eclipse visible in North America projected to occur? 
A1NIKHUA79SWGD,1,corona,general,Useful,NC_47_U,12,"Add baking soda, soak in advance, use a preassure cooker",What can you do to make dry beans cook faster?
A1NIKHUA79SWGD,1,corona,general,Useful,NC_51_U,16,White vinegar,What salad dressing ingredient is also an efficient weed killer?
A1NIKHUA79SWGD,1,corona,third,MTurk,TB_33_MT,8,"For SpaceX — the cheapest of NASA's new carriers — each pound costs approximately $27,000. So an average person of 160 pounds costs over $4,320,000.",How much does it cost to launch a person into space?
A1NIKHUA79SWGD,1,corona,third,MTurk,TB_37_MT,12,Engineers and architects agree that the answer is positive. Houses for the non-rich are much better built today than they were built 500 years ago.,Are houses built better than they used to be?
A1NIKHUA79SWGD,1,corona,third,MTurk,TB_39_MT,12,"There is radio emission around black holes. Scientists created a network of telescopes, capturing an image of a black hole by improving upon a technique that allows for the imaging of far-away objects",How was the recent picture of a black hole made?
A1NIKHUA79SWGD,1,corona,third,MTurk,TB_43_MT,8,"Planets likely start off as grains of dust that then combine to form bigger rocks. They clear material from their path, leaving tracks of space empty but for fine dust.",How do planets form?
A1NIKHUA79SWGD,1,corona,third,MTurk,TB_44_MT,8,"In all U.S states, same-sex marriage is now legal. Also, the number of kids per family has decreased and so ""middle"" childreen, between the eldest and youngest, are getting rarer. ",How have families changed over time?
A1NIKHUA79SWGD,1,corona,third,Trivia,TB_06_TR,8,Xanadu,What 1980 film is named for the legendary square-shaped capital of Kublai Khan?
A1NIKHUA79SWGD,1,corona,third,Trivia,TB_10_TR,16,George VI,Who was the last British Monarch to also be an emperor?
A1NIKHUA79SWGD,1,corona,third,Trivia,TB_11_TR,4,Mung beans,What kind of bean produces the Asian-style bean sprouts in the produce section of supermarkets?
