PID,sess,firstBlock,block,type,questionId,wait_duration,answer,question
A1NO4N6E04SAOR,1,general,corona,Not useful,C_06_NU,4,Gwyneth Paltrow,"Which celebrity said about the new coronavirus ""I've already been in this movie""?"
A1NO4N6E04SAOR,1,general,general,Not useful,NC_20_NU,8,Russia,Which country has the most public libraries?
A1NO4N6E04SAOR,1,general,general,Useful,NC_34_U,12,"Pineapple, by planting the green leaves",What tropical fruit can be regrown from its scraps?
A1NO4N6E04SAOR,1,general,general,Useful,NC_51_U,12,White vinegar,What salad dressing ingredient is also an efficient weed killer?
A1NO4N6E04SAOR,1,general,third,Trivia,TB_19_TR,16,Ketchup,The only vegetable ice cream ever produced was what flavor?
