PID,sess,firstBlock,block,type,questionId,wait_duration,answer,question
A1O7WUQDKPZGH4,1,corona,corona,Not useful,C_02_NU,4,Three ,How many pandemics were there in the 20th century?
A1O7WUQDKPZGH4,1,corona,corona,Not useful,C_05_NU,8,University of Washington,Which was the first US University to cancel classes becuase of the new coronavirus?
A1O7WUQDKPZGH4,1,corona,corona,Not useful,C_13_NU,8,"The initial cases of the disease are thought to have been among people with a connection to a seafood wholesale market, which also sold live animals","Why is the virus believed to have zoonotic origin, i.e., to have potentially come from animals?"
A1O7WUQDKPZGH4,1,corona,corona,Not useful,C_18_NU,4,They are able to filter out at least 95% of airborne particles,Why are N95 respirator face masks so named?
A1O7WUQDKPZGH4,1,corona,corona,Not useful,C_20_NU,16,"Rear Adm. Ziemer led the global health security team, responsible for leading the US response to pandemics.","In May 2018, Rear Admiral Timothy Ziemer left the White House staff and was not replaced. What was Rear Adm. Ziemer's responsibility in the White House?"
A1O7WUQDKPZGH4,1,corona,corona,Useful,C_32_U,8,"Healthcare professionals treating patients, in-home caregivers, and those who are already sick with the new coronavirus",Which three groups of people does the CDC recommend masks for?
A1O7WUQDKPZGH4,1,corona,general,Not useful,NC_09_NU,4,Captain Cook,"Who christened Hawaii ""the Sandwich Islands"" in 1778?"
A1O7WUQDKPZGH4,1,corona,general,Not useful,NC_15_NU,8,Albert Einstein,Who beat out FDR and Gandhi to be named Time's Person of the Century in 1999?
A1O7WUQDKPZGH4,1,corona,general,Not useful,NC_16_NU,8,Newborns,The apgar score is used to measure the color and condition of what?
A1O7WUQDKPZGH4,1,corona,general,Not useful,NC_20_NU,12,Russia,Which country has the most public libraries?
A1O7WUQDKPZGH4,1,corona,general,Not useful,NC_23_NU,12,The Netherlands,In 1568 the Catholic Church sentenced the entire population of which nation to death as heretics?
A1O7WUQDKPZGH4,1,corona,general,Useful,NC_37_U,16,"Over the past 150 year, real estate, if you rent it out",What's a better investment: stocks or real estate?
A1O7WUQDKPZGH4,1,corona,third,MTurk,TB_32_MT,8,Sophisticated equipment is either lowered to the sea bottom or directly attached to submersible buoys and transmits to a research vessel that is equipped with state-of-the-art navigational instruments.,What are undersea researchers doing to explore the ocean floor?
A1O7WUQDKPZGH4,1,corona,third,MTurk,TB_45_MT,12,"The amygdala (from Greek, 'almond') is one of two almond-shaped clusters of nuclei located deep and medially within the temporal lobes of the brain in complex vertebrates, including humans.",What is the amygdala?
A1O7WUQDKPZGH4,1,corona,third,Trivia,TB_04_TR,8,Phil Knight,"In 1964, who founded Blue Ribbon Sports, which later went on to become Nike?"
A1O7WUQDKPZGH4,1,corona,third,Trivia,TB_06_TR,16,Xanadu,What 1980 film is named for the legendary square-shaped capital of Kublai Khan?
A1O7WUQDKPZGH4,1,corona,third,Trivia,TB_09_TR,16,The first email,"What did Ray Tomlinson send in Cambridge, Massachusetts, in late 1971?"
A1O7WUQDKPZGH4,1,corona,third,Trivia,TB_13_TR,4,Java,On what namesake Asian island are the first Homo erectus fossils found?
A1O7WUQDKPZGH4,1,corona,third,Trivia,TB_18_TR,12,Orville Wright,Who was flying the plane in which the first US airplane fatality occurred?
