PID,sess,firstBlock,block,type,questionId,wait_duration,answer,question
A1OAR421WY7JR3,1,general,corona,Not useful,C_06_NU,4,Gwyneth Paltrow,"Which celebrity said about the new coronavirus ""I've already been in this movie""?"
A1OAR421WY7JR3,1,general,corona,Not useful,C_11_NU,4,The Chicago of China,"Wuhan, China, the city in which the coronavirus was first identified, is commonly referred to as the chinese version of what American city?"
A1OAR421WY7JR3,1,general,corona,Not useful,C_17_NU,8,"Locations, people, or animals","The name for the new disease COVID-19 adheres to WHO best practices in disease naming, which include guidelines to not name disease after what?"
A1OAR421WY7JR3,1,general,corona,Useful,C_35_U,8,"The virus spreads through coughs and sneezes, there are no reports of transmission through mosquito bites.",Can the new coronavirus be transmitted through mosquito bites?
A1OAR421WY7JR3,1,general,corona,Useful,C_36_U,12,No. There is no evidence that regularly rinsing the nose with saline has protected people from infection with the new coronavirus.,Can regularly rinsing your nose with saline help prevent infection with the new coronavirus?
A1OAR421WY7JR3,1,general,corona,Useful,C_46_U,4,Remdesivir,"Which drug, which has been used as a treatment for the Ebola and Marburg viruses, might be promising as a treatment for this new coronavirus?"
A1OAR421WY7JR3,1,general,general,Not useful,NC_10_NU,8,K.D. Lang,What Canadian singer appeared on the first cover of Entertainment Weekly?
A1OAR421WY7JR3,1,general,general,Not useful,NC_12_NU,8,Come by her,"The title of the song ""Kumbaya"" is actually a distortion of what three-word phrase?"
A1OAR421WY7JR3,1,general,general,Not useful,NC_16_NU,12,Newborns,The apgar score is used to measure the color and condition of what?
A1OAR421WY7JR3,1,general,general,Not useful,NC_24_NU,4,State quarters,What's been released five times a year from January 1999 to fall 2008?
A1OAR421WY7JR3,1,general,general,Useful,NC_51_U,4,White vinegar,What salad dressing ingredient is also an efficient weed killer?
A1OAR421WY7JR3,1,general,third,Trivia,TB_15_TR,8,Portia,The United States' first law school for woman was named for what cross-dressing Shakespearean character?
