PID,sess,firstBlock,block,type,questionId,wait_duration,answer,question
A1OBAKX81G0B55,1,corona,corona,Not useful,C_01_NU,12,"Animals, probably bats",What is the source of coronavirus in humans?
A1OBAKX81G0B55,1,corona,corona,Not useful,C_07_NU,8,Pink,What color latex gloves did Naomi Campbell wear to protect herself from coronavirus?
A1OBAKX81G0B55,1,corona,corona,Not useful,C_08_NU,16,Lombardy,What is the name of the county in Italy that had the first coronavirus outbreak?
A1OBAKX81G0B55,1,corona,corona,Not useful,C_22_NU,8,Contact tracing,What is the name of the process health authorities use to understand the sources of infection and to prevent further transmission?
A1OBAKX81G0B55,1,corona,corona,Useful,C_28_U,4,"Yes, by boosting the immune system",Does sleep make you more resistant to coronavirus infections?
A1OBAKX81G0B55,1,corona,corona,Useful,C_32_U,12,"Healthcare professionals treating patients, in-home caregivers, and those who are already sick with the new coronavirus",Which three groups of people does the CDC recommend masks for?
A1OBAKX81G0B55,1,corona,corona,Useful,C_34_U,4,"The virus lives for up to a few days on surfaces, and so packages cannot transmit the virus.",Can the new coronavirus be transmitted on a package from an infected country?
A1OBAKX81G0B55,1,corona,corona,Useful,C_37_U,8,There is no evidence from the current outbreak that eating garlic has protected people from the new coronavirus.,Can eating garlic help prevent infection with the new coronavirus?
A1OBAKX81G0B55,1,corona,corona,Useful,C_43_U,4,Quarantine themselves for 14 days to make sure they are not infected.,"Currently, people who  may have been in contact with someone with the new coronavirus are recommended to do what?"
A1OBAKX81G0B55,1,corona,general,Not useful,NC_01_NU,8,Mike Powell,"In 1991, who finally broke Bob Beamon's decades-old long jump record?"
A1OBAKX81G0B55,1,corona,general,Not useful,NC_17_NU,16,Gilbert Van Camp,What Indianapolis grocer made his name by selling canned pork and beans to U.S. troops during the Civil War?
A1OBAKX81G0B55,1,corona,general,Not useful,NC_20_NU,16,Russia,Which country has the most public libraries?
A1OBAKX81G0B55,1,corona,general,Not useful,NC_23_NU,16,The Netherlands,In 1568 the Catholic Church sentenced the entire population of which nation to death as heretics?
A1OBAKX81G0B55,1,corona,general,Not useful,NC_26_NU,12,Dark Side of the Moon,What album spent a record 741 weeks on Billboard's Top 200 Albums chart?
A1OBAKX81G0B55,1,corona,general,Useful,NC_28_U,4,Microwave next to a glass of water,How can you soften brown sugar that has hardened into a lump?
A1OBAKX81G0B55,1,corona,general,Useful,NC_44_U,12,Doritos,What popular snack food is effective to use as kindling to start a fire?
A1OBAKX81G0B55,1,corona,general,Useful,NC_49_U,8,"Roll it along its long side. If it stops immediately, it's raw.",How can you tell if an egg is cooked without breaking it?
A1OBAKX81G0B55,1,corona,third,MTurk,TB_24_MT,12,"Deep sea creatures must survive in extremely harsh conditions. They include the giant spider crab, frilled shark, and the atlantic wolffish",Which creatures live in deep sea?
A1OBAKX81G0B55,1,corona,third,MTurk,TB_29_MT,8,"There are a few helpful techniques. One is to imagine that you climb on top of a high building, and ""look down"" at your life. Second, to try to think about issues in novel ways. ",How to stay calm in adversity?
A1OBAKX81G0B55,1,corona,third,MTurk,TB_30_MT,16,"The ""no hair theorem"" states that a black hole has only three properties: electric charge, angular momentum, and mass.",What is the composition of a black hole?
A1OBAKX81G0B55,1,corona,third,MTurk,TB_44_MT,12,"In all U.S states, same-sex marriage is now legal. Also, the number of kids per family has decreased and so ""middle"" childreen, between the eldest and youngest, are getting rarer. ",How have families changed over time?
A1OBAKX81G0B55,1,corona,third,MTurk,TB_46_MT,4,"Scientists are still figuring it out. It seems that passive use is slightly bad, but active use is not.",How does social media influence our mental health?
A1OBAKX81G0B55,1,corona,third,Trivia,TB_07_TR,16,Tuxedo Club,What New York country club lent its name to the kind of dinner jacket first worn there in 1886?
A1OBAKX81G0B55,1,corona,third,Trivia,TB_10_TR,16,George VI,Who was the last British Monarch to also be an emperor?
A1OBAKX81G0B55,1,corona,third,Trivia,TB_13_TR,8,Java,On what namesake Asian island are the first Homo erectus fossils found?
