PID,sess,firstBlock,block,type,questionId,wait_duration,answer,question
A1OWHPMKE7YAGL,1,general,corona,Not useful,C_01_NU,12,"Animals, probably bats",What is the source of coronavirus in humans?
A1OWHPMKE7YAGL,1,general,corona,Not useful,C_22_NU,16,Contact tracing,What is the name of the process health authorities use to understand the sources of infection and to prevent further transmission?
A1OWHPMKE7YAGL,1,general,corona,Useful,C_27_U,4,Washing your hands frequently,What is the most effective measure to prevent infection with the coronavirus?
A1OWHPMKE7YAGL,1,general,corona,Useful,C_28_U,4,"Yes, by boosting the immune system",Does sleep help prevent coronavirus infections?
A1OWHPMKE7YAGL,1,general,corona,Useful,C_37_U,12,There is no evidence from the current outbreak that eating garlic has protected people from the new coronavirus.,Can eating garlic help prevent infection with the new coronavirus?
A1OWHPMKE7YAGL,1,general,corona,Useful,C_45_U,4,"Pre-existing health conditions, including cardiovascular diseases and diabetes.",What did 75% of the people who have died from the new coronavirus have?
A1OWHPMKE7YAGL,1,general,corona,Useful,C_47_U,4,"Free of fever; no other symptoms, including cough; negative tests on at least two consecutive respiratory specimens at least 24 hours apart.",What are current Centers for Disease Control (CDC) guidelines for releasing someone from isolation?
A1OWHPMKE7YAGL,1,general,general,Useful,NC_32_U,8,Take a picture of your fridge before leaving the house,What's a simple trick for telling whether your out of something when you're grocery shopping?
A1OWHPMKE7YAGL,1,general,general,Useful,NC_33_U,16,Below eye level,Where in the supermarket can you usually find the cheaper items?
A1OWHPMKE7YAGL,1,general,general,Useful,NC_44_U,4,Doritos,What popular snack food is effective to use as kindling to start a fire?
A1OWHPMKE7YAGL,1,general,general,Useful,NC_45_U,8,"Grapes or raisins, onions, avocado","In addition to chocolate, what other foods can be very harmful to dogs? "
A1OWHPMKE7YAGL,1,general,general,Useful,NC_46_U,16,"Dish soap, peroxide, and baking soda","While tomato juice probably will not work, what does work to remove skunk odor? "
A1OWHPMKE7YAGL,1,general,general,Useful,NC_50_U,12,Spread beeswax over them and then blow dry until you can't see the beeswax anymore,What's an easy way to waterproof canvas shoes?
A1OWHPMKE7YAGL,1,general,general,Useful,NC_51_U,8,White vinegar,What salad dressing ingredient is also an efficient weed killer?
A1OWHPMKE7YAGL,1,general,third,MTurk,TB_25_MT,16,"Scientists estimate that we are likely to see flying cars, and that computers may be able to read people's thoughts and emotions ",What will be the new technologies of future?
A1OWHPMKE7YAGL,1,general,third,MTurk,TB_38_MT,12,"As a rule, yes. Restaurants have to cover rent, salaries and taxes. These are all included in the prices.",Is it really cheaper to cook at home vs. eating out?
A1OWHPMKE7YAGL,1,general,third,MTurk,TB_46_MT,4,"Scientists are still figuring it out. It seems that passive use is slightly bad, but active use is not.",How does social media influence our mental health?
A1OWHPMKE7YAGL,1,general,third,Trivia,TB_18_TR,8,Orville Wright,Who was flying the plane in which the first US airplane fatality occurred?
A1OWHPMKE7YAGL,1,general,third,Trivia,TB_20_TR,16,Rafflesia (corpse lily),What is the largest flower in the world?
A1OWHPMKE7YAGL,1,general,third,Trivia,TB_23_TR,4,Tooth,What is the only part of the body that can't repair itself?
