PID,sess,firstBlock,block,type,questionId,wait_duration,answer,question
A1OZ5BB2L44KG,1,general,corona,Not useful,C_03_NU,4,"Fuburary 1st, 2020",When was the molecular structure of the coronovirus identfied?
A1OZ5BB2L44KG,1,general,corona,Not useful,C_24_NU,8,Contagion,"According to media reports, which 2011 movie has seen a large increase in popularity in the wake of the new coronavirus?"
A1OZ5BB2L44KG,1,general,corona,Useful,C_28_U,12,"Yes, by boosting the immune system",Does sleep make you more resistant to coronavirus infections?
A1OZ5BB2L44KG,1,general,corona,Useful,C_33_U,16,Soft surfaces are less likely to transmit the virus than hard surfaces.,Can the new coronavirus be transmitted by touching a soft surface like carpets or fabric?
A1OZ5BB2L44KG,1,general,corona,Useful,C_47_U,16,"Free of fever; no other symptoms, including cough; negative tests on at least two consecutive respiratory specimens at least 24 hours apart.",What are current Centers for Disease Control (CDC) guidelines for releasing someone from isolation?
A1OZ5BB2L44KG,1,general,corona,Useful,C_51_U,16,Nasal or orab swab or a sample of sputum,What sort of specimen is needed to test for the new coronavirus? 
A1OZ5BB2L44KG,1,general,general,Not useful,NC_16_NU,8,Newborns,The apgar score is used to measure the color and condition of what?
A1OZ5BB2L44KG,1,general,general,Not useful,NC_17_NU,8,Gilbert Van Camp,What Indianapolis grocer made his name by selling canned pork and beans to U.S. troops during the Civil War?
A1OZ5BB2L44KG,1,general,general,Not useful,NC_21_NU,4,The Pieta,Which was the only one of his sculptures that Michelangelo signed?
A1OZ5BB2L44KG,1,general,general,Not useful,NC_24_NU,4,State quarters,What's been released five times a year from January 1999 to fall 2008?
A1OZ5BB2L44KG,1,general,general,Not useful,NC_26_NU,4,Dark Side of the Moon,What album spent a record 741 weeks on Billboard's Top 200 Albums chart?
A1OZ5BB2L44KG,1,general,general,Useful,NC_27_U,12,White vinegar,What can you use instead of fabric softner to soften sheets and remove odours?
A1OZ5BB2L44KG,1,general,general,Useful,NC_29_U,4,"Freeze before chopping, or hold a piece of bread in your mouth, half sticking out",How to chop an onion without crying?
A1OZ5BB2L44KG,1,general,general,Useful,NC_30_U,8,Floormats - put them under the wheels for traction,What item that can be found in any car can help you extract your car from mud or snow?
A1OZ5BB2L44KG,1,general,general,Useful,NC_31_U,12,Sign up for a free USAA membership,How can people under 25 rent a car without paying extra fees?
A1OZ5BB2L44KG,1,general,general,Useful,NC_36_U,12,Potatos: rub a cut potato over your windshield before a frost to prevent freezing,What vegetable can prevent your windshield from freezing over in winter?
A1OZ5BB2L44KG,1,general,third,MTurk,TB_25_MT,12,"Scientists estimate that we are likely to see flying cars, and that computers may be able to read people's thoughts and emotions ",What will be the new technologies of future?
A1OZ5BB2L44KG,1,general,third,MTurk,TB_28_MT,4,"Futurist Diamandis argues that due to improved powers of computation we are likely to see AI, improved medicine, and new ways of communicating.",What is to happen ten years from now?
A1OZ5BB2L44KG,1,general,third,MTurk,TB_30_MT,16,"The ""no hair theorem"" states that a black hole has only three properties: electric charge, angular momentum, and mass.",What is the composition of a black hole?
A1OZ5BB2L44KG,1,general,third,MTurk,TB_41_MT,16,"Deep learning-based machines, that can process unparalleled amount of information will allow AI to accomplish goals that were unimaginable until very recently. ",What are the most recent developments in artificial intelligence?
A1OZ5BB2L44KG,1,general,third,Trivia,TB_04_TR,4,Phil Knight,"In 1964, who founded Blue Ribbon Sports, which later went on to become Nike?"
A1OZ5BB2L44KG,1,general,third,Trivia,TB_11_TR,16,Mung beans,What kind of bean produces the Asian-style bean sprouts in the produce section of supermarkets?
A1OZ5BB2L44KG,1,general,third,Trivia,TB_13_TR,8,Java,On what namesake Asian island are the first Homo erectus fossils found?
A1OZ5BB2L44KG,1,general,third,Trivia,TB_15_TR,4,Portia,The United States' first law school for woman was named for what cross-dressing Shakespearean character?
