PID,sess,firstBlock,block,type,questionId,wait_duration,answer,question
A1PBQWJCL9ZBP5,1,corona,corona,Not useful,C_11_NU,4,The Chicago of China,"Wuhan, China, the city in which the coronavirus was first identified, is commonly referred to as the chinese version of what American city?"
A1PBQWJCL9ZBP5,1,corona,corona,Not useful,C_13_NU,16,"The initial cases of the disease are thought to have been among people with a connection to a seafood wholesale market, which also sold live animals","Why is the virus believed to have zoonotic origin, i.e., to have potentially come from animals?"
A1PBQWJCL9ZBP5,1,corona,corona,Not useful,C_21_NU,8,An epidemic that has spread around the world,An epidemic is the outbreak of a disease that affects many people at the same time. What does pandemic mean?
A1PBQWJCL9ZBP5,1,corona,corona,Useful,C_31_U,8,"The virus is probably not sexually tansmissible, but infection does occurs when kissing.",Can the coronavirus be transmitted through sexual intercourse?
A1PBQWJCL9ZBP5,1,corona,corona,Useful,C_33_U,12,Soft surfaces are less likely to transmit the virus than hard surfaces.,Can the new coronavirus be transmitted by touching a soft surface like carpets or fabric?
A1PBQWJCL9ZBP5,1,corona,corona,Useful,C_40_U,8,"The incubation period - the time between catching the virus and beginning to have symptoms of the disease - is estimated to range from 1-14 days, most commonly around five days.",How long is the incubation period for the new coronavirus?
A1PBQWJCL9ZBP5,1,corona,corona,Useful,C_42_U,8,"Fever, cough, shortness of breath.",What are the most common symptoms of the new coronavirus?
A1PBQWJCL9ZBP5,1,corona,corona,Useful,C_51_U,4,Nasal or orab swab or a sample of sputum,What sort of specimen is needed to test for the new coronavirus? 
A1PBQWJCL9ZBP5,1,corona,general,Not useful,NC_03_NU,8,Red River,"What name is shared by the rivers that run through Denison, TX and Hanoi, Vietnam?"
A1PBQWJCL9ZBP5,1,corona,general,Not useful,NC_23_NU,12,The Netherlands,In 1568 the Catholic Church sentenced the entire population of which nation to death as heretics?
A1PBQWJCL9ZBP5,1,corona,general,Not useful,NC_24_NU,4,State quarters,What's been released five times a year from January 1999 to fall 2008?
A1PBQWJCL9ZBP5,1,corona,general,Useful,NC_43_U,16,Between 105 and 54 days before the scheduled trip.,How far in advance of a trip is the most cost effective time to purchase a plane ticket? 
A1PBQWJCL9ZBP5,1,corona,general,Useful,NC_45_U,12,"Grapes or raisins, onions, avocado","In addition to chocolate, what other foods can be very harmful to dogs? "
A1PBQWJCL9ZBP5,1,corona,general,Useful,NC_46_U,16,"Dish soap, peroxide, and baking soda","While tomato juice probably will not work, what does work to remove skunk odor? "
A1PBQWJCL9ZBP5,1,corona,third,MTurk,TB_25_MT,16,"Scientists estimate that we are likely to see flying cars, and that computers may be able to read people's thoughts and emotions ",What will be the new technologies of future?
A1PBQWJCL9ZBP5,1,corona,third,MTurk,TB_33_MT,12,"For SpaceX — the cheapest of NASA's new carriers — each pound costs approximately $27,000. So an average person of 160 pounds costs over $4,320,000.",How much does it cost to launch a person into space?
A1PBQWJCL9ZBP5,1,corona,third,MTurk,TB_36_MT,8,"For two reasons. One, they are too heavy. For example, the Space Shuttle weighed 2 thousand tons, yet a Boeing can only carry about 120 tons. Second, the thrust is likely to be too strong.",Why don't space rockets take off from a plane already in the air?
A1PBQWJCL9ZBP5,1,corona,third,Trivia,TB_11_TR,16,Mung beans,What kind of bean produces the Asian-style bean sprouts in the produce section of supermarkets?
