PID,sess,firstBlock,block,type,questionId,wait_duration,answer,question
A1PSY86OP2JO0R,1,corona,corona,Not useful,C_07_NU,8,Pink,What color latex gloves did Naomi Campbell wear to protect herself from coronavirus?
A1PSY86OP2JO0R,1,corona,corona,Not useful,C_08_NU,8,Lombardy,What is the name of the county in Italy that had the first coronavirus outbreak?
A1PSY86OP2JO0R,1,corona,corona,Not useful,C_17_NU,4,"Locations, people, or animals","The name for the new disease COVID-19 adheres to WHO best practices in disease naming, which include guidelines to not name disease after what?"
A1PSY86OP2JO0R,1,corona,corona,Not useful,C_18_NU,16,They are able to filter out at least 95% of airborne particles,Why are N95 respirator face masks so named?
A1PSY86OP2JO0R,1,corona,corona,Not useful,C_26_NU,4,Severe acute respiratory syndrome,The official name of the new coronavirus is SARS-CoV-2. What does SARS stand for?
A1PSY86OP2JO0R,1,corona,corona,Useful,C_36_U,16,No. There is no evidence that regularly rinsing the nose with saline has protected people from infection with the new coronavirus.,Can regularly rinsing your nose with saline help prevent infection with the new coronavirus?
A1PSY86OP2JO0R,1,corona,corona,Useful,C_52_U,8,No. To protect yourself against the new coronavirus washing your hands is the best preventive measure.,Are hand dryers effective in killing the new coronavirus?
A1PSY86OP2JO0R,1,corona,general,Not useful,NC_07_NU,4,Salt Lake City,In what city could you see the Seagull Monument at Temple Square?
A1PSY86OP2JO0R,1,corona,general,Not useful,NC_14_NU,4,Rod Serling,What famed TV personality wrote the screenplay for 1968's Planet of the Apes?
A1PSY86OP2JO0R,1,corona,general,Not useful,NC_19_NU,4,Smoke,"in 1908, New York City passed the Sullivan Ordinance which made it illegal for women to do what in public?"
A1PSY86OP2JO0R,1,corona,general,Not useful,NC_20_NU,12,Russia,Which country has the most public libraries?
A1PSY86OP2JO0R,1,corona,general,Not useful,NC_22_NU,12,Steamboat Geyser,"Which Yellowstone geyser, with eruptions 100 fee taller than Old Faithful's, is the world's tallest?"
A1PSY86OP2JO0R,1,corona,general,Useful,NC_31_U,16,Sign up for a free USAA membership,How can people under 25 rent a car without paying extra fees?
A1PSY86OP2JO0R,1,corona,general,Useful,NC_33_U,8,Below eye level,Where in the supermarket can you usually find the cheaper items?
A1PSY86OP2JO0R,1,corona,general,Useful,NC_36_U,12,Potatos: rub a cut potato over your windshield before a frost to prevent freezing,What vegetable can prevent your windshield from freezing over in winter?
A1PSY86OP2JO0R,1,corona,third,MTurk,TB_26_MT,4,"Sometimes, it is easy to know, but science revealed that self-insight is prblematic. It is often very helpful to ask friends and family ",How do you know if you're happy?
A1PSY86OP2JO0R,1,corona,third,MTurk,TB_30_MT,12,"The ""no hair theorem"" states that a black hole has only three properties: electric charge, angular momentum, and mass.",What is the composition of a black hole?
A1PSY86OP2JO0R,1,corona,third,MTurk,TB_36_MT,4,"For two reasons. One, they are too heavy. For example, the Space Shuttle weighed 2 thousand tons, yet a Boeing can only carry about 120 tons. Second, the thrust is likely to be too strong.",Why don't space rockets take off from a plane already in the air?
A1PSY86OP2JO0R,1,corona,third,MTurk,TB_41_MT,12,"Deep learning-based machines, that can process unparalleled amount of information will allow AI to accomplish goals that were unimaginable until very recently. ",What are the most recent developments in artificial intelligence?
A1PSY86OP2JO0R,1,corona,third,MTurk,TB_46_MT,8,"Scientists are still figuring it out. It seems that passive use is slightly bad, but active use is not.",How does social media influence our mental health?
A1PSY86OP2JO0R,1,corona,third,Trivia,TB_14_TR,4,James Brown,"When asked to define ""cool,"" what two words did James Brown use?"
A1PSY86OP2JO0R,1,corona,third,Trivia,TB_15_TR,8,Portia,The United States' first law school for woman was named for what cross-dressing Shakespearean character?
A1PSY86OP2JO0R,1,corona,third,Trivia,TB_20_TR,16,Rafflesia (corpse lily),What is the largest flower in the world?
A1PSY86OP2JO0R,1,corona,third,Trivia,TB_22_TR,16,Cheetah,Which is the only cat that cannot retract its claws?
