PID,sess,firstBlock,block,type,questionId,wait_duration,answer,question
A1PVBXVZ1L7AN9,1,corona,corona,Not useful,C_11_NU,16,The Chicago of China,"Wuhan, China, the city in which the coronavirus was first identified, is commonly referred to as the chinese version of what American city?"
A1PVBXVZ1L7AN9,1,corona,corona,Not useful,C_18_NU,8,They are able to filter out at least 95% of airborne particles,Why are N95 respirator face masks so named?
A1PVBXVZ1L7AN9,1,corona,corona,Not useful,C_19_NU,4,Strategic National Stockpile,What is the name of the repository of drugs and supplies the U.S. government is supposed to maintain in case of a public health emergency?
A1PVBXVZ1L7AN9,1,corona,corona,Not useful,C_20_NU,16,"Rear Adm. Ziemer led the global health security team, responsible for leading the US response to pandemics.","In May 2018, Rear Admiral Timothy Ziemer left the White House staff and was not replaced. What was Rear Adm. Ziemer's responsibility in the White House?"
A1PVBXVZ1L7AN9,1,corona,general,Not useful,NC_02_NU,16,Tiger Woods,"Who's the only two-time Sports Illustrated Sportsman of the Year, so named in 1996 and 2000?"
A1PVBXVZ1L7AN9,1,corona,general,Not useful,NC_07_NU,12,Salt Lake City,In what city could you see the Seagull Monument at Temple Square?
A1PVBXVZ1L7AN9,1,corona,general,Not useful,NC_16_NU,4,Newborns,The apgar score is used to measure the color and condition of what?
A1PVBXVZ1L7AN9,1,corona,general,Not useful,NC_17_NU,4,Gilbert Van Camp,What Indianapolis grocer made his name by selling canned pork and beans to U.S. troops during the Civil War?
A1PVBXVZ1L7AN9,1,corona,general,Not useful,NC_21_NU,16,The Pieta,Which was the only one of his sculptures that Michelangelo signed?
A1PVBXVZ1L7AN9,1,corona,general,Useful,NC_46_U,16,"Dish soap, peroxide, and baking soda","While tomato juice probably will not work, what does work to remove skunk odor? "
A1PVBXVZ1L7AN9,1,corona,third,MTurk,TB_30_MT,16,"The ""no hair theorem"" states that a black hole has only three properties: electric charge, angular momentum, and mass.",What is the composition of a black hole?
A1PVBXVZ1L7AN9,1,corona,third,Trivia,TB_02_TR,16,Ivory Coast's,"The world's largest church is Our Lady of Peace Basilica in Yamoussoukro, what nation's capital?"
A1PVBXVZ1L7AN9,1,corona,third,Trivia,TB_19_TR,12,Ketchup,The only vegetable ice cream ever produced was what flavor?
