PID,sess,firstBlock,block,type,questionId,wait_duration,answer,question
A1Q750ZJ5SMP6Z,1,corona,corona,Not useful,C_08_NU,16,Lombardy,What is the name of the county in Italy that had the first coronavirus outbreak?
A1Q750ZJ5SMP6Z,1,corona,corona,Not useful,C_11_NU,4,The Chicago of China,"Wuhan, China, the city in which the coronavirus was first identified, is commonly referred to as the chinese version of what American city?"
A1Q750ZJ5SMP6Z,1,corona,corona,Not useful,C_14_NU,8,"January 30, 2020",On what date did the World Health Organization declare the new coronavirus outbreak to be a Public Health Emergency of International Concern?
A1Q750ZJ5SMP6Z,1,corona,corona,Not useful,C_18_NU,12,They are able to filter out at least 95% of airborne particles,Why are N95 respirator face masks so named?
A1Q750ZJ5SMP6Z,1,corona,corona,Not useful,C_22_NU,4,Contact tracing,What is the name of the process health authorities use to understand the sources of infection and to prevent further transmission?
A1Q750ZJ5SMP6Z,1,corona,corona,Useful,C_36_U,4,No. There is no evidence that regularly rinsing the nose with saline has protected people from infection with the new coronavirus.,Can regularly rinsing your nose with saline help prevent infection with the new coronavirus?
A1Q750ZJ5SMP6Z,1,corona,corona,Useful,C_39_U,4,"No, antibiotics do not work against viruses, only bacteria.",Are antibiotics effective in preventing and treating the new coronavirus?
A1Q750ZJ5SMP6Z,1,corona,corona,Useful,C_43_U,4,Quarantine themselves for 14 days to make sure they are not infected.,"Currently, people who have traveled to a high-risk area or who may have been in contact with someone with the new coronavirus are recommended to do what?"
A1Q750ZJ5SMP6Z,1,corona,corona,Useful,C_48_U,8,"Regular face masks are not considered effective, and reserves need to be saved for people who are infected and for healthcare professionals.",Why does the CDC currently recommend that healthy people do not wear face masks?
A1Q750ZJ5SMP6Z,1,corona,general,Not useful,NC_08_NU,16,The guppy,What common aquarium fish is named for the naturalist who discovered it in Trinidad in 1876?
A1Q750ZJ5SMP6Z,1,corona,general,Not useful,NC_09_NU,16,Captain Cook,"Who christened Hawaii ""the Sandwich Islands"" in 1778?"
A1Q750ZJ5SMP6Z,1,corona,general,Not useful,NC_15_NU,4,Albert Einstein,Who beat out FDR and Gandhi to be named Time's Person of the Century in 1999?
A1Q750ZJ5SMP6Z,1,corona,general,Not useful,NC_20_NU,4,Russia,Which country has the most public libraries?
A1Q750ZJ5SMP6Z,1,corona,general,Not useful,NC_25_NU,16,Shark,"What animal is thought to be immune to most all diseases, including cancer?"
A1Q750ZJ5SMP6Z,1,corona,general,Useful,NC_30_U,4,Floormats - put them under the wheels for traction,What item that can be found in any car can help you extract your car from mud or snow?
A1Q750ZJ5SMP6Z,1,corona,general,Useful,NC_33_U,8,Below eye level,Where in the supermarket can you usually find the cheaper items?
A1Q750ZJ5SMP6Z,1,corona,general,Useful,NC_51_U,4,White vinegar,What salad dressing ingredient is also an efficient weed killer?
A1Q750ZJ5SMP6Z,1,corona,third,MTurk,TB_34_MT,16,Evolution is usually very slow. Think about the similarities between apes and people. Future people are going to be as similar to us as we are to apes. ,What will future humans look like?
A1Q750ZJ5SMP6Z,1,corona,third,MTurk,TB_43_MT,8,"Planets likely start off as grains of dust that then combine to form bigger rocks. They clear material from their path, leaving tracks of space empty but for fine dust.",How do planets form?
A1Q750ZJ5SMP6Z,1,corona,third,MTurk,TB_44_MT,12,"In all U.S states, same-sex marriage is now legal. Also, the number of kids per family has decreased and so ""middle"" childreen, between the eldest and youngest, are getting rarer. ",How have families changed over time?
A1Q750ZJ5SMP6Z,1,corona,third,Trivia,TB_11_TR,4,Mung beans,What kind of bean produces the Asian-style bean sprouts in the produce section of supermarkets?
A1Q750ZJ5SMP6Z,1,corona,third,Trivia,TB_13_TR,4,Java,On what namesake Asian island are the first Homo erectus fossils found?
A1Q750ZJ5SMP6Z,1,corona,third,Trivia,TB_15_TR,4,Portia,The United States' first law school for woman was named for what cross-dressing Shakespearean character?
A1Q750ZJ5SMP6Z,1,corona,third,Trivia,TB_16_TR,16,Jim Lovell,Alan Shepard was scheduled to command the ill-fated Apollo 13 before switching missions with what astronaut?
