PID,sess,firstBlock,block,type,questionId,wait_duration,answer,question
A1RAGQEYV6A3WQ,1,general,corona,Not useful,C_03_NU,12,"Fuburary 1st, 2020",When was the molecular structure of the coronovirus identfied?
A1RAGQEYV6A3WQ,1,general,corona,Useful,C_52_U,8,No. To protect yourself against the new coronavirus washing your hands is the best preventive measure.,Are hand dryers effective in killing the new coronavirus?
A1RAGQEYV6A3WQ,1,general,general,Not useful,NC_03_NU,4,Red River,"What name is shared by the rivers that run through Denison, TX and Hanoi, Vietnam?"
A1RAGQEYV6A3WQ,1,general,general,Not useful,NC_08_NU,4,The guppy,What common aquarium fish is named for the naturalist who discovered it in Trinidad in 1876?
A1RAGQEYV6A3WQ,1,general,general,Not useful,NC_16_NU,12,Newborns,The apgar score is used to measure the color and condition of what?
A1RAGQEYV6A3WQ,1,general,general,Useful,NC_46_U,8,"Dish soap, peroxide, and baking soda","While tomato juice probably will not work, what does work to remove skunk odor? "
A1RAGQEYV6A3WQ,1,general,general,Useful,NC_51_U,16,White vinegar,What salad dressing ingredient is also an efficient weed killer?
A1RAGQEYV6A3WQ,1,general,third,MTurk,TB_35_MT,8,Prototypes already exist. Technological estimates suggest that definitely within the next twenty years -- although the challenges are great.,When will we have flying cars?
A1RAGQEYV6A3WQ,1,general,third,Trivia,TB_23_TR,16,Tooth,What is the only part of the body that can't repair itself?
