PID,sess,firstBlock,block,type,questionId,wait_duration,answer,question
A1RVDON2TVXMSM,1,corona,corona,Not useful,C_01_NU,4,"Animals, probably bats",What is the source of coronavirus in humans?
A1RVDON2TVXMSM,1,corona,corona,Not useful,C_08_NU,12,Lombardy,What is the name of the county in Italy that had the first coronavirus outbreak?
A1RVDON2TVXMSM,1,corona,corona,Not useful,C_11_NU,12,The Chicago of China,"Wuhan, China, the city in which the coronavirus was first identified, is commonly referred to as the chinese version of what American city?"
A1RVDON2TVXMSM,1,corona,corona,Not useful,C_23_NU,4,They falsely claimed to cure or prevent coronavirus,"At the end of February, Amazon banned over a million products because of what?"
A1RVDON2TVXMSM,1,corona,general,Not useful,NC_07_NU,8,Salt Lake City,In what city could you see the Seagull Monument at Temple Square?
A1RVDON2TVXMSM,1,corona,general,Not useful,NC_19_NU,12,Smoke,"in 1908, New York City passed the Sullivan Ordinance which made it illegal for women to do what in public?"
A1RVDON2TVXMSM,1,corona,general,Not useful,NC_20_NU,16,Russia,Which country has the most public libraries?
A1RVDON2TVXMSM,1,corona,general,Useful,NC_47_U,12,"Add baking soda, soak in advance, use a preassure cooker",What can you do to make dry beans cook faster?
A1RVDON2TVXMSM,1,corona,general,Useful,NC_51_U,4,White vinegar,What salad dressing ingredient is also an efficient weed killer?
A1RVDON2TVXMSM,1,corona,general,Useful,NC_52_U,12,"Tie your hair into a tight ponytail at the front of your head, and cut it.",How can you give yourself a layered haircut?
A1RVDON2TVXMSM,1,corona,third,MTurk,TB_29_MT,8,"There are a few helpful techniques. One is to imagine that you climb on top of a high building, and ""look down"" at your life. Second, to try to think about issues in novel ways. ",How to stay calm in adversity?
A1RVDON2TVXMSM,1,corona,third,Trivia,TB_02_TR,8,Ivory Coast's,"The world's largest church is Our Lady of Peace Basilica in Yamoussoukro, what nation's capital?"
A1RVDON2TVXMSM,1,corona,third,Trivia,TB_21_TR,16,New York,Which state has the zip code 12345?
A1RVDON2TVXMSM,1,corona,third,Trivia,TB_23_TR,4,Tooth,What is the only part of the body that can't repair itself?
