PID,sess,firstBlock,block,type,questionId,wait_duration,answer,question
A1RZT7L92M3XY0,1,general,corona,Not useful,C_10_NU,4,11 million people,"What is the population of Wuhan, the city in which coronavirus was first identified?"
A1RZT7L92M3XY0,1,general,corona,Not useful,C_23_NU,12,They falsely claimed to cure or prevent coronavirus,"At the end of February, Amazon banned over a million products because of what?"
A1RZT7L92M3XY0,1,general,corona,Useful,C_37_U,8,There is no evidence from the current outbreak that eating garlic has protected people from the new coronavirus.,Can eating garlic help prevent infection with the new coronavirus?
A1RZT7L92M3XY0,1,general,corona,Useful,C_40_U,12,"The incubation period - the time between catching the virus and beginning to have symptoms of the disease - is estimated to range from 1-14 days, most commonly around five days.",How long is the incubation period for the new coronavirus?
A1RZT7L92M3XY0,1,general,corona,Useful,C_41_U,4,Studies suggest that coronaviruses (including preliminary information on the new virus) may persist on surfaces for a few hours or up to several days.,How long does the new coronavirus survive on surfaces?
A1RZT7L92M3XY0,1,general,corona,Useful,C_50_U,4,Washington,The first US death from the new coronavirus occurred in which state?
A1RZT7L92M3XY0,1,general,general,Not useful,NC_13_NU,8,Bling bling,What term does rapper B.G. say he wishes he'd patented when he used it for the title of his massive 1999 hit?
A1RZT7L92M3XY0,1,general,general,Not useful,NC_14_NU,4,Rod Serling,What famed TV personality wrote the screenplay for 1968's Planet of the Apes?
A1RZT7L92M3XY0,1,general,general,Not useful,NC_21_NU,4,The Pieta,Which was the only one of his sculptures that Michelangelo signed?
A1RZT7L92M3XY0,1,general,general,Useful,NC_31_U,4,Sign up for a free USAA membership,How can people under 25 rent a car without paying extra fees?
A1RZT7L92M3XY0,1,general,general,Useful,NC_32_U,12,Take a picture of your fridge before leaving the house,What's a simple trick for telling whether your out of something when you're grocery shopping?
A1RZT7L92M3XY0,1,general,general,Useful,NC_34_U,8,"Pineapple, by planting the green leaves",What tropical fruit can be regrown from its scraps?
A1RZT7L92M3XY0,1,general,general,Useful,NC_44_U,12,Doritos,What popular snack food is effective to use as kindling to start a fire?
A1RZT7L92M3XY0,1,general,third,MTurk,TB_30_MT,16,"The ""no hair theorem"" states that a black hole has only three properties: electric charge, angular momentum, and mass.",What is the composition of a black hole?
A1RZT7L92M3XY0,1,general,third,MTurk,TB_32_MT,4,Sophisticated equipment is either lowered to the sea bottom or directly attached to submersible buoys and transmits to a research vessel that is equipped with state-of-the-art navigational instruments.,What are undersea researchers doing to explore the ocean floor?
A1RZT7L92M3XY0,1,general,third,MTurk,TB_35_MT,12,Prototypes already exist. Technological estimates suggest that definitely within the next twenty years -- although the challenges are great.,When will we have flying cars?
A1RZT7L92M3XY0,1,general,third,MTurk,TB_43_MT,8,"Planets likely start off as grains of dust that then combine to form bigger rocks. They clear material from their path, leaving tracks of space empty but for fine dust.",How do planets form?
A1RZT7L92M3XY0,1,general,third,Trivia,TB_15_TR,4,Portia,The United States' first law school for woman was named for what cross-dressing Shakespearean character?
