PID,sess,firstBlock,block,type,questionId,wait_duration,answer,question
A1SKBBTD0PJI6G,1,general,corona,Not useful,C_11_NU,12,The Chicago of China,"Wuhan, China, the city in which the coronavirus was first identified, is commonly referred to as the chinese version of what American city?"
A1SKBBTD0PJI6G,1,general,corona,Useful,C_28_U,8,"Yes, by boosting the immune system",Does sleep make you more resistant to coronavirus infections?
A1SKBBTD0PJI6G,1,general,corona,Useful,C_44_U,4,People over age 60,Approximately 80% of deaths attributed to the new coronavirus were among people of what age?
A1SKBBTD0PJI6G,1,general,general,Not useful,NC_09_NU,12,Captain Cook,"Who christened Hawaii ""the Sandwich Islands"" in 1778?"
A1SKBBTD0PJI6G,1,general,general,Not useful,NC_14_NU,4,Rod Serling,What famed TV personality wrote the screenplay for 1968's Planet of the Apes?
A1SKBBTD0PJI6G,1,general,general,Useful,NC_27_U,4,White vinegar,What can you use instead of fabric softner to soften sheets and remove odours?
A1SKBBTD0PJI6G,1,general,general,Useful,NC_33_U,4,Below eye level,Where in the supermarket can you usually find the cheaper items?
A1SKBBTD0PJI6G,1,general,third,MTurk,TB_32_MT,4,Sophisticated equipment is either lowered to the sea bottom or directly attached to submersible buoys and transmits to a research vessel that is equipped with state-of-the-art navigational instruments.,What are undersea researchers doing to explore the ocean floor?
A1SKBBTD0PJI6G,1,general,third,Trivia,TB_08_TR,4,Library of Congress,"In 1802, John Beckley became the librarian of what collection containing 740 books at the time?"
