PID,sess,firstBlock,block,type,questionId,wait_duration,answer,question
A1SWGSFIMZJQE,1,corona,corona,Not useful,C_16_NU,8,Bats and pangolins,What other animals have been found to have viruses with highly similar genome sequences as the current coronavirus?
A1SWGSFIMZJQE,1,corona,corona,Useful,C_29_U,4,Not for at least several months from now,How soon is a vaccine for the coronavirus likely to be available?
A1SWGSFIMZJQE,1,corona,corona,Useful,C_38_U,8,People of all ages can be infected by the new coronavirus. Older people appear to be more vulnerable to becoming severely ill with the virus.,"Does the new coronavirus affect older people, or are younger people also susceptible?"
A1SWGSFIMZJQE,1,corona,corona,Useful,C_49_U,4,"Approved filtering facemask respirators, such as the N95 respirator.","It is recommended that healthcare professionals who may be working in contact with people with the virus wear what, in addition to personal protective equipment on their hands and bodies?"
A1SWGSFIMZJQE,1,corona,general,Not useful,NC_01_NU,12,Mike Powell,"In 1991, who finally broke Bob Beamon's decades-old long jump record?"
A1SWGSFIMZJQE,1,corona,third,Trivia,TB_04_TR,16,Phil Knight,"In 1964, who founded Blue Ribbon Sports, which later went on to become Nike?"
