PID,sess,firstBlock,block,type,questionId,wait_duration,answer,question
A1TLNLB9D87H6,1,corona,corona,Not useful,C_21_NU,12,An epidemic that has spread around the world,An epidemic is the outbreak of a disease that affects many people at the same time. What does pandemic mean?
A1TLNLB9D87H6,1,corona,general,Useful,NC_44_U,8,Doritos,What popular snack food is effective to use as kindling to start a fire?
A1TLNLB9D87H6,1,corona,third,MTurk,TB_25_MT,12,"Scientists estimate that we are likely to see flying cars, and that computers may be able to read people's thoughts and emotions ",What will be the new technologies of future?
A1TLNLB9D87H6,1,corona,third,MTurk,TB_33_MT,4,"For SpaceX — the cheapest of NASA's new carriers — each pound costs approximately $27,000. So an average person of 160 pounds costs over $4,320,000.",How much does it cost to launch a person into space?
A1TLNLB9D87H6,1,corona,third,MTurk,TB_35_MT,8,Prototypes already exist. Technological estimates suggest that definitely within the next twenty years -- although the challenges are great.,When will we have flying cars?
