PID,sess,firstBlock,block,type,questionId,wait_duration,answer,question
A1TZP0563TMGLK,1,corona,corona,Not useful,C_10_NU,4,11 million people,"What is the population of Wuhan, the city in which coronavirus was first identified?"
A1TZP0563TMGLK,1,corona,corona,Not useful,C_24_NU,16,Contagion,"According to media reports, which 2011 movie has seen a large increase in popularity in the wake of the new coronavirus?"
A1TZP0563TMGLK,1,corona,corona,Useful,C_29_U,12,Not for at least several months from now,How soon is a vaccine for the new coronavirus likely to be available?
A1TZP0563TMGLK,1,corona,corona,Useful,C_45_U,8,"Pre-existing health conditions, including cardiovascular diseases and diabetes.",What did 75% of the people who have died from the new coronavirus have?
A1TZP0563TMGLK,1,corona,corona,Useful,C_49_U,8,"Approved filtering facemask respirators, such as the N95 respirator.","It is recommended that healthcare professionals who may be working in contact with people with the virus wear what, in addition to personal protective equipment on their hands and bodies?"
A1TZP0563TMGLK,1,corona,general,Not useful,NC_19_NU,16,Smoke,"in 1908, New York City passed the Sullivan Ordinance which made it illegal for women to do what in public?"
A1TZP0563TMGLK,1,corona,general,Useful,NC_32_U,4,Take a picture of your fridge before leaving the house,What's a simple trick for telling whether your out of something when you're grocery shopping?
A1TZP0563TMGLK,1,corona,general,Useful,NC_34_U,8,"Pineapple, by planting the green leaves",What tropical fruit can be regrown from its scraps?
A1TZP0563TMGLK,1,corona,general,Useful,NC_35_U,8,Wrap a wet paper towel around the bottle and put in the fridge,How can you cool beverages more quickly?
A1TZP0563TMGLK,1,corona,general,Useful,NC_36_U,4,Potatos: rub a cut potato over your windshield before a frost to prevent freezing,What vegetable can prevent your windshield from freezing over in winter?
A1TZP0563TMGLK,1,corona,third,MTurk,TB_27_MT,4,"We do not know, of course. Yet, it is important to realize that there is no scientific proof for God's existence.  ",Does God exist?
A1TZP0563TMGLK,1,corona,third,MTurk,TB_31_MT,8,Scientists estimate that at the moment it is not. But with global warming it might become more feasilbe later in the 21st century.,How feasible would it be to colonize Antarctica?
A1TZP0563TMGLK,1,corona,third,MTurk,TB_34_MT,16,Evolution is usually very slow. Think about the similarities between apes and people. Future people are going to be as similar to us as we are to apes. ,What will future humans look like?
A1TZP0563TMGLK,1,corona,third,MTurk,TB_39_MT,8,"There is radio emission around black holes. Scientists created a network of telescopes, capturing an image of a black hole by improving upon a technique that allows for the imaging of far-away objects",How was the recent picture of a black hole made?
