PID,sess,firstBlock,block,type,questionId,wait_duration,answer,question
A1U7IFPOFUBEJC,1,corona,corona,Not useful,C_04_NU,4,"It stands for ""COronaVIrus Disease 2019""","Why is the new coronavirus called ""COVID-19""? "
A1U7IFPOFUBEJC,1,corona,corona,Not useful,C_06_NU,4,Gwyneth Paltrow,"Which celebrity said about the new coronavirus ""I've already been in this movie""?"
A1U7IFPOFUBEJC,1,corona,corona,Not useful,C_13_NU,16,"The initial cases of the disease are thought to have been among people with a connection to a seafood wholesale market, which also sold live animals","Why is the virus believed to have zoonotic origin, i.e., to have potentially come from animals?"
A1U7IFPOFUBEJC,1,corona,corona,Not useful,C_18_NU,4,They are able to filter out at least 95% of airborne particles,Why are N95 respirator face masks so named?
A1U7IFPOFUBEJC,1,corona,corona,Not useful,C_21_NU,12,An epidemic that has spread around the world,An epidemic is the outbreak of a disease that affects many people at the same time. What does pandemic mean?
A1U7IFPOFUBEJC,1,corona,corona,Useful,C_27_U,8,Washing your hands frequently,What is the most effective measure to prevent infection with the coronavirus?
A1U7IFPOFUBEJC,1,corona,corona,Useful,C_40_U,8,"The incubation period - the time between catching the virus and beginning to have symptoms of the disease - is estimated to range from 1-14 days, most commonly around five days.",How long is the incubation period for the new coronavirus?
A1U7IFPOFUBEJC,1,corona,corona,Useful,C_46_U,12,Remdesivir,"Which drug, which has been used as a treatment for the Ebola and Marburg viruses, might be promising as a treatment for this new coronavirus?"
A1U7IFPOFUBEJC,1,corona,corona,Useful,C_47_U,8,"Free of fever; no other symptoms, including cough; negative tests on at least two consecutive respiratory specimens at least 24 hours apart.",What are current Centers for Disease Control (CDC) guidelines for releasing someone from isolation?
A1U7IFPOFUBEJC,1,corona,corona,Useful,C_48_U,12,"Regular face masks are not considered effective, and reserves need to be saved for people who are infected and for healthcare professionals.",Why does the CDC currently recommend that healthy people do not wear face masks?
A1U7IFPOFUBEJC,1,corona,general,Not useful,NC_13_NU,4,Bling bling,What term does rapper B.G. say he wishes he'd patented when he used it for the title of his massive 1999 hit?
A1U7IFPOFUBEJC,1,corona,general,Not useful,NC_18_NU,12,A truce,What was put in place by the Ancient Greeks before and during all Olympic festivals?
A1U7IFPOFUBEJC,1,corona,general,Not useful,NC_20_NU,4,Russia,Which country has the most public libraries?
A1U7IFPOFUBEJC,1,corona,general,Useful,NC_30_U,16,Floormats - put them under the wheels for traction,What item that can be found in any car can help you extract your car from mud or snow?
A1U7IFPOFUBEJC,1,corona,general,Useful,NC_38_U,16,"Camu Camu, a cherry-like fruit from Brazil",What fruit has the highest content of vitamin C?
A1U7IFPOFUBEJC,1,corona,general,Useful,NC_46_U,16,"Dish soap, peroxide, and baking soda","While tomato juice probably will not work, what does work to remove skunk odor? "
A1U7IFPOFUBEJC,1,corona,general,Useful,NC_48_U,4,"Drop it from a 3 inch height. If it bounces, it's dead.",How can you tell if a battery is dead without using any tools?
A1U7IFPOFUBEJC,1,corona,third,MTurk,TB_24_MT,12,"Deep sea creatures must survive in extremely harsh conditions. They include the giant spider crab, frilled shark, and the atlantic wolffish",Which creatures live in deep sea?
A1U7IFPOFUBEJC,1,corona,third,MTurk,TB_31_MT,4,Scientists estimate that at the moment it is not. But with global warming it might become more feasilbe later in the 21st century.,How feasible would it be to colonize Antarctica?
A1U7IFPOFUBEJC,1,corona,third,MTurk,TB_32_MT,4,Sophisticated equipment is either lowered to the sea bottom or directly attached to submersible buoys and transmits to a research vessel that is equipped with state-of-the-art navigational instruments.,What are undersea researchers doing to explore the ocean floor?
A1U7IFPOFUBEJC,1,corona,third,MTurk,TB_40_MT,4,"NASA plans another crewed mission to the Moon by 2024, followed by a sustained presence  by 2028.  Russia is planning to begin building a human colony by 2037.",When could a lunar base be established?
A1U7IFPOFUBEJC,1,corona,third,MTurk,TB_41_MT,12,"Deep learning-based machines, that can process unparalleled amount of information will allow AI to accomplish goals that were unimaginable until very recently. ",What are the most recent developments in artificial intelligence?
A1U7IFPOFUBEJC,1,corona,third,MTurk,TB_45_MT,16,"The amygdala (from Greek, 'almond') is one of two almond-shaped clusters of nuclei located deep and medially within the temporal lobes of the brain in complex vertebrates, including humans.",What is the amygdala?
A1U7IFPOFUBEJC,1,corona,third,Trivia,TB_07_TR,8,Tuxedo Club,What New York country club lent its name to the kind of dinner jacket first worn there in 1886?
A1U7IFPOFUBEJC,1,corona,third,Trivia,TB_09_TR,12,The first email,"What did Ray Tomlinson send in Cambridge, Massachusetts, in late 1971?"
A1U7IFPOFUBEJC,1,corona,third,Trivia,TB_22_TR,8,Cheetah,Which is the only cat that cannot retract its claws?
