PID,sess,firstBlock,block,type,questionId,wait_duration,answer,question
A1UOF38Y071BUQ,1,corona,corona,Not useful,C_10_NU,4,11 million people,"What is the population of Wuhan, the city in which coronavirus was first identified?"
A1UOF38Y071BUQ,1,corona,corona,Not useful,C_14_NU,8,"January 30, 2020",On what date did the World Health Organization declare the new coronavirus outbreak to be a Public Health Emergency of International Concern?
A1UOF38Y071BUQ,1,corona,corona,Not useful,C_17_NU,4,"Locations, people, or animals","The name for the new disease COVID-19 adheres to WHO best practices in disease naming, which include guidelines to not name disease after what?"
A1UOF38Y071BUQ,1,corona,corona,Not useful,C_18_NU,16,They are able to filter out at least 95% of airborne particles,Why are N95 respirator face masks so named?
A1UOF38Y071BUQ,1,corona,corona,Not useful,C_20_NU,8,"Rear Adm. Ziemer led the global health security team, responsible for leading the US response to pandemics.","In May 2018, Rear Admiral Timothy Ziemer left the White House staff and was not replaced. What was Rear Adm. Ziemer's responsibility in the White House?"
A1UOF38Y071BUQ,1,corona,corona,Useful,C_35_U,4,"The virus spreads through coughs and sneezes, there are no reports of transmission through mosquito bites.",Can the new coronavirus be transmitted through mosquito bites?
A1UOF38Y071BUQ,1,corona,general,Not useful,NC_07_NU,4,Salt Lake City,In what city could you see the Seagull Monument at Temple Square?
A1UOF38Y071BUQ,1,corona,general,Not useful,NC_12_NU,4,Come by her,"The title of the song ""Kumbaya"" is actually a distortion of what three-word phrase?"
A1UOF38Y071BUQ,1,corona,general,Not useful,NC_17_NU,12,Gilbert Van Camp,What Indianapolis grocer made his name by selling canned pork and beans to U.S. troops during the Civil War?
A1UOF38Y071BUQ,1,corona,general,Not useful,NC_26_NU,12,Dark Side of the Moon,What album spent a record 741 weeks on Billboard's Top 200 Albums chart?
A1UOF38Y071BUQ,1,corona,general,Useful,NC_30_U,12,Floormats - put them under the wheels for traction,What item that can be found in any car can help you extract your car from mud or snow?
A1UOF38Y071BUQ,1,corona,general,Useful,NC_36_U,8,Potatos: rub a cut potato over your windshield before a frost to prevent freezing,What vegetable can prevent your windshield from freezing over in winter?
A1UOF38Y071BUQ,1,corona,general,Useful,NC_41_U,8,"April 8th, 2024",When is the next total solar eclipse visible in North America projected to occur? 
A1UOF38Y071BUQ,1,corona,general,Useful,NC_52_U,4,"Tie your hair into a tight ponytail at the front of your head, and cut it.",How can you give yourself a layered haircut?
A1UOF38Y071BUQ,1,corona,third,MTurk,TB_35_MT,16,Prototypes already exist. Technological estimates suggest that definitely within the next twenty years -- although the challenges are great.,When will we have flying cars?
A1UOF38Y071BUQ,1,corona,third,MTurk,TB_38_MT,16,"As a rule, yes. Restaurants have to cover rent, salaries and taxes. These are all included in the prices.",Is it really cheaper to cook at home vs. eating out?
A1UOF38Y071BUQ,1,corona,third,MTurk,TB_46_MT,16,"Scientists are still figuring it out. It seems that passive use is slightly bad, but active use is not.",How does social media influence our mental health?
A1UOF38Y071BUQ,1,corona,third,Trivia,TB_18_TR,12,Orville Wright,Who was flying the plane in which the first US airplane fatality occurred?
A1UOF38Y071BUQ,1,corona,third,Trivia,TB_20_TR,16,Rafflesia (corpse lily),What is the largest flower in the world?
A1UOF38Y071BUQ,1,corona,third,Trivia,TB_22_TR,4,Cheetah,Which is the only cat that cannot retract its claws?
