PID,sess,firstBlock,block,type,questionId,wait_duration,answer,question
A1UPJ64GJNJTRO,1,corona,corona,Not useful,C_02_NU,16,Three ,How many pandemics were there in the 20th century?
A1UPJ64GJNJTRO,1,corona,corona,Not useful,C_18_NU,4,They are able to filter out at least 95% of airborne particles,Why are N95 respirator face masks so named?
A1UPJ64GJNJTRO,1,corona,corona,Not useful,C_25_NU,8,The viruses have spikes on their outer surface that look like a crown (or corona in Latin),What is the supposed origin of the name coronavirus?
A1UPJ64GJNJTRO,1,corona,corona,Useful,C_30_U,16,More similar to the symptoms of the ful,"Are the new coronavirus symptoms more similar to the symptoms of flu, or of seasonal allergies?"
A1UPJ64GJNJTRO,1,corona,corona,Useful,C_40_U,4,"The incubation period - the time between catching the virus and beginning to have symptoms of the disease - is estimated to range from 1-14 days, most commonly around five days.",How long is the incubation period for the new coronavirus?
A1UPJ64GJNJTRO,1,corona,corona,Useful,C_41_U,8,Studies suggest that coronaviruses (including preliminary information on the new virus) may persist on surfaces for a few hours or up to several days.,How long does the new coronavirus survive on surfaces?
A1UPJ64GJNJTRO,1,corona,general,Not useful,NC_03_NU,12,Red River,"What name is shared by the rivers that run through Denison, TX and Hanoi, Vietnam?"
A1UPJ64GJNJTRO,1,corona,general,Not useful,NC_15_NU,4,Albert Einstein,Who beat out FDR and Gandhi to be named Time's Person of the Century in 1999?
A1UPJ64GJNJTRO,1,corona,general,Not useful,NC_17_NU,4,Gilbert Van Camp,What Indianapolis grocer made his name by selling canned pork and beans to U.S. troops during the Civil War?
A1UPJ64GJNJTRO,1,corona,general,Useful,NC_33_U,4,Below eye level,Where in the supermarket can you usually find the cheaper items?
A1UPJ64GJNJTRO,1,corona,general,Useful,NC_36_U,16,Potatos: rub a cut potato over your windshield before a frost to prevent freezing,What vegetable can prevent your windshield from freezing over in winter?
A1UPJ64GJNJTRO,1,corona,third,MTurk,TB_33_MT,8,"For SpaceX — the cheapest of NASA's new carriers — each pound costs approximately $27,000. So an average person of 160 pounds costs over $4,320,000.",How much does it cost to launch a person into space?
A1UPJ64GJNJTRO,1,corona,third,MTurk,TB_40_MT,4,"NASA plans another crewed mission to the Moon by 2024, followed by a sustained presence  by 2028.  Russia is planning to begin building a human colony by 2037.",When could a lunar base be established?
A1UPJ64GJNJTRO,1,corona,third,MTurk,TB_41_MT,16,"Deep learning-based machines, that can process unparalleled amount of information will allow AI to accomplish goals that were unimaginable until very recently. ",What are the most recent developments in artificial intelligence?
A1UPJ64GJNJTRO,1,corona,third,Trivia,TB_18_TR,12,Orville Wright,Who was flying the plane in which the first US airplane fatality occurred?
A1UPJ64GJNJTRO,1,corona,third,Trivia,TB_19_TR,4,Ketchup,The only vegetable ice cream ever produced was what flavor?
