PID,sess,firstBlock,block,type,questionId,wait_duration,answer,question
A1VPD12Q3TBJNY,1,corona,corona,Not useful,C_03_NU,16,"Fuburary 1st, 2020",When was the molecular structure of the coronovirus identfied?
A1VPD12Q3TBJNY,1,corona,corona,Not useful,C_06_NU,4,Gwyneth Paltrow,"Which celebrity said about the new coronavirus ""I've already been in this movie""?"
A1VPD12Q3TBJNY,1,corona,corona,Not useful,C_09_NU,8,Hubei,What is the name of the province in China in which this new coronavirus was first discovered?
A1VPD12Q3TBJNY,1,corona,corona,Not useful,C_12_NU,8,Diamond Princess,What was the name of the British cruise ship that was quarantined in Japanese waters?
A1VPD12Q3TBJNY,1,corona,corona,Not useful,C_15_NU,12,7.5 days,"In the early stages of the new coronavirus, the number of new cases doubled approximately every how many days?"
A1VPD12Q3TBJNY,1,corona,corona,Not useful,C_25_NU,16,The viruses have spikes on their outer surface that look like a crown (or corona in Latin),What is the supposed origin of the name coronavirus?
A1VPD12Q3TBJNY,1,corona,corona,Useful,C_29_U,4,Not for at least several months from now,How soon is a vaccine for the new coronavirus likely to be available?
A1VPD12Q3TBJNY,1,corona,corona,Useful,C_34_U,4,"The virus lives for up to a few days on surfaces, and so packages cannot transmit the virus.",Can the new coronavirus be transmitted on a package from an infected country?
A1VPD12Q3TBJNY,1,corona,corona,Useful,C_51_U,4,Nasal or orab swab or a sample of sputum,What sort of specimen is needed to test for the new coronavirus? 
A1VPD12Q3TBJNY,1,corona,general,Not useful,NC_13_NU,12,Bling bling,What term does rapper B.G. say he wishes he'd patented when he used it for the title of his massive 1999 hit?
A1VPD12Q3TBJNY,1,corona,general,Not useful,NC_16_NU,4,Newborns,The apgar score is used to measure the color and condition of what?
A1VPD12Q3TBJNY,1,corona,general,Useful,NC_30_U,12,Floormats - put them under the wheels for traction,What item that can be found in any car can help you extract your car from mud or snow?
A1VPD12Q3TBJNY,1,corona,general,Useful,NC_40_U,8,Squint your eyes,How do you make your smile look more genuine in photographs?
A1VPD12Q3TBJNY,1,corona,general,Useful,NC_44_U,8,Doritos,What popular snack food is effective to use as kindling to start a fire?
A1VPD12Q3TBJNY,1,corona,general,Useful,NC_48_U,12,"Drop it from a 3 inch height. If it bounces, it's dead.",How can you tell if a battery is dead without using any tools?
A1VPD12Q3TBJNY,1,corona,general,Useful,NC_50_U,16,Spread beeswax over them and then blow dry until you can't see the beeswax anymore,What's an easy way to waterproof canvas shoes?
A1VPD12Q3TBJNY,1,corona,third,MTurk,TB_28_MT,4,"Futurist Diamandis argues that due to improved powers of computation we are likely to see AI, improved medicine, and new ways of communicating.",What is to happen ten years from now?
A1VPD12Q3TBJNY,1,corona,third,MTurk,TB_32_MT,8,Sophisticated equipment is either lowered to the sea bottom or directly attached to submersible buoys and transmits to a research vessel that is equipped with state-of-the-art navigational instruments.,What are undersea researchers doing to explore the ocean floor?
A1VPD12Q3TBJNY,1,corona,third,MTurk,TB_33_MT,8,"For SpaceX — the cheapest of NASA's new carriers — each pound costs approximately $27,000. So an average person of 160 pounds costs over $4,320,000.",How much does it cost to launch a person into space?
A1VPD12Q3TBJNY,1,corona,third,Trivia,TB_08_TR,4,Library of Congress,"In 1802, John Beckley became the librarian of what collection containing 740 books at the time?"
A1VPD12Q3TBJNY,1,corona,third,Trivia,TB_09_TR,12,The first email,"What did Ray Tomlinson send in Cambridge, Massachusetts, in late 1971?"
A1VPD12Q3TBJNY,1,corona,third,Trivia,TB_14_TR,16,James Brown,"When asked to define ""cool,"" what two words did James Brown use?"
A1VPD12Q3TBJNY,1,corona,third,Trivia,TB_23_TR,8,Tooth,What is the only part of the body that can't repair itself?
