PID,sess,firstBlock,block,type,questionId,wait_duration,answer,question
A1VS5B3MN6FA9C,1,general,corona,Not useful,C_02_NU,12,Three ,How many pandemics were there in the 20th century?
A1VS5B3MN6FA9C,1,general,corona,Not useful,C_16_NU,16,Bats and pangolins,What other animals have been found to have viruses with highly similar genome sequences as the current coronavirus?
A1VS5B3MN6FA9C,1,general,corona,Useful,C_45_U,8,"Pre-existing health conditions, including cardiovascular diseases and diabetes.",What did 75% of the people who have died from the new coronavirus have?
A1VS5B3MN6FA9C,1,general,corona,Useful,C_47_U,4,"Free of fever; no other symptoms, including cough; negative tests on at least two consecutive respiratory specimens at least 24 hours apart.",What are current Centers for Disease Control (CDC) guidelines for releasing someone from isolation?
A1VS5B3MN6FA9C,1,general,general,Not useful,NC_12_NU,4,Come by her,"The title of the song ""Kumbaya"" is actually a distortion of what three-word phrase?"
A1VS5B3MN6FA9C,1,general,general,Not useful,NC_15_NU,12,Albert Einstein,Who beat out FDR and Gandhi to be named Time's Person of the Century in 1999?
A1VS5B3MN6FA9C,1,general,general,Not useful,NC_18_NU,4,A truce,What was put in place by the Ancient Greeks before and during all Olympic festivals?
A1VS5B3MN6FA9C,1,general,general,Not useful,NC_20_NU,8,Russia,Which country has the most public libraries?
A1VS5B3MN6FA9C,1,general,general,Not useful,NC_23_NU,16,The Netherlands,In 1568 the Catholic Church sentenced the entire population of which nation to death as heretics?
A1VS5B3MN6FA9C,1,general,general,Useful,NC_51_U,12,White vinegar,What salad dressing ingredient is also an efficient weed killer?
A1VS5B3MN6FA9C,1,general,third,MTurk,TB_34_MT,8,Evolution is usually very slow. Think about the similarities between apes and people. Future people are going to be as similar to us as we are to apes. ,What will future humans look like?
A1VS5B3MN6FA9C,1,general,third,MTurk,TB_45_MT,8,"The amygdala (from Greek, 'almond') is one of two almond-shaped clusters of nuclei located deep and medially within the temporal lobes of the brain in complex vertebrates, including humans.",What is the amygdala?
A1VS5B3MN6FA9C,1,general,third,Trivia,TB_05_TR,4,Hong Kong,What city's harbor is overlooked by Victoria Peak?
A1VS5B3MN6FA9C,1,general,third,Trivia,TB_23_TR,12,Tooth,What is the only part of the body that can't repair itself?
