PID,sess,firstBlock,block,type,questionId,wait_duration,answer,question
A1W14VMKBAYBTU,1,general,corona,Not useful,C_04_NU,16,"It stands for ""COronaVIrus Disease 2019""","Why is the new coronavirus called ""COVID-19""? "
A1W14VMKBAYBTU,1,general,corona,Useful,C_47_U,12,"Free of fever; no other symptoms, including cough; negative tests on at least two consecutive respiratory specimens at least 24 hours apart.",What are current Centers for Disease Control (CDC) guidelines for releasing someone from isolation?
A1W14VMKBAYBTU,1,general,general,Not useful,NC_01_NU,8,Mike Powell,"In 1991, who finally broke Bob Beamon's decades-old long jump record?"
A1W14VMKBAYBTU,1,general,general,Useful,NC_49_U,4,"Roll it along its long side. If it stops immediately, it's raw.",How can you tell if an egg is cooked without breaking it?
A1W14VMKBAYBTU,1,general,general,Useful,NC_51_U,4,White vinegar,What salad dressing ingredient is also an efficient weed killer?
A1W14VMKBAYBTU,1,general,third,MTurk,TB_33_MT,12,"For SpaceX — the cheapest of NASA's new carriers — each pound costs approximately $27,000. So an average person of 160 pounds costs over $4,320,000.",How much does it cost to launch a person into space?
A1W14VMKBAYBTU,1,general,third,MTurk,TB_45_MT,8,"The amygdala (from Greek, 'almond') is one of two almond-shaped clusters of nuclei located deep and medially within the temporal lobes of the brain in complex vertebrates, including humans.",What is the amygdala?
A1W14VMKBAYBTU,1,general,third,Trivia,TB_21_TR,8,New York,Which state has the zip code 12345?
