PID,sess,firstBlock,block,type,questionId,wait_duration,answer,question
A1W35PGD51Q851,1,general,corona,Not useful,C_26_NU,4,Severe acute respiratory syndrome,The official name of the new coronavirus is SARS-CoV-2. What does SARS stand for?
A1W35PGD51Q851,1,general,general,Not useful,NC_06_NU,12,David Livingstone,Who discovered the Victoria Falls?
A1W35PGD51Q851,1,general,general,Not useful,NC_13_NU,16,Bling bling,What term does rapper B.G. say he wishes he'd patented when he used it for the title of his massive 1999 hit?
A1W35PGD51Q851,1,general,general,Not useful,NC_21_NU,4,The Pieta,Which was the only one of his sculptures that Michelangelo signed?
A1W35PGD51Q851,1,general,general,Useful,NC_48_U,8,"Drop it from a 3 inch height. If it bounces, it's dead.",How can you tell if a battery is dead without using any tools?
A1W35PGD51Q851,1,general,general,Useful,NC_51_U,4,White vinegar,What salad dressing ingredient is also an efficient weed killer?
