PID,sess,firstBlock,block,type,questionId,wait_duration,answer,question
A1WS9UHL45VZ0X,1,general,corona,Not useful,C_08_NU,8,Lombardy,What is the name of the county in Italy that had the first coronavirus outbreak?
A1WS9UHL45VZ0X,1,general,corona,Not useful,C_13_NU,8,"The initial cases of the disease are thought to have been among people with a connection to a seafood wholesale market, which also sold live animals","Why is the virus believed to have zoonotic origin, i.e., to have potentially come from animals?"
A1WS9UHL45VZ0X,1,general,corona,Not useful,C_23_NU,12,They falsely claimed to cure or prevent coronavirus,"At the end of February, Amazon banned over a million products because of what?"
A1WS9UHL45VZ0X,1,general,corona,Useful,C_43_U,16,Quarantine themselves for 14 days to make sure they are not infected.,"Currently, people who have traveled to a high-risk area or who may have been in contact with someone with the new coronavirus are recommended to do what?"
A1WS9UHL45VZ0X,1,general,corona,Useful,C_44_U,8,People over age 60,Approximately 80% of deaths attributed to the new coronavirus were among people of what age?
A1WS9UHL45VZ0X,1,general,corona,Useful,C_45_U,12,"Pre-existing health conditions, including cardiovascular diseases and diabetes.",What did 75% of the people who have died from the new coronavirus have?
A1WS9UHL45VZ0X,1,general,corona,Useful,C_48_U,4,"Regular face masks are not considered effective, and reserves need to be saved for people who are infected and for healthcare professionals.",Why does the CDC currently recommend that healthy people do not wear face masks?
A1WS9UHL45VZ0X,1,general,general,Not useful,NC_03_NU,12,Red River,"What name is shared by the rivers that run through Denison, TX and Hanoi, Vietnam?"
A1WS9UHL45VZ0X,1,general,general,Not useful,NC_21_NU,4,The Pieta,Which was the only one of his sculptures that Michelangelo signed?
A1WS9UHL45VZ0X,1,general,general,Not useful,NC_22_NU,8,Steamboat Geyser,"Which Yellowstone geyser, with eruptions 100 fee taller than Old Faithful's, is the world's tallest?"
A1WS9UHL45VZ0X,1,general,general,Not useful,NC_24_NU,12,State quarters,What's been released five times a year from January 1999 to fall 2008?
A1WS9UHL45VZ0X,1,general,general,Useful,NC_28_U,4,Microwave next to a glass of water,How can you soften brown sugar that has hardened into a lump?
A1WS9UHL45VZ0X,1,general,general,Useful,NC_30_U,16,Floormats - put them under the wheels for traction,What item that can be found in any car can help you extract your car from mud or snow?
A1WS9UHL45VZ0X,1,general,general,Useful,NC_35_U,4,Wrap a wet paper towel around the bottle and put in the fridge,How can you cool beverages more quickly?
A1WS9UHL45VZ0X,1,general,general,Useful,NC_36_U,8,Potatos: rub a cut potato over your windshield before a frost to prevent freezing,What vegetable can prevent your windshield from freezing over in winter?
A1WS9UHL45VZ0X,1,general,general,Useful,NC_43_U,8,Between 105 and 54 days before the scheduled trip.,How far in advance of a trip is the most cost effective time to purchase a plane ticket? 
A1WS9UHL45VZ0X,1,general,general,Useful,NC_45_U,8,"Grapes or raisins, onions, avocado","In addition to chocolate, what other foods can be very harmful to dogs? "
A1WS9UHL45VZ0X,1,general,third,MTurk,TB_39_MT,12,"There is radio emission around black holes. Scientists created a network of telescopes, capturing an image of a black hole by improving upon a technique that allows for the imaging of far-away objects",How was the recent picture of a black hole made?
A1WS9UHL45VZ0X,1,general,third,MTurk,TB_40_MT,4,"NASA plans another crewed mission to the Moon by 2024, followed by a sustained presence  by 2028.  Russia is planning to begin building a human colony by 2037.",When could a lunar base be established?
A1WS9UHL45VZ0X,1,general,third,MTurk,TB_42_MT,4,"Galaxy formation occured in the aftermath of the Big Bang. Clustering and merging allows galaxies to accumulate mass, determining both their shape and structure. ",How do galaxies form?
A1WS9UHL45VZ0X,1,general,third,MTurk,TB_44_MT,12,"In all U.S states, same-sex marriage is now legal. Also, the number of kids per family has decreased and so ""middle"" childreen, between the eldest and youngest, are getting rarer. ",How have families changed over time?
A1WS9UHL45VZ0X,1,general,third,Trivia,TB_14_TR,16,James Brown,"When asked to define ""cool,"" what two words did James Brown use?"
A1WS9UHL45VZ0X,1,general,third,Trivia,TB_16_TR,16,Jim Lovell,Alan Shepard was scheduled to command the ill-fated Apollo 13 before switching missions with what astronaut?
A1WS9UHL45VZ0X,1,general,third,Trivia,TB_23_TR,8,Tooth,What is the only part of the body that can't repair itself?
