PID,sess,firstBlock,block,type,questionId,wait_duration,answer,question
A1WVNDH62P2UNZ,1,corona,corona,Not useful,C_12_NU,4,Diamond Princess,What was the name of the British cruise ship that was quarantined in Japanese waters?
A1WVNDH62P2UNZ,1,corona,corona,Not useful,C_14_NU,8,"January 30, 2020",On what date did the World Health Organization declare the new coronavirus outbreak to be a Public Health Emergency of International Concern?
A1WVNDH62P2UNZ,1,corona,corona,Not useful,C_22_NU,4,Contact tracing,What is the name of the process health authorities use to understand the sources of infection and to prevent further transmission?
A1WVNDH62P2UNZ,1,corona,corona,Not useful,C_26_NU,4,Severe acute respiratory syndrome,The official name of the new coronavirus is SARS-CoV-2. What does SARS stand for?
A1WVNDH62P2UNZ,1,corona,corona,Useful,C_44_U,12,People over age 60,Approximately 80% of deaths attributed to the new coronavirus were among people of what age?
A1WVNDH62P2UNZ,1,corona,corona,Useful,C_50_U,12,Washington,The first US death from the new coronavirus occurred in which state?
A1WVNDH62P2UNZ,1,corona,general,Not useful,NC_01_NU,4,Mike Powell,"In 1991, who finally broke Bob Beamon's decades-old long jump record?"
A1WVNDH62P2UNZ,1,corona,general,Not useful,NC_10_NU,12,K.D. Lang,What Canadian singer appeared on the first cover of Entertainment Weekly?
A1WVNDH62P2UNZ,1,corona,general,Not useful,NC_15_NU,4,Albert Einstein,Who beat out FDR and Gandhi to be named Time's Person of the Century in 1999?
A1WVNDH62P2UNZ,1,corona,general,Not useful,NC_16_NU,16,Newborns,The apgar score is used to measure the color and condition of what?
A1WVNDH62P2UNZ,1,corona,general,Useful,NC_27_U,8,White vinegar,What can you use instead of fabric softner to soften sheets and remove odours?
A1WVNDH62P2UNZ,1,corona,third,MTurk,TB_34_MT,16,Evolution is usually very slow. Think about the similarities between apes and people. Future people are going to be as similar to us as we are to apes. ,What will future humans look like?
A1WVNDH62P2UNZ,1,corona,third,MTurk,TB_35_MT,16,Prototypes already exist. Technological estimates suggest that definitely within the next twenty years -- although the challenges are great.,When will we have flying cars?
A1WVNDH62P2UNZ,1,corona,third,Trivia,TB_03_TR,16,Mrs. Doubtfire's,What 1993 film's title character has the first name Euphegenia?
A1WVNDH62P2UNZ,1,corona,third,Trivia,TB_10_TR,12,George VI,Who was the last British Monarch to also be an emperor?
A1WVNDH62P2UNZ,1,corona,third,Trivia,TB_19_TR,12,Ketchup,The only vegetable ice cream ever produced was what flavor?
