PID,sess,firstBlock,block,type,questionId,wait_duration,answer,question
A1X7EQSOG2D9JG,1,corona,corona,Not useful,C_03_NU,12,"Fuburary 1st, 2020",When was the molecular structure of the coronovirus identfied?
A1X7EQSOG2D9JG,1,corona,corona,Not useful,C_14_NU,4,"January 30, 2020",On what date did the World Health Organization declare the new coronavirus outbreak to be a Public Health Emergency of International Concern?
A1X7EQSOG2D9JG,1,corona,corona,Not useful,C_22_NU,16,Contact tracing,What is the name of the process health authorities use to understand the sources of infection and to prevent further transmission?
A1X7EQSOG2D9JG,1,corona,corona,Useful,C_29_U,8,Not for at least several months from now,How soon is a vaccine for the new coronavirus likely to be available?
A1X7EQSOG2D9JG,1,corona,corona,Useful,C_41_U,8,Studies suggest that coronaviruses (including preliminary information on the new virus) may persist on surfaces for a few hours or up to several days.,How long does the new coronavirus survive on surfaces?
A1X7EQSOG2D9JG,1,corona,general,Not useful,NC_04_NU,12,Edward Albee,"Who wrote ""Who's Afraid of Virginia Woolf?"""
A1X7EQSOG2D9JG,1,corona,general,Not useful,NC_11_NU,8,Endeavour,What is the name of the ship that carried Captain Cook to Australia?
A1X7EQSOG2D9JG,1,corona,general,Not useful,NC_15_NU,16,Albert Einstein,Who beat out FDR and Gandhi to be named Time's Person of the Century in 1999?
A1X7EQSOG2D9JG,1,corona,general,Not useful,NC_18_NU,8,A truce,What was put in place by the Ancient Greeks before and during all Olympic festivals?
A1X7EQSOG2D9JG,1,corona,general,Useful,NC_28_U,4,Microwave next to a glass of water,How can you soften brown sugar that has hardened into a lump?
A1X7EQSOG2D9JG,1,corona,general,Useful,NC_40_U,4,Squint your eyes,How do you make your smile look more genuine in photographs?
A1X7EQSOG2D9JG,1,corona,general,Useful,NC_52_U,8,"Tie your hair into a tight ponytail at the front of your head, and cut it.",How can you give yourself a layered haircut?
A1X7EQSOG2D9JG,1,corona,third,MTurk,TB_29_MT,12,"There are a few helpful techniques. One is to imagine that you climb on top of a high building, and ""look down"" at your life. Second, to try to think about issues in novel ways. ",How to stay calm in adversity?
A1X7EQSOG2D9JG,1,corona,third,MTurk,TB_30_MT,4,"The ""no hair theorem"" states that a black hole has only three properties: electric charge, angular momentum, and mass.",What is the composition of a black hole?
A1X7EQSOG2D9JG,1,corona,third,MTurk,TB_31_MT,4,Scientists estimate that at the moment it is not. But with global warming it might become more feasilbe later in the 21st century.,How feasible would it be to colonize Antarctica?
A1X7EQSOG2D9JG,1,corona,third,MTurk,TB_39_MT,8,"There is radio emission around black holes. Scientists created a network of telescopes, capturing an image of a black hole by improving upon a technique that allows for the imaging of far-away objects",How was the recent picture of a black hole made?
A1X7EQSOG2D9JG,1,corona,third,Trivia,TB_03_TR,16,Mrs. Doubtfire's,What 1993 film's title character has the first name Euphegenia?
A1X7EQSOG2D9JG,1,corona,third,Trivia,TB_09_TR,4,The first email,"What did Ray Tomlinson send in Cambridge, Massachusetts, in late 1971?"
A1X7EQSOG2D9JG,1,corona,third,Trivia,TB_19_TR,8,Ketchup,The only vegetable ice cream ever produced was what flavor?
A1X7EQSOG2D9JG,1,corona,third,Trivia,TB_21_TR,12,New York,Which state has the zip code 12345?
