PID,sess,firstBlock,block,type,questionId,wait_duration,answer,question
A1Y6E94Q2RDOST,1,general,corona,Not useful,C_21_NU,16,An epidemic that has spread around the world,An epidemic is the outbreak of a disease that affects many people at the same time. What does pandemic mean?
A1Y6E94Q2RDOST,1,general,corona,Useful,C_45_U,16,"Pre-existing health conditions, including cardiovascular diseases and diabetes.",What did 75% of the people who have died from the new coronavirus have?
A1Y6E94Q2RDOST,1,general,general,Not useful,NC_25_NU,4,Shark,"What animal is thought to be immune to most all diseases, including cancer?"
A1Y6E94Q2RDOST,1,general,general,Useful,NC_34_U,8,"Pineapple, by planting the green leaves",What tropical fruit can be regrown from its scraps?
A1Y6E94Q2RDOST,1,general,general,Useful,NC_44_U,16,Doritos,What popular snack food is effective to use as kindling to start a fire?
A1Y6E94Q2RDOST,1,general,general,Useful,NC_49_U,8,"Roll it along its long side. If it stops immediately, it's raw.",How can you tell if an egg is cooked without breaking it?
A1Y6E94Q2RDOST,1,general,third,MTurk,TB_34_MT,8,Evolution is usually very slow. Think about the similarities between apes and people. Future people are going to be as similar to us as we are to apes. ,What will future humans look like?
