PID,sess,firstBlock,block,type,questionId,wait_duration,answer,question
A1YBX7P5PY8LL,1,corona,corona,Not useful,C_11_NU,4,The Chicago of China,"Wuhan, China, the city in which the coronavirus was first identified, is commonly referred to as the chinese version of what American city?"
A1YBX7P5PY8LL,1,corona,corona,Not useful,C_24_NU,8,Contagion,"According to media reports, which 2011 movie has seen a large increase in popularity in the wake of the new coronavirus?"
A1YBX7P5PY8LL,1,corona,corona,Useful,C_36_U,4,No. There is no evidence that regularly rinsing the nose with saline has protected people from infection with the new coronavirus.,Can regularly rinsing your nose with saline help prevent infection with the new coronavirus?
A1YBX7P5PY8LL,1,corona,corona,Useful,C_37_U,12,There is no evidence from the current outbreak that eating garlic has protected people from the new coronavirus.,Can eating garlic help prevent infection with the new coronavirus?
A1YBX7P5PY8LL,1,corona,corona,Useful,C_45_U,16,"Pre-existing health conditions, including cardiovascular diseases and diabetes.",What did 75% of the people who have died from the new coronavirus have?
A1YBX7P5PY8LL,1,corona,corona,Useful,C_46_U,8,Remdesivir,"Which drug, which has been used as a treatment for the Ebola and Marburg viruses, might be promising as a treatment for this new coronavirus?"
A1YBX7P5PY8LL,1,corona,corona,Useful,C_51_U,4,Nasal or orab swab or a sample of sputum,What sort of specimen is needed to test for the new coronavirus? 
A1YBX7P5PY8LL,1,corona,general,Not useful,NC_17_NU,12,Gilbert Van Camp,What Indianapolis grocer made his name by selling canned pork and beans to U.S. troops during the Civil War?
A1YBX7P5PY8LL,1,corona,general,Not useful,NC_23_NU,4,The Netherlands,In 1568 the Catholic Church sentenced the entire population of which nation to death as heretics?
A1YBX7P5PY8LL,1,corona,general,Not useful,NC_25_NU,16,Shark,"What animal is thought to be immune to most all diseases, including cancer?"
A1YBX7P5PY8LL,1,corona,general,Useful,NC_27_U,12,White vinegar,What can you use instead of fabric softner to soften sheets and remove odours?
A1YBX7P5PY8LL,1,corona,general,Useful,NC_33_U,16,Below eye level,Where in the supermarket can you usually find the cheaper items?
A1YBX7P5PY8LL,1,corona,general,Useful,NC_42_U,8,"Deprive it of oxygen by covering, pouring baking soda if the fire is small, or using a fire extinguisher if it's large.",How do you put out a grease fire? 
A1YBX7P5PY8LL,1,corona,general,Useful,NC_50_U,16,Spread beeswax over them and then blow dry until you can't see the beeswax anymore,What's an easy way to waterproof canvas shoes?
A1YBX7P5PY8LL,1,corona,general,Useful,NC_51_U,4,White vinegar,What salad dressing ingredient is also an efficient weed killer?
A1YBX7P5PY8LL,1,corona,third,MTurk,TB_35_MT,16,Prototypes already exist. Technological estimates suggest that definitely within the next twenty years -- although the challenges are great.,When will we have flying cars?
A1YBX7P5PY8LL,1,corona,third,MTurk,TB_37_MT,16,Engineers and architects agree that the answer is positive. Houses for the non-rich are much better built today than they were built 500 years ago.,Are houses built better than they used to be?
A1YBX7P5PY8LL,1,corona,third,MTurk,TB_41_MT,4,"Deep learning-based machines, that can process unparalleled amount of information will allow AI to accomplish goals that were unimaginable until very recently. ",What are the most recent developments in artificial intelligence?
A1YBX7P5PY8LL,1,corona,third,Trivia,TB_01_TR,16,Canada,"What country is home to Roots, the company that outfits the U.S. Olympic team?"
A1YBX7P5PY8LL,1,corona,third,Trivia,TB_04_TR,12,Phil Knight,"In 1964, who founded Blue Ribbon Sports, which later went on to become Nike?"
A1YBX7P5PY8LL,1,corona,third,Trivia,TB_13_TR,12,Java,On what namesake Asian island are the first Homo erectus fossils found?
A1YBX7P5PY8LL,1,corona,third,Trivia,TB_17_TR,8,"Third finger, left hand",What part of his body did Keith Richards insure for a million pounds?
