PID,sess,firstBlock,block,type,questionId,wait_duration,answer,question
A1ZD9SJXQ9C6EW,1,corona,corona,Not useful,C_02_NU,8,Three ,How many pandemics were there in the 20th century?
A1ZD9SJXQ9C6EW,1,corona,corona,Not useful,C_06_NU,12,Gwyneth Paltrow,"Which celebrity said about the new coronavirus ""I've already been in this movie""?"
A1ZD9SJXQ9C6EW,1,corona,corona,Not useful,C_08_NU,4,Lombardy,What is the name of the county in Italy that had the first coronavirus outbreak?
A1ZD9SJXQ9C6EW,1,corona,corona,Useful,C_32_U,12,"Healthcare professionals treating patients, in-home caregivers, and those who are already sick with the new coronavirus",Which three groups of people does the CDC recommend masks for?
A1ZD9SJXQ9C6EW,1,corona,corona,Useful,C_40_U,8,"The incubation period - the time between catching the virus and beginning to have symptoms of the disease - is estimated to range from 1-14 days, most commonly around five days.",How long is the incubation period for the new coronavirus?
A1ZD9SJXQ9C6EW,1,corona,corona,Useful,C_41_U,12,Studies suggest that coronaviruses (including preliminary information on the new virus) may persist on surfaces for a few hours or up to several days.,How long does the new coronavirus survive on surfaces?
A1ZD9SJXQ9C6EW,1,corona,corona,Useful,C_47_U,8,"Free of fever; no other symptoms, including cough; negative tests on at least two consecutive respiratory specimens at least 24 hours apart.",What are current Centers for Disease Control (CDC) guidelines for releasing someone from isolation?
A1ZD9SJXQ9C6EW,1,corona,general,Not useful,NC_23_NU,16,The Netherlands,In 1568 the Catholic Church sentenced the entire population of which nation to death as heretics?
A1ZD9SJXQ9C6EW,1,corona,general,Useful,NC_39_U,16,"At least $2,467 according to current research",How much money should I keep as an emergency fund?
A1ZD9SJXQ9C6EW,1,corona,general,Useful,NC_41_U,4,"April 8th, 2024",When is the next total solar eclipse visible in North America projected to occur? 
A1ZD9SJXQ9C6EW,1,corona,general,Useful,NC_42_U,4,"Deprive it of oxygen by covering, pouring baking soda if the fire is small, or using a fire extinguisher if it's large.",How do you put out a grease fire? 
A1ZD9SJXQ9C6EW,1,corona,general,Useful,NC_44_U,8,Doritos,What popular snack food is effective to use as kindling to start a fire?
A1ZD9SJXQ9C6EW,1,corona,general,Useful,NC_49_U,8,"Roll it along its long side. If it stops immediately, it's raw.",How can you tell if an egg is cooked without breaking it?
A1ZD9SJXQ9C6EW,1,corona,third,MTurk,TB_28_MT,16,"Futurist Diamandis argues that due to improved powers of computation we are likely to see AI, improved medicine, and new ways of communicating.",What is to happen ten years from now?
A1ZD9SJXQ9C6EW,1,corona,third,MTurk,TB_36_MT,4,"For two reasons. One, they are too heavy. For example, the Space Shuttle weighed 2 thousand tons, yet a Boeing can only carry about 120 tons. Second, the thrust is likely to be too strong.",Why don't space rockets take off from a plane already in the air?
A1ZD9SJXQ9C6EW,1,corona,third,MTurk,TB_45_MT,4,"The amygdala (from Greek, 'almond') is one of two almond-shaped clusters of nuclei located deep and medially within the temporal lobes of the brain in complex vertebrates, including humans.",What is the amygdala?
A1ZD9SJXQ9C6EW,1,corona,third,Trivia,TB_11_TR,4,Mung beans,What kind of bean produces the Asian-style bean sprouts in the produce section of supermarkets?
A1ZD9SJXQ9C6EW,1,corona,third,Trivia,TB_21_TR,8,New York,Which state has the zip code 12345?
A1ZD9SJXQ9C6EW,1,corona,third,Trivia,TB_22_TR,12,Cheetah,Which is the only cat that cannot retract its claws?
