PID,sess,firstBlock,block,type,questionId,wait_duration,answer,question
A2051CN5YPVQD,1,corona,corona,Not useful,C_01_NU,16,"Animals, probably bats",What is the source of coronavirus in humans?
A2051CN5YPVQD,1,corona,corona,Not useful,C_05_NU,4,University of Washington,Which was the first US University to cancel classes becuase of the new coronavirus?
A2051CN5YPVQD,1,corona,corona,Not useful,C_10_NU,8,11 million people,"What is the population of Wuhan, the city in which coronavirus was first identified?"
A2051CN5YPVQD,1,corona,corona,Not useful,C_17_NU,16,"Locations, people, or animals","The name for the new disease COVID-19 adheres to WHO best practices in disease naming, which include guidelines to not name disease after what?"
A2051CN5YPVQD,1,corona,corona,Not useful,C_24_NU,4,Contagion,"According to media reports, which 2011 movie has seen a large increase in popularity in the wake of the new coronavirus?"
A2051CN5YPVQD,1,corona,corona,Useful,C_29_U,16,Not for at least several months from now,How soon is a vaccine for the new coronavirus likely to be available?
A2051CN5YPVQD,1,corona,corona,Useful,C_37_U,4,There is no evidence from the current outbreak that eating garlic has protected people from the new coronavirus.,Can eating garlic help prevent infection with the new coronavirus?
A2051CN5YPVQD,1,corona,corona,Useful,C_48_U,12,Reserves need to be saved for people who are infected and for healthcare professionals.,Why does the CDC currently recommend that healthy people do not wear N95 face masks?
A2051CN5YPVQD,1,corona,general,Not useful,NC_11_NU,12,Endeavour,What is the name of the ship that carried Captain Cook to Australia?
A2051CN5YPVQD,1,corona,general,Not useful,NC_20_NU,12,Russia,Which country has the most public libraries?
A2051CN5YPVQD,1,corona,general,Not useful,NC_21_NU,12,The Pieta,Which was the only one of his sculptures that Michelangelo signed?
A2051CN5YPVQD,1,corona,general,Not useful,NC_25_NU,8,Shark,"What animal is thought to be immune to most all diseases, including cancer?"
A2051CN5YPVQD,1,corona,general,Useful,NC_40_U,12,Squint your eyes,How do you make your smile look more genuine in photographs?
A2051CN5YPVQD,1,corona,general,Useful,NC_49_U,4,"Roll it along its long side. If it stops immediately, it's raw.",How can you tell if an egg is cooked without breaking it?
A2051CN5YPVQD,1,corona,third,MTurk,TB_29_MT,8,"There are a few helpful techniques. One is to imagine that you climb on top of a high building, and ""look down"" at your life. Second, to try to think about issues in novel ways. ",How to stay calm in adversity?
A2051CN5YPVQD,1,corona,third,MTurk,TB_40_MT,16,"NASA plans another crewed mission to the Moon by 2024, followed by a sustained presence  by 2028.  Russia is planning to begin building a human colony by 2037.",When could a lunar base be established?
A2051CN5YPVQD,1,corona,third,MTurk,TB_44_MT,8,"In all U.S states, same-sex marriage is now legal. Also, the number of kids per family has decreased and so ""middle"" childreen, between the eldest and youngest, are getting rarer. ",How have families changed over time?
A2051CN5YPVQD,1,corona,third,MTurk,TB_45_MT,16,"The amygdala (from Greek, 'almond') is one of two almond-shaped clusters of nuclei located deep and medially within the temporal lobes of the brain in complex vertebrates, including humans.",What is the amygdala?
A2051CN5YPVQD,1,corona,third,Trivia,TB_01_TR,16,Canada,"What country is home to Roots, the company that outfits the U.S. Olympic team?"
A2051CN5YPVQD,1,corona,third,Trivia,TB_13_TR,12,Java,On what namesake Asian island are the first Homo erectus fossils found?
A2051CN5YPVQD,1,corona,third,Trivia,TB_23_TR,4,Tooth,What is the only part of the body that can't repair itself?
