PID,sess,firstBlock,block,type,questionId,wait_duration,answer,question
A20DJRAE8TZUH5,1,corona,corona,Not useful,C_01_NU,16,"Animals, probably bats",What is the source of coronavirus in humans?
A20DJRAE8TZUH5,1,corona,corona,Not useful,C_02_NU,4,Three ,How many pandemics were there in the 20th century?
A20DJRAE8TZUH5,1,corona,corona,Not useful,C_03_NU,8,"Fuburary 1st, 2020",When was the molecular structure of the coronovirus identfied?
A20DJRAE8TZUH5,1,corona,corona,Not useful,C_15_NU,16,7.5 days,"In the early stages of the new coronavirus, the number of new cases doubled approximately every how many days?"
A20DJRAE8TZUH5,1,corona,corona,Useful,C_31_U,4,Probably not but it's too soon to be sure,Can the coronavirus be transmitted through sexual intercourse?
A20DJRAE8TZUH5,1,corona,corona,Useful,C_36_U,12,No. There is no evidence that regularly rinsing the nose with saline has protected people from infection with the new coronavirus.,Can regularly rinsing your nose with saline help prevent infection with the new coronavirus?
A20DJRAE8TZUH5,1,corona,corona,Useful,C_49_U,12,"Approved filtering facemask respirators, such as the N95 respirator.","It is recommended that healthcare professionals who may be working in contact with people with the virus wear what, in addition to personal protective equipment on their hands and bodies?"
A20DJRAE8TZUH5,1,corona,general,Not useful,NC_04_NU,4,Edward Albee,"Who wrote ""Who's Afraid of Virginia Woolf?"""
A20DJRAE8TZUH5,1,corona,general,Not useful,NC_07_NU,8,Salt Lake City,In what city could you see the Seagull Monument at Temple Square?
A20DJRAE8TZUH5,1,corona,general,Not useful,NC_20_NU,8,Russia,Which country has the most public libraries?
A20DJRAE8TZUH5,1,corona,general,Not useful,NC_24_NU,12,State quarters,What's been released five times a year from January 1999 to fall 2008?
A20DJRAE8TZUH5,1,corona,general,Useful,NC_48_U,8,"Drop it from a 3 inch height. If it bounces, it's dead.",How can you tell if a battery is dead without using any tools?
A20DJRAE8TZUH5,1,corona,general,Useful,NC_52_U,16,"Tie your hair into a tight ponytail at the front of your head, and cut it.",How can you give yourself a layered haircut?
A20DJRAE8TZUH5,1,corona,third,MTurk,TB_31_MT,8,Scientists estimate that at the moment it is not. But with global warming it might become more feasilbe later in the 21st century.,How feasible would it be to colonize Antarctica?
A20DJRAE8TZUH5,1,corona,third,Trivia,TB_13_TR,8,Java,On what namesake Asian island are the first Homo erectus fossils found?
A20DJRAE8TZUH5,1,corona,third,Trivia,TB_14_TR,12,James Brown,"When asked to define ""cool,"" what two words did James Brown use?"
A20DJRAE8TZUH5,1,corona,third,Trivia,TB_16_TR,4,Jim Lovell,Alan Shepard was scheduled to command the ill-fated Apollo 13 before switching missions with what astronaut?
A20DJRAE8TZUH5,1,corona,third,Trivia,TB_18_TR,12,Orville Wright,Who was flying the plane in which the first US airplane fatality occurred?
A20DJRAE8TZUH5,1,corona,third,Trivia,TB_21_TR,8,New York,Which state has the zip code 12345?
