PID,sess,firstBlock,block,type,questionId,wait_duration,answer,question
A20MUNY2OLDCLC,1,general,corona,Not useful,C_15_NU,8,7.5 days,"In the early stages of the new coronavirus, the number of new cases doubled approximately every how many days?"
A20MUNY2OLDCLC,1,general,corona,Useful,C_30_U,4,More similar to the symptoms of the ful,"Are the new coronavirus symptoms more similar to the symptoms of flu, or of seasonal allergies?"
A20MUNY2OLDCLC,1,general,corona,Useful,C_34_U,4,"The virus lives for up to a few days on surfaces, and so packages cannot transmit the virus.",Can the new coronavirus be transmitted on a package from an infected country?
A20MUNY2OLDCLC,1,general,corona,Useful,C_45_U,16,"Pre-existing health conditions, including cardiovascular diseases and diabetes.",What did 75% of the people who have died from the new coronavirus have?
A20MUNY2OLDCLC,1,general,general,Useful,NC_37_U,8,"Over the past 150 year, real estate, if you rent it out",What's a better investment: stocks or real estate?
A20MUNY2OLDCLC,1,general,general,Useful,NC_46_U,8,"Dish soap, peroxide, and baking soda","While tomato juice probably will not work, what does work to remove skunk odor? "
A20MUNY2OLDCLC,1,general,general,Useful,NC_52_U,12,"Tie your hair into a tight ponytail at the front of your head, and cut it.",How can you give yourself a layered haircut?
A20MUNY2OLDCLC,1,general,third,MTurk,TB_34_MT,16,Evolution is usually very slow. Think about the similarities between apes and people. Future people are going to be as similar to us as we are to apes. ,What will future humans look like?
A20MUNY2OLDCLC,1,general,third,Trivia,TB_22_TR,12,Cheetah,Which is the only cat that cannot retract its claws?
