PID,sess,firstBlock,block,type,questionId,wait_duration,answer,question
A20VH0U95N7M0T,1,general,corona,Useful,C_36_U,4,No. There is no evidence that regularly rinsing the nose with saline has protected people from infection with the new coronavirus.,Can regularly rinsing your nose with saline help prevent infection with the new coronavirus?
A20VH0U95N7M0T,1,general,corona,Useful,C_46_U,8,Remdesivir,"Which drug, which has been used as a treatment for the Ebola and Marburg viruses, might be promising as a treatment for this new coronavirus?"
A20VH0U95N7M0T,1,general,corona,Useful,C_48_U,4,"Regular face masks are not considered effective, and reserves need to be saved for people who are infected and for healthcare professionals.",Why does the CDC currently recommend that healthy people do not wear face masks?
A20VH0U95N7M0T,1,general,general,Not useful,NC_02_NU,8,Tiger Woods,"Who's the only two-time Sports Illustrated Sportsman of the Year, so named in 1996 and 2000?"
A20VH0U95N7M0T,1,general,general,Not useful,NC_21_NU,8,The Pieta,Which was the only one of his sculptures that Michelangelo signed?
A20VH0U95N7M0T,1,general,general,Not useful,NC_24_NU,4,State quarters,What's been released five times a year from January 1999 to fall 2008?
A20VH0U95N7M0T,1,general,general,Useful,NC_30_U,8,Floormats - put them under the wheels for traction,What item that can be found in any car can help you extract your car from mud or snow?
A20VH0U95N7M0T,1,general,general,Useful,NC_35_U,4,Wrap a wet paper towel around the bottle and put in the fridge,How can you cool beverages more quickly?
A20VH0U95N7M0T,1,general,general,Useful,NC_36_U,4,Potatos: rub a cut potato over your windshield before a frost to prevent freezing,What vegetable can prevent your windshield from freezing over in winter?
A20VH0U95N7M0T,1,general,general,Useful,NC_40_U,4,Squint your eyes,How do you make your smile look more genuine in photographs?
A20VH0U95N7M0T,1,general,general,Useful,NC_44_U,8,Doritos,What popular snack food is effective to use as kindling to start a fire?
A20VH0U95N7M0T,1,general,third,MTurk,TB_31_MT,4,Scientists estimate that at the moment it is not. But with global warming it might become more feasilbe later in the 21st century.,How feasible would it be to colonize Antarctica?
A20VH0U95N7M0T,1,general,third,Trivia,TB_08_TR,16,Library of Congress,"In 1802, John Beckley became the librarian of what collection containing 740 books at the time?"
