PID,sess,firstBlock,block,type,questionId,wait_duration,answer,question
A211HK32QNTYX1,1,general,corona,Not useful,C_01_NU,4,"Animals, probably bats",What is the source of coronavirus in humans?
A211HK32QNTYX1,1,general,corona,Useful,C_32_U,4,"Healthcare professionals treating patients, in-home caregivers, and those who are already sick with the new coronavirus",Which three groups of people does the CDC recommend masks for?
A211HK32QNTYX1,1,general,corona,Useful,C_34_U,16,"The virus lives for up to a few days on surfaces, and so packages cannot transmit the virus.",Can the new coronavirus be transmitted on a package from an infected country?
A211HK32QNTYX1,1,general,corona,Useful,C_45_U,16,"Pre-existing health conditions, including cardiovascular diseases and diabetes.",What did 75% of the people who have died from the new coronavirus have?
A211HK32QNTYX1,1,general,corona,Useful,C_46_U,8,Remdesivir,"Which drug, which has been used as a treatment for the Ebola and Marburg viruses, might be promising as a treatment for this new coronavirus?"
A211HK32QNTYX1,1,general,general,Not useful,NC_05_NU,8,Matthew,Which of the four biblical Gospels was written by a tax collector?
A211HK32QNTYX1,1,general,general,Not useful,NC_09_NU,4,Captain Cook,"Who christened Hawaii ""the Sandwich Islands"" in 1778?"
A211HK32QNTYX1,1,general,general,Not useful,NC_11_NU,12,Endeavour,What is the name of the ship that carried Captain Cook to Australia?
A211HK32QNTYX1,1,general,general,Not useful,NC_21_NU,12,The Pieta,Which was the only one of his sculptures that Michelangelo signed?
A211HK32QNTYX1,1,general,general,Not useful,NC_24_NU,8,State quarters,What's been released five times a year from January 1999 to fall 2008?
A211HK32QNTYX1,1,general,general,Useful,NC_29_U,8,"Freeze before chopping, or hold a piece of bread in your mouth, half sticking out",How to chop an onion without crying?
A211HK32QNTYX1,1,general,general,Useful,NC_34_U,16,"Pineapple, by planting the green leaves",What tropical fruit can be regrown from its scraps?
A211HK32QNTYX1,1,general,general,Useful,NC_36_U,8,Potatos: rub a cut potato over your windshield before a frost to prevent freezing,What vegetable can prevent your windshield from freezing over in winter?
A211HK32QNTYX1,1,general,general,Useful,NC_37_U,8,"Over the past 150 year, real estate, if you rent it out",What's a better investment: stocks or real estate?
A211HK32QNTYX1,1,general,general,Useful,NC_41_U,16,"April 8th, 2024",When is the next total solar eclipse visible in North America projected to occur? 
A211HK32QNTYX1,1,general,third,MTurk,TB_30_MT,8,"The ""no hair theorem"" states that a black hole has only three properties: electric charge, angular momentum, and mass.",What is the composition of a black hole?
A211HK32QNTYX1,1,general,third,MTurk,TB_37_MT,16,Engineers and architects agree that the answer is positive. Houses for the non-rich are much better built today than they were built 500 years ago.,Are houses built better than they used to be?
A211HK32QNTYX1,1,general,third,MTurk,TB_43_MT,12,"Planets likely start off as grains of dust that then combine to form bigger rocks. They clear material from their path, leaving tracks of space empty but for fine dust.",How do planets form?
A211HK32QNTYX1,1,general,third,Trivia,TB_14_TR,12,James Brown,"When asked to define ""cool,"" what two words did James Brown use?"
