PID,sess,firstBlock,block,type,questionId,wait_duration,answer,question
A21OQV0G2H7FDR,1,corona,corona,Not useful,C_01_NU,4,"Animals, probably bats",What is the source of coronavirus in humans?
A21OQV0G2H7FDR,1,corona,corona,Not useful,C_02_NU,16,Three ,How many pandemics were there in the 20th century?
A21OQV0G2H7FDR,1,corona,corona,Not useful,C_12_NU,8,Diamond Princess,What was the name of the British cruise ship that was quarantined in Japanese waters?
A21OQV0G2H7FDR,1,corona,corona,Not useful,C_16_NU,4,Bats and pangolins,What other animals have been found to have viruses with highly similar genome sequences as the current coronavirus?
A21OQV0G2H7FDR,1,corona,corona,Not useful,C_22_NU,8,Contact tracing,What is the name of the process health authorities use to understand the sources of infection and to prevent further transmission?
A21OQV0G2H7FDR,1,corona,corona,Useful,C_33_U,16,Soft surfaces are less likely to transmit the virus than hard surfaces.,Can the new coronavirus be transmitted by touching a soft surface like carpets or fabric?
A21OQV0G2H7FDR,1,corona,corona,Useful,C_34_U,4,"The virus lives for up to a few days on surfaces, and so packages cannot transmit the virus.",Can the new coronavirus be transmitted on a package from an infected country?
A21OQV0G2H7FDR,1,corona,corona,Useful,C_37_U,8,There is no evidence from the current outbreak that eating garlic has protected people from the new coronavirus.,Can eating garlic help prevent infection with the new coronavirus?
A21OQV0G2H7FDR,1,corona,corona,Useful,C_52_U,8,No. To protect yourself against the new coronavirus washing your hands is the best preventive measure.,Are hand dryers effective in killing the new coronavirus?
A21OQV0G2H7FDR,1,corona,general,Not useful,NC_15_NU,8,Albert Einstein,Who beat out FDR and Gandhi to be named Time's Person of the Century in 1999?
A21OQV0G2H7FDR,1,corona,general,Not useful,NC_19_NU,16,Smoke,"in 1908, New York City passed the Sullivan Ordinance which made it illegal for women to do what in public?"
A21OQV0G2H7FDR,1,corona,general,Not useful,NC_23_NU,12,The Netherlands,In 1568 the Catholic Church sentenced the entire population of which nation to death as heretics?
A21OQV0G2H7FDR,1,corona,general,Useful,NC_29_U,8,"Freeze before chopping, or hold a piece of bread in your mouth, half sticking out",How to chop an onion without crying?
A21OQV0G2H7FDR,1,corona,general,Useful,NC_34_U,12,"Pineapple, by planting the green leaves",What tropical fruit can be regrown from its scraps?
A21OQV0G2H7FDR,1,corona,general,Useful,NC_51_U,12,White vinegar,What salad dressing ingredient is also an efficient weed killer?
A21OQV0G2H7FDR,1,corona,third,MTurk,TB_26_MT,16,"Sometimes, it is easy to know, but science revealed that self-insight is prblematic. It is often very helpful to ask friends and family ",How do you know if you're happy?
A21OQV0G2H7FDR,1,corona,third,MTurk,TB_28_MT,12,"Futurist Diamandis argues that due to improved powers of computation we are likely to see AI, improved medicine, and new ways of communicating.",What is to happen ten years from now?
A21OQV0G2H7FDR,1,corona,third,MTurk,TB_46_MT,12,"Scientists are still figuring it out. It seems that passive use is slightly bad, but active use is not.",How does social media influence our mental health?
A21OQV0G2H7FDR,1,corona,third,Trivia,TB_04_TR,4,Phil Knight,"In 1964, who founded Blue Ribbon Sports, which later went on to become Nike?"
A21OQV0G2H7FDR,1,corona,third,Trivia,TB_14_TR,16,James Brown,"When asked to define ""cool,"" what two words did James Brown use?"
A21OQV0G2H7FDR,1,corona,third,Trivia,TB_20_TR,16,Rafflesia (corpse lily),What is the largest flower in the world?
