PID,sess,firstBlock,block,type,questionId,wait_duration,answer,question
A21P1T8EW4NHOU,1,general,corona,Not useful,C_10_NU,16,11 million people,"What is the population of Wuhan, the city in which coronavirus was first identified?"
A21P1T8EW4NHOU,1,general,corona,Not useful,C_11_NU,16,The Chicago of China,"Wuhan, China, the city in which the coronavirus was first identified, is commonly referred to as the chinese version of what American city?"
A21P1T8EW4NHOU,1,general,corona,Not useful,C_16_NU,12,Bats and pangolins,What other animals have been found to have viruses with highly similar genome sequences as the current coronavirus?
A21P1T8EW4NHOU,1,general,corona,Not useful,C_25_NU,8,The viruses have spikes on their outer surface that look like a crown (or corona in Latin),What is the supposed origin of the name coronavirus?
A21P1T8EW4NHOU,1,general,corona,Useful,C_42_U,4,"Fever, cough, shortness of breath.",What are the most common symptoms of the new coronavirus?
A21P1T8EW4NHOU,1,general,corona,Useful,C_46_U,16,Remdesivir,"Which drug, which has been used as a treatment for the Ebola and Marburg viruses, might be promising as a treatment for this new coronavirus?"
A21P1T8EW4NHOU,1,general,corona,Useful,C_51_U,12,Nasal or orab swab or a sample of sputum,What sort of specimen is needed to test for the new coronavirus? 
A21P1T8EW4NHOU,1,general,general,Not useful,NC_01_NU,4,Mike Powell,"In 1991, who finally broke Bob Beamon's decades-old long jump record?"
A21P1T8EW4NHOU,1,general,general,Not useful,NC_07_NU,12,Salt Lake City,In what city could you see the Seagull Monument at Temple Square?
A21P1T8EW4NHOU,1,general,general,Not useful,NC_11_NU,4,Endeavour,What is the name of the ship that carried Captain Cook to Australia?
A21P1T8EW4NHOU,1,general,general,Not useful,NC_19_NU,16,Smoke,"in 1908, New York City passed the Sullivan Ordinance which made it illegal for women to do what in public?"
A21P1T8EW4NHOU,1,general,general,Not useful,NC_26_NU,4,Dark Side of the Moon,What album spent a record 741 weeks on Billboard's Top 200 Albums chart?
A21P1T8EW4NHOU,1,general,general,Useful,NC_31_U,12,Sign up for a free USAA membership,How can people under 25 rent a car without paying extra fees?
A21P1T8EW4NHOU,1,general,general,Useful,NC_43_U,8,Between 105 and 54 days before the scheduled trip.,How far in advance of a trip is the most cost effective time to purchase a plane ticket? 
A21P1T8EW4NHOU,1,general,general,Useful,NC_48_U,8,"Drop it from a 3 inch height. If it bounces, it's dead.",How can you tell if a battery is dead without using any tools?
A21P1T8EW4NHOU,1,general,general,Useful,NC_50_U,8,Spread beeswax over them and then blow dry until you can't see the beeswax anymore,What's an easy way to waterproof canvas shoes?
A21P1T8EW4NHOU,1,general,third,MTurk,TB_29_MT,12,"There are a few helpful techniques. One is to imagine that you climb on top of a high building, and ""look down"" at your life. Second, to try to think about issues in novel ways. ",How to stay calm in adversity?
A21P1T8EW4NHOU,1,general,third,MTurk,TB_30_MT,16,"The ""no hair theorem"" states that a black hole has only three properties: electric charge, angular momentum, and mass.",What is the composition of a black hole?
A21P1T8EW4NHOU,1,general,third,MTurk,TB_37_MT,8,Engineers and architects agree that the answer is positive. Houses for the non-rich are much better built today than they were built 500 years ago.,Are houses built better than they used to be?
A21P1T8EW4NHOU,1,general,third,MTurk,TB_38_MT,8,"As a rule, yes. Restaurants have to cover rent, salaries and taxes. These are all included in the prices.",Is it really cheaper to cook at home vs. eating out?
A21P1T8EW4NHOU,1,general,third,Trivia,TB_19_TR,12,Ketchup,The only vegetable ice cream ever produced was what flavor?
A21P1T8EW4NHOU,1,general,third,Trivia,TB_22_TR,16,Cheetah,Which is the only cat that cannot retract its claws?
A21P1T8EW4NHOU,1,general,third,Trivia,TB_23_TR,8,Tooth,What is the only part of the body that can't repair itself?
