PID,sess,firstBlock,block,type,questionId,wait_duration,answer,question
A220LB7PQCTML8,1,general,corona,Useful,C_51_U,8,Nasal or orab swab or a sample of sputum,What sort of specimen is needed to test for the new coronavirus? 
A220LB7PQCTML8,1,general,general,Not useful,NC_10_NU,4,K.D. Lang,What Canadian singer appeared on the first cover of Entertainment Weekly?
A220LB7PQCTML8,1,general,general,Not useful,NC_24_NU,12,State quarters,What's been released five times a year from January 1999 to fall 2008?
A220LB7PQCTML8,1,general,general,Useful,NC_36_U,4,Potatos: rub a cut potato over your windshield before a frost to prevent freezing,What vegetable can prevent your windshield from freezing over in winter?
A220LB7PQCTML8,1,general,general,Useful,NC_44_U,8,Doritos,What popular snack food is effective to use as kindling to start a fire?
