PID,sess,firstBlock,block,type,questionId,wait_duration,answer,question
A226PPE8EN1W8M,1,general,corona,Not useful,C_02_NU,8,Three ,How many pandemics were there in the 20th century?
A226PPE8EN1W8M,1,general,corona,Not useful,C_03_NU,16,"Fuburary 1st, 2020",When was the molecular structure of the coronovirus identfied?
A226PPE8EN1W8M,1,general,corona,Not useful,C_08_NU,4,Lombardy,What is the name of the county in Italy that had the first coronavirus outbreak?
A226PPE8EN1W8M,1,general,corona,Not useful,C_14_NU,4,"January 30, 2020",On what date did the World Health Organization declare the new coronavirus outbreak to be a Public Health Emergency of International Concern?
A226PPE8EN1W8M,1,general,corona,Useful,C_33_U,8,Soft surfaces are less likely to transmit the virus than hard surfaces.,Can the new coronavirus be transmitted by touching a soft surface like carpets or fabric?
A226PPE8EN1W8M,1,general,general,Not useful,NC_14_NU,12,Rod Serling,What famed TV personality wrote the screenplay for 1968's Planet of the Apes?
A226PPE8EN1W8M,1,general,general,Not useful,NC_17_NU,12,Gilbert Van Camp,What Indianapolis grocer made his name by selling canned pork and beans to U.S. troops during the Civil War?
A226PPE8EN1W8M,1,general,general,Not useful,NC_24_NU,4,State quarters,What's been released five times a year from January 1999 to fall 2008?
A226PPE8EN1W8M,1,general,general,Not useful,NC_25_NU,16,Shark,"What animal is thought to be immune to most all diseases, including cancer?"
A226PPE8EN1W8M,1,general,general,Useful,NC_36_U,16,Potatos: rub a cut potato over your windshield before a frost to prevent freezing,What vegetable can prevent your windshield from freezing over in winter?
A226PPE8EN1W8M,1,general,general,Useful,NC_39_U,4,"At least $2,467 according to current research",How much money should I keep as an emergency fund?
A226PPE8EN1W8M,1,general,general,Useful,NC_43_U,8,Between 105 and 54 days before the scheduled trip.,How far in advance of a trip is the most cost effective time to purchase a plane ticket? 
A226PPE8EN1W8M,1,general,third,MTurk,TB_36_MT,16,"For two reasons. One, they are too heavy. For example, the Space Shuttle weighed 2 thousand tons, yet a Boeing can only carry about 120 tons. Second, the thrust is likely to be too strong.",Why don't space rockets take off from a plane already in the air?
A226PPE8EN1W8M,1,general,third,MTurk,TB_40_MT,12,"NASA plans another crewed mission to the Moon by 2024, followed by a sustained presence  by 2028.  Russia is planning to begin building a human colony by 2037.",When could a lunar base be established?
A226PPE8EN1W8M,1,general,third,MTurk,TB_42_MT,8,"Galaxy formation occured in the aftermath of the Big Bang. Clustering and merging allows galaxies to accumulate mass, determining both their shape and structure. ",How do galaxies form?
A226PPE8EN1W8M,1,general,third,Trivia,TB_04_TR,4,Phil Knight,"In 1964, who founded Blue Ribbon Sports, which later went on to become Nike?"
A226PPE8EN1W8M,1,general,third,Trivia,TB_16_TR,8,Jim Lovell,Alan Shepard was scheduled to command the ill-fated Apollo 13 before switching missions with what astronaut?
A226PPE8EN1W8M,1,general,third,Trivia,TB_18_TR,8,Orville Wright,Who was flying the plane in which the first US airplane fatality occurred?
