PID,sess,firstBlock,block,type,questionId,wait_duration,answer,question
A22DF0EWILGRLV,1,general,corona,Not useful,C_13_NU,4,"The initial cases of the disease are thought to have been among people with a connection to a seafood wholesale market, which also sold live animals","Why is the virus believed to have zoonotic origin, i.e., to have potentially come from animals?"
A22DF0EWILGRLV,1,general,corona,Useful,C_29_U,8,Not for at least several months from now,How soon is a vaccine for the new coronavirus likely to be available?
A22DF0EWILGRLV,1,general,corona,Useful,C_48_U,8,"Regular face masks are not considered effective, and reserves need to be saved for people who are infected and for healthcare professionals.",Why does the CDC currently recommend that healthy people do not wear face masks?
A22DF0EWILGRLV,1,general,general,Useful,NC_33_U,8,Below eye level,Where in the supermarket can you usually find the cheaper items?
A22DF0EWILGRLV,1,general,general,Useful,NC_36_U,12,Potatos: rub a cut potato over your windshield before a frost to prevent freezing,What vegetable can prevent your windshield from freezing over in winter?
A22DF0EWILGRLV,1,general,general,Useful,NC_45_U,4,"Grapes or raisins, onions, avocado","In addition to chocolate, what other foods can be very harmful to dogs? "
