PID,sess,firstBlock,block,type,questionId,wait_duration,answer,question
A23G1L7KYHK9F2,1,general,corona,Not useful,C_02_NU,16,Three ,How many pandemics were there in the 20th century?
A23G1L7KYHK9F2,1,general,corona,Useful,C_31_U,16,"The virus is probably not sexually tansmissible, but infection does occurs when kissing.",Can the coronavirus be transmitted through sexual intercourse?
A23G1L7KYHK9F2,1,general,corona,Useful,C_48_U,4,Reserves need to be saved for people who are infected and for healthcare professionals.,Why does the CDC currently recommend that healthy people do not wear N95 face masks?
A23G1L7KYHK9F2,1,general,general,Not useful,NC_08_NU,8,The guppy,What common aquarium fish is named for the naturalist who discovered it in Trinidad in 1876?
A23G1L7KYHK9F2,1,general,general,Not useful,NC_12_NU,16,Come by her,"The title of the song ""Kumbaya"" is actually a distortion of what three-word phrase?"
A23G1L7KYHK9F2,1,general,general,Not useful,NC_23_NU,8,The Netherlands,In 1568 the Catholic Church sentenced the entire population of which nation to death as heretics?
A23G1L7KYHK9F2,1,general,general,Useful,NC_28_U,8,Microwave next to a glass of water,How can you soften brown sugar that has hardened into a lump?
A23G1L7KYHK9F2,1,general,general,Useful,NC_31_U,8,Sign up for a free USAA membership,How can people under 25 rent a car without paying extra fees?
A23G1L7KYHK9F2,1,general,general,Useful,NC_34_U,12,"Pineapple, by planting the green leaves",What tropical fruit can be regrown from its scraps?
A23G1L7KYHK9F2,1,general,general,Useful,NC_47_U,4,"Add baking soda, soak in advance, use a preassure cooker",What can you do to make dry beans cook faster?
A23G1L7KYHK9F2,1,general,third,MTurk,TB_34_MT,8,Evolution is usually very slow. Think about the similarities between apes and people. Future people are going to be as similar to us as we are to apes. ,What will future humans look like?
A23G1L7KYHK9F2,1,general,third,MTurk,TB_42_MT,4,"Galaxy formation occured in the aftermath of the Big Bang. Clustering and merging allows galaxies to accumulate mass, determining both their shape and structure. ",How do galaxies form?
A23G1L7KYHK9F2,1,general,third,MTurk,TB_43_MT,16,"Planets likely start off as grains of dust that then combine to form bigger rocks. They clear material from their path, leaving tracks of space empty but for fine dust.",How do planets form?
A23G1L7KYHK9F2,1,general,third,Trivia,TB_12_TR,16,It sits beside the Finger Lakes,"Why is Oneida Lake, near Syracuse, New York, sometimes called ""the thumb""?"
A23G1L7KYHK9F2,1,general,third,Trivia,TB_18_TR,4,Orville Wright,Who was flying the plane in which the first US airplane fatality occurred?
