PID,sess,firstBlock,block,type,questionId,wait_duration,answer,question
A248QG4DPULP46,1,corona,corona,Not useful,C_03_NU,4,"Fuburary 1st, 2020",When was the molecular structure of the coronovirus identfied?
A248QG4DPULP46,1,corona,corona,Not useful,C_11_NU,12,The Chicago of China,"Wuhan, China, the city in which the coronavirus was first identified, is commonly referred to as the chinese version of what American city?"
A248QG4DPULP46,1,corona,corona,Not useful,C_18_NU,4,They are able to filter out at least 95% of airborne particles,Why are N95 respirator face masks so named?
A248QG4DPULP46,1,corona,corona,Not useful,C_23_NU,4,They falsely claimed to cure or prevent coronavirus,"At the end of February, Amazon banned over a million products because of what?"
A248QG4DPULP46,1,corona,corona,Not useful,C_24_NU,16,Contagion,"According to media reports, which 2011 movie has seen a large increase in popularity in the wake of the new coronavirus?"
A248QG4DPULP46,1,corona,corona,Useful,C_45_U,16,"Pre-existing health conditions, including cardiovascular diseases and diabetes.",What did 75% of the people who have died from the new coronavirus have?
A248QG4DPULP46,1,corona,general,Not useful,NC_11_NU,8,Endeavour,What is the name of the ship that carried Captain Cook to Australia?
A248QG4DPULP46,1,corona,general,Not useful,NC_12_NU,16,Come by her,"The title of the song ""Kumbaya"" is actually a distortion of what three-word phrase?"
A248QG4DPULP46,1,corona,general,Not useful,NC_18_NU,4,A truce,What was put in place by the Ancient Greeks before and during all Olympic festivals?
A248QG4DPULP46,1,corona,general,Not useful,NC_19_NU,8,Smoke,"in 1908, New York City passed the Sullivan Ordinance which made it illegal for women to do what in public?"
A248QG4DPULP46,1,corona,general,Useful,NC_31_U,12,Sign up for a free USAA membership,How can people under 25 rent a car without paying extra fees?
A248QG4DPULP46,1,corona,general,Useful,NC_47_U,8,"Add baking soda, soak in advance, use a preassure cooker",What can you do to make dry beans cook faster?
A248QG4DPULP46,1,corona,general,Useful,NC_49_U,8,"Roll it along its long side. If it stops immediately, it's raw.",How can you tell if an egg is cooked without breaking it?
A248QG4DPULP46,1,corona,general,Useful,NC_51_U,4,White vinegar,What salad dressing ingredient is also an efficient weed killer?
A248QG4DPULP46,1,corona,third,MTurk,TB_31_MT,4,Scientists estimate that at the moment it is not. But with global warming it might become more feasilbe later in the 21st century.,How feasible would it be to colonize Antarctica?
A248QG4DPULP46,1,corona,third,MTurk,TB_39_MT,12,"There is radio emission around black holes. Scientists created a network of telescopes, capturing an image of a black hole by improving upon a technique that allows for the imaging of far-away objects",How was the recent picture of a black hole made?
A248QG4DPULP46,1,corona,third,MTurk,TB_40_MT,12,"NASA plans another crewed mission to the Moon by 2024, followed by a sustained presence  by 2028.  Russia is planning to begin building a human colony by 2037.",When could a lunar base be established?
A248QG4DPULP46,1,corona,third,Trivia,TB_01_TR,8,Canada,"What country is home to Roots, the company that outfits the U.S. Olympic team?"
A248QG4DPULP46,1,corona,third,Trivia,TB_14_TR,4,James Brown,"When asked to define ""cool,"" what two words did James Brown use?"
A248QG4DPULP46,1,corona,third,Trivia,TB_15_TR,12,Portia,The United States' first law school for woman was named for what cross-dressing Shakespearean character?
