PID,sess,firstBlock,block,type,questionId,wait_duration,answer,question
A24BGPSHNP81J2,1,corona,corona,Not useful,C_02_NU,16,Three ,How many pandemics were there in the 20th century?
A24BGPSHNP81J2,1,corona,corona,Not useful,C_15_NU,16,7.5 days,"In the early stages of the new coronavirus, the number of new cases doubled approximately every how many days?"
A24BGPSHNP81J2,1,corona,corona,Not useful,C_21_NU,8,An epidemic that has spread around the world,An epidemic is the outbreak of a disease that affects many people at the same time. What does pandemic mean?
A24BGPSHNP81J2,1,corona,corona,Useful,C_33_U,12,Soft surfaces are less likely to transmit the virus than hard surfaces.,Can the new coronavirus be transmitted by touching a soft surface like carpets or fabric?
A24BGPSHNP81J2,1,corona,corona,Useful,C_36_U,4,No. There is no evidence that regularly rinsing the nose with saline has protected people from infection with the new coronavirus.,Can regularly rinsing your nose with saline help prevent infection with the new coronavirus?
A24BGPSHNP81J2,1,corona,corona,Useful,C_48_U,4,Reserves need to be saved for people who are infected and for healthcare professionals.,Why does the CDC currently recommend that healthy people do not wear N95 face masks?
A24BGPSHNP81J2,1,corona,corona,Useful,C_51_U,8,Nasal or orab swab or a sample of sputum,What sort of specimen is needed to test for the new coronavirus? 
A24BGPSHNP81J2,1,corona,general,Not useful,NC_02_NU,16,Tiger Woods,"Who's the only two-time Sports Illustrated Sportsman of the Year, so named in 1996 and 2000?"
A24BGPSHNP81J2,1,corona,general,Not useful,NC_19_NU,16,Smoke,"in 1908, New York City passed the Sullivan Ordinance which made it illegal for women to do what in public?"
A24BGPSHNP81J2,1,corona,general,Not useful,NC_21_NU,12,The Pieta,Which was the only one of his sculptures that Michelangelo signed?
A24BGPSHNP81J2,1,corona,general,Not useful,NC_24_NU,12,State quarters,What's been released five times a year from January 1999 to fall 2008?
A24BGPSHNP81J2,1,corona,general,Not useful,NC_25_NU,12,Shark,"What animal is thought to be immune to most all diseases, including cancer?"
A24BGPSHNP81J2,1,corona,general,Useful,NC_31_U,4,Sign up for a free USAA membership,How can people under 25 rent a car without paying extra fees?
A24BGPSHNP81J2,1,corona,third,MTurk,TB_33_MT,8,"For SpaceX — the cheapest of NASA's new carriers — each pound costs approximately $27,000. So an average person of 160 pounds costs over $4,320,000.",How much does it cost to launch a person into space?
A24BGPSHNP81J2,1,corona,third,MTurk,TB_42_MT,4,"Galaxy formation occured in the aftermath of the Big Bang. Clustering and merging allows galaxies to accumulate mass, determining both their shape and structure. ",How do galaxies form?
A24BGPSHNP81J2,1,corona,third,Trivia,TB_01_TR,8,Canada,"What country is home to Roots, the company that outfits the U.S. Olympic team?"
A24BGPSHNP81J2,1,corona,third,Trivia,TB_03_TR,12,Mrs. Doubtfire's,What 1993 film's title character has the first name Euphegenia?
A24BGPSHNP81J2,1,corona,third,Trivia,TB_08_TR,16,Library of Congress,"In 1802, John Beckley became the librarian of what collection containing 740 books at the time?"
A24BGPSHNP81J2,1,corona,third,Trivia,TB_15_TR,4,Portia,The United States' first law school for woman was named for what cross-dressing Shakespearean character?
A24BGPSHNP81J2,1,corona,third,Trivia,TB_17_TR,12,"Third finger, left hand",What part of his body did Keith Richards insure for a million pounds?
A24BGPSHNP81J2,1,corona,third,Trivia,TB_18_TR,12,Orville Wright,Who was flying the plane in which the first US airplane fatality occurred?
