PID,sess,firstBlock,block,type,questionId,wait_duration,answer,question
A255RBA8P0K0XV,1,general,corona,Useful,C_37_U,8,There is no evidence from the current outbreak that eating garlic has protected people from the new coronavirus.,Can eating garlic help prevent infection with the new coronavirus?
A255RBA8P0K0XV,1,general,general,Not useful,NC_14_NU,16,Rod Serling,What famed TV personality wrote the screenplay for 1968's Planet of the Apes?
A255RBA8P0K0XV,1,general,general,Not useful,NC_16_NU,12,Newborns,The apgar score is used to measure the color and condition of what?
A255RBA8P0K0XV,1,general,general,Not useful,NC_23_NU,4,The Netherlands,In 1568 the Catholic Church sentenced the entire population of which nation to death as heretics?
A255RBA8P0K0XV,1,general,general,Not useful,NC_25_NU,16,Shark,"What animal is thought to be immune to most all diseases, including cancer?"
A255RBA8P0K0XV,1,general,general,Useful,NC_32_U,8,Take a picture of your fridge before leaving the house,What's a simple trick for telling whether your out of something when you're grocery shopping?
A255RBA8P0K0XV,1,general,third,Trivia,TB_11_TR,4,Mung beans,What kind of bean produces the Asian-style bean sprouts in the produce section of supermarkets?
A255RBA8P0K0XV,1,general,third,Trivia,TB_21_TR,8,New York,Which state has the zip code 12345?
