PID,sess,firstBlock,block,type,questionId,wait_duration,answer,question
A264ST1NX9PDLI,1,corona,corona,Not useful,C_05_NU,8,University of Washington,Which was the first US University to cancel classes becuase of the new coronavirus?
A264ST1NX9PDLI,1,corona,corona,Not useful,C_08_NU,16,Lombardy,What is the name of the county in Italy that had the first coronavirus outbreak?
A264ST1NX9PDLI,1,corona,corona,Not useful,C_15_NU,16,7.5 days,"In the early stages of the new coronavirus, the number of new cases doubled approximately every how many days?"
A264ST1NX9PDLI,1,corona,corona,Not useful,C_20_NU,4,"Rear Adm. Ziemer led the global health security team, responsible for leading the US response to pandemics.","In May 2018, Rear Admiral Timothy Ziemer left the White House staff and was not replaced. What was Rear Adm. Ziemer's responsibility in the White House?"
A264ST1NX9PDLI,1,corona,corona,Useful,C_33_U,8,Soft surfaces are less likely to transmit the virus than hard surfaces.,Can the new coronavirus be transmitted by touching a soft surface like carpets or fabric?
A264ST1NX9PDLI,1,corona,corona,Useful,C_49_U,16,"Approved filtering facemask respirators, such as the N95 respirator.","It is recommended that healthcare professionals who may be working in contact with people with the virus wear what, in addition to personal protective equipment on their hands and bodies?"
A264ST1NX9PDLI,1,corona,general,Not useful,NC_07_NU,12,Salt Lake City,In what city could you see the Seagull Monument at Temple Square?
A264ST1NX9PDLI,1,corona,general,Not useful,NC_20_NU,8,Russia,Which country has the most public libraries?
A264ST1NX9PDLI,1,corona,general,Useful,NC_31_U,12,Sign up for a free USAA membership,How can people under 25 rent a car without paying extra fees?
A264ST1NX9PDLI,1,corona,general,Useful,NC_32_U,12,Take a picture of your fridge before leaving the house,What's a simple trick for telling whether your out of something when you're grocery shopping?
A264ST1NX9PDLI,1,corona,general,Useful,NC_33_U,12,Below eye level,Where in the supermarket can you usually find the cheaper items?
A264ST1NX9PDLI,1,corona,general,Useful,NC_50_U,4,Spread beeswax over them and then blow dry until you can't see the beeswax anymore,What's an easy way to waterproof canvas shoes?
A264ST1NX9PDLI,1,corona,general,Useful,NC_51_U,16,White vinegar,What salad dressing ingredient is also an efficient weed killer?
A264ST1NX9PDLI,1,corona,third,MTurk,TB_24_MT,4,"Deep sea creatures must survive in extremely harsh conditions. They include the giant spider crab, frilled shark, and the atlantic wolffish",Which creatures live in deep sea?
A264ST1NX9PDLI,1,corona,third,MTurk,TB_28_MT,12,"Futurist Diamandis argues that due to improved powers of computation we are likely to see AI, improved medicine, and new ways of communicating.",What is to happen ten years from now?
A264ST1NX9PDLI,1,corona,third,MTurk,TB_30_MT,8,"The ""no hair theorem"" states that a black hole has only three properties: electric charge, angular momentum, and mass.",What is the composition of a black hole?
A264ST1NX9PDLI,1,corona,third,MTurk,TB_33_MT,8,"For SpaceX — the cheapest of NASA's new carriers — each pound costs approximately $27,000. So an average person of 160 pounds costs over $4,320,000.",How much does it cost to launch a person into space?
A264ST1NX9PDLI,1,corona,third,Trivia,TB_08_TR,16,Library of Congress,"In 1802, John Beckley became the librarian of what collection containing 740 books at the time?"
A264ST1NX9PDLI,1,corona,third,Trivia,TB_09_TR,8,The first email,"What did Ray Tomlinson send in Cambridge, Massachusetts, in late 1971?"
A264ST1NX9PDLI,1,corona,third,Trivia,TB_15_TR,12,Portia,The United States' first law school for woman was named for what cross-dressing Shakespearean character?
