PID,sess,firstBlock,block,type,questionId,wait_duration,answer,question
A26LOVXF4QZZCO,1,corona,corona,Not useful,C_04_NU,4,"It stands for ""COronaVIrus Disease 2019""","Why is the new coronavirus called ""COVID-19""? "
A26LOVXF4QZZCO,1,corona,corona,Not useful,C_05_NU,16,University of Washington,Which was the first US University to cancel classes becuase of the new coronavirus?
A26LOVXF4QZZCO,1,corona,corona,Not useful,C_13_NU,12,"The initial cases of the disease are thought to have been among people with a connection to a seafood wholesale market, which also sold live animals","Why is the virus believed to have zoonotic origin, i.e., to have potentially come from animals?"
A26LOVXF4QZZCO,1,corona,corona,Not useful,C_25_NU,8,The viruses have spikes on their outer surface that look like a crown (or corona in Latin),What is the supposed origin of the name coronavirus?
A26LOVXF4QZZCO,1,corona,corona,Useful,C_28_U,8,"Yes, by boosting the immune system",Does sleep make you more resistant to coronavirus infections?
A26LOVXF4QZZCO,1,corona,corona,Useful,C_30_U,8,More similar to the symptoms of the ful,"Are the new coronavirus symptoms more similar to the symptoms of flu, or of seasonal allergies?"
A26LOVXF4QZZCO,1,corona,corona,Useful,C_46_U,8,Remdesivir,"Which drug, which has been used as a treatment for the Ebola and Marburg viruses, might be promising as a treatment for this new coronavirus?"
A26LOVXF4QZZCO,1,corona,corona,Useful,C_52_U,4,No. To protect yourself against the new coronavirus washing your hands is the best preventive measure.,Are hand dryers effective in killing the new coronavirus?
A26LOVXF4QZZCO,1,corona,general,Not useful,NC_01_NU,4,Mike Powell,"In 1991, who finally broke Bob Beamon's decades-old long jump record?"
A26LOVXF4QZZCO,1,corona,general,Not useful,NC_02_NU,16,Tiger Woods,"Who's the only two-time Sports Illustrated Sportsman of the Year, so named in 1996 and 2000?"
A26LOVXF4QZZCO,1,corona,general,Not useful,NC_07_NU,8,Salt Lake City,In what city could you see the Seagull Monument at Temple Square?
A26LOVXF4QZZCO,1,corona,general,Useful,NC_27_U,16,White vinegar,What can you use instead of fabric softner to soften sheets and remove odours?
A26LOVXF4QZZCO,1,corona,general,Useful,NC_44_U,12,Doritos,What popular snack food is effective to use as kindling to start a fire?
A26LOVXF4QZZCO,1,corona,general,Useful,NC_50_U,8,Spread beeswax over them and then blow dry until you can't see the beeswax anymore,What's an easy way to waterproof canvas shoes?
A26LOVXF4QZZCO,1,corona,general,Useful,NC_52_U,4,"Tie your hair into a tight ponytail at the front of your head, and cut it.",How can you give yourself a layered haircut?
A26LOVXF4QZZCO,1,corona,third,MTurk,TB_28_MT,12,"Futurist Diamandis argues that due to improved powers of computation we are likely to see AI, improved medicine, and new ways of communicating.",What is to happen ten years from now?
A26LOVXF4QZZCO,1,corona,third,MTurk,TB_37_MT,8,Engineers and architects agree that the answer is positive. Houses for the non-rich are much better built today than they were built 500 years ago.,Are houses built better than they used to be?
A26LOVXF4QZZCO,1,corona,third,MTurk,TB_41_MT,4,"Deep learning-based machines, that can process unparalleled amount of information will allow AI to accomplish goals that were unimaginable until very recently. ",What are the most recent developments in artificial intelligence?
A26LOVXF4QZZCO,1,corona,third,Trivia,TB_07_TR,8,Tuxedo Club,What New York country club lent its name to the kind of dinner jacket first worn there in 1886?
A26LOVXF4QZZCO,1,corona,third,Trivia,TB_09_TR,8,The first email,"What did Ray Tomlinson send in Cambridge, Massachusetts, in late 1971?"
A26LOVXF4QZZCO,1,corona,third,Trivia,TB_18_TR,12,Orville Wright,Who was flying the plane in which the first US airplane fatality occurred?
A26LOVXF4QZZCO,1,corona,third,Trivia,TB_22_TR,12,Cheetah,Which is the only cat that cannot retract its claws?
