PID,sess,firstBlock,block,type,questionId,wait_duration,answer,question
A297ZA3UNS5GUX,1,corona,corona,Not useful,C_02_NU,8,Three ,How many pandemics were there in the 20th century?
A297ZA3UNS5GUX,1,corona,corona,Not useful,C_05_NU,16,University of Washington,Which was the first US University to cancel classes becuase of the new coronavirus?
A297ZA3UNS5GUX,1,corona,corona,Not useful,C_11_NU,16,The Chicago of China,"Wuhan, China, the city in which the coronavirus was first identified, is commonly referred to as the chinese version of what American city?"
A297ZA3UNS5GUX,1,corona,corona,Useful,C_31_U,8,"The virus is probably not sexually tansmissible, but infection does occurs when kissing.",Can the coronavirus be transmitted through sexual intercourse?
A297ZA3UNS5GUX,1,corona,corona,Useful,C_34_U,8,"The virus lives for up to a few days on surfaces, and so packages cannot transmit the virus.",Can the new coronavirus be transmitted on a package from an infected country?
A297ZA3UNS5GUX,1,corona,corona,Useful,C_46_U,8,Remdesivir,"Which drug, which has been used as a treatment for the Ebola and Marburg viruses, might be promising as a treatment for this new coronavirus?"
A297ZA3UNS5GUX,1,corona,general,Not useful,NC_13_NU,8,Bling bling,What term does rapper B.G. say he wishes he'd patented when he used it for the title of his massive 1999 hit?
A297ZA3UNS5GUX,1,corona,general,Not useful,NC_23_NU,8,The Netherlands,In 1568 the Catholic Church sentenced the entire population of which nation to death as heretics?
A297ZA3UNS5GUX,1,corona,general,Not useful,NC_25_NU,8,Shark,"What animal is thought to be immune to most all diseases, including cancer?"
A297ZA3UNS5GUX,1,corona,general,Not useful,NC_26_NU,4,Dark Side of the Moon,What album spent a record 741 weeks on Billboard's Top 200 Albums chart?
A297ZA3UNS5GUX,1,corona,general,Useful,NC_30_U,12,Floormats - put them under the wheels for traction,What item that can be found in any car can help you extract your car from mud or snow?
A297ZA3UNS5GUX,1,corona,general,Useful,NC_39_U,12,"At least $2,467 according to current research",How much money should I keep as an emergency fund?
A297ZA3UNS5GUX,1,corona,general,Useful,NC_46_U,8,"Dish soap, peroxide, and baking soda","While tomato juice probably will not work, what does work to remove skunk odor? "
A297ZA3UNS5GUX,1,corona,general,Useful,NC_50_U,8,Spread beeswax over them and then blow dry until you can't see the beeswax anymore,What's an easy way to waterproof canvas shoes?
A297ZA3UNS5GUX,1,corona,third,MTurk,TB_25_MT,12,"Scientists estimate that we are likely to see flying cars, and that computers may be able to read people's thoughts and emotions ",What will be the new technologies of future?
A297ZA3UNS5GUX,1,corona,third,MTurk,TB_39_MT,16,"There is radio emission around black holes. Scientists created a network of telescopes, capturing an image of a black hole by improving upon a technique that allows for the imaging of far-away objects",How was the recent picture of a black hole made?
A297ZA3UNS5GUX,1,corona,third,MTurk,TB_40_MT,12,"NASA plans another crewed mission to the Moon by 2024, followed by a sustained presence  by 2028.  Russia is planning to begin building a human colony by 2037.",When could a lunar base be established?
A297ZA3UNS5GUX,1,corona,third,Trivia,TB_07_TR,8,Tuxedo Club,What New York country club lent its name to the kind of dinner jacket first worn there in 1886?
A297ZA3UNS5GUX,1,corona,third,Trivia,TB_15_TR,12,Portia,The United States' first law school for woman was named for what cross-dressing Shakespearean character?
A297ZA3UNS5GUX,1,corona,third,Trivia,TB_19_TR,4,Ketchup,The only vegetable ice cream ever produced was what flavor?
