PID,sess,firstBlock,block,type,questionId,wait_duration,answer,question
A2D34R2A1L9JCH,1,general,corona,Not useful,C_24_NU,4,Contagion,"According to media reports, which 2011 movie has seen a large increase in popularity in the wake of the new coronavirus?"
A2D34R2A1L9JCH,1,general,corona,Useful,C_49_U,8,"Approved filtering facemask respirators, such as the N95 respirator.","It is recommended that healthcare professionals who may be working in contact with people with the virus wear what, in addition to personal protective equipment on their hands and bodies?"
A2D34R2A1L9JCH,1,general,general,Not useful,NC_05_NU,8,Matthew,Which of the four biblical Gospels was written by a tax collector?
A2D34R2A1L9JCH,1,general,general,Not useful,NC_12_NU,16,Come by her,"The title of the song ""Kumbaya"" is actually a distortion of what three-word phrase?"
A2D34R2A1L9JCH,1,general,general,Not useful,NC_20_NU,12,Russia,Which country has the most public libraries?
A2D34R2A1L9JCH,1,general,general,Useful,NC_28_U,12,Microwave next to a glass of water,How can you soften brown sugar that has hardened into a lump?
