PID,sess,firstBlock,block,type,questionId,wait_duration,answer,question
A2D70C0LG6MJH9,1,corona,corona,Not useful,C_22_NU,12,Contact tracing,What is the name of the process health authorities use to understand the sources of infection and to prevent further transmission?
A2D70C0LG6MJH9,1,corona,corona,Useful,C_28_U,8,"Yes, by boosting the immune system",Does sleep make you more resistant to coronavirus infections?
A2D70C0LG6MJH9,1,corona,corona,Useful,C_35_U,16,"The virus spreads through coughs and sneezes, there are no reports of transmission through mosquito bites.",Can the new coronavirus be transmitted through mosquito bites?
A2D70C0LG6MJH9,1,corona,corona,Useful,C_47_U,16,"Free of fever; no other symptoms, including cough; negative tests on at least two consecutive respiratory specimens at least 24 hours apart.",What are current Centers for Disease Control (CDC) guidelines for releasing someone from isolation?
A2D70C0LG6MJH9,1,corona,corona,Useful,C_48_U,8,Reserves need to be saved for people who are infected and for healthcare professionals.,Why does the CDC currently recommend that healthy people do not wear N95 face masks?
A2D70C0LG6MJH9,1,corona,corona,Useful,C_52_U,4,No. To protect yourself against the new coronavirus washing your hands is the best preventive measure.,Are hand dryers effective in killing the new coronavirus?
A2D70C0LG6MJH9,1,corona,general,Not useful,NC_23_NU,4,The Netherlands,In 1568 the Catholic Church sentenced the entire population of which nation to death as heretics?
A2D70C0LG6MJH9,1,corona,general,Useful,NC_34_U,4,"Pineapple, by planting the green leaves",What tropical fruit can be regrown from its scraps?
A2D70C0LG6MJH9,1,corona,general,Useful,NC_42_U,4,"Deprive it of oxygen by covering, pouring baking soda if the fire is small, or using a fire extinguisher if it's large.",How do you put out a grease fire? 
A2D70C0LG6MJH9,1,corona,general,Useful,NC_43_U,4,Between 105 and 54 days before the scheduled trip.,How far in advance of a trip is the most cost effective time to purchase a plane ticket? 
A2D70C0LG6MJH9,1,corona,general,Useful,NC_47_U,8,"Add baking soda, soak in advance, use a preassure cooker",What can you do to make dry beans cook faster?
A2D70C0LG6MJH9,1,corona,third,MTurk,TB_31_MT,16,Scientists estimate that at the moment it is not. But with global warming it might become more feasilbe later in the 21st century.,How feasible would it be to colonize Antarctica?
A2D70C0LG6MJH9,1,corona,third,MTurk,TB_32_MT,4,Sophisticated equipment is either lowered to the sea bottom or directly attached to submersible buoys and transmits to a research vessel that is equipped with state-of-the-art navigational instruments.,What are undersea researchers doing to explore the ocean floor?
A2D70C0LG6MJH9,1,corona,third,MTurk,TB_41_MT,16,"Deep learning-based machines, that can process unparalleled amount of information will allow AI to accomplish goals that were unimaginable until very recently. ",What are the most recent developments in artificial intelligence?
A2D70C0LG6MJH9,1,corona,third,Trivia,TB_12_TR,8,It sits beside the Finger Lakes,"Why is Oneida Lake, near Syracuse, New York, sometimes called ""the thumb""?"
A2D70C0LG6MJH9,1,corona,third,Trivia,TB_23_TR,4,Tooth,What is the only part of the body that can't repair itself?
