PID,sess,firstBlock,block,type,questionId,wait_duration,answer,question
A2DN53DIE3049T,1,general,corona,Not useful,C_02_NU,12,Three ,How many pandemics were there in the 20th century?
A2DN53DIE3049T,1,general,corona,Not useful,C_07_NU,12,Pink,What color latex gloves did Naomi Campbell wear to protect herself from coronavirus?
A2DN53DIE3049T,1,general,corona,Not useful,C_08_NU,4,Lombardy,What is the name of the county in Italy that had the first coronavirus outbreak?
A2DN53DIE3049T,1,general,corona,Not useful,C_12_NU,12,Diamond Princess,What was the name of the British cruise ship that was quarantined in Japanese waters?
A2DN53DIE3049T,1,general,corona,Not useful,C_21_NU,12,An epidemic that has spread around the world,An epidemic is the outbreak of a disease that affects many people at the same time. What does pandemic mean?
A2DN53DIE3049T,1,general,corona,Useful,C_32_U,16,"Healthcare professionals treating patients, in-home caregivers, and those who are already sick with the new coronavirus",Which three groups of people does the CDC recommend masks for?
A2DN53DIE3049T,1,general,corona,Useful,C_39_U,16,"No, antibiotics do not work against viruses, only bacteria.",Are antibiotics effective in preventing and treating the new coronavirus?
A2DN53DIE3049T,1,general,corona,Useful,C_42_U,4,"Fever, cough, shortness of breath.",What are the most common symptoms of the new coronavirus?
A2DN53DIE3049T,1,general,corona,Useful,C_52_U,4,No. To protect yourself against the new coronavirus washing your hands is the best preventive measure.,Are hand dryers effective in killing the new coronavirus?
A2DN53DIE3049T,1,general,general,Not useful,NC_07_NU,16,Salt Lake City,In what city could you see the Seagull Monument at Temple Square?
A2DN53DIE3049T,1,general,general,Not useful,NC_10_NU,12,K.D. Lang,What Canadian singer appeared on the first cover of Entertainment Weekly?
A2DN53DIE3049T,1,general,general,Not useful,NC_13_NU,4,Bling bling,What term does rapper B.G. say he wishes he'd patented when he used it for the title of his massive 1999 hit?
A2DN53DIE3049T,1,general,general,Not useful,NC_14_NU,12,Rod Serling,What famed TV personality wrote the screenplay for 1968's Planet of the Apes?
A2DN53DIE3049T,1,general,general,Not useful,NC_20_NU,4,Russia,Which country has the most public libraries?
A2DN53DIE3049T,1,general,general,Useful,NC_30_U,4,Floormats - put them under the wheels for traction,What item that can be found in any car can help you extract your car from mud or snow?
A2DN53DIE3049T,1,general,general,Useful,NC_33_U,8,Below eye level,Where in the supermarket can you usually find the cheaper items?
A2DN53DIE3049T,1,general,general,Useful,NC_43_U,12,Between 105 and 54 days before the scheduled trip.,How far in advance of a trip is the most cost effective time to purchase a plane ticket? 
A2DN53DIE3049T,1,general,general,Useful,NC_46_U,12,"Dish soap, peroxide, and baking soda","While tomato juice probably will not work, what does work to remove skunk odor? "
A2DN53DIE3049T,1,general,general,Useful,NC_48_U,8,"Drop it from a 3 inch height. If it bounces, it's dead.",How can you tell if a battery is dead without using any tools?
A2DN53DIE3049T,1,general,general,Useful,NC_52_U,4,"Tie your hair into a tight ponytail at the front of your head, and cut it.",How can you give yourself a layered haircut?
A2DN53DIE3049T,1,general,third,MTurk,TB_25_MT,4,"Scientists estimate that we are likely to see flying cars, and that computers may be able to read people's thoughts and emotions ",What will be the new technologies of future?
A2DN53DIE3049T,1,general,third,MTurk,TB_27_MT,12,"We do not know, of course. Yet, it is important to realize that there is no scientific proof for God's existence.  ",Does God exist?
A2DN53DIE3049T,1,general,third,MTurk,TB_31_MT,12,Scientists estimate that at the moment it is not. But with global warming it might become more feasilbe later in the 21st century.,How feasible would it be to colonize Antarctica?
A2DN53DIE3049T,1,general,third,MTurk,TB_36_MT,8,"For two reasons. One, they are too heavy. For example, the Space Shuttle weighed 2 thousand tons, yet a Boeing can only carry about 120 tons. Second, the thrust is likely to be too strong.",Why don't space rockets take off from a plane already in the air?
A2DN53DIE3049T,1,general,third,Trivia,TB_08_TR,4,Library of Congress,"In 1802, John Beckley became the librarian of what collection containing 740 books at the time?"
A2DN53DIE3049T,1,general,third,Trivia,TB_09_TR,12,The first email,"What did Ray Tomlinson send in Cambridge, Massachusetts, in late 1971?"
A2DN53DIE3049T,1,general,third,Trivia,TB_14_TR,16,James Brown,"When asked to define ""cool,"" what two words did James Brown use?"
A2DN53DIE3049T,1,general,third,Trivia,TB_15_TR,4,Portia,The United States' first law school for woman was named for what cross-dressing Shakespearean character?
A2DN53DIE3049T,1,general,third,Trivia,TB_18_TR,12,Orville Wright,Who was flying the plane in which the first US airplane fatality occurred?
