PID,sess,firstBlock,block,type,questionId,wait_duration,answer,question
A2DQFF9PSUG2G,1,general,corona,Not useful,C_02_NU,4,Three ,How many pandemics were there in the 20th century?
A2DQFF9PSUG2G,1,general,corona,Not useful,C_26_NU,4,Severe acute respiratory syndrome,The official name of the new coronavirus is SARS-CoV-2. What does SARS stand for?
A2DQFF9PSUG2G,1,general,corona,Useful,C_51_U,4,Nasal or orab swab or a sample of sputum,What sort of specimen is needed to test for the new coronavirus? 
A2DQFF9PSUG2G,1,general,general,Not useful,NC_12_NU,8,Come by her,"The title of the song ""Kumbaya"" is actually a distortion of what three-word phrase?"
A2DQFF9PSUG2G,1,general,general,Not useful,NC_16_NU,8,Newborns,The apgar score is used to measure the color and condition of what?
A2DQFF9PSUG2G,1,general,general,Not useful,NC_25_NU,8,Shark,"What animal is thought to be immune to most all diseases, including cancer?"
A2DQFF9PSUG2G,1,general,general,Useful,NC_30_U,4,Floormats - put them under the wheels for traction,What item that can be found in any car can help you extract your car from mud or snow?
A2DQFF9PSUG2G,1,general,general,Useful,NC_33_U,8,Below eye level,Where in the supermarket can you usually find the cheaper items?
A2DQFF9PSUG2G,1,general,general,Useful,NC_46_U,4,"Dish soap, peroxide, and baking soda","While tomato juice probably will not work, what does work to remove skunk odor? "
A2DQFF9PSUG2G,1,general,third,MTurk,TB_34_MT,4,Evolution is usually very slow. Think about the similarities between apes and people. Future people are going to be as similar to us as we are to apes. ,What will future humans look like?
A2DQFF9PSUG2G,1,general,third,MTurk,TB_36_MT,12,"For two reasons. One, they are too heavy. For example, the Space Shuttle weighed 2 thousand tons, yet a Boeing can only carry about 120 tons. Second, the thrust is likely to be too strong.",Why don't space rockets take off from a plane already in the air?
A2DQFF9PSUG2G,1,general,third,Trivia,TB_04_TR,4,Phil Knight,"In 1964, who founded Blue Ribbon Sports, which later went on to become Nike?"
A2DQFF9PSUG2G,1,general,third,Trivia,TB_20_TR,8,Rafflesia (corpse lily),What is the largest flower in the world?
