PID,sess,firstBlock,block,type,questionId,wait_duration,answer,question
A2EJ06OGI9671Q,1,corona,general,Useful,NC_36_U,16,Potatos: rub a cut potato over your windshield before a frost to prevent freezing,What vegetable can prevent your windshield from freezing over in winter?
A2EJ06OGI9671Q,1,corona,general,Useful,NC_37_U,4,"Over the past 150 year, real estate, if you rent it out",What's a better investment: stocks or real estate?
A2EJ06OGI9671Q,1,corona,general,Useful,NC_40_U,8,Squint your eyes,How do you make your smile look more genuine in photographs?
A2EJ06OGI9671Q,1,corona,general,Useful,NC_51_U,4,White vinegar,What salad dressing ingredient is also an efficient weed killer?
A2EJ06OGI9671Q,1,corona,third,MTurk,TB_28_MT,12,"Futurist Diamandis argues that due to improved powers of computation we are likely to see AI, improved medicine, and new ways of communicating.",What is to happen ten years from now?
A2EJ06OGI9671Q,1,corona,third,MTurk,TB_33_MT,4,"For SpaceX — the cheapest of NASA's new carriers — each pound costs approximately $27,000. So an average person of 160 pounds costs over $4,320,000.",How much does it cost to launch a person into space?
A2EJ06OGI9671Q,1,corona,third,Trivia,TB_17_TR,4,"Third finger, left hand",What part of his body did Keith Richards insure for a million pounds?
