PID,sess,firstBlock,block,type,questionId,wait_duration,answer,question
A2EOMP0EJUE36Q,1,general,corona,Not useful,C_01_NU,4,"Animals, probably bats",What is the source of coronavirus in humans?
A2EOMP0EJUE36Q,1,general,corona,Not useful,C_04_NU,4,"It stands for ""COronaVIrus Disease 2019""","Why is the new coronavirus called ""COVID-19""? "
A2EOMP0EJUE36Q,1,general,corona,Not useful,C_17_NU,12,"Locations, people, or animals","The name for the new disease COVID-19 adheres to WHO best practices in disease naming, which include guidelines to not name disease after what?"
A2EOMP0EJUE36Q,1,general,corona,Not useful,C_19_NU,4,Strategic National Stockpile,What is the name of the repository of drugs and supplies the U.S. government is supposed to maintain in case of a public health emergency?
A2EOMP0EJUE36Q,1,general,corona,Useful,C_31_U,16,"The virus is probably not sexually tansmissible, but infection does occurs when kissing.",Can the coronavirus be transmitted through sexual intercourse?
A2EOMP0EJUE36Q,1,general,corona,Useful,C_34_U,4,"The virus lives for up to a few days on surfaces, and so packages cannot transmit the virus.",Can the new coronavirus be transmitted on a package from an infected country?
A2EOMP0EJUE36Q,1,general,corona,Useful,C_50_U,16,Washington,The first US death from the new coronavirus occurred in which state?
A2EOMP0EJUE36Q,1,general,general,Not useful,NC_01_NU,4,Mike Powell,"In 1991, who finally broke Bob Beamon's decades-old long jump record?"
A2EOMP0EJUE36Q,1,general,general,Not useful,NC_04_NU,16,Edward Albee,"Who wrote ""Who's Afraid of Virginia Woolf?"""
A2EOMP0EJUE36Q,1,general,general,Not useful,NC_12_NU,12,Come by her,"The title of the song ""Kumbaya"" is actually a distortion of what three-word phrase?"
A2EOMP0EJUE36Q,1,general,general,Not useful,NC_15_NU,8,Albert Einstein,Who beat out FDR and Gandhi to be named Time's Person of the Century in 1999?
A2EOMP0EJUE36Q,1,general,general,Not useful,NC_22_NU,4,Steamboat Geyser,"Which Yellowstone geyser, with eruptions 100 fee taller than Old Faithful's, is the world's tallest?"
A2EOMP0EJUE36Q,1,general,general,Not useful,NC_23_NU,8,The Netherlands,In 1568 the Catholic Church sentenced the entire population of which nation to death as heretics?
A2EOMP0EJUE36Q,1,general,general,Useful,NC_31_U,12,Sign up for a free USAA membership,How can people under 25 rent a car without paying extra fees?
A2EOMP0EJUE36Q,1,general,general,Useful,NC_40_U,4,Squint your eyes,How do you make your smile look more genuine in photographs?
A2EOMP0EJUE36Q,1,general,general,Useful,NC_41_U,4,"April 8th, 2024",When is the next total solar eclipse visible in North America projected to occur? 
A2EOMP0EJUE36Q,1,general,third,MTurk,TB_28_MT,16,"Futurist Diamandis argues that due to improved powers of computation we are likely to see AI, improved medicine, and new ways of communicating.",What is to happen ten years from now?
A2EOMP0EJUE36Q,1,general,third,MTurk,TB_35_MT,4,Prototypes already exist. Technological estimates suggest that definitely within the next twenty years -- although the challenges are great.,When will we have flying cars?
A2EOMP0EJUE36Q,1,general,third,MTurk,TB_42_MT,4,"Galaxy formation occured in the aftermath of the Big Bang. Clustering and merging allows galaxies to accumulate mass, determining both their shape and structure. ",How do galaxies form?
A2EOMP0EJUE36Q,1,general,third,Trivia,TB_02_TR,16,Ivory Coast's,"The world's largest church is Our Lady of Peace Basilica in Yamoussoukro, what nation's capital?"
A2EOMP0EJUE36Q,1,general,third,Trivia,TB_04_TR,8,Phil Knight,"In 1964, who founded Blue Ribbon Sports, which later went on to become Nike?"
A2EOMP0EJUE36Q,1,general,third,Trivia,TB_05_TR,4,Hong Kong,What city's harbor is overlooked by Victoria Peak?
A2EOMP0EJUE36Q,1,general,third,Trivia,TB_09_TR,4,The first email,"What did Ray Tomlinson send in Cambridge, Massachusetts, in late 1971?"
A2EOMP0EJUE36Q,1,general,third,Trivia,TB_15_TR,12,Portia,The United States' first law school for woman was named for what cross-dressing Shakespearean character?
A2EOMP0EJUE36Q,1,general,third,Trivia,TB_20_TR,12,Rafflesia (corpse lily),What is the largest flower in the world?
