PID,sess,firstBlock,block,type,questionId,wait_duration,answer,question
A2F2DDH12YU4AK,1,corona,corona,Not useful,C_07_NU,12,Pink,What color latex gloves did Naomi Campbell wear to protect herself from coronavirus?
A2F2DDH12YU4AK,1,corona,corona,Not useful,C_19_NU,12,Strategic National Stockpile,What is the name of the repository of drugs and supplies the U.S. government is supposed to maintain in case of a public health emergency?
A2F2DDH12YU4AK,1,corona,corona,Useful,C_28_U,4,"Yes, by boosting the immune system",Does sleep make you more resistant to coronavirus infections?
A2F2DDH12YU4AK,1,corona,corona,Useful,C_50_U,16,Washington,The first US death from the new coronavirus occurred in which state?
A2F2DDH12YU4AK,1,corona,general,Not useful,NC_01_NU,16,Mike Powell,"In 1991, who finally broke Bob Beamon's decades-old long jump record?"
A2F2DDH12YU4AK,1,corona,general,Not useful,NC_03_NU,4,Red River,"What name is shared by the rivers that run through Denison, TX and Hanoi, Vietnam?"
A2F2DDH12YU4AK,1,corona,general,Not useful,NC_08_NU,12,The guppy,What common aquarium fish is named for the naturalist who discovered it in Trinidad in 1876?
A2F2DDH12YU4AK,1,corona,general,Not useful,NC_17_NU,8,Gilbert Van Camp,What Indianapolis grocer made his name by selling canned pork and beans to U.S. troops during the Civil War?
A2F2DDH12YU4AK,1,corona,general,Not useful,NC_18_NU,4,A truce,What was put in place by the Ancient Greeks before and during all Olympic festivals?
A2F2DDH12YU4AK,1,corona,general,Not useful,NC_19_NU,8,Smoke,"in 1908, New York City passed the Sullivan Ordinance which made it illegal for women to do what in public?"
A2F2DDH12YU4AK,1,corona,general,Not useful,NC_26_NU,8,Dark Side of the Moon,What album spent a record 741 weeks on Billboard's Top 200 Albums chart?
A2F2DDH12YU4AK,1,corona,general,Useful,NC_32_U,4,Take a picture of your fridge before leaving the house,What's a simple trick for telling whether your out of something when you're grocery shopping?
A2F2DDH12YU4AK,1,corona,third,MTurk,TB_28_MT,12,"Futurist Diamandis argues that due to improved powers of computation we are likely to see AI, improved medicine, and new ways of communicating.",What is to happen ten years from now?
A2F2DDH12YU4AK,1,corona,third,Trivia,TB_14_TR,12,James Brown,"When asked to define ""cool,"" what two words did James Brown use?"
A2F2DDH12YU4AK,1,corona,third,Trivia,TB_15_TR,8,Portia,The United States' first law school for woman was named for what cross-dressing Shakespearean character?
A2F2DDH12YU4AK,1,corona,third,Trivia,TB_17_TR,8,"Third finger, left hand",What part of his body did Keith Richards insure for a million pounds?
A2F2DDH12YU4AK,1,corona,third,Trivia,TB_19_TR,16,Ketchup,The only vegetable ice cream ever produced was what flavor?
A2F2DDH12YU4AK,1,corona,third,Trivia,TB_22_TR,12,Cheetah,Which is the only cat that cannot retract its claws?
