PID,sess,firstBlock,block,type,questionId,wait_duration,answer,question
A2FWZR12905V6J,1,corona,corona,Not useful,C_13_NU,4,"The initial cases of the disease are thought to have been among people with a connection to a seafood wholesale market, which also sold live animals","Why is the virus believed to have zoonotic origin, i.e., to have potentially come from animals?"
A2FWZR12905V6J,1,corona,corona,Not useful,C_14_NU,16,"January 30, 2020",On what date did the World Health Organization declare the new coronavirus outbreak to be a Public Health Emergency of International Concern?
A2FWZR12905V6J,1,corona,corona,Not useful,C_24_NU,4,Contagion,"According to media reports, which 2011 movie has seen a large increase in popularity in the wake of the new coronavirus?"
A2FWZR12905V6J,1,corona,corona,Not useful,C_26_NU,16,Severe acute respiratory syndrome,The official name of the new coronavirus is SARS-CoV-2. What does SARS stand for?
A2FWZR12905V6J,1,corona,corona,Useful,C_27_U,4,Washing your hands frequently,What is the most effective measure to prevent infection with the coronavirus?
A2FWZR12905V6J,1,corona,corona,Useful,C_34_U,12,"The virus lives for up to a few days on surfaces, and so packages cannot transmit the virus.",Can the new coronavirus be transmitted on a package from an infected country?
A2FWZR12905V6J,1,corona,corona,Useful,C_39_U,8,"No, antibiotics do not work against viruses, only bacteria.",Are antibiotics effective in preventing and treating the new coronavirus?
A2FWZR12905V6J,1,corona,corona,Useful,C_41_U,8,Studies suggest that coronaviruses (including preliminary information on the new virus) may persist on surfaces for a few hours or up to several days.,How long does the new coronavirus survive on surfaces?
A2FWZR12905V6J,1,corona,general,Not useful,NC_03_NU,4,Red River,"What name is shared by the rivers that run through Denison, TX and Hanoi, Vietnam?"
A2FWZR12905V6J,1,corona,general,Not useful,NC_09_NU,16,Captain Cook,"Who christened Hawaii ""the Sandwich Islands"" in 1778?"
A2FWZR12905V6J,1,corona,general,Not useful,NC_11_NU,8,Endeavour,What is the name of the ship that carried Captain Cook to Australia?
A2FWZR12905V6J,1,corona,general,Not useful,NC_17_NU,8,Gilbert Van Camp,What Indianapolis grocer made his name by selling canned pork and beans to U.S. troops during the Civil War?
A2FWZR12905V6J,1,corona,general,Useful,NC_35_U,4,Wrap a wet paper towel around the bottle and put in the fridge,How can you cool beverages more quickly?
A2FWZR12905V6J,1,corona,general,Useful,NC_36_U,16,Potatos: rub a cut potato over your windshield before a frost to prevent freezing,What vegetable can prevent your windshield from freezing over in winter?
A2FWZR12905V6J,1,corona,general,Useful,NC_44_U,12,Doritos,What popular snack food is effective to use as kindling to start a fire?
A2FWZR12905V6J,1,corona,general,Useful,NC_49_U,8,"Roll it along its long side. If it stops immediately, it's raw.",How can you tell if an egg is cooked without breaking it?
A2FWZR12905V6J,1,corona,third,MTurk,TB_27_MT,12,"We do not know, of course. Yet, it is important to realize that there is no scientific proof for God's existence.  ",Does God exist?
A2FWZR12905V6J,1,corona,third,MTurk,TB_32_MT,12,Sophisticated equipment is either lowered to the sea bottom or directly attached to submersible buoys and transmits to a research vessel that is equipped with state-of-the-art navigational instruments.,What are undersea researchers doing to explore the ocean floor?
A2FWZR12905V6J,1,corona,third,MTurk,TB_33_MT,12,"For SpaceX — the cheapest of NASA's new carriers — each pound costs approximately $27,000. So an average person of 160 pounds costs over $4,320,000.",How much does it cost to launch a person into space?
A2FWZR12905V6J,1,corona,third,MTurk,TB_37_MT,16,Engineers and architects agree that the answer is positive. Houses for the non-rich are much better built today than they were built 500 years ago.,Are houses built better than they used to be?
A2FWZR12905V6J,1,corona,third,Trivia,TB_06_TR,12,Xanadu,What 1980 film is named for the legendary square-shaped capital of Kublai Khan?
A2FWZR12905V6J,1,corona,third,Trivia,TB_08_TR,8,Library of Congress,"In 1802, John Beckley became the librarian of what collection containing 740 books at the time?"
A2FWZR12905V6J,1,corona,third,Trivia,TB_13_TR,4,Java,On what namesake Asian island are the first Homo erectus fossils found?
A2FWZR12905V6J,1,corona,third,Trivia,TB_20_TR,8,Rafflesia (corpse lily),What is the largest flower in the world?
