PID,sess,firstBlock,block,type,questionId,wait_duration,answer,question
A2GOYSTIL3LOV1,1,corona,corona,Not useful,C_11_NU,4,The Chicago of China,"Wuhan, China, the city in which the coronavirus was first identified, is commonly referred to as the chinese version of what American city?"
A2GOYSTIL3LOV1,1,corona,corona,Not useful,C_13_NU,12,"The initial cases of the disease are thought to have been among people with a connection to a seafood wholesale market, which also sold live animals","Why is the virus believed to have zoonotic origin, i.e., to have potentially come from animals?"
A2GOYSTIL3LOV1,1,corona,corona,Not useful,C_16_NU,12,Bats and pangolins,What other animals have been found to have viruses with highly similar genome sequences as the current coronavirus?
A2GOYSTIL3LOV1,1,corona,corona,Useful,C_32_U,16,"Healthcare professionals treating patients, in-home caregivers, and those who are already sick with the new coronavirus",Which three groups of people does the CDC recommend masks for?
A2GOYSTIL3LOV1,1,corona,corona,Useful,C_37_U,8,There is no evidence from the current outbreak that eating garlic has protected people from the new coronavirus.,Can eating garlic help prevent infection with the new coronavirus?
A2GOYSTIL3LOV1,1,corona,corona,Useful,C_52_U,4,No. To protect yourself against the new coronavirus washing your hands is the best preventive measure.,Are hand dryers effective in killing the new coronavirus?
A2GOYSTIL3LOV1,1,corona,general,Not useful,NC_13_NU,8,Bling bling,What term does rapper B.G. say he wishes he'd patented when he used it for the title of his massive 1999 hit?
A2GOYSTIL3LOV1,1,corona,general,Not useful,NC_15_NU,4,Albert Einstein,Who beat out FDR and Gandhi to be named Time's Person of the Century in 1999?
A2GOYSTIL3LOV1,1,corona,general,Not useful,NC_24_NU,4,State quarters,What's been released five times a year from January 1999 to fall 2008?
A2GOYSTIL3LOV1,1,corona,general,Useful,NC_36_U,8,Potatos: rub a cut potato over your windshield before a frost to prevent freezing,What vegetable can prevent your windshield from freezing over in winter?
A2GOYSTIL3LOV1,1,corona,general,Useful,NC_45_U,16,"Grapes or raisins, onions, avocado","In addition to chocolate, what other foods can be very harmful to dogs? "
A2GOYSTIL3LOV1,1,corona,general,Useful,NC_48_U,4,"Drop it from a 3 inch height. If it bounces, it's dead.",How can you tell if a battery is dead without using any tools?
A2GOYSTIL3LOV1,1,corona,general,Useful,NC_51_U,16,White vinegar,What salad dressing ingredient is also an efficient weed killer?
A2GOYSTIL3LOV1,1,corona,third,MTurk,TB_26_MT,12,"Sometimes, it is easy to know, but science revealed that self-insight is prblematic. It is often very helpful to ask friends and family ",How do you know if you're happy?
A2GOYSTIL3LOV1,1,corona,third,MTurk,TB_30_MT,8,"The ""no hair theorem"" states that a black hole has only three properties: electric charge, angular momentum, and mass.",What is the composition of a black hole?
A2GOYSTIL3LOV1,1,corona,third,MTurk,TB_42_MT,12,"Galaxy formation occured in the aftermath of the Big Bang. Clustering and merging allows galaxies to accumulate mass, determining both their shape and structure. ",How do galaxies form?
A2GOYSTIL3LOV1,1,corona,third,Trivia,TB_03_TR,4,Mrs. Doubtfire's,What 1993 film's title character has the first name Euphegenia?
A2GOYSTIL3LOV1,1,corona,third,Trivia,TB_13_TR,12,Java,On what namesake Asian island are the first Homo erectus fossils found?
A2GOYSTIL3LOV1,1,corona,third,Trivia,TB_15_TR,12,Portia,The United States' first law school for woman was named for what cross-dressing Shakespearean character?
