PID,sess,firstBlock,block,type,questionId,wait_duration,answer,question
A2HQPA08B2DM7X,1,general,corona,Not useful,C_06_NU,16,Gwyneth Paltrow,"Which celebrity said about the new coronavirus ""I've already been in this movie""?"
A2HQPA08B2DM7X,1,general,corona,Not useful,C_24_NU,12,Contagion,"According to media reports, which 2011 movie has seen a large increase in popularity in the wake of the new coronavirus?"
A2HQPA08B2DM7X,1,general,corona,Useful,C_36_U,12,No. There is no evidence that regularly rinsing the nose with saline has protected people from infection with the new coronavirus.,Can regularly rinsing your nose with saline help prevent infection with the new coronavirus?
A2HQPA08B2DM7X,1,general,general,Not useful,NC_14_NU,8,Rod Serling,What famed TV personality wrote the screenplay for 1968's Planet of the Apes?
A2HQPA08B2DM7X,1,general,general,Not useful,NC_23_NU,12,The Netherlands,In 1568 the Catholic Church sentenced the entire population of which nation to death as heretics?
A2HQPA08B2DM7X,1,general,general,Useful,NC_27_U,16,White vinegar,What can you use instead of fabric softner to soften sheets and remove odours?
A2HQPA08B2DM7X,1,general,general,Useful,NC_32_U,4,Take a picture of your fridge before leaving the house,What's a simple trick for telling whether your out of something when you're grocery shopping?
A2HQPA08B2DM7X,1,general,general,Useful,NC_40_U,8,Squint your eyes,How do you make your smile look more genuine in photographs?
A2HQPA08B2DM7X,1,general,general,Useful,NC_51_U,12,White vinegar,What salad dressing ingredient is also an efficient weed killer?
A2HQPA08B2DM7X,1,general,third,MTurk,TB_34_MT,4,Evolution is usually very slow. Think about the similarities between apes and people. Future people are going to be as similar to us as we are to apes. ,What will future humans look like?
A2HQPA08B2DM7X,1,general,third,MTurk,TB_37_MT,12,Engineers and architects agree that the answer is positive. Houses for the non-rich are much better built today than they were built 500 years ago.,Are houses built better than they used to be?
A2HQPA08B2DM7X,1,general,third,MTurk,TB_40_MT,8,"NASA plans another crewed mission to the Moon by 2024, followed by a sustained presence  by 2028.  Russia is planning to begin building a human colony by 2037.",When could a lunar base be established?
A2HQPA08B2DM7X,1,general,third,Trivia,TB_12_TR,4,It sits beside the Finger Lakes,"Why is Oneida Lake, near Syracuse, New York, sometimes called ""the thumb""?"
A2HQPA08B2DM7X,1,general,third,Trivia,TB_20_TR,8,Rafflesia (corpse lily),What is the largest flower in the world?
A2HQPA08B2DM7X,1,general,third,Trivia,TB_23_TR,4,Tooth,What is the only part of the body that can't repair itself?
