PID,sess,firstBlock,block,type,questionId,wait_duration,answer,question
A2I37S7GQR6X1H,1,general,corona,Not useful,C_03_NU,16,"Fuburary 1st, 2020",When was the molecular structure of the coronovirus identfied?
A2I37S7GQR6X1H,1,general,corona,Not useful,C_07_NU,16,Pink,What color latex gloves did Naomi Campbell wear to protect herself from coronavirus?
A2I37S7GQR6X1H,1,general,corona,Useful,C_32_U,12,"Healthcare professionals treating patients, in-home caregivers, and those who are already sick with the new coronavirus",Which three groups of people does the CDC recommend masks for?
A2I37S7GQR6X1H,1,general,corona,Useful,C_46_U,12,Remdesivir,"Which drug, which has been used as a treatment for the Ebola and Marburg viruses, might be promising as a treatment for this new coronavirus?"
A2I37S7GQR6X1H,1,general,corona,Useful,C_49_U,16,"Approved filtering facemask respirators, such as the N95 respirator.","It is recommended that healthcare professionals who may be working in contact with people with the virus wear what, in addition to personal protective equipment on their hands and bodies?"
A2I37S7GQR6X1H,1,general,general,Not useful,NC_01_NU,16,Mike Powell,"In 1991, who finally broke Bob Beamon's decades-old long jump record?"
A2I37S7GQR6X1H,1,general,general,Not useful,NC_12_NU,4,Come by her,"The title of the song ""Kumbaya"" is actually a distortion of what three-word phrase?"
A2I37S7GQR6X1H,1,general,general,Not useful,NC_25_NU,16,Shark,"What animal is thought to be immune to most all diseases, including cancer?"
A2I37S7GQR6X1H,1,general,general,Not useful,NC_26_NU,4,Dark Side of the Moon,What album spent a record 741 weeks on Billboard's Top 200 Albums chart?
A2I37S7GQR6X1H,1,general,general,Useful,NC_29_U,16,"Freeze before chopping, or hold a piece of bread in your mouth, half sticking out",How to chop an onion without crying?
A2I37S7GQR6X1H,1,general,general,Useful,NC_32_U,16,Take a picture of your fridge before leaving the house,What's a simple trick for telling whether your out of something when you're grocery shopping?
A2I37S7GQR6X1H,1,general,general,Useful,NC_42_U,16,"Deprive it of oxygen by covering, pouring baking soda if the fire is small, or using a fire extinguisher if it's large.",How do you put out a grease fire? 
A2I37S7GQR6X1H,1,general,third,MTurk,TB_26_MT,16,"Sometimes, it is easy to know, but science revealed that self-insight is prblematic. It is often very helpful to ask friends and family ",How do you know if you're happy?
A2I37S7GQR6X1H,1,general,third,MTurk,TB_32_MT,12,Sophisticated equipment is either lowered to the sea bottom or directly attached to submersible buoys and transmits to a research vessel that is equipped with state-of-the-art navigational instruments.,What are undersea researchers doing to explore the ocean floor?
A2I37S7GQR6X1H,1,general,third,MTurk,TB_35_MT,12,Prototypes already exist. Technological estimates suggest that definitely within the next twenty years -- although the challenges are great.,When will we have flying cars?
A2I37S7GQR6X1H,1,general,third,MTurk,TB_40_MT,16,"NASA plans another crewed mission to the Moon by 2024, followed by a sustained presence  by 2028.  Russia is planning to begin building a human colony by 2037.",When could a lunar base be established?
A2I37S7GQR6X1H,1,general,third,Trivia,TB_09_TR,4,The first email,"What did Ray Tomlinson send in Cambridge, Massachusetts, in late 1971?"
A2I37S7GQR6X1H,1,general,third,Trivia,TB_12_TR,4,It sits beside the Finger Lakes,"Why is Oneida Lake, near Syracuse, New York, sometimes called ""the thumb""?"
A2I37S7GQR6X1H,1,general,third,Trivia,TB_15_TR,8,Portia,The United States' first law school for woman was named for what cross-dressing Shakespearean character?
A2I37S7GQR6X1H,1,general,third,Trivia,TB_23_TR,4,Tooth,What is the only part of the body that can't repair itself?
