PID,sess,firstBlock,block,type,questionId,wait_duration,answer,question
A2KED6T6BO622W,1,corona,corona,Useful,C_35_U,8,"The virus spreads through coughs and sneezes, there are no reports of transmission through mosquito bites.",Can the new coronavirus be transmitted through mosquito bites?
A2KED6T6BO622W,1,corona,corona,Useful,C_37_U,4,There is no evidence from the current outbreak that eating garlic has protected people from the new coronavirus.,Can eating garlic help prevent infection with the new coronavirus?
A2KED6T6BO622W,1,corona,general,Not useful,NC_26_NU,16,Dark Side of the Moon,What album spent a record 741 weeks on Billboard's Top 200 Albums chart?
A2KED6T6BO622W,1,corona,third,MTurk,TB_28_MT,8,"Futurist Diamandis argues that due to improved powers of computation we are likely to see AI, improved medicine, and new ways of communicating.",What is to happen ten years from now?
A2KED6T6BO622W,1,corona,third,MTurk,TB_30_MT,12,"The ""no hair theorem"" states that a black hole has only three properties: electric charge, angular momentum, and mass.",What is the composition of a black hole?
A2KED6T6BO622W,1,corona,third,Trivia,TB_23_TR,4,Tooth,What is the only part of the body that can't repair itself?
