PID,sess,firstBlock,block,type,questionId,wait_duration,answer,question
A2KWADVDUGF4JG,1,corona,corona,Not useful,C_05_NU,12,University of Washington,Which was the first US University to cancel classes becuase of the new coronavirus?
A2KWADVDUGF4JG,1,corona,corona,Not useful,C_08_NU,8,Lombardy,What is the name of the county in Italy that had the first coronavirus outbreak?
A2KWADVDUGF4JG,1,corona,corona,Not useful,C_11_NU,12,The Chicago of China,"Wuhan, China, the city in which the coronavirus was first identified, is commonly referred to as the chinese version of what American city?"
A2KWADVDUGF4JG,1,corona,corona,Not useful,C_15_NU,16,7.5 days,"In the early stages of the new coronavirus, the number of new cases doubled approximately every how many days?"
A2KWADVDUGF4JG,1,corona,corona,Useful,C_47_U,8,"Free of fever; no other symptoms, including cough; negative tests on at least two consecutive respiratory specimens at least 24 hours apart.",What are current Centers for Disease Control (CDC) guidelines for releasing someone from isolation?
A2KWADVDUGF4JG,1,corona,corona,Useful,C_50_U,8,Washington,The first US death from the new coronavirus occurred in which state?
A2KWADVDUGF4JG,1,corona,general,Not useful,NC_04_NU,12,Edward Albee,"Who wrote ""Who's Afraid of Virginia Woolf?"""
A2KWADVDUGF4JG,1,corona,general,Not useful,NC_11_NU,4,Endeavour,What is the name of the ship that carried Captain Cook to Australia?
A2KWADVDUGF4JG,1,corona,general,Not useful,NC_22_NU,12,Steamboat Geyser,"Which Yellowstone geyser, with eruptions 100 fee taller than Old Faithful's, is the world's tallest?"
A2KWADVDUGF4JG,1,corona,general,Not useful,NC_26_NU,8,Dark Side of the Moon,What album spent a record 741 weeks on Billboard's Top 200 Albums chart?
A2KWADVDUGF4JG,1,corona,general,Useful,NC_29_U,8,"Freeze before chopping, or hold a piece of bread in your mouth, half sticking out",How to chop an onion without crying?
A2KWADVDUGF4JG,1,corona,general,Useful,NC_36_U,8,Potatos: rub a cut potato over your windshield before a frost to prevent freezing,What vegetable can prevent your windshield from freezing over in winter?
A2KWADVDUGF4JG,1,corona,general,Useful,NC_44_U,8,Doritos,What popular snack food is effective to use as kindling to start a fire?
A2KWADVDUGF4JG,1,corona,general,Useful,NC_50_U,4,Spread beeswax over them and then blow dry until you can't see the beeswax anymore,What's an easy way to waterproof canvas shoes?
A2KWADVDUGF4JG,1,corona,third,MTurk,TB_30_MT,8,"The ""no hair theorem"" states that a black hole has only three properties: electric charge, angular momentum, and mass.",What is the composition of a black hole?
A2KWADVDUGF4JG,1,corona,third,MTurk,TB_44_MT,12,"In all U.S states, same-sex marriage is now legal. Also, the number of kids per family has decreased and so ""middle"" childreen, between the eldest and youngest, are getting rarer. ",How have families changed over time?
A2KWADVDUGF4JG,1,corona,third,Trivia,TB_07_TR,16,Tuxedo Club,What New York country club lent its name to the kind of dinner jacket first worn there in 1886?
A2KWADVDUGF4JG,1,corona,third,Trivia,TB_18_TR,16,Orville Wright,Who was flying the plane in which the first US airplane fatality occurred?
A2KWADVDUGF4JG,1,corona,third,Trivia,TB_23_TR,12,Tooth,What is the only part of the body that can't repair itself?
