PID,sess,firstBlock,block,type,questionId,wait_duration,answer,question
A2LJTCHPRZLGS7,1,general,corona,Not useful,C_05_NU,12,University of Washington,Which was the first US University to cancel classes becuase of the new coronavirus?
A2LJTCHPRZLGS7,1,general,corona,Not useful,C_06_NU,16,Gwyneth Paltrow,"Which celebrity said about the new coronavirus ""I've already been in this movie""?"
A2LJTCHPRZLGS7,1,general,corona,Not useful,C_19_NU,16,Strategic National Stockpile,What is the name of the repository of drugs and supplies the U.S. government is supposed to maintain in case of a public health emergency?
A2LJTCHPRZLGS7,1,general,corona,Useful,C_28_U,4,"Yes, by boosting the immune system",Does sleep make you more resistant to coronavirus infections?
A2LJTCHPRZLGS7,1,general,corona,Useful,C_39_U,16,"No, antibiotics do not work against viruses, only bacteria.",Are antibiotics effective in preventing and treating the new coronavirus?
A2LJTCHPRZLGS7,1,general,corona,Useful,C_49_U,16,"Approved filtering facemask respirators, such as the N95 respirator.","It is recommended that healthcare professionals who may be working in contact with people with the virus wear what, in addition to personal protective equipment on their hands and bodies?"
A2LJTCHPRZLGS7,1,general,general,Not useful,NC_01_NU,12,Mike Powell,"In 1991, who finally broke Bob Beamon's decades-old long jump record?"
A2LJTCHPRZLGS7,1,general,general,Not useful,NC_02_NU,16,Tiger Woods,"Who's the only two-time Sports Illustrated Sportsman of the Year, so named in 1996 and 2000?"
A2LJTCHPRZLGS7,1,general,general,Not useful,NC_03_NU,12,Red River,"What name is shared by the rivers that run through Denison, TX and Hanoi, Vietnam?"
A2LJTCHPRZLGS7,1,general,general,Not useful,NC_10_NU,4,K.D. Lang,What Canadian singer appeared on the first cover of Entertainment Weekly?
A2LJTCHPRZLGS7,1,general,general,Not useful,NC_14_NU,4,Rod Serling,What famed TV personality wrote the screenplay for 1968's Planet of the Apes?
A2LJTCHPRZLGS7,1,general,general,Not useful,NC_21_NU,12,The Pieta,Which was the only one of his sculptures that Michelangelo signed?
A2LJTCHPRZLGS7,1,general,general,Useful,NC_32_U,16,Take a picture of your fridge before leaving the house,What's a simple trick for telling whether your out of something when you're grocery shopping?
A2LJTCHPRZLGS7,1,general,general,Useful,NC_34_U,16,"Pineapple, by planting the green leaves",What tropical fruit can be regrown from its scraps?
A2LJTCHPRZLGS7,1,general,third,MTurk,TB_34_MT,8,Evolution is usually very slow. Think about the similarities between apes and people. Future people are going to be as similar to us as we are to apes. ,What will future humans look like?
A2LJTCHPRZLGS7,1,general,third,MTurk,TB_35_MT,4,Prototypes already exist. Technological estimates suggest that definitely within the next twenty years -- although the challenges are great.,When will we have flying cars?
A2LJTCHPRZLGS7,1,general,third,MTurk,TB_40_MT,4,"NASA plans another crewed mission to the Moon by 2024, followed by a sustained presence  by 2028.  Russia is planning to begin building a human colony by 2037.",When could a lunar base be established?
A2LJTCHPRZLGS7,1,general,third,Trivia,TB_04_TR,16,Phil Knight,"In 1964, who founded Blue Ribbon Sports, which later went on to become Nike?"
A2LJTCHPRZLGS7,1,general,third,Trivia,TB_07_TR,16,Tuxedo Club,What New York country club lent its name to the kind of dinner jacket first worn there in 1886?
A2LJTCHPRZLGS7,1,general,third,Trivia,TB_10_TR,4,George VI,Who was the last British Monarch to also be an emperor?
A2LJTCHPRZLGS7,1,general,third,Trivia,TB_15_TR,8,Portia,The United States' first law school for woman was named for what cross-dressing Shakespearean character?
