PID,sess,firstBlock,block,type,questionId,wait_duration,answer,question
A2ND52KJ1AIYEK,1,general,corona,Not useful,C_03_NU,8,"Fuburary 1st, 2020",When was the molecular structure of the coronovirus identfied?
A2ND52KJ1AIYEK,1,general,corona,Not useful,C_08_NU,4,Lombardy,What is the name of the county in Italy that had the first coronavirus outbreak?
A2ND52KJ1AIYEK,1,general,corona,Not useful,C_21_NU,8,An epidemic that has spread around the world,An epidemic is the outbreak of a disease that affects many people at the same time. What does pandemic mean?
A2ND52KJ1AIYEK,1,general,corona,Useful,C_44_U,4,People over age 60,Approximately 80% of deaths attributed to the new coronavirus were among people of what age?
A2ND52KJ1AIYEK,1,general,general,Not useful,NC_06_NU,16,David Livingstone,Who discovered the Victoria Falls?
A2ND52KJ1AIYEK,1,general,general,Not useful,NC_23_NU,4,The Netherlands,In 1568 the Catholic Church sentenced the entire population of which nation to death as heretics?
A2ND52KJ1AIYEK,1,general,general,Useful,NC_28_U,12,Microwave next to a glass of water,How can you soften brown sugar that has hardened into a lump?
A2ND52KJ1AIYEK,1,general,general,Useful,NC_37_U,16,"Over the past 150 year, real estate, if you rent it out",What's a better investment: stocks or real estate?
A2ND52KJ1AIYEK,1,general,general,Useful,NC_44_U,8,Doritos,What popular snack food is effective to use as kindling to start a fire?
A2ND52KJ1AIYEK,1,general,general,Useful,NC_45_U,12,"Grapes or raisins, onions, avocado","In addition to chocolate, what other foods can be very harmful to dogs? "
A2ND52KJ1AIYEK,1,general,third,MTurk,TB_25_MT,4,"Scientists estimate that we are likely to see flying cars, and that computers may be able to read people's thoughts and emotions ",What will be the new technologies of future?
A2ND52KJ1AIYEK,1,general,third,MTurk,TB_31_MT,8,Scientists estimate that at the moment it is not. But with global warming it might become more feasilbe later in the 21st century.,How feasible would it be to colonize Antarctica?
A2ND52KJ1AIYEK,1,general,third,MTurk,TB_45_MT,4,"The amygdala (from Greek, 'almond') is one of two almond-shaped clusters of nuclei located deep and medially within the temporal lobes of the brain in complex vertebrates, including humans.",What is the amygdala?
A2ND52KJ1AIYEK,1,general,third,Trivia,TB_05_TR,16,Hong Kong,What city's harbor is overlooked by Victoria Peak?
A2ND52KJ1AIYEK,1,general,third,Trivia,TB_14_TR,16,James Brown,"When asked to define ""cool,"" what two words did James Brown use?"
