PID,sess,firstBlock,block,type,questionId,wait_duration,answer,question
A2NXHJ905WLGAA,1,general,corona,Not useful,C_03_NU,8,"Fuburary 1st, 2020",When was the molecular structure of the coronovirus identfied?
A2NXHJ905WLGAA,1,general,corona,Not useful,C_11_NU,16,The Chicago of China,"Wuhan, China, the city in which the coronavirus was first identified, is commonly referred to as the chinese version of what American city?"
A2NXHJ905WLGAA,1,general,corona,Not useful,C_20_NU,16,"Rear Adm. Ziemer led the global health security team, responsible for leading the US response to pandemics.","In May 2018, Rear Admiral Timothy Ziemer left the White House staff and was not replaced. What was Rear Adm. Ziemer's responsibility in the White House?"
A2NXHJ905WLGAA,1,general,corona,Useful,C_27_U,16,Washing your hands frequently,What is the most effective measure to prevent infection with the coronavirus?
A2NXHJ905WLGAA,1,general,corona,Useful,C_32_U,16,"Healthcare professionals treating patients, in-home caregivers, and those who are already sick with the new coronavirus",Which three groups of people does the CDC recommend masks for?
A2NXHJ905WLGAA,1,general,corona,Useful,C_47_U,12,"Free of fever; no other symptoms, including cough; negative tests on at least two consecutive respiratory specimens at least 24 hours apart.",What are current Centers for Disease Control (CDC) guidelines for releasing someone from isolation?
A2NXHJ905WLGAA,1,general,general,Not useful,NC_03_NU,4,Red River,"What name is shared by the rivers that run through Denison, TX and Hanoi, Vietnam?"
A2NXHJ905WLGAA,1,general,general,Not useful,NC_14_NU,12,Rod Serling,What famed TV personality wrote the screenplay for 1968's Planet of the Apes?
A2NXHJ905WLGAA,1,general,general,Not useful,NC_15_NU,16,Albert Einstein,Who beat out FDR and Gandhi to be named Time's Person of the Century in 1999?
A2NXHJ905WLGAA,1,general,general,Not useful,NC_18_NU,8,A truce,What was put in place by the Ancient Greeks before and during all Olympic festivals?
A2NXHJ905WLGAA,1,general,general,Useful,NC_41_U,8,"April 8th, 2024",When is the next total solar eclipse visible in North America projected to occur? 
A2NXHJ905WLGAA,1,general,general,Useful,NC_43_U,16,Between 105 and 54 days before the scheduled trip.,How far in advance of a trip is the most cost effective time to purchase a plane ticket? 
A2NXHJ905WLGAA,1,general,general,Useful,NC_45_U,12,"Grapes or raisins, onions, avocado","In addition to chocolate, what other foods can be very harmful to dogs? "
A2NXHJ905WLGAA,1,general,general,Useful,NC_49_U,4,"Roll it along its long side. If it stops immediately, it's raw.",How can you tell if an egg is cooked without breaking it?
A2NXHJ905WLGAA,1,general,third,MTurk,TB_29_MT,8,"There are a few helpful techniques. One is to imagine that you climb on top of a high building, and ""look down"" at your life. Second, to try to think about issues in novel ways. ",How to stay calm in adversity?
A2NXHJ905WLGAA,1,general,third,MTurk,TB_30_MT,8,"The ""no hair theorem"" states that a black hole has only three properties: electric charge, angular momentum, and mass.",What is the composition of a black hole?
A2NXHJ905WLGAA,1,general,third,MTurk,TB_37_MT,12,Engineers and architects agree that the answer is positive. Houses for the non-rich are much better built today than they were built 500 years ago.,Are houses built better than they used to be?
A2NXHJ905WLGAA,1,general,third,MTurk,TB_38_MT,12,"As a rule, yes. Restaurants have to cover rent, salaries and taxes. These are all included in the prices.",Is it really cheaper to cook at home vs. eating out?
A2NXHJ905WLGAA,1,general,third,Trivia,TB_09_TR,16,The first email,"What did Ray Tomlinson send in Cambridge, Massachusetts, in late 1971?"
A2NXHJ905WLGAA,1,general,third,Trivia,TB_19_TR,8,Ketchup,The only vegetable ice cream ever produced was what flavor?
A2NXHJ905WLGAA,1,general,third,Trivia,TB_21_TR,8,New York,Which state has the zip code 12345?
A2NXHJ905WLGAA,1,general,third,Trivia,TB_23_TR,16,Tooth,What is the only part of the body that can't repair itself?
