PID,sess,firstBlock,block,type,questionId,wait_duration,answer,question
A2OW2CIT4H7364,1,corona,corona,Not useful,C_08_NU,16,Lombardy,What is the name of the county in Italy that had the first coronavirus outbreak?
A2OW2CIT4H7364,1,corona,corona,Not useful,C_19_NU,4,Strategic National Stockpile,What is the name of the repository of drugs and supplies the U.S. government is supposed to maintain in case of a public health emergency?
A2OW2CIT4H7364,1,corona,corona,Not useful,C_25_NU,12,The viruses have spikes on their outer surface that look like a crown (or corona in Latin),What is the supposed origin of the name coronavirus?
A2OW2CIT4H7364,1,corona,corona,Useful,C_33_U,4,Soft surfaces are less likely to transmit the virus than hard surfaces.,Can the new coronavirus be transmitted by touching a soft surface like carpets or fabric?
A2OW2CIT4H7364,1,corona,corona,Useful,C_35_U,8,"The virus spreads through coughs and sneezes, there are no reports of transmission through mosquito bites.",Can the new coronavirus be transmitted through mosquito bites?
A2OW2CIT4H7364,1,corona,corona,Useful,C_45_U,12,"Pre-existing health conditions, including cardiovascular diseases and diabetes.",What did 75% of the people who have died from the new coronavirus have?
A2OW2CIT4H7364,1,corona,corona,Useful,C_52_U,8,No. To protect yourself against the new coronavirus washing your hands is the best preventive measure.,Are hand dryers effective in killing the new coronavirus?
A2OW2CIT4H7364,1,corona,general,Not useful,NC_19_NU,12,Smoke,"in 1908, New York City passed the Sullivan Ordinance which made it illegal for women to do what in public?"
A2OW2CIT4H7364,1,corona,general,Not useful,NC_23_NU,8,The Netherlands,In 1568 the Catholic Church sentenced the entire population of which nation to death as heretics?
A2OW2CIT4H7364,1,corona,general,Useful,NC_31_U,8,Sign up for a free USAA membership,How can people under 25 rent a car without paying extra fees?
A2OW2CIT4H7364,1,corona,general,Useful,NC_33_U,12,Below eye level,Where in the supermarket can you usually find the cheaper items?
A2OW2CIT4H7364,1,corona,general,Useful,NC_46_U,4,"Dish soap, peroxide, and baking soda","While tomato juice probably will not work, what does work to remove skunk odor? "
A2OW2CIT4H7364,1,corona,general,Useful,NC_47_U,4,"Add baking soda, soak in advance, use a preassure cooker",What can you do to make dry beans cook faster?
A2OW2CIT4H7364,1,corona,third,MTurk,TB_34_MT,4,Evolution is usually very slow. Think about the similarities between apes and people. Future people are going to be as similar to us as we are to apes. ,What will future humans look like?
A2OW2CIT4H7364,1,corona,third,MTurk,TB_43_MT,8,"Planets likely start off as grains of dust that then combine to form bigger rocks. They clear material from their path, leaving tracks of space empty but for fine dust.",How do planets form?
A2OW2CIT4H7364,1,corona,third,MTurk,TB_44_MT,4,"In all U.S states, same-sex marriage is now legal. Also, the number of kids per family has decreased and so ""middle"" childreen, between the eldest and youngest, are getting rarer. ",How have families changed over time?
A2OW2CIT4H7364,1,corona,third,MTurk,TB_46_MT,12,"Scientists are still figuring it out. It seems that passive use is slightly bad, but active use is not.",How does social media influence our mental health?
A2OW2CIT4H7364,1,corona,third,Trivia,TB_01_TR,4,Canada,"What country is home to Roots, the company that outfits the U.S. Olympic team?"
A2OW2CIT4H7364,1,corona,third,Trivia,TB_07_TR,8,Tuxedo Club,What New York country club lent its name to the kind of dinner jacket first worn there in 1886?
A2OW2CIT4H7364,1,corona,third,Trivia,TB_10_TR,4,George VI,Who was the last British Monarch to also be an emperor?
A2OW2CIT4H7364,1,corona,third,Trivia,TB_20_TR,16,Rafflesia (corpse lily),What is the largest flower in the world?
