PID,sess,firstBlock,block,type,questionId,wait_duration,answer,question
A2PJBSDDN22XIX,1,corona,corona,Not useful,C_06_NU,4,Gwyneth Paltrow,"Which celebrity said about the new coronavirus ""I've already been in this movie""?"
A2PJBSDDN22XIX,1,corona,corona,Not useful,C_08_NU,12,Lombardy,What is the name of the county in Italy that had the first coronavirus outbreak?
A2PJBSDDN22XIX,1,corona,corona,Not useful,C_15_NU,16,7.5 days,"In the early stages of the new coronavirus, the number of new cases doubled approximately every how many days?"
A2PJBSDDN22XIX,1,corona,general,Not useful,NC_05_NU,12,Matthew,Which of the four biblical Gospels was written by a tax collector?
A2PJBSDDN22XIX,1,corona,general,Not useful,NC_09_NU,16,Captain Cook,"Who christened Hawaii ""the Sandwich Islands"" in 1778?"
A2PJBSDDN22XIX,1,corona,general,Not useful,NC_17_NU,4,Gilbert Van Camp,What Indianapolis grocer made his name by selling canned pork and beans to U.S. troops during the Civil War?
A2PJBSDDN22XIX,1,corona,general,Not useful,NC_20_NU,4,Russia,Which country has the most public libraries?
A2PJBSDDN22XIX,1,corona,general,Not useful,NC_24_NU,16,State quarters,What's been released five times a year from January 1999 to fall 2008?
A2PJBSDDN22XIX,1,corona,general,Not useful,NC_26_NU,8,Dark Side of the Moon,What album spent a record 741 weeks on Billboard's Top 200 Albums chart?
A2PJBSDDN22XIX,1,corona,general,Useful,NC_30_U,12,Floormats - put them under the wheels for traction,What item that can be found in any car can help you extract your car from mud or snow?
A2PJBSDDN22XIX,1,corona,third,MTurk,TB_44_MT,12,"In all U.S states, same-sex marriage is now legal. Also, the number of kids per family has decreased and so ""middle"" childreen, between the eldest and youngest, are getting rarer. ",How have families changed over time?
A2PJBSDDN22XIX,1,corona,third,MTurk,TB_45_MT,8,"The amygdala (from Greek, 'almond') is one of two almond-shaped clusters of nuclei located deep and medially within the temporal lobes of the brain in complex vertebrates, including humans.",What is the amygdala?
A2PJBSDDN22XIX,1,corona,third,Trivia,TB_03_TR,4,Mrs. Doubtfire's,What 1993 film's title character has the first name Euphegenia?
A2PJBSDDN22XIX,1,corona,third,Trivia,TB_07_TR,4,Tuxedo Club,What New York country club lent its name to the kind of dinner jacket first worn there in 1886?
A2PJBSDDN22XIX,1,corona,third,Trivia,TB_21_TR,8,New York,Which state has the zip code 12345?
A2PJBSDDN22XIX,1,corona,third,Trivia,TB_22_TR,8,Cheetah,Which is the only cat that cannot retract its claws?
