PID,sess,firstBlock,block,type,questionId,wait_duration,answer,question
A2Q7BWWDXGQJQR,1,general,corona,Not useful,C_02_NU,4,Three ,How many pandemics were there in the 20th century?
A2Q7BWWDXGQJQR,1,general,corona,Not useful,C_13_NU,16,"The initial cases of the disease are thought to have been among people with a connection to a seafood wholesale market, which also sold live animals","Why is the virus believed to have zoonotic origin, i.e., to have potentially come from animals?"
A2Q7BWWDXGQJQR,1,general,corona,Not useful,C_26_NU,8,Severe acute respiratory syndrome,The official name of the new coronavirus is SARS-CoV-2. What does SARS stand for?
A2Q7BWWDXGQJQR,1,general,corona,Useful,C_27_U,16,Washing your hands frequently,What is the most effective measure to prevent infection with the coronavirus?
A2Q7BWWDXGQJQR,1,general,corona,Useful,C_30_U,16,More similar to the symptoms of the ful,"Are the new coronavirus symptoms more similar to the symptoms of flu, or of seasonal allergies?"
A2Q7BWWDXGQJQR,1,general,corona,Useful,C_35_U,8,"The virus spreads through coughs and sneezes, there are no reports of transmission through mosquito bites.",Can the new coronavirus be transmitted through mosquito bites?
A2Q7BWWDXGQJQR,1,general,corona,Useful,C_41_U,4,Studies suggest that coronaviruses (including preliminary information on the new virus) may persist on surfaces for a few hours or up to several days.,How long does the new coronavirus survive on surfaces?
A2Q7BWWDXGQJQR,1,general,corona,Useful,C_52_U,4,No. To protect yourself against the new coronavirus washing your hands is the best preventive measure.,Are hand dryers effective in killing the new coronavirus?
A2Q7BWWDXGQJQR,1,general,general,Not useful,NC_05_NU,16,Matthew,Which of the four biblical Gospels was written by a tax collector?
A2Q7BWWDXGQJQR,1,general,general,Not useful,NC_07_NU,8,Salt Lake City,In what city could you see the Seagull Monument at Temple Square?
A2Q7BWWDXGQJQR,1,general,general,Not useful,NC_16_NU,8,Newborns,The apgar score is used to measure the color and condition of what?
A2Q7BWWDXGQJQR,1,general,general,Not useful,NC_21_NU,4,The Pieta,Which was the only one of his sculptures that Michelangelo signed?
A2Q7BWWDXGQJQR,1,general,general,Useful,NC_36_U,8,Potatos: rub a cut potato over your windshield before a frost to prevent freezing,What vegetable can prevent your windshield from freezing over in winter?
A2Q7BWWDXGQJQR,1,general,general,Useful,NC_43_U,12,Between 105 and 54 days before the scheduled trip.,How far in advance of a trip is the most cost effective time to purchase a plane ticket? 
A2Q7BWWDXGQJQR,1,general,general,Useful,NC_44_U,4,Doritos,What popular snack food is effective to use as kindling to start a fire?
A2Q7BWWDXGQJQR,1,general,general,Useful,NC_47_U,4,"Add baking soda, soak in advance, use a preassure cooker",What can you do to make dry beans cook faster?
A2Q7BWWDXGQJQR,1,general,general,Useful,NC_49_U,16,"Roll it along its long side. If it stops immediately, it's raw.",How can you tell if an egg is cooked without breaking it?
A2Q7BWWDXGQJQR,1,general,general,Useful,NC_51_U,12,White vinegar,What salad dressing ingredient is also an efficient weed killer?
A2Q7BWWDXGQJQR,1,general,third,MTurk,TB_25_MT,4,"Scientists estimate that we are likely to see flying cars, and that computers may be able to read people's thoughts and emotions ",What will be the new technologies of future?
A2Q7BWWDXGQJQR,1,general,third,MTurk,TB_27_MT,16,"We do not know, of course. Yet, it is important to realize that there is no scientific proof for God's existence.  ",Does God exist?
A2Q7BWWDXGQJQR,1,general,third,MTurk,TB_30_MT,16,"The ""no hair theorem"" states that a black hole has only three properties: electric charge, angular momentum, and mass.",What is the composition of a black hole?
A2Q7BWWDXGQJQR,1,general,third,MTurk,TB_40_MT,4,"NASA plans another crewed mission to the Moon by 2024, followed by a sustained presence  by 2028.  Russia is planning to begin building a human colony by 2037.",When could a lunar base be established?
A2Q7BWWDXGQJQR,1,general,third,MTurk,TB_45_MT,16,"The amygdala (from Greek, 'almond') is one of two almond-shaped clusters of nuclei located deep and medially within the temporal lobes of the brain in complex vertebrates, including humans.",What is the amygdala?
A2Q7BWWDXGQJQR,1,general,third,Trivia,TB_07_TR,12,Tuxedo Club,What New York country club lent its name to the kind of dinner jacket first worn there in 1886?
A2Q7BWWDXGQJQR,1,general,third,Trivia,TB_09_TR,4,The first email,"What did Ray Tomlinson send in Cambridge, Massachusetts, in late 1971?"
A2Q7BWWDXGQJQR,1,general,third,Trivia,TB_21_TR,8,New York,Which state has the zip code 12345?
A2Q7BWWDXGQJQR,1,general,third,Trivia,TB_22_TR,8,Cheetah,Which is the only cat that cannot retract its claws?
