PID,sess,firstBlock,block,type,questionId,wait_duration,answer,question
A2RBG0G82ULSZC,1,corona,corona,Not useful,C_02_NU,4,Three ,How many pandemics were there in the 20th century?
A2RBG0G82ULSZC,1,corona,corona,Not useful,C_19_NU,4,Strategic National Stockpile,What is the name of the repository of drugs and supplies the U.S. government is supposed to maintain in case of a public health emergency?
A2RBG0G82ULSZC,1,corona,corona,Not useful,C_20_NU,4,"Rear Adm. Ziemer led the global health security team, responsible for leading the US response to pandemics.","In May 2018, Rear Admiral Timothy Ziemer left the White House staff and was not replaced. What was Rear Adm. Ziemer's responsibility in the White House?"
A2RBG0G82ULSZC,1,corona,corona,Not useful,C_21_NU,8,An epidemic that has spread around the world,An epidemic is the outbreak of a disease that affects many people at the same time. What does pandemic mean?
A2RBG0G82ULSZC,1,corona,corona,Useful,C_39_U,16,"No, antibiotics do not work against viruses, only bacteria.",Are antibiotics effective in preventing and treating the new coronavirus?
A2RBG0G82ULSZC,1,corona,corona,Useful,C_49_U,8,"Approved filtering facemask respirators, such as the N95 respirator.","It is recommended that healthcare professionals who may be working in contact with people with the virus wear what, in addition to personal protective equipment on their hands and bodies?"
A2RBG0G82ULSZC,1,corona,general,Not useful,NC_14_NU,4,Rod Serling,What famed TV personality wrote the screenplay for 1968's Planet of the Apes?
A2RBG0G82ULSZC,1,corona,general,Not useful,NC_15_NU,12,Albert Einstein,Who beat out FDR and Gandhi to be named Time's Person of the Century in 1999?
A2RBG0G82ULSZC,1,corona,general,Not useful,NC_21_NU,16,The Pieta,Which was the only one of his sculptures that Michelangelo signed?
A2RBG0G82ULSZC,1,corona,general,Useful,NC_27_U,8,White vinegar,What can you use instead of fabric softner to soften sheets and remove odours?
A2RBG0G82ULSZC,1,corona,general,Useful,NC_30_U,4,Floormats - put them under the wheels for traction,What item that can be found in any car can help you extract your car from mud or snow?
A2RBG0G82ULSZC,1,corona,general,Useful,NC_33_U,4,Below eye level,Where in the supermarket can you usually find the cheaper items?
A2RBG0G82ULSZC,1,corona,general,Useful,NC_38_U,12,"Camu Camu, a cherry-like fruit from Brazil",What fruit has the highest content of vitamin C?
A2RBG0G82ULSZC,1,corona,general,Useful,NC_46_U,4,"Dish soap, peroxide, and baking soda","While tomato juice probably will not work, what does work to remove skunk odor? "
A2RBG0G82ULSZC,1,corona,general,Useful,NC_51_U,4,White vinegar,What salad dressing ingredient is also an efficient weed killer?
A2RBG0G82ULSZC,1,corona,third,MTurk,TB_30_MT,8,"The ""no hair theorem"" states that a black hole has only three properties: electric charge, angular momentum, and mass.",What is the composition of a black hole?
A2RBG0G82ULSZC,1,corona,third,MTurk,TB_40_MT,12,"NASA plans another crewed mission to the Moon by 2024, followed by a sustained presence  by 2028.  Russia is planning to begin building a human colony by 2037.",When could a lunar base be established?
A2RBG0G82ULSZC,1,corona,third,MTurk,TB_41_MT,16,"Deep learning-based machines, that can process unparalleled amount of information will allow AI to accomplish goals that were unimaginable until very recently. ",What are the most recent developments in artificial intelligence?
A2RBG0G82ULSZC,1,corona,third,MTurk,TB_43_MT,16,"Planets likely start off as grains of dust that then combine to form bigger rocks. They clear material from their path, leaving tracks of space empty but for fine dust.",How do planets form?
A2RBG0G82ULSZC,1,corona,third,Trivia,TB_03_TR,4,Mrs. Doubtfire's,What 1993 film's title character has the first name Euphegenia?
A2RBG0G82ULSZC,1,corona,third,Trivia,TB_04_TR,12,Phil Knight,"In 1964, who founded Blue Ribbon Sports, which later went on to become Nike?"
A2RBG0G82ULSZC,1,corona,third,Trivia,TB_10_TR,16,George VI,Who was the last British Monarch to also be an emperor?
A2RBG0G82ULSZC,1,corona,third,Trivia,TB_20_TR,4,Rafflesia (corpse lily),What is the largest flower in the world?
