PID,sess,firstBlock,block,type,questionId,wait_duration,answer,question
A2RGIULFG1GWF5,1,corona,corona,Not useful,C_02_NU,4,Three ,How many pandemics were there in the 20th century?
A2RGIULFG1GWF5,1,corona,corona,Not useful,C_08_NU,12,Lombardy,What is the name of the county in Italy that had the first coronavirus outbreak?
A2RGIULFG1GWF5,1,corona,corona,Not useful,C_22_NU,16,Contact tracing,What is the name of the process health authorities use to understand the sources of infection and to prevent further transmission?
A2RGIULFG1GWF5,1,corona,corona,Not useful,C_23_NU,16,They falsely claimed to cure or prevent coronavirus,"At the end of February, Amazon banned over a million products because of what?"
A2RGIULFG1GWF5,1,corona,corona,Useful,C_34_U,4,"The virus lives for up to a few days on surfaces, and so packages cannot transmit the virus.",Can the new coronavirus be transmitted on a package from an infected country?
A2RGIULFG1GWF5,1,corona,corona,Useful,C_36_U,8,No. There is no evidence that regularly rinsing the nose with saline has protected people from infection with the new coronavirus.,Can regularly rinsing your nose with saline help prevent infection with the new coronavirus?
A2RGIULFG1GWF5,1,corona,corona,Useful,C_46_U,12,Remdesivir,"Which drug, which has been used as a treatment for the Ebola and Marburg viruses, might be promising as a treatment for this new coronavirus?"
A2RGIULFG1GWF5,1,corona,corona,Useful,C_50_U,12,Washington,The first US death from the new coronavirus occurred in which state?
A2RGIULFG1GWF5,1,corona,corona,Useful,C_52_U,8,No. To protect yourself against the new coronavirus washing your hands is the best preventive measure.,Are hand dryers effective in killing the new coronavirus?
A2RGIULFG1GWF5,1,corona,general,Not useful,NC_01_NU,12,Mike Powell,"In 1991, who finally broke Bob Beamon's decades-old long jump record?"
A2RGIULFG1GWF5,1,corona,general,Not useful,NC_03_NU,4,Red River,"What name is shared by the rivers that run through Denison, TX and Hanoi, Vietnam?"
A2RGIULFG1GWF5,1,corona,general,Not useful,NC_11_NU,4,Endeavour,What is the name of the ship that carried Captain Cook to Australia?
A2RGIULFG1GWF5,1,corona,general,Not useful,NC_18_NU,8,A truce,What was put in place by the Ancient Greeks before and during all Olympic festivals?
A2RGIULFG1GWF5,1,corona,general,Useful,NC_28_U,8,Microwave next to a glass of water,How can you soften brown sugar that has hardened into a lump?
A2RGIULFG1GWF5,1,corona,general,Useful,NC_30_U,16,Floormats - put them under the wheels for traction,What item that can be found in any car can help you extract your car from mud or snow?
A2RGIULFG1GWF5,1,corona,general,Useful,NC_39_U,16,"At least $2,467 according to current research",How much money should I keep as an emergency fund?
A2RGIULFG1GWF5,1,corona,general,Useful,NC_44_U,12,Doritos,What popular snack food is effective to use as kindling to start a fire?
A2RGIULFG1GWF5,1,corona,general,Useful,NC_51_U,12,White vinegar,What salad dressing ingredient is also an efficient weed killer?
A2RGIULFG1GWF5,1,corona,third,MTurk,TB_38_MT,16,"As a rule, yes. Restaurants have to cover rent, salaries and taxes. These are all included in the prices.",Is it really cheaper to cook at home vs. eating out?
A2RGIULFG1GWF5,1,corona,third,MTurk,TB_43_MT,12,"Planets likely start off as grains of dust that then combine to form bigger rocks. They clear material from their path, leaving tracks of space empty but for fine dust.",How do planets form?
A2RGIULFG1GWF5,1,corona,third,Trivia,TB_03_TR,16,Mrs. Doubtfire's,What 1993 film's title character has the first name Euphegenia?
A2RGIULFG1GWF5,1,corona,third,Trivia,TB_11_TR,8,Mung beans,What kind of bean produces the Asian-style bean sprouts in the produce section of supermarkets?
A2RGIULFG1GWF5,1,corona,third,Trivia,TB_18_TR,4,Orville Wright,Who was flying the plane in which the first US airplane fatality occurred?
A2RGIULFG1GWF5,1,corona,third,Trivia,TB_22_TR,8,Cheetah,Which is the only cat that cannot retract its claws?
A2RGIULFG1GWF5,1,corona,third,Trivia,TB_23_TR,12,Tooth,What is the only part of the body that can't repair itself?
