PID,sess,firstBlock,block,type,questionId,wait_duration,answer,question
A2RMQ5CCDH4DD1,1,general,corona,Useful,C_27_U,12,Washing your hands frequently,What is the most effective measure to prevent infection with the coronavirus?
A2RMQ5CCDH4DD1,1,general,general,Not useful,NC_07_NU,4,Salt Lake City,In what city could you see the Seagull Monument at Temple Square?
A2RMQ5CCDH4DD1,1,general,general,Not useful,NC_09_NU,16,Captain Cook,"Who christened Hawaii ""the Sandwich Islands"" in 1778?"
A2RMQ5CCDH4DD1,1,general,general,Not useful,NC_12_NU,16,Come by her,"The title of the song ""Kumbaya"" is actually a distortion of what three-word phrase?"
A2RMQ5CCDH4DD1,1,general,general,Not useful,NC_14_NU,16,Rod Serling,What famed TV personality wrote the screenplay for 1968's Planet of the Apes?
A2RMQ5CCDH4DD1,1,general,general,Not useful,NC_23_NU,16,The Netherlands,In 1568 the Catholic Church sentenced the entire population of which nation to death as heretics?
A2RMQ5CCDH4DD1,1,general,general,Useful,NC_40_U,4,Squint your eyes,How do you make your smile look more genuine in photographs?
A2RMQ5CCDH4DD1,1,general,third,MTurk,TB_25_MT,8,"Scientists estimate that we are likely to see flying cars, and that computers may be able to read people's thoughts and emotions ",What will be the new technologies of future?
A2RMQ5CCDH4DD1,1,general,third,MTurk,TB_35_MT,12,Prototypes already exist. Technological estimates suggest that definitely within the next twenty years -- although the challenges are great.,When will we have flying cars?
A2RMQ5CCDH4DD1,1,general,third,Trivia,TB_21_TR,16,New York,Which state has the zip code 12345?
