PID,sess,firstBlock,block,type,questionId,wait_duration,answer,question
A2RMR0ZSQ575XZ,1,general,corona,Not useful,C_18_NU,16,They are able to filter out at least 95% of airborne particles,Why are N95 respirator face masks so named?
A2RMR0ZSQ575XZ,1,general,corona,Useful,C_35_U,8,"The virus spreads through coughs and sneezes, there are no reports of transmission through mosquito bites.",Can the new coronavirus be transmitted through mosquito bites?
A2RMR0ZSQ575XZ,1,general,corona,Useful,C_37_U,4,There is no evidence from the current outbreak that eating garlic has protected people from the new coronavirus.,Can eating garlic help prevent infection with the new coronavirus?
A2RMR0ZSQ575XZ,1,general,general,Not useful,NC_01_NU,4,Mike Powell,"In 1991, who finally broke Bob Beamon's decades-old long jump record?"
A2RMR0ZSQ575XZ,1,general,general,Not useful,NC_23_NU,8,The Netherlands,In 1568 the Catholic Church sentenced the entire population of which nation to death as heretics?
A2RMR0ZSQ575XZ,1,general,general,Useful,NC_30_U,8,Floormats - put them under the wheels for traction,What item that can be found in any car can help you extract your car from mud or snow?
A2RMR0ZSQ575XZ,1,general,general,Useful,NC_38_U,12,"Camu Camu, a cherry-like fruit from Brazil",What fruit has the highest content of vitamin C?
A2RMR0ZSQ575XZ,1,general,general,Useful,NC_41_U,8,"April 8th, 2024",When is the next total solar eclipse visible in North America projected to occur? 
A2RMR0ZSQ575XZ,1,general,third,MTurk,TB_28_MT,16,"Futurist Diamandis argues that due to improved powers of computation we are likely to see AI, improved medicine, and new ways of communicating.",What is to happen ten years from now?
A2RMR0ZSQ575XZ,1,general,third,Trivia,TB_03_TR,16,Mrs. Doubtfire's,What 1993 film's title character has the first name Euphegenia?
A2RMR0ZSQ575XZ,1,general,third,Trivia,TB_06_TR,4,Xanadu,What 1980 film is named for the legendary square-shaped capital of Kublai Khan?
A2RMR0ZSQ575XZ,1,general,third,Trivia,TB_07_TR,8,Tuxedo Club,What New York country club lent its name to the kind of dinner jacket first worn there in 1886?
