PID,sess,firstBlock,block,type,questionId,wait_duration,answer,question
A2TWU2TKFM30C4,1,general,corona,Not useful,C_16_NU,16,Bats and pangolins,What other animals have been found to have viruses with highly similar genome sequences as the current coronavirus?
A2TWU2TKFM30C4,1,general,corona,Not useful,C_21_NU,12,An epidemic that has spread around the world,An epidemic is the outbreak of a disease that affects many people at the same time. What does pandemic mean?
A2TWU2TKFM30C4,1,general,corona,Not useful,C_22_NU,16,Contact tracing,What is the name of the process health authorities use to understand the sources of infection and to prevent further transmission?
A2TWU2TKFM30C4,1,general,corona,Useful,C_30_U,4,More similar to the symptoms of the ful,"Are the new coronavirus symptoms more similar to the symptoms of flu, or of seasonal allergies?"
A2TWU2TKFM30C4,1,general,corona,Useful,C_43_U,4,Quarantine themselves for 14 days to make sure they are not infected.,"Currently, people who  may have been in contact with someone with the new coronavirus are recommended to do what?"
A2TWU2TKFM30C4,1,general,general,Not useful,NC_10_NU,8,K.D. Lang,What Canadian singer appeared on the first cover of Entertainment Weekly?
A2TWU2TKFM30C4,1,general,general,Not useful,NC_14_NU,16,Rod Serling,What famed TV personality wrote the screenplay for 1968's Planet of the Apes?
A2TWU2TKFM30C4,1,general,general,Not useful,NC_26_NU,4,Dark Side of the Moon,What album spent a record 741 weeks on Billboard's Top 200 Albums chart?
A2TWU2TKFM30C4,1,general,general,Useful,NC_28_U,4,Microwave next to a glass of water,How can you soften brown sugar that has hardened into a lump?
A2TWU2TKFM30C4,1,general,general,Useful,NC_30_U,12,Floormats - put them under the wheels for traction,What item that can be found in any car can help you extract your car from mud or snow?
A2TWU2TKFM30C4,1,general,general,Useful,NC_38_U,12,"Camu Camu, a cherry-like fruit from Brazil",What fruit has the highest content of vitamin C?
A2TWU2TKFM30C4,1,general,general,Useful,NC_41_U,12,"April 8th, 2024",When is the next total solar eclipse visible in North America projected to occur? 
A2TWU2TKFM30C4,1,general,third,MTurk,TB_33_MT,8,"For SpaceX — the cheapest of NASA's new carriers — each pound costs approximately $27,000. So an average person of 160 pounds costs over $4,320,000.",How much does it cost to launch a person into space?
A2TWU2TKFM30C4,1,general,third,MTurk,TB_35_MT,12,Prototypes already exist. Technological estimates suggest that definitely within the next twenty years -- although the challenges are great.,When will we have flying cars?
A2TWU2TKFM30C4,1,general,third,MTurk,TB_37_MT,12,Engineers and architects agree that the answer is positive. Houses for the non-rich are much better built today than they were built 500 years ago.,Are houses built better than they used to be?
A2TWU2TKFM30C4,1,general,third,Trivia,TB_05_TR,8,Hong Kong,What city's harbor is overlooked by Victoria Peak?
A2TWU2TKFM30C4,1,general,third,Trivia,TB_12_TR,8,It sits beside the Finger Lakes,"Why is Oneida Lake, near Syracuse, New York, sometimes called ""the thumb""?"
A2TWU2TKFM30C4,1,general,third,Trivia,TB_18_TR,16,Orville Wright,Who was flying the plane in which the first US airplane fatality occurred?
