PID,sess,firstBlock,block,type,questionId,wait_duration,answer,question
A2U0BGP51C2UR5,1,corona,corona,Not useful,C_15_NU,8,7.5 days,"In the early stages of the new coronavirus, the number of new cases doubled approximately every how many days?"
A2U0BGP51C2UR5,1,corona,corona,Not useful,C_19_NU,16,Strategic National Stockpile,What is the name of the repository of drugs and supplies the U.S. government is supposed to maintain in case of a public health emergency?
A2U0BGP51C2UR5,1,corona,corona,Not useful,C_24_NU,12,Contagion,"According to media reports, which 2011 movie has seen a large increase in popularity in the wake of the new coronavirus?"
A2U0BGP51C2UR5,1,corona,corona,Useful,C_28_U,8,"Yes, by boosting the immune system",Does sleep make you more resistant to coronavirus infections?
A2U0BGP51C2UR5,1,corona,corona,Useful,C_37_U,12,There is no evidence from the current outbreak that eating garlic has protected people from the new coronavirus.,Can eating garlic help prevent infection with the new coronavirus?
A2U0BGP51C2UR5,1,corona,general,Not useful,NC_02_NU,4,Tiger Woods,"Who's the only two-time Sports Illustrated Sportsman of the Year, so named in 1996 and 2000?"
A2U0BGP51C2UR5,1,corona,general,Not useful,NC_18_NU,8,A truce,What was put in place by the Ancient Greeks before and during all Olympic festivals?
A2U0BGP51C2UR5,1,corona,general,Not useful,NC_21_NU,16,The Pieta,Which was the only one of his sculptures that Michelangelo signed?
A2U0BGP51C2UR5,1,corona,general,Not useful,NC_22_NU,12,Steamboat Geyser,"Which Yellowstone geyser, with eruptions 100 fee taller than Old Faithful's, is the world's tallest?"
A2U0BGP51C2UR5,1,corona,general,Not useful,NC_25_NU,12,Shark,"What animal is thought to be immune to most all diseases, including cancer?"
A2U0BGP51C2UR5,1,corona,general,Not useful,NC_26_NU,8,Dark Side of the Moon,What album spent a record 741 weeks on Billboard's Top 200 Albums chart?
A2U0BGP51C2UR5,1,corona,third,MTurk,TB_33_MT,8,"For SpaceX — the cheapest of NASA's new carriers — each pound costs approximately $27,000. So an average person of 160 pounds costs over $4,320,000.",How much does it cost to launch a person into space?
A2U0BGP51C2UR5,1,corona,third,Trivia,TB_12_TR,4,It sits beside the Finger Lakes,"Why is Oneida Lake, near Syracuse, New York, sometimes called ""the thumb""?"
A2U0BGP51C2UR5,1,corona,third,Trivia,TB_14_TR,4,James Brown,"When asked to define ""cool,"" what two words did James Brown use?"
A2U0BGP51C2UR5,1,corona,third,Trivia,TB_17_TR,16,"Third finger, left hand",What part of his body did Keith Richards insure for a million pounds?
A2U0BGP51C2UR5,1,corona,third,Trivia,TB_23_TR,8,Tooth,What is the only part of the body that can't repair itself?
