PID,sess,firstBlock,block,type,questionId,wait_duration,answer,question
A2UTDZAZV1DF0N,1,corona,corona,Not useful,C_04_NU,4,"It stands for ""COronaVIrus Disease 2019""","Why is the new coronavirus called ""COVID-19""? "
A2UTDZAZV1DF0N,1,corona,corona,Not useful,C_06_NU,4,Gwyneth Paltrow,"Which celebrity said about the new coronavirus ""I've already been in this movie""?"
A2UTDZAZV1DF0N,1,corona,corona,Not useful,C_15_NU,8,7.5 days,"In the early stages of the new coronavirus, the number of new cases doubled approximately every how many days?"
A2UTDZAZV1DF0N,1,corona,corona,Not useful,C_19_NU,16,Strategic National Stockpile,What is the name of the repository of drugs and supplies the U.S. government is supposed to maintain in case of a public health emergency?
A2UTDZAZV1DF0N,1,corona,corona,Useful,C_31_U,4,"The virus is probably not sexually tansmissible, but infection does occurs when kissing.",Can the coronavirus be transmitted through sexual intercourse?
A2UTDZAZV1DF0N,1,corona,corona,Useful,C_42_U,16,"Fever, cough, shortness of breath.",What are the most common symptoms of the new coronavirus?
A2UTDZAZV1DF0N,1,corona,corona,Useful,C_44_U,16,People over age 60,Approximately 80% of deaths attributed to the new coronavirus were among people of what age?
A2UTDZAZV1DF0N,1,corona,corona,Useful,C_45_U,12,"Pre-existing health conditions, including cardiovascular diseases and diabetes.",What did 75% of the people who have died from the new coronavirus have?
A2UTDZAZV1DF0N,1,corona,general,Not useful,NC_12_NU,4,Come by her,"The title of the song ""Kumbaya"" is actually a distortion of what three-word phrase?"
A2UTDZAZV1DF0N,1,corona,general,Not useful,NC_24_NU,16,State quarters,What's been released five times a year from January 1999 to fall 2008?
A2UTDZAZV1DF0N,1,corona,general,Useful,NC_36_U,16,Potatos: rub a cut potato over your windshield before a frost to prevent freezing,What vegetable can prevent your windshield from freezing over in winter?
A2UTDZAZV1DF0N,1,corona,general,Useful,NC_39_U,16,"At least $2,467 according to current research",How much money should I keep as an emergency fund?
A2UTDZAZV1DF0N,1,corona,general,Useful,NC_42_U,8,"Deprive it of oxygen by covering, pouring baking soda if the fire is small, or using a fire extinguisher if it's large.",How do you put out a grease fire? 
A2UTDZAZV1DF0N,1,corona,third,MTurk,TB_29_MT,12,"There are a few helpful techniques. One is to imagine that you climb on top of a high building, and ""look down"" at your life. Second, to try to think about issues in novel ways. ",How to stay calm in adversity?
A2UTDZAZV1DF0N,1,corona,third,MTurk,TB_38_MT,4,"As a rule, yes. Restaurants have to cover rent, salaries and taxes. These are all included in the prices.",Is it really cheaper to cook at home vs. eating out?
A2UTDZAZV1DF0N,1,corona,third,MTurk,TB_41_MT,4,"Deep learning-based machines, that can process unparalleled amount of information will allow AI to accomplish goals that were unimaginable until very recently. ",What are the most recent developments in artificial intelligence?
A2UTDZAZV1DF0N,1,corona,third,MTurk,TB_43_MT,4,"Planets likely start off as grains of dust that then combine to form bigger rocks. They clear material from their path, leaving tracks of space empty but for fine dust.",How do planets form?
A2UTDZAZV1DF0N,1,corona,third,MTurk,TB_46_MT,16,"Scientists are still figuring it out. It seems that passive use is slightly bad, but active use is not.",How does social media influence our mental health?
A2UTDZAZV1DF0N,1,corona,third,Trivia,TB_18_TR,16,Orville Wright,Who was flying the plane in which the first US airplane fatality occurred?
