PID,sess,firstBlock,block,type,questionId,wait_duration,answer,question
A2W5MSZP0O4Y2P,1,general,corona,Not useful,C_03_NU,12,"Fuburary 1st, 2020",When was the molecular structure of the coronovirus identfied?
A2W5MSZP0O4Y2P,1,general,corona,Not useful,C_06_NU,16,Gwyneth Paltrow,"Which celebrity said about the new coronavirus ""I've already been in this movie""?"
A2W5MSZP0O4Y2P,1,general,corona,Not useful,C_11_NU,4,The Chicago of China,"Wuhan, China, the city in which the coronavirus was first identified, is commonly referred to as the chinese version of what American city?"
A2W5MSZP0O4Y2P,1,general,corona,Not useful,C_26_NU,4,Severe acute respiratory syndrome,The official name of the new coronavirus is SARS-CoV-2. What does SARS stand for?
A2W5MSZP0O4Y2P,1,general,corona,Useful,C_28_U,16,"Yes, by boosting the immune system",Does sleep make you more resistant to coronavirus infections?
A2W5MSZP0O4Y2P,1,general,corona,Useful,C_31_U,16,"The virus is probably not sexually tansmissible, but infection does occurs when kissing.",Can the coronavirus be transmitted through sexual intercourse?
A2W5MSZP0O4Y2P,1,general,general,Not useful,NC_06_NU,16,David Livingstone,Who discovered the Victoria Falls?
A2W5MSZP0O4Y2P,1,general,general,Not useful,NC_08_NU,8,The guppy,What common aquarium fish is named for the naturalist who discovered it in Trinidad in 1876?
A2W5MSZP0O4Y2P,1,general,general,Not useful,NC_14_NU,4,Rod Serling,What famed TV personality wrote the screenplay for 1968's Planet of the Apes?
A2W5MSZP0O4Y2P,1,general,general,Not useful,NC_26_NU,8,Dark Side of the Moon,What album spent a record 741 weeks on Billboard's Top 200 Albums chart?
A2W5MSZP0O4Y2P,1,general,general,Useful,NC_32_U,4,Take a picture of your fridge before leaving the house,What's a simple trick for telling whether your out of something when you're grocery shopping?
A2W5MSZP0O4Y2P,1,general,general,Useful,NC_36_U,16,Potatos: rub a cut potato over your windshield before a frost to prevent freezing,What vegetable can prevent your windshield from freezing over in winter?
A2W5MSZP0O4Y2P,1,general,general,Useful,NC_44_U,8,Doritos,What popular snack food is effective to use as kindling to start a fire?
A2W5MSZP0O4Y2P,1,general,general,Useful,NC_45_U,16,"Grapes or raisins, onions, avocado","In addition to chocolate, what other foods can be very harmful to dogs? "
A2W5MSZP0O4Y2P,1,general,third,MTurk,TB_28_MT,8,"Futurist Diamandis argues that due to improved powers of computation we are likely to see AI, improved medicine, and new ways of communicating.",What is to happen ten years from now?
A2W5MSZP0O4Y2P,1,general,third,MTurk,TB_29_MT,8,"There are a few helpful techniques. One is to imagine that you climb on top of a high building, and ""look down"" at your life. Second, to try to think about issues in novel ways. ",How to stay calm in adversity?
A2W5MSZP0O4Y2P,1,general,third,MTurk,TB_40_MT,8,"NASA plans another crewed mission to the Moon by 2024, followed by a sustained presence  by 2028.  Russia is planning to begin building a human colony by 2037.",When could a lunar base be established?
A2W5MSZP0O4Y2P,1,general,third,MTurk,TB_45_MT,8,"The amygdala (from Greek, 'almond') is one of two almond-shaped clusters of nuclei located deep and medially within the temporal lobes of the brain in complex vertebrates, including humans.",What is the amygdala?
A2W5MSZP0O4Y2P,1,general,third,Trivia,TB_01_TR,8,Canada,"What country is home to Roots, the company that outfits the U.S. Olympic team?"
A2W5MSZP0O4Y2P,1,general,third,Trivia,TB_06_TR,12,Xanadu,What 1980 film is named for the legendary square-shaped capital of Kublai Khan?
A2W5MSZP0O4Y2P,1,general,third,Trivia,TB_13_TR,8,Java,On what namesake Asian island are the first Homo erectus fossils found?
A2W5MSZP0O4Y2P,1,general,third,Trivia,TB_15_TR,16,Portia,The United States' first law school for woman was named for what cross-dressing Shakespearean character?
