PID,sess,firstBlock,block,type,questionId,wait_duration,answer,question
A2WMIDZYE3J9FN,1,corona,corona,Not useful,C_05_NU,4,University of Washington,Which was the first US University to cancel classes becuase of the new coronavirus?
A2WMIDZYE3J9FN,1,corona,corona,Not useful,C_08_NU,8,Lombardy,What is the name of the county in Italy that had the first coronavirus outbreak?
A2WMIDZYE3J9FN,1,corona,corona,Not useful,C_15_NU,8,7.5 days,"In the early stages of the new coronavirus, the number of new cases doubled approximately every how many days?"
A2WMIDZYE3J9FN,1,corona,corona,Not useful,C_24_NU,4,Contagion,"According to media reports, which 2011 movie has seen a large increase in popularity in the wake of the new coronavirus?"
A2WMIDZYE3J9FN,1,corona,corona,Not useful,C_25_NU,8,The viruses have spikes on their outer surface that look like a crown (or corona in Latin),What is the supposed origin of the name coronavirus?
A2WMIDZYE3J9FN,1,corona,corona,Useful,C_31_U,8,"The virus is probably not sexually tansmissible, but infection does occurs when kissing.",Can the coronavirus be transmitted through sexual intercourse?
A2WMIDZYE3J9FN,1,corona,corona,Useful,C_39_U,16,"No, antibiotics do not work against viruses, only bacteria.",Are antibiotics effective in preventing and treating the new coronavirus?
A2WMIDZYE3J9FN,1,corona,corona,Useful,C_41_U,12,Studies suggest that coronaviruses (including preliminary information on the new virus) may persist on surfaces for a few hours or up to several days.,How long does the new coronavirus survive on surfaces?
A2WMIDZYE3J9FN,1,corona,general,Not useful,NC_22_NU,4,Steamboat Geyser,"Which Yellowstone geyser, with eruptions 100 fee taller than Old Faithful's, is the world's tallest?"
A2WMIDZYE3J9FN,1,corona,general,Not useful,NC_23_NU,8,The Netherlands,In 1568 the Catholic Church sentenced the entire population of which nation to death as heretics?
A2WMIDZYE3J9FN,1,corona,general,Not useful,NC_24_NU,12,State quarters,What's been released five times a year from January 1999 to fall 2008?
A2WMIDZYE3J9FN,1,corona,general,Useful,NC_36_U,16,Potatos: rub a cut potato over your windshield before a frost to prevent freezing,What vegetable can prevent your windshield from freezing over in winter?
A2WMIDZYE3J9FN,1,corona,general,Useful,NC_37_U,16,"Over the past 150 year, real estate, if you rent it out",What's a better investment: stocks or real estate?
A2WMIDZYE3J9FN,1,corona,general,Useful,NC_43_U,16,Between 105 and 54 days before the scheduled trip.,How far in advance of a trip is the most cost effective time to purchase a plane ticket? 
A2WMIDZYE3J9FN,1,corona,third,MTurk,TB_24_MT,4,"Deep sea creatures must survive in extremely harsh conditions. They include the giant spider crab, frilled shark, and the atlantic wolffish",Which creatures live in deep sea?
A2WMIDZYE3J9FN,1,corona,third,MTurk,TB_35_MT,4,Prototypes already exist. Technological estimates suggest that definitely within the next twenty years -- although the challenges are great.,When will we have flying cars?
A2WMIDZYE3J9FN,1,corona,third,MTurk,TB_40_MT,4,"NASA plans another crewed mission to the Moon by 2024, followed by a sustained presence  by 2028.  Russia is planning to begin building a human colony by 2037.",When could a lunar base be established?
A2WMIDZYE3J9FN,1,corona,third,Trivia,TB_06_TR,4,Xanadu,What 1980 film is named for the legendary square-shaped capital of Kublai Khan?
A2WMIDZYE3J9FN,1,corona,third,Trivia,TB_18_TR,12,Orville Wright,Who was flying the plane in which the first US airplane fatality occurred?
A2WMIDZYE3J9FN,1,corona,third,Trivia,TB_19_TR,12,Ketchup,The only vegetable ice cream ever produced was what flavor?
A2WMIDZYE3J9FN,1,corona,third,Trivia,TB_20_TR,12,Rafflesia (corpse lily),What is the largest flower in the world?
A2WMIDZYE3J9FN,1,corona,third,Trivia,TB_21_TR,8,New York,Which state has the zip code 12345?
