PID,sess,firstBlock,block,type,questionId,wait_duration,answer,question
A2WQZJ1W21K8FM,1,corona,corona,Not useful,C_01_NU,8,"Animals, probably bats",What is the source of coronavirus in humans?
A2WQZJ1W21K8FM,1,corona,corona,Not useful,C_03_NU,4,"Fuburary 1st, 2020",When was the molecular structure of the coronovirus identfied?
A2WQZJ1W21K8FM,1,corona,corona,Not useful,C_05_NU,4,University of Washington,Which was the first US University to cancel classes becuase of the new coronavirus?
A2WQZJ1W21K8FM,1,corona,corona,Not useful,C_07_NU,16,Pink,What color latex gloves did Naomi Campbell wear to protect herself from coronavirus?
A2WQZJ1W21K8FM,1,corona,corona,Useful,C_28_U,12,"Yes, by boosting the immune system",Does sleep make you more resistant to coronavirus infections?
A2WQZJ1W21K8FM,1,corona,corona,Useful,C_30_U,16,More similar to the symptoms of the ful,"Are the new coronavirus symptoms more similar to the symptoms of flu, or of seasonal allergies?"
A2WQZJ1W21K8FM,1,corona,corona,Useful,C_39_U,8,"No, antibiotics do not work against viruses, only bacteria.",Are antibiotics effective in preventing and treating the new coronavirus?
A2WQZJ1W21K8FM,1,corona,corona,Useful,C_41_U,16,Studies suggest that coronaviruses (including preliminary information on the new virus) may persist on surfaces for a few hours or up to several days.,How long does the new coronavirus survive on surfaces?
A2WQZJ1W21K8FM,1,corona,corona,Useful,C_52_U,4,No. To protect yourself against the new coronavirus washing your hands is the best preventive measure.,Are hand dryers effective in killing the new coronavirus?
A2WQZJ1W21K8FM,1,corona,general,Not useful,NC_03_NU,16,Red River,"What name is shared by the rivers that run through Denison, TX and Hanoi, Vietnam?"
A2WQZJ1W21K8FM,1,corona,general,Not useful,NC_07_NU,8,Salt Lake City,In what city could you see the Seagull Monument at Temple Square?
A2WQZJ1W21K8FM,1,corona,general,Not useful,NC_14_NU,4,Rod Serling,What famed TV personality wrote the screenplay for 1968's Planet of the Apes?
A2WQZJ1W21K8FM,1,corona,general,Not useful,NC_23_NU,16,The Netherlands,In 1568 the Catholic Church sentenced the entire population of which nation to death as heretics?
A2WQZJ1W21K8FM,1,corona,general,Useful,NC_31_U,16,Sign up for a free USAA membership,How can people under 25 rent a car without paying extra fees?
A2WQZJ1W21K8FM,1,corona,general,Useful,NC_36_U,8,Potatos: rub a cut potato over your windshield before a frost to prevent freezing,What vegetable can prevent your windshield from freezing over in winter?
A2WQZJ1W21K8FM,1,corona,general,Useful,NC_43_U,8,Between 105 and 54 days before the scheduled trip.,How far in advance of a trip is the most cost effective time to purchase a plane ticket? 
A2WQZJ1W21K8FM,1,corona,general,Useful,NC_47_U,4,"Add baking soda, soak in advance, use a preassure cooker",What can you do to make dry beans cook faster?
A2WQZJ1W21K8FM,1,corona,third,MTurk,TB_24_MT,4,"Deep sea creatures must survive in extremely harsh conditions. They include the giant spider crab, frilled shark, and the atlantic wolffish",Which creatures live in deep sea?
A2WQZJ1W21K8FM,1,corona,third,MTurk,TB_32_MT,16,Sophisticated equipment is either lowered to the sea bottom or directly attached to submersible buoys and transmits to a research vessel that is equipped with state-of-the-art navigational instruments.,What are undersea researchers doing to explore the ocean floor?
A2WQZJ1W21K8FM,1,corona,third,MTurk,TB_33_MT,12,"For SpaceX — the cheapest of NASA's new carriers — each pound costs approximately $27,000. So an average person of 160 pounds costs over $4,320,000.",How much does it cost to launch a person into space?
A2WQZJ1W21K8FM,1,corona,third,MTurk,TB_37_MT,8,Engineers and architects agree that the answer is positive. Houses for the non-rich are much better built today than they were built 500 years ago.,Are houses built better than they used to be?
A2WQZJ1W21K8FM,1,corona,third,Trivia,TB_06_TR,8,Xanadu,What 1980 film is named for the legendary square-shaped capital of Kublai Khan?
A2WQZJ1W21K8FM,1,corona,third,Trivia,TB_11_TR,16,Mung beans,What kind of bean produces the Asian-style bean sprouts in the produce section of supermarkets?
A2WQZJ1W21K8FM,1,corona,third,Trivia,TB_16_TR,16,Jim Lovell,Alan Shepard was scheduled to command the ill-fated Apollo 13 before switching missions with what astronaut?
A2WQZJ1W21K8FM,1,corona,third,Trivia,TB_17_TR,12,"Third finger, left hand",What part of his body did Keith Richards insure for a million pounds?
A2WQZJ1W21K8FM,1,corona,third,Trivia,TB_22_TR,12,Cheetah,Which is the only cat that cannot retract its claws?
