PID,sess,firstBlock,block,type,questionId,wait_duration,answer,question
A2YZ52JQWUS2Z2,1,general,corona,Not useful,C_11_NU,16,The Chicago of China,"Wuhan, China, the city in which the coronavirus was first identified, is commonly referred to as the chinese version of what American city?"
A2YZ52JQWUS2Z2,1,general,corona,Useful,C_46_U,16,Remdesivir,"Which drug, which has been used as a treatment for the Ebola and Marburg viruses, might be promising as a treatment for this new coronavirus?"
A2YZ52JQWUS2Z2,1,general,general,Not useful,NC_23_NU,12,The Netherlands,In 1568 the Catholic Church sentenced the entire population of which nation to death as heretics?
A2YZ52JQWUS2Z2,1,general,general,Useful,NC_41_U,4,"April 8th, 2024",When is the next total solar eclipse visible in North America projected to occur? 
A2YZ52JQWUS2Z2,1,general,general,Useful,NC_50_U,8,Spread beeswax over them and then blow dry until you can't see the beeswax anymore,What's an easy way to waterproof canvas shoes?
A2YZ52JQWUS2Z2,1,general,general,Useful,NC_51_U,12,White vinegar,What salad dressing ingredient is also an efficient weed killer?
A2YZ52JQWUS2Z2,1,general,third,MTurk,TB_25_MT,16,"Scientists estimate that we are likely to see flying cars, and that computers may be able to read people's thoughts and emotions ",What will be the new technologies of future?
A2YZ52JQWUS2Z2,1,general,third,MTurk,TB_28_MT,12,"Futurist Diamandis argues that due to improved powers of computation we are likely to see AI, improved medicine, and new ways of communicating.",What is to happen ten years from now?
A2YZ52JQWUS2Z2,1,general,third,MTurk,TB_40_MT,8,"NASA plans another crewed mission to the Moon by 2024, followed by a sustained presence  by 2028.  Russia is planning to begin building a human colony by 2037.",When could a lunar base be established?
A2YZ52JQWUS2Z2,1,general,third,Trivia,TB_07_TR,4,Tuxedo Club,What New York country club lent its name to the kind of dinner jacket first worn there in 1886?
A2YZ52JQWUS2Z2,1,general,third,Trivia,TB_18_TR,12,Orville Wright,Who was flying the plane in which the first US airplane fatality occurred?
