PID,sess,firstBlock,block,type,questionId,wait_duration,answer,question
A2ZDXFFGSPHGBE,1,corona,corona,Not useful,C_01_NU,12,"Animals, probably bats",What is the source of coronavirus in humans?
A2ZDXFFGSPHGBE,1,corona,corona,Not useful,C_23_NU,12,They falsely claimed to cure or prevent coronavirus,"At the end of February, Amazon banned over a million products because of what?"
A2ZDXFFGSPHGBE,1,corona,corona,Useful,C_37_U,8,There is no evidence from the current outbreak that eating garlic has protected people from the new coronavirus.,Can eating garlic help prevent infection with the new coronavirus?
A2ZDXFFGSPHGBE,1,corona,general,Not useful,NC_24_NU,12,State quarters,What's been released five times a year from January 1999 to fall 2008?
A2ZDXFFGSPHGBE,1,corona,general,Useful,NC_30_U,12,Floormats - put them under the wheels for traction,What item that can be found in any car can help you extract your car from mud or snow?
A2ZDXFFGSPHGBE,1,corona,general,Useful,NC_39_U,4,"At least $2,467 according to current research",How much money should I keep as an emergency fund?
A2ZDXFFGSPHGBE,1,corona,general,Useful,NC_41_U,4,"April 8th, 2024",When is the next total solar eclipse visible in North America projected to occur? 
A2ZDXFFGSPHGBE,1,corona,general,Useful,NC_42_U,8,"Deprive it of oxygen by covering, pouring baking soda if the fire is small, or using a fire extinguisher if it's large.",How do you put out a grease fire? 
A2ZDXFFGSPHGBE,1,corona,third,MTurk,TB_26_MT,16,"Sometimes, it is easy to know, but science revealed that self-insight is prblematic. It is often very helpful to ask friends and family ",How do you know if you're happy?
A2ZDXFFGSPHGBE,1,corona,third,MTurk,TB_28_MT,12,"Futurist Diamandis argues that due to improved powers of computation we are likely to see AI, improved medicine, and new ways of communicating.",What is to happen ten years from now?
A2ZDXFFGSPHGBE,1,corona,third,Trivia,TB_09_TR,12,The first email,"What did Ray Tomlinson send in Cambridge, Massachusetts, in late 1971?"
A2ZDXFFGSPHGBE,1,corona,third,Trivia,TB_20_TR,8,Rafflesia (corpse lily),What is the largest flower in the world?
