PID,sess,firstBlock,block,type,questionId,wait_duration,answer,question
A2ZOJ3JN2HD3US,1,corona,corona,Not useful,C_06_NU,8,Gwyneth Paltrow,"Which celebrity said about the new coronavirus ""I've already been in this movie""?"
A2ZOJ3JN2HD3US,1,corona,corona,Not useful,C_10_NU,4,11 million people,"What is the population of Wuhan, the city in which coronavirus was first identified?"
A2ZOJ3JN2HD3US,1,corona,corona,Not useful,C_17_NU,4,"Locations, people, or animals","The name for the new disease COVID-19 adheres to WHO best practices in disease naming, which include guidelines to not name disease after what?"
A2ZOJ3JN2HD3US,1,corona,corona,Useful,C_35_U,8,"The virus spreads through coughs and sneezes, there are no reports of transmission through mosquito bites.",Can the new coronavirus be transmitted through mosquito bites?
A2ZOJ3JN2HD3US,1,corona,general,Not useful,NC_11_NU,8,Endeavour,What is the name of the ship that carried Captain Cook to Australia?
A2ZOJ3JN2HD3US,1,corona,general,Not useful,NC_26_NU,4,Dark Side of the Moon,What album spent a record 741 weeks on Billboard's Top 200 Albums chart?
A2ZOJ3JN2HD3US,1,corona,general,Useful,NC_27_U,12,White vinegar,What can you use instead of fabric softner to soften sheets and remove odours?
A2ZOJ3JN2HD3US,1,corona,general,Useful,NC_33_U,8,Below eye level,Where in the supermarket can you usually find the cheaper items?
A2ZOJ3JN2HD3US,1,corona,general,Useful,NC_34_U,12,"Pineapple, by planting the green leaves",What tropical fruit can be regrown from its scraps?
A2ZOJ3JN2HD3US,1,corona,general,Useful,NC_44_U,8,Doritos,What popular snack food is effective to use as kindling to start a fire?
A2ZOJ3JN2HD3US,1,corona,general,Useful,NC_47_U,4,"Add baking soda, soak in advance, use a preassure cooker",What can you do to make dry beans cook faster?
A2ZOJ3JN2HD3US,1,corona,general,Useful,NC_50_U,4,Spread beeswax over them and then blow dry until you can't see the beeswax anymore,What's an easy way to waterproof canvas shoes?
A2ZOJ3JN2HD3US,1,corona,third,MTurk,TB_40_MT,12,"NASA plans another crewed mission to the Moon by 2024, followed by a sustained presence  by 2028.  Russia is planning to begin building a human colony by 2037.",When could a lunar base be established?
A2ZOJ3JN2HD3US,1,corona,third,MTurk,TB_41_MT,4,"Deep learning-based machines, that can process unparalleled amount of information will allow AI to accomplish goals that were unimaginable until very recently. ",What are the most recent developments in artificial intelligence?
A2ZOJ3JN2HD3US,1,corona,third,Trivia,TB_10_TR,16,George VI,Who was the last British Monarch to also be an emperor?
A2ZOJ3JN2HD3US,1,corona,third,Trivia,TB_14_TR,8,James Brown,"When asked to define ""cool,"" what two words did James Brown use?"
A2ZOJ3JN2HD3US,1,corona,third,Trivia,TB_19_TR,12,Ketchup,The only vegetable ice cream ever produced was what flavor?
A2ZOJ3JN2HD3US,1,corona,third,Trivia,TB_21_TR,16,New York,Which state has the zip code 12345?
A2ZOJ3JN2HD3US,1,corona,third,Trivia,TB_22_TR,12,Cheetah,Which is the only cat that cannot retract its claws?
