PID,sess,firstBlock,block,type,questionId,wait_duration,answer,question
A308FEI88TJ8WV,1,corona,corona,Not useful,C_01_NU,8,"Animals, probably bats",What is the source of coronavirus in humans?
A308FEI88TJ8WV,1,corona,corona,Not useful,C_04_NU,16,"It stands for ""COronaVIrus Disease 2019""","Why is the new coronavirus called ""COVID-19""? "
A308FEI88TJ8WV,1,corona,corona,Not useful,C_07_NU,4,Pink,What color latex gloves did Naomi Campbell wear to protect herself from coronavirus?
A308FEI88TJ8WV,1,corona,corona,Not useful,C_25_NU,12,The viruses have spikes on their outer surface that look like a crown (or corona in Latin),What is the supposed origin of the name coronavirus?
A308FEI88TJ8WV,1,corona,corona,Useful,C_28_U,12,"Yes, by boosting the immune system",Does sleep make you more resistant to coronavirus infections?
A308FEI88TJ8WV,1,corona,corona,Useful,C_36_U,12,No. There is no evidence that regularly rinsing the nose with saline has protected people from infection with the new coronavirus.,Can regularly rinsing your nose with saline help prevent infection with the new coronavirus?
A308FEI88TJ8WV,1,corona,general,Not useful,NC_11_NU,12,Endeavour,What is the name of the ship that carried Captain Cook to Australia?
A308FEI88TJ8WV,1,corona,general,Not useful,NC_25_NU,12,Shark,"What animal is thought to be immune to most all diseases, including cancer?"
A308FEI88TJ8WV,1,corona,general,Useful,NC_33_U,16,Below eye level,Where in the supermarket can you usually find the cheaper items?
A308FEI88TJ8WV,1,corona,general,Useful,NC_43_U,4,Between 105 and 54 days before the scheduled trip.,How far in advance of a trip is the most cost effective time to purchase a plane ticket? 
A308FEI88TJ8WV,1,corona,general,Useful,NC_51_U,12,White vinegar,What salad dressing ingredient is also an efficient weed killer?
A308FEI88TJ8WV,1,corona,third,MTurk,TB_25_MT,4,"Scientists estimate that we are likely to see flying cars, and that computers may be able to read people's thoughts and emotions ",What will be the new technologies of future?
A308FEI88TJ8WV,1,corona,third,MTurk,TB_35_MT,16,Prototypes already exist. Technological estimates suggest that definitely within the next twenty years -- although the challenges are great.,When will we have flying cars?
A308FEI88TJ8WV,1,corona,third,MTurk,TB_38_MT,12,"As a rule, yes. Restaurants have to cover rent, salaries and taxes. These are all included in the prices.",Is it really cheaper to cook at home vs. eating out?
A308FEI88TJ8WV,1,corona,third,MTurk,TB_40_MT,8,"NASA plans another crewed mission to the Moon by 2024, followed by a sustained presence  by 2028.  Russia is planning to begin building a human colony by 2037.",When could a lunar base be established?
A308FEI88TJ8WV,1,corona,third,Trivia,TB_14_TR,12,James Brown,"When asked to define ""cool,"" what two words did James Brown use?"
A308FEI88TJ8WV,1,corona,third,Trivia,TB_20_TR,4,Rafflesia (corpse lily),What is the largest flower in the world?
A308FEI88TJ8WV,1,corona,third,Trivia,TB_22_TR,8,Cheetah,Which is the only cat that cannot retract its claws?
