PID,sess,firstBlock,block,type,questionId,wait_duration,answer,question
A30YR5TPOKQYXJ,1,corona,general,Not useful,NC_07_NU,4,Salt Lake City,In what city could you see the Seagull Monument at Temple Square?
A30YR5TPOKQYXJ,1,corona,general,Not useful,NC_20_NU,8,Russia,Which country has the most public libraries?
A30YR5TPOKQYXJ,1,corona,general,Useful,NC_41_U,4,"April 8th, 2024",When is the next total solar eclipse visible in North America projected to occur? 
A30YR5TPOKQYXJ,1,corona,general,Useful,NC_43_U,16,Between 105 and 54 days before the scheduled trip.,How far in advance of a trip is the most cost effective time to purchase a plane ticket? 
A30YR5TPOKQYXJ,1,corona,third,Trivia,TB_02_TR,8,Ivory Coast's,"The world's largest church is Our Lady of Peace Basilica in Yamoussoukro, what nation's capital?"
A30YR5TPOKQYXJ,1,corona,third,Trivia,TB_10_TR,12,George VI,Who was the last British Monarch to also be an emperor?
