PID,sess,firstBlock,block,type,questionId,wait_duration,answer,question
A31K79PQ18A3P0,1,corona,corona,Not useful,C_02_NU,4,Three ,How many pandemics were there in the 20th century?
A31K79PQ18A3P0,1,corona,corona,Useful,C_44_U,16,People over age 60,Approximately 80% of deaths attributed to the new coronavirus were among people of what age?
A31K79PQ18A3P0,1,corona,corona,Useful,C_50_U,16,Washington,The first US death from the new coronavirus occurred in which state?
A31K79PQ18A3P0,1,corona,general,Not useful,NC_06_NU,8,David Livingstone,Who discovered the Victoria Falls?
A31K79PQ18A3P0,1,corona,general,Not useful,NC_14_NU,8,Rod Serling,What famed TV personality wrote the screenplay for 1968's Planet of the Apes?
A31K79PQ18A3P0,1,corona,general,Useful,NC_31_U,16,Sign up for a free USAA membership,How can people under 25 rent a car without paying extra fees?
