PID,sess,firstBlock,block,type,questionId,wait_duration,answer,question
A324VBRLXHG5IB,1,corona,corona,Not useful,C_04_NU,4,"It stands for ""COronaVIrus Disease 2019""","Why is the new coronavirus called ""COVID-19""? "
A324VBRLXHG5IB,1,corona,corona,Not useful,C_15_NU,8,7.5 days,"In the early stages of the new coronavirus, the number of new cases doubled approximately every how many days?"
A324VBRLXHG5IB,1,corona,corona,Not useful,C_25_NU,4,The viruses have spikes on their outer surface that look like a crown (or corona in Latin),What is the supposed origin of the name coronavirus?
A324VBRLXHG5IB,1,corona,corona,Useful,C_29_U,8,Not for at least several months from now,How soon is a vaccine for the new coronavirus likely to be available?
A324VBRLXHG5IB,1,corona,corona,Useful,C_31_U,4,"The virus is probably not sexually tansmissible, but infection does occurs when kissing.",Can the coronavirus be transmitted through sexual intercourse?
A324VBRLXHG5IB,1,corona,corona,Useful,C_34_U,8,"The virus lives for up to a few days on surfaces, and so packages cannot transmit the virus.",Can the new coronavirus be transmitted on a package from an infected country?
A324VBRLXHG5IB,1,corona,corona,Useful,C_41_U,16,Studies suggest that coronaviruses (including preliminary information on the new virus) may persist on surfaces for a few hours or up to several days.,How long does the new coronavirus survive on surfaces?
A324VBRLXHG5IB,1,corona,corona,Useful,C_52_U,4,No. To protect yourself against the new coronavirus washing your hands is the best preventive measure.,Are hand dryers effective in killing the new coronavirus?
A324VBRLXHG5IB,1,corona,general,Not useful,NC_06_NU,4,David Livingstone,Who discovered the Victoria Falls?
A324VBRLXHG5IB,1,corona,general,Not useful,NC_12_NU,12,Come by her,"The title of the song ""Kumbaya"" is actually a distortion of what three-word phrase?"
A324VBRLXHG5IB,1,corona,general,Not useful,NC_26_NU,8,Dark Side of the Moon,What album spent a record 741 weeks on Billboard's Top 200 Albums chart?
A324VBRLXHG5IB,1,corona,general,Useful,NC_30_U,12,Floormats - put them under the wheels for traction,What item that can be found in any car can help you extract your car from mud or snow?
A324VBRLXHG5IB,1,corona,general,Useful,NC_35_U,12,Wrap a wet paper towel around the bottle and put in the fridge,How can you cool beverages more quickly?
A324VBRLXHG5IB,1,corona,general,Useful,NC_46_U,8,"Dish soap, peroxide, and baking soda","While tomato juice probably will not work, what does work to remove skunk odor? "
A324VBRLXHG5IB,1,corona,third,MTurk,TB_37_MT,4,Engineers and architects agree that the answer is positive. Houses for the non-rich are much better built today than they were built 500 years ago.,Are houses built better than they used to be?
A324VBRLXHG5IB,1,corona,third,MTurk,TB_39_MT,12,"There is radio emission around black holes. Scientists created a network of telescopes, capturing an image of a black hole by improving upon a technique that allows for the imaging of far-away objects",How was the recent picture of a black hole made?
A324VBRLXHG5IB,1,corona,third,MTurk,TB_42_MT,12,"Galaxy formation occured in the aftermath of the Big Bang. Clustering and merging allows galaxies to accumulate mass, determining both their shape and structure. ",How do galaxies form?
A324VBRLXHG5IB,1,corona,third,MTurk,TB_46_MT,8,"Scientists are still figuring it out. It seems that passive use is slightly bad, but active use is not.",How does social media influence our mental health?
A324VBRLXHG5IB,1,corona,third,Trivia,TB_03_TR,16,Mrs. Doubtfire's,What 1993 film's title character has the first name Euphegenia?
A324VBRLXHG5IB,1,corona,third,Trivia,TB_07_TR,16,Tuxedo Club,What New York country club lent its name to the kind of dinner jacket first worn there in 1886?
A324VBRLXHG5IB,1,corona,third,Trivia,TB_18_TR,4,Orville Wright,Who was flying the plane in which the first US airplane fatality occurred?
A324VBRLXHG5IB,1,corona,third,Trivia,TB_22_TR,16,Cheetah,Which is the only cat that cannot retract its claws?
