PID,sess,firstBlock,block,type,questionId,wait_duration,answer,question
A330VK560XSKWX,1,corona,corona,Not useful,C_07_NU,12,Pink,What color latex gloves did Naomi Campbell wear to protect herself from coronavirus?
A330VK560XSKWX,1,corona,corona,Not useful,C_09_NU,16,Hubei,What is the name of the province in China in which this new coronavirus was first discovered?
A330VK560XSKWX,1,corona,corona,Not useful,C_14_NU,4,"January 30, 2020",On what date did the World Health Organization declare the new coronavirus outbreak to be a Public Health Emergency of International Concern?
A330VK560XSKWX,1,corona,corona,Useful,C_28_U,8,"Yes, by boosting the immune system",Does sleep make you more resistant to coronavirus infections?
A330VK560XSKWX,1,corona,corona,Useful,C_31_U,4,"The virus is probably not sexually tansmissible, but infection does occurs when kissing.",Can the coronavirus be transmitted through sexual intercourse?
A330VK560XSKWX,1,corona,corona,Useful,C_39_U,8,"No, antibiotics do not work against viruses, only bacteria.",Are antibiotics effective in preventing and treating the new coronavirus?
A330VK560XSKWX,1,corona,corona,Useful,C_46_U,12,Remdesivir,"Which drug, which has been used as a treatment for the Ebola and Marburg viruses, might be promising as a treatment for this new coronavirus?"
A330VK560XSKWX,1,corona,corona,Useful,C_47_U,4,"Free of fever; no other symptoms, including cough; negative tests on at least two consecutive respiratory specimens at least 24 hours apart.",What are current Centers for Disease Control (CDC) guidelines for releasing someone from isolation?
A330VK560XSKWX,1,corona,corona,Useful,C_51_U,8,Nasal or orab swab or a sample of sputum,What sort of specimen is needed to test for the new coronavirus? 
A330VK560XSKWX,1,corona,general,Not useful,NC_06_NU,8,David Livingstone,Who discovered the Victoria Falls?
A330VK560XSKWX,1,corona,general,Not useful,NC_18_NU,8,A truce,What was put in place by the Ancient Greeks before and during all Olympic festivals?
A330VK560XSKWX,1,corona,general,Not useful,NC_22_NU,4,Steamboat Geyser,"Which Yellowstone geyser, with eruptions 100 fee taller than Old Faithful's, is the world's tallest?"
A330VK560XSKWX,1,corona,general,Not useful,NC_24_NU,16,State quarters,What's been released five times a year from January 1999 to fall 2008?
A330VK560XSKWX,1,corona,general,Not useful,NC_26_NU,12,Dark Side of the Moon,What album spent a record 741 weeks on Billboard's Top 200 Albums chart?
A330VK560XSKWX,1,corona,general,Useful,NC_27_U,8,White vinegar,What can you use instead of fabric softner to soften sheets and remove odours?
A330VK560XSKWX,1,corona,general,Useful,NC_39_U,16,"At least $2,467 according to current research",How much money should I keep as an emergency fund?
A330VK560XSKWX,1,corona,general,Useful,NC_44_U,16,Doritos,What popular snack food is effective to use as kindling to start a fire?
A330VK560XSKWX,1,corona,general,Useful,NC_52_U,8,"Tie your hair into a tight ponytail at the front of your head, and cut it.",How can you give yourself a layered haircut?
A330VK560XSKWX,1,corona,third,MTurk,TB_27_MT,12,"We do not know, of course. Yet, it is important to realize that there is no scientific proof for God's existence.  ",Does God exist?
A330VK560XSKWX,1,corona,third,MTurk,TB_37_MT,8,Engineers and architects agree that the answer is positive. Houses for the non-rich are much better built today than they were built 500 years ago.,Are houses built better than they used to be?
A330VK560XSKWX,1,corona,third,MTurk,TB_39_MT,8,"There is radio emission around black holes. Scientists created a network of telescopes, capturing an image of a black hole by improving upon a technique that allows for the imaging of far-away objects",How was the recent picture of a black hole made?
A330VK560XSKWX,1,corona,third,MTurk,TB_40_MT,8,"NASA plans another crewed mission to the Moon by 2024, followed by a sustained presence  by 2028.  Russia is planning to begin building a human colony by 2037.",When could a lunar base be established?
A330VK560XSKWX,1,corona,third,Trivia,TB_01_TR,8,Canada,"What country is home to Roots, the company that outfits the U.S. Olympic team?"
A330VK560XSKWX,1,corona,third,Trivia,TB_08_TR,4,Library of Congress,"In 1802, John Beckley became the librarian of what collection containing 740 books at the time?"
A330VK560XSKWX,1,corona,third,Trivia,TB_09_TR,12,The first email,"What did Ray Tomlinson send in Cambridge, Massachusetts, in late 1971?"
A330VK560XSKWX,1,corona,third,Trivia,TB_14_TR,16,James Brown,"When asked to define ""cool,"" what two words did James Brown use?"
A330VK560XSKWX,1,corona,third,Trivia,TB_19_TR,16,Ketchup,The only vegetable ice cream ever produced was what flavor?
