PID,sess,firstBlock,block,type,questionId,wait_duration,answer,question
A33921T4I2XIRS,1,general,corona,Not useful,C_07_NU,8,Pink,What color latex gloves did Naomi Campbell wear to protect herself from coronavirus?
A33921T4I2XIRS,1,general,corona,Not useful,C_13_NU,8,"The initial cases of the disease are thought to have been among people with a connection to a seafood wholesale market, which also sold live animals","Why is the virus believed to have zoonotic origin, i.e., to have potentially come from animals?"
A33921T4I2XIRS,1,general,corona,Not useful,C_16_NU,4,Bats and pangolins,What other animals have been found to have viruses with highly similar genome sequences as the current coronavirus?
A33921T4I2XIRS,1,general,corona,Useful,C_27_U,4,Washing your hands frequently,What is the most effective measure to prevent infection with the coronavirus?
A33921T4I2XIRS,1,general,corona,Useful,C_33_U,4,Soft surfaces are less likely to transmit the virus than hard surfaces.,Can the new coronavirus be transmitted by touching a soft surface like carpets or fabric?
A33921T4I2XIRS,1,general,corona,Useful,C_36_U,4,No. There is no evidence that regularly rinsing the nose with saline has protected people from infection with the new coronavirus.,Can regularly rinsing your nose with saline help prevent infection with the new coronavirus?
A33921T4I2XIRS,1,general,corona,Useful,C_41_U,8,Studies suggest that coronaviruses (including preliminary information on the new virus) may persist on surfaces for a few hours or up to several days.,How long does the new coronavirus survive on surfaces?
A33921T4I2XIRS,1,general,corona,Useful,C_46_U,8,Remdesivir,"Which drug, which has been used as a treatment for the Ebola and Marburg viruses, might be promising as a treatment for this new coronavirus?"
A33921T4I2XIRS,1,general,general,Not useful,NC_07_NU,4,Salt Lake City,In what city could you see the Seagull Monument at Temple Square?
A33921T4I2XIRS,1,general,general,Not useful,NC_11_NU,4,Endeavour,What is the name of the ship that carried Captain Cook to Australia?
A33921T4I2XIRS,1,general,general,Not useful,NC_16_NU,12,Newborns,The apgar score is used to measure the color and condition of what?
A33921T4I2XIRS,1,general,general,Not useful,NC_21_NU,16,The Pieta,Which was the only one of his sculptures that Michelangelo signed?
A33921T4I2XIRS,1,general,general,Not useful,NC_23_NU,4,The Netherlands,In 1568 the Catholic Church sentenced the entire population of which nation to death as heretics?
A33921T4I2XIRS,1,general,general,Useful,NC_27_U,8,White vinegar,What can you use instead of fabric softner to soften sheets and remove odours?
A33921T4I2XIRS,1,general,general,Useful,NC_33_U,12,Below eye level,Where in the supermarket can you usually find the cheaper items?
A33921T4I2XIRS,1,general,general,Useful,NC_34_U,8,"Pineapple, by planting the green leaves",What tropical fruit can be regrown from its scraps?
A33921T4I2XIRS,1,general,general,Useful,NC_37_U,8,"Over the past 150 year, real estate, if you rent it out",What's a better investment: stocks or real estate?
A33921T4I2XIRS,1,general,general,Useful,NC_48_U,4,"Drop it from a 3 inch height. If it bounces, it's dead.",How can you tell if a battery is dead without using any tools?
A33921T4I2XIRS,1,general,third,MTurk,TB_28_MT,8,"Futurist Diamandis argues that due to improved powers of computation we are likely to see AI, improved medicine, and new ways of communicating.",What is to happen ten years from now?
A33921T4I2XIRS,1,general,third,MTurk,TB_38_MT,12,"As a rule, yes. Restaurants have to cover rent, salaries and taxes. These are all included in the prices.",Is it really cheaper to cook at home vs. eating out?
A33921T4I2XIRS,1,general,third,MTurk,TB_41_MT,4,"Deep learning-based machines, that can process unparalleled amount of information will allow AI to accomplish goals that were unimaginable until very recently. ",What are the most recent developments in artificial intelligence?
A33921T4I2XIRS,1,general,third,MTurk,TB_42_MT,4,"Galaxy formation occured in the aftermath of the Big Bang. Clustering and merging allows galaxies to accumulate mass, determining both their shape and structure. ",How do galaxies form?
A33921T4I2XIRS,1,general,third,MTurk,TB_45_MT,8,"The amygdala (from Greek, 'almond') is one of two almond-shaped clusters of nuclei located deep and medially within the temporal lobes of the brain in complex vertebrates, including humans.",What is the amygdala?
A33921T4I2XIRS,1,general,third,Trivia,TB_03_TR,8,Mrs. Doubtfire's,What 1993 film's title character has the first name Euphegenia?
A33921T4I2XIRS,1,general,third,Trivia,TB_20_TR,16,Rafflesia (corpse lily),What is the largest flower in the world?
A33921T4I2XIRS,1,general,third,Trivia,TB_23_TR,4,Tooth,What is the only part of the body that can't repair itself?
