PID,sess,firstBlock,block,type,questionId,wait_duration,answer,question
A3415FKWLN1BEM,1,corona,corona,Not useful,C_04_NU,4,"It stands for ""COronaVIrus Disease 2019""","Why is the new coronavirus called ""COVID-19""? "
A3415FKWLN1BEM,1,corona,corona,Not useful,C_08_NU,12,Lombardy,What is the name of the county in Italy that had the first coronavirus outbreak?
A3415FKWLN1BEM,1,corona,corona,Not useful,C_16_NU,16,Bats and pangolins,What other animals have been found to have viruses with highly similar genome sequences as the current coronavirus?
A3415FKWLN1BEM,1,corona,corona,Not useful,C_22_NU,16,Contact tracing,What is the name of the process health authorities use to understand the sources of infection and to prevent further transmission?
A3415FKWLN1BEM,1,corona,corona,Not useful,C_24_NU,12,Contagion,"According to media reports, which 2011 movie has seen a large increase in popularity in the wake of the new coronavirus?"
A3415FKWLN1BEM,1,corona,corona,Useful,C_27_U,8,Washing your hands frequently,What is the most effective measure to prevent infection with the coronavirus?
A3415FKWLN1BEM,1,corona,corona,Useful,C_33_U,16,Soft surfaces are less likely to transmit the virus than hard surfaces.,Can the new coronavirus be transmitted by touching a soft surface like carpets or fabric?
A3415FKWLN1BEM,1,corona,general,Not useful,NC_09_NU,12,Captain Cook,"Who christened Hawaii ""the Sandwich Islands"" in 1778?"
A3415FKWLN1BEM,1,corona,general,Not useful,NC_15_NU,8,Albert Einstein,Who beat out FDR and Gandhi to be named Time's Person of the Century in 1999?
A3415FKWLN1BEM,1,corona,general,Not useful,NC_18_NU,8,A truce,What was put in place by the Ancient Greeks before and during all Olympic festivals?
A3415FKWLN1BEM,1,corona,general,Not useful,NC_26_NU,8,Dark Side of the Moon,What album spent a record 741 weeks on Billboard's Top 200 Albums chart?
A3415FKWLN1BEM,1,corona,general,Useful,NC_38_U,4,"Camu Camu, a cherry-like fruit from Brazil",What fruit has the highest content of vitamin C?
A3415FKWLN1BEM,1,corona,general,Useful,NC_43_U,16,Between 105 and 54 days before the scheduled trip.,How far in advance of a trip is the most cost effective time to purchase a plane ticket? 
A3415FKWLN1BEM,1,corona,general,Useful,NC_48_U,8,"Drop it from a 3 inch height. If it bounces, it's dead.",How can you tell if a battery is dead without using any tools?
A3415FKWLN1BEM,1,corona,general,Useful,NC_49_U,4,"Roll it along its long side. If it stops immediately, it's raw.",How can you tell if an egg is cooked without breaking it?
A3415FKWLN1BEM,1,corona,third,MTurk,TB_27_MT,8,"We do not know, of course. Yet, it is important to realize that there is no scientific proof for God's existence.  ",Does God exist?
A3415FKWLN1BEM,1,corona,third,MTurk,TB_31_MT,8,Scientists estimate that at the moment it is not. But with global warming it might become more feasilbe later in the 21st century.,How feasible would it be to colonize Antarctica?
A3415FKWLN1BEM,1,corona,third,MTurk,TB_34_MT,4,Evolution is usually very slow. Think about the similarities between apes and people. Future people are going to be as similar to us as we are to apes. ,What will future humans look like?
A3415FKWLN1BEM,1,corona,third,MTurk,TB_42_MT,16,"Galaxy formation occured in the aftermath of the Big Bang. Clustering and merging allows galaxies to accumulate mass, determining both their shape and structure. ",How do galaxies form?
A3415FKWLN1BEM,1,corona,third,MTurk,TB_45_MT,16,"The amygdala (from Greek, 'almond') is one of two almond-shaped clusters of nuclei located deep and medially within the temporal lobes of the brain in complex vertebrates, including humans.",What is the amygdala?
A3415FKWLN1BEM,1,corona,third,Trivia,TB_06_TR,8,Xanadu,What 1980 film is named for the legendary square-shaped capital of Kublai Khan?
A3415FKWLN1BEM,1,corona,third,Trivia,TB_19_TR,4,Ketchup,The only vegetable ice cream ever produced was what flavor?
A3415FKWLN1BEM,1,corona,third,Trivia,TB_23_TR,4,Tooth,What is the only part of the body that can't repair itself?
