PID,sess,firstBlock,block,type,questionId,wait_duration,answer,question
A34EIXOWQY9383,1,corona,corona,Not useful,C_02_NU,12,Three ,How many pandemics were there in the 20th century?
A34EIXOWQY9383,1,corona,corona,Not useful,C_12_NU,4,Diamond Princess,What was the name of the British cruise ship that was quarantined in Japanese waters?
A34EIXOWQY9383,1,corona,corona,Not useful,C_17_NU,4,"Locations, people, or animals","The name for the new disease COVID-19 adheres to WHO best practices in disease naming, which include guidelines to not name disease after what?"
A34EIXOWQY9383,1,corona,corona,Useful,C_31_U,16,"The virus is probably not sexually tansmissible, but infection does occurs when kissing.",Can the coronavirus be transmitted through sexual intercourse?
A34EIXOWQY9383,1,corona,corona,Useful,C_36_U,4,No. There is no evidence that regularly rinsing the nose with saline has protected people from infection with the new coronavirus.,Can regularly rinsing your nose with saline help prevent infection with the new coronavirus?
A34EIXOWQY9383,1,corona,corona,Useful,C_40_U,4,"The incubation period - the time between catching the virus and beginning to have symptoms of the disease - is estimated to range from 1-14 days, most commonly around five days.",How long is the incubation period for the new coronavirus?
A34EIXOWQY9383,1,corona,general,Not useful,NC_05_NU,12,Matthew,Which of the four biblical Gospels was written by a tax collector?
A34EIXOWQY9383,1,corona,general,Not useful,NC_11_NU,4,Endeavour,What is the name of the ship that carried Captain Cook to Australia?
A34EIXOWQY9383,1,corona,general,Not useful,NC_17_NU,4,Gilbert Van Camp,What Indianapolis grocer made his name by selling canned pork and beans to U.S. troops during the Civil War?
A34EIXOWQY9383,1,corona,general,Not useful,NC_18_NU,12,A truce,What was put in place by the Ancient Greeks before and during all Olympic festivals?
A34EIXOWQY9383,1,corona,general,Not useful,NC_25_NU,8,Shark,"What animal is thought to be immune to most all diseases, including cancer?"
A34EIXOWQY9383,1,corona,general,Useful,NC_30_U,8,Floormats - put them under the wheels for traction,What item that can be found in any car can help you extract your car from mud or snow?
A34EIXOWQY9383,1,corona,general,Useful,NC_34_U,4,"Pineapple, by planting the green leaves",What tropical fruit can be regrown from its scraps?
A34EIXOWQY9383,1,corona,general,Useful,NC_46_U,4,"Dish soap, peroxide, and baking soda","While tomato juice probably will not work, what does work to remove skunk odor? "
A34EIXOWQY9383,1,corona,third,MTurk,TB_30_MT,12,"The ""no hair theorem"" states that a black hole has only three properties: electric charge, angular momentum, and mass.",What is the composition of a black hole?
A34EIXOWQY9383,1,corona,third,MTurk,TB_31_MT,12,Scientists estimate that at the moment it is not. But with global warming it might become more feasilbe later in the 21st century.,How feasible would it be to colonize Antarctica?
A34EIXOWQY9383,1,corona,third,Trivia,TB_08_TR,4,Library of Congress,"In 1802, John Beckley became the librarian of what collection containing 740 books at the time?"
A34EIXOWQY9383,1,corona,third,Trivia,TB_16_TR,4,Jim Lovell,Alan Shepard was scheduled to command the ill-fated Apollo 13 before switching missions with what astronaut?
A34EIXOWQY9383,1,corona,third,Trivia,TB_17_TR,8,"Third finger, left hand",What part of his body did Keith Richards insure for a million pounds?
A34EIXOWQY9383,1,corona,third,Trivia,TB_20_TR,8,Rafflesia (corpse lily),What is the largest flower in the world?
