PID,sess,firstBlock,block,type,questionId,wait_duration,answer,question
A362RXUHDXF7EA,1,general,corona,Not useful,C_16_NU,8,Bats and pangolins,What other animals have been found to have viruses with highly similar genome sequences as the current coronavirus?
A362RXUHDXF7EA,1,general,corona,Useful,C_33_U,4,Soft surfaces are less likely to transmit the virus than hard surfaces.,Can the new coronavirus be transmitted by touching a soft surface like carpets or fabric?
A362RXUHDXF7EA,1,general,corona,Useful,C_41_U,16,Studies suggest that coronaviruses (including preliminary information on the new virus) may persist on surfaces for a few hours or up to several days.,How long does the new coronavirus survive on surfaces?
A362RXUHDXF7EA,1,general,corona,Useful,C_46_U,12,Remdesivir,"Which drug, which has been used as a treatment for the Ebola and Marburg viruses, might be promising as a treatment for this new coronavirus?"
A362RXUHDXF7EA,1,general,general,Not useful,NC_02_NU,12,Tiger Woods,"Who's the only two-time Sports Illustrated Sportsman of the Year, so named in 1996 and 2000?"
A362RXUHDXF7EA,1,general,general,Not useful,NC_14_NU,16,Rod Serling,What famed TV personality wrote the screenplay for 1968's Planet of the Apes?
A362RXUHDXF7EA,1,general,general,Not useful,NC_26_NU,8,Dark Side of the Moon,What album spent a record 741 weeks on Billboard's Top 200 Albums chart?
A362RXUHDXF7EA,1,general,general,Useful,NC_32_U,4,Take a picture of your fridge before leaving the house,What's a simple trick for telling whether your out of something when you're grocery shopping?
A362RXUHDXF7EA,1,general,general,Useful,NC_40_U,12,Squint your eyes,How do you make your smile look more genuine in photographs?
A362RXUHDXF7EA,1,general,general,Useful,NC_51_U,16,White vinegar,What salad dressing ingredient is also an efficient weed killer?
A362RXUHDXF7EA,1,general,third,MTurk,TB_39_MT,16,"There is radio emission around black holes. Scientists created a network of telescopes, capturing an image of a black hole by improving upon a technique that allows for the imaging of far-away objects",How was the recent picture of a black hole made?
A362RXUHDXF7EA,1,general,third,MTurk,TB_42_MT,12,"Galaxy formation occured in the aftermath of the Big Bang. Clustering and merging allows galaxies to accumulate mass, determining both their shape and structure. ",How do galaxies form?
A362RXUHDXF7EA,1,general,third,MTurk,TB_43_MT,8,"Planets likely start off as grains of dust that then combine to form bigger rocks. They clear material from their path, leaving tracks of space empty but for fine dust.",How do planets form?
A362RXUHDXF7EA,1,general,third,Trivia,TB_19_TR,8,Ketchup,The only vegetable ice cream ever produced was what flavor?
