PID,sess,firstBlock,block,type,questionId,wait_duration,answer,question
A363D6LSDTYJDT,1,corona,corona,Not useful,C_16_NU,8,Bats and pangolins,What other animals have been found to have viruses with highly similar genome sequences as the current coronavirus?
A363D6LSDTYJDT,1,corona,corona,Not useful,C_17_NU,8,"Locations, people, or animals","The name for the new disease COVID-19 adheres to WHO best practices in disease naming, which include guidelines to not name disease after what?"
A363D6LSDTYJDT,1,corona,corona,Not useful,C_23_NU,4,They falsely claimed to cure or prevent coronavirus,"At the end of February, Amazon banned over a million products because of what?"
A363D6LSDTYJDT,1,corona,corona,Not useful,C_26_NU,4,Severe acute respiratory syndrome,The official name of the new coronavirus is SARS-CoV-2. What does SARS stand for?
A363D6LSDTYJDT,1,corona,corona,Useful,C_27_U,16,Washing your hands frequently,What is the most effective measure to prevent infection with the coronavirus?
A363D6LSDTYJDT,1,corona,corona,Useful,C_29_U,8,Not for at least several months from now,How soon is a vaccine for the new coronavirus likely to be available?
A363D6LSDTYJDT,1,corona,corona,Useful,C_52_U,4,No. To protect yourself against the new coronavirus washing your hands is the best preventive measure.,Are hand dryers effective in killing the new coronavirus?
A363D6LSDTYJDT,1,corona,general,Not useful,NC_08_NU,4,The guppy,What common aquarium fish is named for the naturalist who discovered it in Trinidad in 1876?
A363D6LSDTYJDT,1,corona,general,Not useful,NC_11_NU,12,Endeavour,What is the name of the ship that carried Captain Cook to Australia?
A363D6LSDTYJDT,1,corona,general,Not useful,NC_12_NU,16,Come by her,"The title of the song ""Kumbaya"" is actually a distortion of what three-word phrase?"
A363D6LSDTYJDT,1,corona,general,Not useful,NC_23_NU,12,The Netherlands,In 1568 the Catholic Church sentenced the entire population of which nation to death as heretics?
A363D6LSDTYJDT,1,corona,general,Useful,NC_32_U,4,Take a picture of your fridge before leaving the house,What's a simple trick for telling whether your out of something when you're grocery shopping?
A363D6LSDTYJDT,1,corona,general,Useful,NC_40_U,16,Squint your eyes,How do you make your smile look more genuine in photographs?
A363D6LSDTYJDT,1,corona,general,Useful,NC_48_U,4,"Drop it from a 3 inch height. If it bounces, it's dead.",How can you tell if a battery is dead without using any tools?
A363D6LSDTYJDT,1,corona,third,MTurk,TB_44_MT,4,"In all U.S states, same-sex marriage is now legal. Also, the number of kids per family has decreased and so ""middle"" childreen, between the eldest and youngest, are getting rarer. ",How have families changed over time?
A363D6LSDTYJDT,1,corona,third,Trivia,TB_10_TR,16,George VI,Who was the last British Monarch to also be an emperor?
A363D6LSDTYJDT,1,corona,third,Trivia,TB_15_TR,12,Portia,The United States' first law school for woman was named for what cross-dressing Shakespearean character?
A363D6LSDTYJDT,1,corona,third,Trivia,TB_17_TR,4,"Third finger, left hand",What part of his body did Keith Richards insure for a million pounds?
A363D6LSDTYJDT,1,corona,third,Trivia,TB_22_TR,8,Cheetah,Which is the only cat that cannot retract its claws?
A363D6LSDTYJDT,1,corona,third,Trivia,TB_23_TR,16,Tooth,What is the only part of the body that can't repair itself?
