PID,sess,firstBlock,block,type,questionId,wait_duration,answer,question
A36KDWI1CGJFFA,1,general,corona,Not useful,C_04_NU,16,"It stands for ""COronaVIrus Disease 2019""","Why is the new coronavirus called ""COVID-19""? "
A36KDWI1CGJFFA,1,general,corona,Not useful,C_05_NU,8,University of Washington,Which was the first US University to cancel classes becuase of the new coronavirus?
A36KDWI1CGJFFA,1,general,corona,Not useful,C_22_NU,8,Contact tracing,What is the name of the process health authorities use to understand the sources of infection and to prevent further transmission?
A36KDWI1CGJFFA,1,general,corona,Useful,C_27_U,8,Washing your hands frequently,What is the most effective measure to prevent infection with the coronavirus?
A36KDWI1CGJFFA,1,general,corona,Useful,C_31_U,12,"The virus is probably not sexually tansmissible, but infection does occurs when kissing.",Can the coronavirus be transmitted through sexual intercourse?
A36KDWI1CGJFFA,1,general,corona,Useful,C_36_U,4,No. There is no evidence that regularly rinsing the nose with saline has protected people from infection with the new coronavirus.,Can regularly rinsing your nose with saline help prevent infection with the new coronavirus?
A36KDWI1CGJFFA,1,general,corona,Useful,C_43_U,8,Quarantine themselves for 14 days to make sure they are not infected.,"Currently, people who  may have been in contact with someone with the new coronavirus are recommended to do what?"
A36KDWI1CGJFFA,1,general,corona,Useful,C_50_U,12,Washington,The first US death from the new coronavirus occurred in which state?
A36KDWI1CGJFFA,1,general,general,Not useful,NC_06_NU,4,David Livingstone,Who discovered the Victoria Falls?
A36KDWI1CGJFFA,1,general,general,Not useful,NC_12_NU,16,Come by her,"The title of the song ""Kumbaya"" is actually a distortion of what three-word phrase?"
A36KDWI1CGJFFA,1,general,general,Not useful,NC_17_NU,4,Gilbert Van Camp,What Indianapolis grocer made his name by selling canned pork and beans to U.S. troops during the Civil War?
A36KDWI1CGJFFA,1,general,general,Not useful,NC_19_NU,4,Smoke,"in 1908, New York City passed the Sullivan Ordinance which made it illegal for women to do what in public?"
A36KDWI1CGJFFA,1,general,general,Useful,NC_36_U,12,Potatos: rub a cut potato over your windshield before a frost to prevent freezing,What vegetable can prevent your windshield from freezing over in winter?
A36KDWI1CGJFFA,1,general,general,Useful,NC_41_U,16,"April 8th, 2024",When is the next total solar eclipse visible in North America projected to occur? 
A36KDWI1CGJFFA,1,general,general,Useful,NC_42_U,12,"Deprive it of oxygen by covering, pouring baking soda if the fire is small, or using a fire extinguisher if it's large.",How do you put out a grease fire? 
A36KDWI1CGJFFA,1,general,general,Useful,NC_43_U,4,Between 105 and 54 days before the scheduled trip.,How far in advance of a trip is the most cost effective time to purchase a plane ticket? 
A36KDWI1CGJFFA,1,general,general,Useful,NC_45_U,8,"Grapes or raisins, onions, avocado","In addition to chocolate, what other foods can be very harmful to dogs? "
A36KDWI1CGJFFA,1,general,general,Useful,NC_52_U,4,"Tie your hair into a tight ponytail at the front of your head, and cut it.",How can you give yourself a layered haircut?
A36KDWI1CGJFFA,1,general,third,MTurk,TB_25_MT,12,"Scientists estimate that we are likely to see flying cars, and that computers may be able to read people's thoughts and emotions ",What will be the new technologies of future?
A36KDWI1CGJFFA,1,general,third,MTurk,TB_32_MT,8,Sophisticated equipment is either lowered to the sea bottom or directly attached to submersible buoys and transmits to a research vessel that is equipped with state-of-the-art navigational instruments.,What are undersea researchers doing to explore the ocean floor?
A36KDWI1CGJFFA,1,general,third,MTurk,TB_35_MT,4,Prototypes already exist. Technological estimates suggest that definitely within the next twenty years -- although the challenges are great.,When will we have flying cars?
A36KDWI1CGJFFA,1,general,third,MTurk,TB_37_MT,8,Engineers and architects agree that the answer is positive. Houses for the non-rich are much better built today than they were built 500 years ago.,Are houses built better than they used to be?
A36KDWI1CGJFFA,1,general,third,MTurk,TB_46_MT,12,"Scientists are still figuring it out. It seems that passive use is slightly bad, but active use is not.",How does social media influence our mental health?
A36KDWI1CGJFFA,1,general,third,Trivia,TB_03_TR,8,Mrs. Doubtfire's,What 1993 film's title character has the first name Euphegenia?
A36KDWI1CGJFFA,1,general,third,Trivia,TB_18_TR,16,Orville Wright,Who was flying the plane in which the first US airplane fatality occurred?
A36KDWI1CGJFFA,1,general,third,Trivia,TB_20_TR,16,Rafflesia (corpse lily),What is the largest flower in the world?
