PID,sess,firstBlock,block,type,questionId,wait_duration,answer,question
A371H3PQPR2Z8J,1,general,corona,Not useful,C_03_NU,12,"Fuburary 1st, 2020",When was the molecular structure of the coronovirus identfied?
A371H3PQPR2Z8J,1,general,corona,Not useful,C_11_NU,12,The Chicago of China,"Wuhan, China, the city in which the coronavirus was first identified, is commonly referred to as the chinese version of what American city?"
A371H3PQPR2Z8J,1,general,corona,Not useful,C_15_NU,4,7.5 days,"In the early stages of the new coronavirus, the number of new cases doubled approximately every how many days?"
A371H3PQPR2Z8J,1,general,corona,Not useful,C_26_NU,8,Severe acute respiratory syndrome,The official name of the new coronavirus is SARS-CoV-2. What does SARS stand for?
A371H3PQPR2Z8J,1,general,corona,Useful,C_39_U,16,"No, antibiotics do not work against viruses, only bacteria.",Are antibiotics effective in preventing and treating the new coronavirus?
A371H3PQPR2Z8J,1,general,corona,Useful,C_45_U,16,"Pre-existing health conditions, including cardiovascular diseases and diabetes.",What did 75% of the people who have died from the new coronavirus have?
A371H3PQPR2Z8J,1,general,general,Not useful,NC_10_NU,4,K.D. Lang,What Canadian singer appeared on the first cover of Entertainment Weekly?
A371H3PQPR2Z8J,1,general,general,Not useful,NC_15_NU,4,Albert Einstein,Who beat out FDR and Gandhi to be named Time's Person of the Century in 1999?
A371H3PQPR2Z8J,1,general,general,Not useful,NC_26_NU,4,Dark Side of the Moon,What album spent a record 741 weeks on Billboard's Top 200 Albums chart?
A371H3PQPR2Z8J,1,general,general,Useful,NC_29_U,8,"Freeze before chopping, or hold a piece of bread in your mouth, half sticking out",How to chop an onion without crying?
A371H3PQPR2Z8J,1,general,general,Useful,NC_43_U,16,Between 105 and 54 days before the scheduled trip.,How far in advance of a trip is the most cost effective time to purchase a plane ticket? 
A371H3PQPR2Z8J,1,general,general,Useful,NC_51_U,4,White vinegar,What salad dressing ingredient is also an efficient weed killer?
A371H3PQPR2Z8J,1,general,third,MTurk,TB_29_MT,16,"There are a few helpful techniques. One is to imagine that you climb on top of a high building, and ""look down"" at your life. Second, to try to think about issues in novel ways. ",How to stay calm in adversity?
A371H3PQPR2Z8J,1,general,third,MTurk,TB_32_MT,12,Sophisticated equipment is either lowered to the sea bottom or directly attached to submersible buoys and transmits to a research vessel that is equipped with state-of-the-art navigational instruments.,What are undersea researchers doing to explore the ocean floor?
A371H3PQPR2Z8J,1,general,third,MTurk,TB_34_MT,8,Evolution is usually very slow. Think about the similarities between apes and people. Future people are going to be as similar to us as we are to apes. ,What will future humans look like?
A371H3PQPR2Z8J,1,general,third,Trivia,TB_04_TR,8,Phil Knight,"In 1964, who founded Blue Ribbon Sports, which later went on to become Nike?"
A371H3PQPR2Z8J,1,general,third,Trivia,TB_11_TR,8,Mung beans,What kind of bean produces the Asian-style bean sprouts in the produce section of supermarkets?
A371H3PQPR2Z8J,1,general,third,Trivia,TB_16_TR,12,Jim Lovell,Alan Shepard was scheduled to command the ill-fated Apollo 13 before switching missions with what astronaut?
A371H3PQPR2Z8J,1,general,third,Trivia,TB_22_TR,12,Cheetah,Which is the only cat that cannot retract its claws?
