PID,sess,firstBlock,block,type,questionId,wait_duration,answer,question
A38BO0BRCQX6OV,1,corona,corona,Not useful,C_21_NU,8,An epidemic that has spread around the world,An epidemic is the outbreak of a disease that affects many people at the same time. What does pandemic mean?
A38BO0BRCQX6OV,1,corona,corona,Useful,C_28_U,16,"Yes, by boosting the immune system",Does sleep make you more resistant to coronavirus infections?
A38BO0BRCQX6OV,1,corona,corona,Useful,C_30_U,8,More similar to the symptoms of the ful,"Are the new coronavirus symptoms more similar to the symptoms of flu, or of seasonal allergies?"
A38BO0BRCQX6OV,1,corona,corona,Useful,C_42_U,12,"Fever, cough, shortness of breath.",What are the most common symptoms of the new coronavirus?
A38BO0BRCQX6OV,1,corona,corona,Useful,C_49_U,16,"Approved filtering facemask respirators, such as the N95 respirator.","It is recommended that healthcare professionals who may be working in contact with people with the virus wear what, in addition to personal protective equipment on their hands and bodies?"
A38BO0BRCQX6OV,1,corona,general,Not useful,NC_05_NU,12,Matthew,Which of the four biblical Gospels was written by a tax collector?
A38BO0BRCQX6OV,1,corona,general,Useful,NC_27_U,4,White vinegar,What can you use instead of fabric softner to soften sheets and remove odours?
A38BO0BRCQX6OV,1,corona,general,Useful,NC_29_U,4,"Freeze before chopping, or hold a piece of bread in your mouth, half sticking out",How to chop an onion without crying?
A38BO0BRCQX6OV,1,corona,general,Useful,NC_43_U,8,Between 105 and 54 days before the scheduled trip.,How far in advance of a trip is the most cost effective time to purchase a plane ticket? 
A38BO0BRCQX6OV,1,corona,general,Useful,NC_49_U,12,"Roll it along its long side. If it stops immediately, it's raw.",How can you tell if an egg is cooked without breaking it?
A38BO0BRCQX6OV,1,corona,third,MTurk,TB_24_MT,4,"Deep sea creatures must survive in extremely harsh conditions. They include the giant spider crab, frilled shark, and the atlantic wolffish",Which creatures live in deep sea?
A38BO0BRCQX6OV,1,corona,third,MTurk,TB_25_MT,8,"Scientists estimate that we are likely to see flying cars, and that computers may be able to read people's thoughts and emotions ",What will be the new technologies of future?
A38BO0BRCQX6OV,1,corona,third,MTurk,TB_44_MT,8,"In all U.S states, same-sex marriage is now legal. Also, the number of kids per family has decreased and so ""middle"" childreen, between the eldest and youngest, are getting rarer. ",How have families changed over time?
A38BO0BRCQX6OV,1,corona,third,Trivia,TB_14_TR,12,James Brown,"When asked to define ""cool,"" what two words did James Brown use?"
A38BO0BRCQX6OV,1,corona,third,Trivia,TB_20_TR,16,Rafflesia (corpse lily),What is the largest flower in the world?
A38BO0BRCQX6OV,1,corona,third,Trivia,TB_21_TR,8,New York,Which state has the zip code 12345?
A38BO0BRCQX6OV,1,corona,third,Trivia,TB_22_TR,8,Cheetah,Which is the only cat that cannot retract its claws?
