PID,sess,firstBlock,block,type,questionId,wait_duration,answer,question
A3BGCHI2LSGHMQ,1,corona,corona,Not useful,C_05_NU,4,University of Washington,Which was the first US University to cancel classes becuase of the new coronavirus?
A3BGCHI2LSGHMQ,1,corona,corona,Not useful,C_08_NU,4,Lombardy,What is the name of the county in Italy that had the first coronavirus outbreak?
A3BGCHI2LSGHMQ,1,corona,corona,Not useful,C_14_NU,16,"January 30, 2020",On what date did the World Health Organization declare the new coronavirus outbreak to be a Public Health Emergency of International Concern?
A3BGCHI2LSGHMQ,1,corona,corona,Not useful,C_19_NU,4,Strategic National Stockpile,What is the name of the repository of drugs and supplies the U.S. government is supposed to maintain in case of a public health emergency?
A3BGCHI2LSGHMQ,1,corona,corona,Not useful,C_26_NU,4,Severe acute respiratory syndrome,The official name of the new coronavirus is SARS-CoV-2. What does SARS stand for?
A3BGCHI2LSGHMQ,1,corona,corona,Useful,C_33_U,8,Soft surfaces are less likely to transmit the virus than hard surfaces.,Can the new coronavirus be transmitted by touching a soft surface like carpets or fabric?
A3BGCHI2LSGHMQ,1,corona,corona,Useful,C_37_U,8,There is no evidence from the current outbreak that eating garlic has protected people from the new coronavirus.,Can eating garlic help prevent infection with the new coronavirus?
A3BGCHI2LSGHMQ,1,corona,corona,Useful,C_49_U,4,"Approved filtering facemask respirators, such as the N95 respirator.","It is recommended that healthcare professionals who may be working in contact with people with the virus wear what, in addition to personal protective equipment on their hands and bodies?"
A3BGCHI2LSGHMQ,1,corona,general,Not useful,NC_19_NU,12,Smoke,"in 1908, New York City passed the Sullivan Ordinance which made it illegal for women to do what in public?"
A3BGCHI2LSGHMQ,1,corona,general,Not useful,NC_20_NU,4,Russia,Which country has the most public libraries?
A3BGCHI2LSGHMQ,1,corona,general,Not useful,NC_21_NU,16,The Pieta,Which was the only one of his sculptures that Michelangelo signed?
A3BGCHI2LSGHMQ,1,corona,general,Not useful,NC_24_NU,8,State quarters,What's been released five times a year from January 1999 to fall 2008?
A3BGCHI2LSGHMQ,1,corona,general,Useful,NC_32_U,8,Take a picture of your fridge before leaving the house,What's a simple trick for telling whether your out of something when you're grocery shopping?
A3BGCHI2LSGHMQ,1,corona,general,Useful,NC_34_U,4,"Pineapple, by planting the green leaves",What tropical fruit can be regrown from its scraps?
A3BGCHI2LSGHMQ,1,corona,general,Useful,NC_36_U,8,Potatos: rub a cut potato over your windshield before a frost to prevent freezing,What vegetable can prevent your windshield from freezing over in winter?
A3BGCHI2LSGHMQ,1,corona,general,Useful,NC_47_U,4,"Add baking soda, soak in advance, use a preassure cooker",What can you do to make dry beans cook faster?
A3BGCHI2LSGHMQ,1,corona,general,Useful,NC_50_U,8,Spread beeswax over them and then blow dry until you can't see the beeswax anymore,What's an easy way to waterproof canvas shoes?
A3BGCHI2LSGHMQ,1,corona,third,MTurk,TB_39_MT,16,"There is radio emission around black holes. Scientists created a network of telescopes, capturing an image of a black hole by improving upon a technique that allows for the imaging of far-away objects",How was the recent picture of a black hole made?
A3BGCHI2LSGHMQ,1,corona,third,Trivia,TB_08_TR,16,Library of Congress,"In 1802, John Beckley became the librarian of what collection containing 740 books at the time?"
A3BGCHI2LSGHMQ,1,corona,third,Trivia,TB_11_TR,12,Mung beans,What kind of bean produces the Asian-style bean sprouts in the produce section of supermarkets?
A3BGCHI2LSGHMQ,1,corona,third,Trivia,TB_13_TR,16,Java,On what namesake Asian island are the first Homo erectus fossils found?
A3BGCHI2LSGHMQ,1,corona,third,Trivia,TB_15_TR,8,Portia,The United States' first law school for woman was named for what cross-dressing Shakespearean character?
A3BGCHI2LSGHMQ,1,corona,third,Trivia,TB_18_TR,8,Orville Wright,Who was flying the plane in which the first US airplane fatality occurred?
A3BGCHI2LSGHMQ,1,corona,third,Trivia,TB_21_TR,4,New York,Which state has the zip code 12345?
