PID,sess,firstBlock,block,type,questionId,wait_duration,answer,question
A3C8NUIBNZYMT2,1,corona,corona,Not useful,C_01_NU,8,"Animals, probably bats",What is the source of coronavirus in humans?
A3C8NUIBNZYMT2,1,corona,corona,Not useful,C_03_NU,4,"Fuburary 1st, 2020",When was the molecular structure of the coronovirus identfied?
A3C8NUIBNZYMT2,1,corona,corona,Not useful,C_04_NU,12,"It stands for ""COronaVIrus Disease 2019""","Why is the new coronavirus called ""COVID-19""? "
A3C8NUIBNZYMT2,1,corona,corona,Not useful,C_11_NU,8,The Chicago of China,"Wuhan, China, the city in which the coronavirus was first identified, is commonly referred to as the chinese version of what American city?"
A3C8NUIBNZYMT2,1,corona,corona,Not useful,C_21_NU,16,An epidemic that has spread around the world,An epidemic is the outbreak of a disease that affects many people at the same time. What does pandemic mean?
A3C8NUIBNZYMT2,1,corona,corona,Not useful,C_22_NU,4,Contact tracing,What is the name of the process health authorities use to understand the sources of infection and to prevent further transmission?
A3C8NUIBNZYMT2,1,corona,corona,Useful,C_28_U,8,"Yes, by boosting the immune system",Does sleep make you more resistant to coronavirus infections?
A3C8NUIBNZYMT2,1,corona,corona,Useful,C_36_U,4,No. There is no evidence that regularly rinsing the nose with saline has protected people from infection with the new coronavirus.,Can regularly rinsing your nose with saline help prevent infection with the new coronavirus?
A3C8NUIBNZYMT2,1,corona,corona,Useful,C_43_U,12,Quarantine themselves for 14 days to make sure they are not infected.,"Currently, people who  may have been in contact with someone with the new coronavirus are recommended to do what?"
A3C8NUIBNZYMT2,1,corona,general,Not useful,NC_14_NU,16,Rod Serling,What famed TV personality wrote the screenplay for 1968's Planet of the Apes?
A3C8NUIBNZYMT2,1,corona,general,Not useful,NC_16_NU,16,Newborns,The apgar score is used to measure the color and condition of what?
A3C8NUIBNZYMT2,1,corona,general,Not useful,NC_21_NU,4,The Pieta,Which was the only one of his sculptures that Michelangelo signed?
A3C8NUIBNZYMT2,1,corona,general,Not useful,NC_23_NU,8,The Netherlands,In 1568 the Catholic Church sentenced the entire population of which nation to death as heretics?
A3C8NUIBNZYMT2,1,corona,general,Not useful,NC_25_NU,8,Shark,"What animal is thought to be immune to most all diseases, including cancer?"
A3C8NUIBNZYMT2,1,corona,general,Useful,NC_36_U,8,Potatos: rub a cut potato over your windshield before a frost to prevent freezing,What vegetable can prevent your windshield from freezing over in winter?
A3C8NUIBNZYMT2,1,corona,general,Useful,NC_41_U,16,"April 8th, 2024",When is the next total solar eclipse visible in North America projected to occur? 
A3C8NUIBNZYMT2,1,corona,general,Useful,NC_43_U,12,Between 105 and 54 days before the scheduled trip.,How far in advance of a trip is the most cost effective time to purchase a plane ticket? 
A3C8NUIBNZYMT2,1,corona,general,Useful,NC_50_U,4,Spread beeswax over them and then blow dry until you can't see the beeswax anymore,What's an easy way to waterproof canvas shoes?
A3C8NUIBNZYMT2,1,corona,third,MTurk,TB_24_MT,16,"Deep sea creatures must survive in extremely harsh conditions. They include the giant spider crab, frilled shark, and the atlantic wolffish",Which creatures live in deep sea?
A3C8NUIBNZYMT2,1,corona,third,MTurk,TB_30_MT,12,"The ""no hair theorem"" states that a black hole has only three properties: electric charge, angular momentum, and mass.",What is the composition of a black hole?
A3C8NUIBNZYMT2,1,corona,third,MTurk,TB_44_MT,12,"In all U.S states, same-sex marriage is now legal. Also, the number of kids per family has decreased and so ""middle"" childreen, between the eldest and youngest, are getting rarer. ",How have families changed over time?
A3C8NUIBNZYMT2,1,corona,third,Trivia,TB_01_TR,4,Canada,"What country is home to Roots, the company that outfits the U.S. Olympic team?"
A3C8NUIBNZYMT2,1,corona,third,Trivia,TB_02_TR,16,Ivory Coast's,"The world's largest church is Our Lady of Peace Basilica in Yamoussoukro, what nation's capital?"
A3C8NUIBNZYMT2,1,corona,third,Trivia,TB_08_TR,8,Library of Congress,"In 1802, John Beckley became the librarian of what collection containing 740 books at the time?"
A3C8NUIBNZYMT2,1,corona,third,Trivia,TB_10_TR,12,George VI,Who was the last British Monarch to also be an emperor?
A3C8NUIBNZYMT2,1,corona,third,Trivia,TB_19_TR,12,Ketchup,The only vegetable ice cream ever produced was what flavor?
