PID,sess,firstBlock,block,type,questionId,wait_duration,answer,question
A3CM2UOJUAKPNQ,1,corona,corona,Not useful,C_15_NU,4,7.5 days,"In the early stages of the new coronavirus, the number of new cases doubled approximately every how many days?"
A3CM2UOJUAKPNQ,1,corona,corona,Not useful,C_18_NU,8,They are able to filter out at least 95% of airborne particles,Why are N95 respirator face masks so named?
A3CM2UOJUAKPNQ,1,corona,corona,Not useful,C_19_NU,16,Strategic National Stockpile,What is the name of the repository of drugs and supplies the U.S. government is supposed to maintain in case of a public health emergency?
A3CM2UOJUAKPNQ,1,corona,corona,Useful,C_35_U,16,"The virus spreads through coughs and sneezes, there are no reports of transmission through mosquito bites.",Can the new coronavirus be transmitted through mosquito bites?
A3CM2UOJUAKPNQ,1,corona,general,Not useful,NC_04_NU,16,Edward Albee,"Who wrote ""Who's Afraid of Virginia Woolf?"""
A3CM2UOJUAKPNQ,1,corona,general,Not useful,NC_06_NU,16,David Livingstone,Who discovered the Victoria Falls?
A3CM2UOJUAKPNQ,1,corona,general,Not useful,NC_22_NU,16,Steamboat Geyser,"Which Yellowstone geyser, with eruptions 100 fee taller than Old Faithful's, is the world's tallest?"
A3CM2UOJUAKPNQ,1,corona,general,Useful,NC_28_U,12,Microwave next to a glass of water,How can you soften brown sugar that has hardened into a lump?
A3CM2UOJUAKPNQ,1,corona,general,Useful,NC_30_U,16,Floormats - put them under the wheels for traction,What item that can be found in any car can help you extract your car from mud or snow?
A3CM2UOJUAKPNQ,1,corona,general,Useful,NC_49_U,8,"Roll it along its long side. If it stops immediately, it's raw.",How can you tell if an egg is cooked without breaking it?
A3CM2UOJUAKPNQ,1,corona,third,MTurk,TB_24_MT,16,"Deep sea creatures must survive in extremely harsh conditions. They include the giant spider crab, frilled shark, and the atlantic wolffish",Which creatures live in deep sea?
A3CM2UOJUAKPNQ,1,corona,third,MTurk,TB_37_MT,12,Engineers and architects agree that the answer is positive. Houses for the non-rich are much better built today than they were built 500 years ago.,Are houses built better than they used to be?
A3CM2UOJUAKPNQ,1,corona,third,MTurk,TB_45_MT,4,"The amygdala (from Greek, 'almond') is one of two almond-shaped clusters of nuclei located deep and medially within the temporal lobes of the brain in complex vertebrates, including humans.",What is the amygdala?
A3CM2UOJUAKPNQ,1,corona,third,Trivia,TB_01_TR,4,Canada,"What country is home to Roots, the company that outfits the U.S. Olympic team?"
A3CM2UOJUAKPNQ,1,corona,third,Trivia,TB_04_TR,8,Phil Knight,"In 1964, who founded Blue Ribbon Sports, which later went on to become Nike?"
A3CM2UOJUAKPNQ,1,corona,third,Trivia,TB_05_TR,16,Hong Kong,What city's harbor is overlooked by Victoria Peak?
A3CM2UOJUAKPNQ,1,corona,third,Trivia,TB_06_TR,12,Xanadu,What 1980 film is named for the legendary square-shaped capital of Kublai Khan?
A3CM2UOJUAKPNQ,1,corona,third,Trivia,TB_23_TR,16,Tooth,What is the only part of the body that can't repair itself?
