PID,sess,firstBlock,block,type,questionId,wait_duration,answer,question
A3D7JEGMSYKCUJ,1,corona,corona,Useful,C_46_U,4,Remdesivir,"Which drug, which has been used as a treatment for the Ebola and Marburg viruses, might be promising as a treatment for this new coronavirus?"
A3D7JEGMSYKCUJ,1,corona,general,Not useful,NC_15_NU,8,Albert Einstein,Who beat out FDR and Gandhi to be named Time's Person of the Century in 1999?
A3D7JEGMSYKCUJ,1,corona,general,Useful,NC_36_U,8,Potatos: rub a cut potato over your windshield before a frost to prevent freezing,What vegetable can prevent your windshield from freezing over in winter?
A3D7JEGMSYKCUJ,1,corona,general,Useful,NC_40_U,12,Squint your eyes,How do you make your smile look more genuine in photographs?
A3D7JEGMSYKCUJ,1,corona,general,Useful,NC_46_U,8,"Dish soap, peroxide, and baking soda","While tomato juice probably will not work, what does work to remove skunk odor? "
A3D7JEGMSYKCUJ,1,corona,third,MTurk,TB_39_MT,4,"There is radio emission around black holes. Scientists created a network of telescopes, capturing an image of a black hole by improving upon a technique that allows for the imaging of far-away objects",How was the recent picture of a black hole made?
A3D7JEGMSYKCUJ,1,corona,third,Trivia,TB_16_TR,4,Jim Lovell,Alan Shepard was scheduled to command the ill-fated Apollo 13 before switching missions with what astronaut?
A3D7JEGMSYKCUJ,1,corona,third,Trivia,TB_19_TR,4,Ketchup,The only vegetable ice cream ever produced was what flavor?
