PID,sess,firstBlock,block,type,questionId,wait_duration,answer,question
A3DAJROQC1BLNI,1,corona,corona,Not useful,C_11_NU,12,The Chicago of China,"Wuhan, China, the city in which the coronavirus was first identified, is commonly referred to as the chinese version of what American city?"
A3DAJROQC1BLNI,1,corona,corona,Not useful,C_23_NU,4,They falsely claimed to cure or prevent coronavirus,"At the end of February, Amazon banned over a million products because of what?"
A3DAJROQC1BLNI,1,corona,corona,Useful,C_33_U,12,Soft surfaces are less likely to transmit the virus than hard surfaces.,Can the new coronavirus be transmitted by touching a soft surface like carpets or fabric?
A3DAJROQC1BLNI,1,corona,corona,Useful,C_34_U,16,"The virus lives for up to a few days on surfaces, and so packages cannot transmit the virus.",Can the new coronavirus be transmitted on a package from an infected country?
A3DAJROQC1BLNI,1,corona,corona,Useful,C_45_U,12,"Pre-existing health conditions, including cardiovascular diseases and diabetes.",What did 75% of the people who have died from the new coronavirus have?
A3DAJROQC1BLNI,1,corona,corona,Useful,C_47_U,8,"Free of fever; no other symptoms, including cough; negative tests on at least two consecutive respiratory specimens at least 24 hours apart.",What are current Centers for Disease Control (CDC) guidelines for releasing someone from isolation?
A3DAJROQC1BLNI,1,corona,general,Not useful,NC_21_NU,8,The Pieta,Which was the only one of his sculptures that Michelangelo signed?
A3DAJROQC1BLNI,1,corona,general,Not useful,NC_23_NU,8,The Netherlands,In 1568 the Catholic Church sentenced the entire population of which nation to death as heretics?
A3DAJROQC1BLNI,1,corona,general,Useful,NC_40_U,4,Squint your eyes,How do you make your smile look more genuine in photographs?
A3DAJROQC1BLNI,1,corona,general,Useful,NC_45_U,12,"Grapes or raisins, onions, avocado","In addition to chocolate, what other foods can be very harmful to dogs? "
A3DAJROQC1BLNI,1,corona,general,Useful,NC_47_U,16,"Add baking soda, soak in advance, use a preassure cooker",What can you do to make dry beans cook faster?
A3DAJROQC1BLNI,1,corona,general,Useful,NC_52_U,12,"Tie your hair into a tight ponytail at the front of your head, and cut it.",How can you give yourself a layered haircut?
A3DAJROQC1BLNI,1,corona,third,MTurk,TB_31_MT,12,Scientists estimate that at the moment it is not. But with global warming it might become more feasilbe later in the 21st century.,How feasible would it be to colonize Antarctica?
A3DAJROQC1BLNI,1,corona,third,MTurk,TB_32_MT,12,Sophisticated equipment is either lowered to the sea bottom or directly attached to submersible buoys and transmits to a research vessel that is equipped with state-of-the-art navigational instruments.,What are undersea researchers doing to explore the ocean floor?
A3DAJROQC1BLNI,1,corona,third,MTurk,TB_35_MT,8,Prototypes already exist. Technological estimates suggest that definitely within the next twenty years -- although the challenges are great.,When will we have flying cars?
A3DAJROQC1BLNI,1,corona,third,MTurk,TB_41_MT,4,"Deep learning-based machines, that can process unparalleled amount of information will allow AI to accomplish goals that were unimaginable until very recently. ",What are the most recent developments in artificial intelligence?
A3DAJROQC1BLNI,1,corona,third,Trivia,TB_10_TR,12,George VI,Who was the last British Monarch to also be an emperor?
A3DAJROQC1BLNI,1,corona,third,Trivia,TB_13_TR,12,Java,On what namesake Asian island are the first Homo erectus fossils found?
