PID,sess,firstBlock,block,type,questionId,wait_duration,answer,question
A3DUZ6WCFZRLX9,1,general,corona,Not useful,C_02_NU,4,Three ,How many pandemics were there in the 20th century?
A3DUZ6WCFZRLX9,1,general,corona,Not useful,C_05_NU,12,University of Washington,Which was the first US University to cancel classes becuase of the new coronavirus?
A3DUZ6WCFZRLX9,1,general,corona,Not useful,C_10_NU,12,11 million people,"What is the population of Wuhan, the city in which coronavirus was first identified?"
A3DUZ6WCFZRLX9,1,general,corona,Not useful,C_12_NU,4,Diamond Princess,What was the name of the British cruise ship that was quarantined in Japanese waters?
A3DUZ6WCFZRLX9,1,general,corona,Not useful,C_16_NU,16,Bats and pangolins,What other animals have been found to have viruses with highly similar genome sequences as the current coronavirus?
A3DUZ6WCFZRLX9,1,general,corona,Useful,C_32_U,4,"Healthcare professionals treating patients, in-home caregivers, and those who are already sick with the new coronavirus",Which three groups of people does the CDC recommend masks for?
A3DUZ6WCFZRLX9,1,general,corona,Useful,C_48_U,16,"Regular face masks are not considered effective, and reserves need to be saved for people who are infected and for healthcare professionals.",Why does the CDC currently recommend that healthy people do not wear face masks?
A3DUZ6WCFZRLX9,1,general,general,Not useful,NC_03_NU,8,Red River,"What name is shared by the rivers that run through Denison, TX and Hanoi, Vietnam?"
A3DUZ6WCFZRLX9,1,general,general,Not useful,NC_07_NU,4,Salt Lake City,In what city could you see the Seagull Monument at Temple Square?
A3DUZ6WCFZRLX9,1,general,general,Not useful,NC_14_NU,16,Rod Serling,What famed TV personality wrote the screenplay for 1968's Planet of the Apes?
A3DUZ6WCFZRLX9,1,general,general,Not useful,NC_21_NU,12,The Pieta,Which was the only one of his sculptures that Michelangelo signed?
A3DUZ6WCFZRLX9,1,general,general,Not useful,NC_23_NU,4,The Netherlands,In 1568 the Catholic Church sentenced the entire population of which nation to death as heretics?
A3DUZ6WCFZRLX9,1,general,general,Useful,NC_38_U,8,"Camu Camu, a cherry-like fruit from Brazil",What fruit has the highest content of vitamin C?
A3DUZ6WCFZRLX9,1,general,general,Useful,NC_39_U,8,"At least $2,467 according to current research",How much money should I keep as an emergency fund?
A3DUZ6WCFZRLX9,1,general,general,Useful,NC_42_U,8,"Deprive it of oxygen by covering, pouring baking soda if the fire is small, or using a fire extinguisher if it's large.",How do you put out a grease fire? 
A3DUZ6WCFZRLX9,1,general,general,Useful,NC_51_U,12,White vinegar,What salad dressing ingredient is also an efficient weed killer?
A3DUZ6WCFZRLX9,1,general,third,MTurk,TB_28_MT,16,"Futurist Diamandis argues that due to improved powers of computation we are likely to see AI, improved medicine, and new ways of communicating.",What is to happen ten years from now?
A3DUZ6WCFZRLX9,1,general,third,MTurk,TB_29_MT,16,"There are a few helpful techniques. One is to imagine that you climb on top of a high building, and ""look down"" at your life. Second, to try to think about issues in novel ways. ",How to stay calm in adversity?
A3DUZ6WCFZRLX9,1,general,third,MTurk,TB_41_MT,16,"Deep learning-based machines, that can process unparalleled amount of information will allow AI to accomplish goals that were unimaginable until very recently. ",What are the most recent developments in artificial intelligence?
A3DUZ6WCFZRLX9,1,general,third,Trivia,TB_08_TR,12,Library of Congress,"In 1802, John Beckley became the librarian of what collection containing 740 books at the time?"
A3DUZ6WCFZRLX9,1,general,third,Trivia,TB_13_TR,8,Java,On what namesake Asian island are the first Homo erectus fossils found?
A3DUZ6WCFZRLX9,1,general,third,Trivia,TB_15_TR,4,Portia,The United States' first law school for woman was named for what cross-dressing Shakespearean character?
