PID,sess,firstBlock,block,type,questionId,wait_duration,answer,question
A3EVXSWHYA1PTT,1,general,corona,Not useful,C_11_NU,12,The Chicago of China,"Wuhan, China, the city in which the coronavirus was first identified, is commonly referred to as the chinese version of what American city?"
A3EVXSWHYA1PTT,1,general,corona,Useful,C_46_U,12,Remdesivir,"Which drug, which has been used as a treatment for the Ebola and Marburg viruses, might be promising as a treatment for this new coronavirus?"
A3EVXSWHYA1PTT,1,general,general,Not useful,NC_02_NU,16,Tiger Woods,"Who's the only two-time Sports Illustrated Sportsman of the Year, so named in 1996 and 2000?"
A3EVXSWHYA1PTT,1,general,general,Not useful,NC_15_NU,4,Albert Einstein,Who beat out FDR and Gandhi to be named Time's Person of the Century in 1999?
A3EVXSWHYA1PTT,1,general,general,Not useful,NC_21_NU,4,The Pieta,Which was the only one of his sculptures that Michelangelo signed?
A3EVXSWHYA1PTT,1,general,general,Not useful,NC_24_NU,8,State quarters,What's been released five times a year from January 1999 to fall 2008?
A3EVXSWHYA1PTT,1,general,general,Useful,NC_35_U,8,Wrap a wet paper towel around the bottle and put in the fridge,How can you cool beverages more quickly?
A3EVXSWHYA1PTT,1,general,general,Useful,NC_38_U,8,"Camu Camu, a cherry-like fruit from Brazil",What fruit has the highest content of vitamin C?
A3EVXSWHYA1PTT,1,general,general,Useful,NC_40_U,12,Squint your eyes,How do you make your smile look more genuine in photographs?
A3EVXSWHYA1PTT,1,general,general,Useful,NC_50_U,16,Spread beeswax over them and then blow dry until you can't see the beeswax anymore,What's an easy way to waterproof canvas shoes?
A3EVXSWHYA1PTT,1,general,third,MTurk,TB_42_MT,16,"Galaxy formation occured in the aftermath of the Big Bang. Clustering and merging allows galaxies to accumulate mass, determining both their shape and structure. ",How do galaxies form?
A3EVXSWHYA1PTT,1,general,third,Trivia,TB_08_TR,8,Library of Congress,"In 1802, John Beckley became the librarian of what collection containing 740 books at the time?"
A3EVXSWHYA1PTT,1,general,third,Trivia,TB_19_TR,8,Ketchup,The only vegetable ice cream ever produced was what flavor?
A3EVXSWHYA1PTT,1,general,third,Trivia,TB_23_TR,4,Tooth,What is the only part of the body that can't repair itself?
