PID,sess,firstBlock,block,type,questionId,wait_duration,answer,question
A3F53IGY4HB1W9,1,general,corona,Not useful,C_01_NU,16,"Animals, probably bats",What is the source of coronavirus in humans?
A3F53IGY4HB1W9,1,general,corona,Not useful,C_12_NU,4,Diamond Princess,What was the name of the British cruise ship that was quarantined in Japanese waters?
A3F53IGY4HB1W9,1,general,corona,Not useful,C_19_NU,12,Strategic National Stockpile,What is the name of the repository of drugs and supplies the U.S. government is supposed to maintain in case of a public health emergency?
A3F53IGY4HB1W9,1,general,corona,Not useful,C_24_NU,8,Contagion,"According to media reports, which 2011 movie has seen a large increase in popularity in the wake of the new coronavirus?"
A3F53IGY4HB1W9,1,general,corona,Not useful,C_26_NU,8,Severe acute respiratory syndrome,The official name of the new coronavirus is SARS-CoV-2. What does SARS stand for?
A3F53IGY4HB1W9,1,general,corona,Useful,C_27_U,4,Washing your hands frequently,What is the most effective measure to prevent infection with the coronavirus?
A3F53IGY4HB1W9,1,general,corona,Useful,C_31_U,12,"The virus is probably not sexually tansmissible, but infection does occurs when kissing.",Can the coronavirus be transmitted through sexual intercourse?
A3F53IGY4HB1W9,1,general,corona,Useful,C_32_U,8,"In public settings where other social distancing measures are difficult to maintain (e.g., grocery stores and pharmacies).",The CDC recommend people wear cloth masks in what situations?
A3F53IGY4HB1W9,1,general,general,Not useful,NC_04_NU,16,Edward Albee,"Who wrote ""Who's Afraid of Virginia Woolf?"""
A3F53IGY4HB1W9,1,general,general,Not useful,NC_06_NU,4,David Livingstone,Who discovered the Victoria Falls?
A3F53IGY4HB1W9,1,general,general,Not useful,NC_11_NU,4,Endeavour,What is the name of the ship that carried Captain Cook to Australia?
A3F53IGY4HB1W9,1,general,general,Not useful,NC_20_NU,8,Russia,Which country has the most public libraries?
A3F53IGY4HB1W9,1,general,general,Not useful,NC_22_NU,8,Steamboat Geyser,"Which Yellowstone geyser, with eruptions 100 fee taller than Old Faithful's, is the world's tallest?"
A3F53IGY4HB1W9,1,general,general,Not useful,NC_25_NU,4,Shark,"What animal is thought to be immune to most all diseases, including cancer?"
A3F53IGY4HB1W9,1,general,general,Useful,NC_27_U,16,White vinegar,What can you use instead of fabric softner to soften sheets and remove odours?
A3F53IGY4HB1W9,1,general,general,Useful,NC_38_U,12,"Camu Camu, a cherry-like fruit from Brazil",What fruit has the highest content of vitamin C?
A3F53IGY4HB1W9,1,general,general,Useful,NC_43_U,16,Between 105 and 54 days before the scheduled trip.,How far in advance of a trip is the most cost effective time to purchase a plane ticket? 
A3F53IGY4HB1W9,1,general,third,MTurk,TB_25_MT,12,"Scientists estimate that we are likely to see flying cars, and that computers may be able to read people's thoughts and emotions ",What will be the new technologies of future?
A3F53IGY4HB1W9,1,general,third,MTurk,TB_34_MT,4,Evolution is usually very slow. Think about the similarities between apes and people. Future people are going to be as similar to us as we are to apes. ,What will future humans look like?
A3F53IGY4HB1W9,1,general,third,MTurk,TB_35_MT,12,Prototypes already exist. Technological estimates suggest that definitely within the next twenty years -- although the challenges are great.,When will we have flying cars?
A3F53IGY4HB1W9,1,general,third,MTurk,TB_41_MT,12,"Deep learning-based machines, that can process unparalleled amount of information will allow AI to accomplish goals that were unimaginable until very recently. ",What are the most recent developments in artificial intelligence?
A3F53IGY4HB1W9,1,general,third,MTurk,TB_45_MT,8,"The amygdala (from Greek, 'almond') is one of two almond-shaped clusters of nuclei located deep and medially within the temporal lobes of the brain in complex vertebrates, including humans.",What is the amygdala?
A3F53IGY4HB1W9,1,general,third,Trivia,TB_06_TR,12,Xanadu,What 1980 film is named for the legendary square-shaped capital of Kublai Khan?
A3F53IGY4HB1W9,1,general,third,Trivia,TB_15_TR,12,Portia,The United States' first law school for woman was named for what cross-dressing Shakespearean character?
A3F53IGY4HB1W9,1,general,third,Trivia,TB_22_TR,4,Cheetah,Which is the only cat that cannot retract its claws?
