PID,sess,firstBlock,block,type,questionId,wait_duration,answer,question
A3FKEMHRTXPWMN,1,general,corona,Not useful,C_05_NU,16,University of Washington,Which was the first US University to cancel classes becuase of the new coronavirus?
A3FKEMHRTXPWMN,1,general,corona,Not useful,C_13_NU,12,"The initial cases of the disease are thought to have been among people with a connection to a seafood wholesale market, which also sold live animals","Why is the virus believed to have zoonotic origin, i.e., to have potentially come from animals?"
A3FKEMHRTXPWMN,1,general,corona,Not useful,C_14_NU,12,"January 30, 2020",On what date did the World Health Organization declare the new coronavirus outbreak to be a Public Health Emergency of International Concern?
A3FKEMHRTXPWMN,1,general,corona,Not useful,C_26_NU,12,Severe acute respiratory syndrome,The official name of the new coronavirus is SARS-CoV-2. What does SARS stand for?
A3FKEMHRTXPWMN,1,general,corona,Useful,C_37_U,16,There is no evidence from the current outbreak that eating garlic has protected people from the new coronavirus.,Can eating garlic help prevent infection with the new coronavirus?
A3FKEMHRTXPWMN,1,general,general,Not useful,NC_03_NU,4,Red River,"What name is shared by the rivers that run through Denison, TX and Hanoi, Vietnam?"
A3FKEMHRTXPWMN,1,general,general,Not useful,NC_11_NU,8,Endeavour,What is the name of the ship that carried Captain Cook to Australia?
A3FKEMHRTXPWMN,1,general,general,Not useful,NC_13_NU,12,Bling bling,What term does rapper B.G. say he wishes he'd patented when he used it for the title of his massive 1999 hit?
A3FKEMHRTXPWMN,1,general,general,Not useful,NC_17_NU,12,Gilbert Van Camp,What Indianapolis grocer made his name by selling canned pork and beans to U.S. troops during the Civil War?
A3FKEMHRTXPWMN,1,general,general,Not useful,NC_24_NU,4,State quarters,What's been released five times a year from January 1999 to fall 2008?
A3FKEMHRTXPWMN,1,general,general,Useful,NC_36_U,16,Potatos: rub a cut potato over your windshield before a frost to prevent freezing,What vegetable can prevent your windshield from freezing over in winter?
A3FKEMHRTXPWMN,1,general,general,Useful,NC_48_U,8,"Drop it from a 3 inch height. If it bounces, it's dead.",How can you tell if a battery is dead without using any tools?
A3FKEMHRTXPWMN,1,general,general,Useful,NC_50_U,12,Spread beeswax over them and then blow dry until you can't see the beeswax anymore,What's an easy way to waterproof canvas shoes?
A3FKEMHRTXPWMN,1,general,third,MTurk,TB_25_MT,4,"Scientists estimate that we are likely to see flying cars, and that computers may be able to read people's thoughts and emotions ",What will be the new technologies of future?
A3FKEMHRTXPWMN,1,general,third,MTurk,TB_26_MT,8,"Sometimes, it is easy to know, but science revealed that self-insight is prblematic. It is often very helpful to ask friends and family ",How do you know if you're happy?
A3FKEMHRTXPWMN,1,general,third,MTurk,TB_28_MT,4,"Futurist Diamandis argues that due to improved powers of computation we are likely to see AI, improved medicine, and new ways of communicating.",What is to happen ten years from now?
A3FKEMHRTXPWMN,1,general,third,MTurk,TB_31_MT,8,Scientists estimate that at the moment it is not. But with global warming it might become more feasilbe later in the 21st century.,How feasible would it be to colonize Antarctica?
A3FKEMHRTXPWMN,1,general,third,Trivia,TB_06_TR,16,Xanadu,What 1980 film is named for the legendary square-shaped capital of Kublai Khan?
A3FKEMHRTXPWMN,1,general,third,Trivia,TB_20_TR,12,Rafflesia (corpse lily),What is the largest flower in the world?
A3FKEMHRTXPWMN,1,general,third,Trivia,TB_21_TR,16,New York,Which state has the zip code 12345?
