PID,sess,firstBlock,block,type,questionId,wait_duration,answer,question
A3I5Y5VHH6UUZE,1,corona,corona,Not useful,C_04_NU,16,"It stands for ""COronaVIrus Disease 2019""","Why is the new coronavirus called ""COVID-19""? "
A3I5Y5VHH6UUZE,1,corona,corona,Not useful,C_10_NU,12,11 million people,"What is the population of Wuhan, the city in which coronavirus was first identified?"
A3I5Y5VHH6UUZE,1,corona,corona,Not useful,C_20_NU,16,"Rear Adm. Ziemer led the global health security team, responsible for leading the US response to pandemics.","In May 2018, Rear Admiral Timothy Ziemer left the White House staff and was not replaced. What was Rear Adm. Ziemer's responsibility in the White House?"
A3I5Y5VHH6UUZE,1,corona,corona,Not useful,C_22_NU,4,Contact tracing,What is the name of the process health authorities use to understand the sources of infection and to prevent further transmission?
A3I5Y5VHH6UUZE,1,corona,corona,Useful,C_45_U,16,"Pre-existing health conditions, including cardiovascular diseases and diabetes.",What did 75% of the people who have died from the new coronavirus have?
A3I5Y5VHH6UUZE,1,corona,general,Not useful,NC_01_NU,12,Mike Powell,"In 1991, who finally broke Bob Beamon's decades-old long jump record?"
A3I5Y5VHH6UUZE,1,corona,general,Not useful,NC_02_NU,12,Tiger Woods,"Who's the only two-time Sports Illustrated Sportsman of the Year, so named in 1996 and 2000?"
A3I5Y5VHH6UUZE,1,corona,general,Not useful,NC_09_NU,12,Captain Cook,"Who christened Hawaii ""the Sandwich Islands"" in 1778?"
A3I5Y5VHH6UUZE,1,corona,general,Not useful,NC_13_NU,16,Bling bling,What term does rapper B.G. say he wishes he'd patented when he used it for the title of his massive 1999 hit?
A3I5Y5VHH6UUZE,1,corona,general,Not useful,NC_14_NU,4,Rod Serling,What famed TV personality wrote the screenplay for 1968's Planet of the Apes?
A3I5Y5VHH6UUZE,1,corona,general,Useful,NC_36_U,16,Potatos: rub a cut potato over your windshield before a frost to prevent freezing,What vegetable can prevent your windshield from freezing over in winter?
A3I5Y5VHH6UUZE,1,corona,third,MTurk,TB_28_MT,12,"Futurist Diamandis argues that due to improved powers of computation we are likely to see AI, improved medicine, and new ways of communicating.",What is to happen ten years from now?
A3I5Y5VHH6UUZE,1,corona,third,Trivia,TB_01_TR,8,Canada,"What country is home to Roots, the company that outfits the U.S. Olympic team?"
A3I5Y5VHH6UUZE,1,corona,third,Trivia,TB_13_TR,16,Java,On what namesake Asian island are the first Homo erectus fossils found?
A3I5Y5VHH6UUZE,1,corona,third,Trivia,TB_18_TR,4,Orville Wright,Who was flying the plane in which the first US airplane fatality occurred?
