PID,sess,firstBlock,block,type,questionId,wait_duration,answer,question
A3IGWYBMJ5NBBJ,1,corona,corona,Not useful,C_08_NU,8,Lombardy,What is the name of the county in Italy that had the first coronavirus outbreak?
A3IGWYBMJ5NBBJ,1,corona,corona,Not useful,C_10_NU,16,11 million people,"What is the population of Wuhan, the city in which coronavirus was first identified?"
A3IGWYBMJ5NBBJ,1,corona,corona,Not useful,C_15_NU,16,7.5 days,"In the early stages of the new coronavirus, the number of new cases doubled approximately every how many days?"
A3IGWYBMJ5NBBJ,1,corona,corona,Useful,C_29_U,4,Not for at least several months from now,How soon is a vaccine for the new coronavirus likely to be available?
A3IGWYBMJ5NBBJ,1,corona,corona,Useful,C_41_U,4,Studies suggest that coronaviruses (including preliminary information on the new virus) may persist on surfaces for a few hours or up to several days.,How long does the new coronavirus survive on surfaces?
A3IGWYBMJ5NBBJ,1,corona,general,Not useful,NC_06_NU,8,David Livingstone,Who discovered the Victoria Falls?
A3IGWYBMJ5NBBJ,1,corona,general,Not useful,NC_08_NU,8,The guppy,What common aquarium fish is named for the naturalist who discovered it in Trinidad in 1876?
A3IGWYBMJ5NBBJ,1,corona,general,Not useful,NC_12_NU,12,Come by her,"The title of the song ""Kumbaya"" is actually a distortion of what three-word phrase?"
A3IGWYBMJ5NBBJ,1,corona,general,Not useful,NC_17_NU,12,Gilbert Van Camp,What Indianapolis grocer made his name by selling canned pork and beans to U.S. troops during the Civil War?
A3IGWYBMJ5NBBJ,1,corona,general,Not useful,NC_19_NU,8,Smoke,"in 1908, New York City passed the Sullivan Ordinance which made it illegal for women to do what in public?"
A3IGWYBMJ5NBBJ,1,corona,general,Useful,NC_34_U,8,"Pineapple, by planting the green leaves",What tropical fruit can be regrown from its scraps?
A3IGWYBMJ5NBBJ,1,corona,general,Useful,NC_40_U,4,Squint your eyes,How do you make your smile look more genuine in photographs?
A3IGWYBMJ5NBBJ,1,corona,general,Useful,NC_41_U,16,"April 8th, 2024",When is the next total solar eclipse visible in North America projected to occur? 
A3IGWYBMJ5NBBJ,1,corona,general,Useful,NC_48_U,8,"Drop it from a 3 inch height. If it bounces, it's dead.",How can you tell if a battery is dead without using any tools?
A3IGWYBMJ5NBBJ,1,corona,third,MTurk,TB_27_MT,12,"We do not know, of course. Yet, it is important to realize that there is no scientific proof for God's existence.  ",Does God exist?
A3IGWYBMJ5NBBJ,1,corona,third,MTurk,TB_31_MT,8,Scientists estimate that at the moment it is not. But with global warming it might become more feasilbe later in the 21st century.,How feasible would it be to colonize Antarctica?
A3IGWYBMJ5NBBJ,1,corona,third,MTurk,TB_34_MT,16,Evolution is usually very slow. Think about the similarities between apes and people. Future people are going to be as similar to us as we are to apes. ,What will future humans look like?
A3IGWYBMJ5NBBJ,1,corona,third,MTurk,TB_35_MT,8,Prototypes already exist. Technological estimates suggest that definitely within the next twenty years -- although the challenges are great.,When will we have flying cars?
A3IGWYBMJ5NBBJ,1,corona,third,MTurk,TB_41_MT,12,"Deep learning-based machines, that can process unparalleled amount of information will allow AI to accomplish goals that were unimaginable until very recently. ",What are the most recent developments in artificial intelligence?
A3IGWYBMJ5NBBJ,1,corona,third,Trivia,TB_07_TR,4,Tuxedo Club,What New York country club lent its name to the kind of dinner jacket first worn there in 1886?
A3IGWYBMJ5NBBJ,1,corona,third,Trivia,TB_10_TR,4,George VI,Who was the last British Monarch to also be an emperor?
A3IGWYBMJ5NBBJ,1,corona,third,Trivia,TB_15_TR,4,Portia,The United States' first law school for woman was named for what cross-dressing Shakespearean character?
