PID,sess,firstBlock,block,type,questionId,wait_duration,answer,question
A3JHXEH79DJ83L,1,corona,corona,Useful,C_47_U,8,"Free of fever; no other symptoms, including cough; negative tests on at least two consecutive respiratory specimens at least 24 hours apart.",What are current Centers for Disease Control (CDC) guidelines for releasing someone from isolation?
A3JHXEH79DJ83L,1,corona,corona,Useful,C_51_U,8,Nasal or orab swab or a sample of sputum,What sort of specimen is needed to test for the new coronavirus? 
A3JHXEH79DJ83L,1,corona,general,Not useful,NC_23_NU,16,The Netherlands,In 1568 the Catholic Church sentenced the entire population of which nation to death as heretics?
A3JHXEH79DJ83L,1,corona,general,Useful,NC_43_U,12,Between 105 and 54 days before the scheduled trip.,How far in advance of a trip is the most cost effective time to purchase a plane ticket? 
A3JHXEH79DJ83L,1,corona,general,Useful,NC_51_U,8,White vinegar,What salad dressing ingredient is also an efficient weed killer?
A3JHXEH79DJ83L,1,corona,third,MTurk,TB_25_MT,16,"Scientists estimate that we are likely to see flying cars, and that computers may be able to read people's thoughts and emotions ",What will be the new technologies of future?
A3JHXEH79DJ83L,1,corona,third,Trivia,TB_17_TR,4,"Third finger, left hand",What part of his body did Keith Richards insure for a million pounds?
