PID,sess,firstBlock,block,type,questionId,wait_duration,answer,question
A3JM0X1X5DEIGM,1,general,corona,Not useful,C_03_NU,4,"Fuburary 1st, 2020",When was the molecular structure of the coronovirus identfied?
A3JM0X1X5DEIGM,1,general,corona,Not useful,C_15_NU,12,7.5 days,"In the early stages of the new coronavirus, the number of new cases doubled approximately every how many days?"
A3JM0X1X5DEIGM,1,general,corona,Not useful,C_18_NU,8,They are able to filter out at least 95% of airborne particles,Why are N95 respirator face masks so named?
A3JM0X1X5DEIGM,1,general,corona,Not useful,C_20_NU,4,"Rear Adm. Ziemer led the global health security team, responsible for leading the US response to pandemics.","In May 2018, Rear Admiral Timothy Ziemer left the White House staff and was not replaced. What was Rear Adm. Ziemer's responsibility in the White House?"
A3JM0X1X5DEIGM,1,general,corona,Useful,C_34_U,4,"The virus lives for up to a few days on surfaces, and so packages cannot transmit the virus.",Can the new coronavirus be transmitted on a package from an infected country?
A3JM0X1X5DEIGM,1,general,general,Not useful,NC_08_NU,4,The guppy,What common aquarium fish is named for the naturalist who discovered it in Trinidad in 1876?
A3JM0X1X5DEIGM,1,general,general,Not useful,NC_11_NU,16,Endeavour,What is the name of the ship that carried Captain Cook to Australia?
A3JM0X1X5DEIGM,1,general,general,Not useful,NC_14_NU,8,Rod Serling,What famed TV personality wrote the screenplay for 1968's Planet of the Apes?
A3JM0X1X5DEIGM,1,general,general,Not useful,NC_18_NU,12,A truce,What was put in place by the Ancient Greeks before and during all Olympic festivals?
A3JM0X1X5DEIGM,1,general,general,Useful,NC_27_U,8,White vinegar,What can you use instead of fabric softner to soften sheets and remove odours?
A3JM0X1X5DEIGM,1,general,general,Useful,NC_28_U,16,Microwave next to a glass of water,How can you soften brown sugar that has hardened into a lump?
A3JM0X1X5DEIGM,1,general,general,Useful,NC_36_U,8,Potatos: rub a cut potato over your windshield before a frost to prevent freezing,What vegetable can prevent your windshield from freezing over in winter?
A3JM0X1X5DEIGM,1,general,general,Useful,NC_51_U,16,White vinegar,What salad dressing ingredient is also an efficient weed killer?
A3JM0X1X5DEIGM,1,general,third,MTurk,TB_24_MT,12,"Deep sea creatures must survive in extremely harsh conditions. They include the giant spider crab, frilled shark, and the atlantic wolffish",Which creatures live in deep sea?
A3JM0X1X5DEIGM,1,general,third,MTurk,TB_27_MT,8,"We do not know, of course. Yet, it is important to realize that there is no scientific proof for God's existence.  ",Does God exist?
A3JM0X1X5DEIGM,1,general,third,Trivia,TB_06_TR,16,Xanadu,What 1980 film is named for the legendary square-shaped capital of Kublai Khan?
A3JM0X1X5DEIGM,1,general,third,Trivia,TB_15_TR,16,Portia,The United States' first law school for woman was named for what cross-dressing Shakespearean character?
A3JM0X1X5DEIGM,1,general,third,Trivia,TB_17_TR,4,"Third finger, left hand",What part of his body did Keith Richards insure for a million pounds?
A3JM0X1X5DEIGM,1,general,third,Trivia,TB_18_TR,12,Orville Wright,Who was flying the plane in which the first US airplane fatality occurred?
A3JM0X1X5DEIGM,1,general,third,Trivia,TB_19_TR,12,Ketchup,The only vegetable ice cream ever produced was what flavor?
