PID,sess,firstBlock,block,type,questionId,wait_duration,answer,question
A3L1LLSPCTGH4G,1,general,corona,Not useful,C_03_NU,12,"Fuburary 1st, 2020",When was the molecular structure of the coronovirus identfied?
A3L1LLSPCTGH4G,1,general,corona,Not useful,C_19_NU,16,Strategic National Stockpile,What is the name of the repository of drugs and supplies the U.S. government is supposed to maintain in case of a public health emergency?
A3L1LLSPCTGH4G,1,general,corona,Not useful,C_23_NU,12,They falsely claimed to cure or prevent coronavirus,"At the end of February, Amazon banned over a million products because of what?"
A3L1LLSPCTGH4G,1,general,general,Not useful,NC_09_NU,16,Captain Cook,"Who christened Hawaii ""the Sandwich Islands"" in 1778?"
A3L1LLSPCTGH4G,1,general,general,Not useful,NC_11_NU,12,Endeavour,What is the name of the ship that carried Captain Cook to Australia?
A3L1LLSPCTGH4G,1,general,general,Not useful,NC_15_NU,4,Albert Einstein,Who beat out FDR and Gandhi to be named Time's Person of the Century in 1999?
A3L1LLSPCTGH4G,1,general,general,Not useful,NC_19_NU,8,Smoke,"in 1908, New York City passed the Sullivan Ordinance which made it illegal for women to do what in public?"
A3L1LLSPCTGH4G,1,general,general,Useful,NC_27_U,12,White vinegar,What can you use instead of fabric softner to soften sheets and remove odours?
A3L1LLSPCTGH4G,1,general,general,Useful,NC_32_U,8,Take a picture of your fridge before leaving the house,What's a simple trick for telling whether your out of something when you're grocery shopping?
A3L1LLSPCTGH4G,1,general,general,Useful,NC_38_U,12,"Camu Camu, a cherry-like fruit from Brazil",What fruit has the highest content of vitamin C?
A3L1LLSPCTGH4G,1,general,general,Useful,NC_49_U,8,"Roll it along its long side. If it stops immediately, it's raw.",How can you tell if an egg is cooked without breaking it?
A3L1LLSPCTGH4G,1,general,third,MTurk,TB_29_MT,16,"There are a few helpful techniques. One is to imagine that you climb on top of a high building, and ""look down"" at your life. Second, to try to think about issues in novel ways. ",How to stay calm in adversity?
A3L1LLSPCTGH4G,1,general,third,MTurk,TB_39_MT,12,"There is radio emission around black holes. Scientists created a network of telescopes, capturing an image of a black hole by improving upon a technique that allows for the imaging of far-away objects",How was the recent picture of a black hole made?
A3L1LLSPCTGH4G,1,general,third,MTurk,TB_40_MT,4,"NASA plans another crewed mission to the Moon by 2024, followed by a sustained presence  by 2028.  Russia is planning to begin building a human colony by 2037.",When could a lunar base be established?
A3L1LLSPCTGH4G,1,general,third,MTurk,TB_41_MT,4,"Deep learning-based machines, that can process unparalleled amount of information will allow AI to accomplish goals that were unimaginable until very recently. ",What are the most recent developments in artificial intelligence?
A3L1LLSPCTGH4G,1,general,third,MTurk,TB_46_MT,4,"Scientists are still figuring it out. It seems that passive use is slightly bad, but active use is not.",How does social media influence our mental health?
A3L1LLSPCTGH4G,1,general,third,Trivia,TB_02_TR,8,Ivory Coast's,"The world's largest church is Our Lady of Peace Basilica in Yamoussoukro, what nation's capital?"
