PID,sess,firstBlock,block,type,questionId,wait_duration,answer,question
A3LA5P3N3KI8U7,1,general,corona,Not useful,C_05_NU,8,University of Washington,Which was the first US University to cancel classes becuase of the new coronavirus?
A3LA5P3N3KI8U7,1,general,corona,Not useful,C_08_NU,16,Lombardy,What is the name of the county in Italy that had the first coronavirus outbreak?
A3LA5P3N3KI8U7,1,general,corona,Not useful,C_16_NU,12,Bats and pangolins,What other animals have been found to have viruses with highly similar genome sequences as the current coronavirus?
A3LA5P3N3KI8U7,1,general,corona,Useful,C_40_U,16,"The incubation period - the time between catching the virus and beginning to have symptoms of the disease - is estimated to range from 1-14 days, most commonly around five days.",How long is the incubation period for the new coronavirus?
A3LA5P3N3KI8U7,1,general,corona,Useful,C_41_U,12,Studies suggest that coronaviruses (including preliminary information on the new virus) may persist on surfaces for a few hours or up to several days.,How long does the new coronavirus survive on surfaces?
A3LA5P3N3KI8U7,1,general,corona,Useful,C_51_U,4,Nasal or orab swab or a sample of sputum,What sort of specimen is needed to test for the new coronavirus? 
A3LA5P3N3KI8U7,1,general,general,Not useful,NC_04_NU,8,Edward Albee,"Who wrote ""Who's Afraid of Virginia Woolf?"""
A3LA5P3N3KI8U7,1,general,general,Not useful,NC_13_NU,8,Bling bling,What term does rapper B.G. say he wishes he'd patented when he used it for the title of his massive 1999 hit?
A3LA5P3N3KI8U7,1,general,general,Not useful,NC_19_NU,12,Smoke,"in 1908, New York City passed the Sullivan Ordinance which made it illegal for women to do what in public?"
A3LA5P3N3KI8U7,1,general,general,Not useful,NC_20_NU,4,Russia,Which country has the most public libraries?
A3LA5P3N3KI8U7,1,general,general,Not useful,NC_23_NU,8,The Netherlands,In 1568 the Catholic Church sentenced the entire population of which nation to death as heretics?
A3LA5P3N3KI8U7,1,general,general,Not useful,NC_24_NU,12,State quarters,What's been released five times a year from January 1999 to fall 2008?
A3LA5P3N3KI8U7,1,general,general,Useful,NC_28_U,8,Microwave next to a glass of water,How can you soften brown sugar that has hardened into a lump?
A3LA5P3N3KI8U7,1,general,general,Useful,NC_34_U,16,"Pineapple, by planting the green leaves",What tropical fruit can be regrown from its scraps?
A3LA5P3N3KI8U7,1,general,general,Useful,NC_35_U,8,Wrap a wet paper towel around the bottle and put in the fridge,How can you cool beverages more quickly?
A3LA5P3N3KI8U7,1,general,general,Useful,NC_45_U,8,"Grapes or raisins, onions, avocado","In addition to chocolate, what other foods can be very harmful to dogs? "
A3LA5P3N3KI8U7,1,general,third,MTurk,TB_25_MT,4,"Scientists estimate that we are likely to see flying cars, and that computers may be able to read people's thoughts and emotions ",What will be the new technologies of future?
A3LA5P3N3KI8U7,1,general,third,MTurk,TB_32_MT,16,Sophisticated equipment is either lowered to the sea bottom or directly attached to submersible buoys and transmits to a research vessel that is equipped with state-of-the-art navigational instruments.,What are undersea researchers doing to explore the ocean floor?
A3LA5P3N3KI8U7,1,general,third,MTurk,TB_33_MT,8,"For SpaceX — the cheapest of NASA's new carriers — each pound costs approximately $27,000. So an average person of 160 pounds costs over $4,320,000.",How much does it cost to launch a person into space?
A3LA5P3N3KI8U7,1,general,third,Trivia,TB_01_TR,4,Canada,"What country is home to Roots, the company that outfits the U.S. Olympic team?"
A3LA5P3N3KI8U7,1,general,third,Trivia,TB_12_TR,12,It sits beside the Finger Lakes,"Why is Oneida Lake, near Syracuse, New York, sometimes called ""the thumb""?"
A3LA5P3N3KI8U7,1,general,third,Trivia,TB_16_TR,12,Jim Lovell,Alan Shepard was scheduled to command the ill-fated Apollo 13 before switching missions with what astronaut?
A3LA5P3N3KI8U7,1,general,third,Trivia,TB_19_TR,8,Ketchup,The only vegetable ice cream ever produced was what flavor?
A3LA5P3N3KI8U7,1,general,third,Trivia,TB_21_TR,12,New York,Which state has the zip code 12345?
