PID,sess,firstBlock,block,type,questionId,wait_duration,answer,question
A3LCVXMW2COCWD,1,general,corona,Not useful,C_02_NU,4,Three ,How many pandemics were there in the 20th century?
A3LCVXMW2COCWD,1,general,corona,Not useful,C_03_NU,8,"Fuburary 1st, 2020",When was the molecular structure of the coronovirus identfied?
A3LCVXMW2COCWD,1,general,corona,Not useful,C_15_NU,8,7.5 days,"In the early stages of the new coronavirus, the number of new cases doubled approximately every how many days?"
A3LCVXMW2COCWD,1,general,corona,Useful,C_28_U,4,"Yes, by boosting the immune system",Does sleep make you more resistant to coronavirus infections?
A3LCVXMW2COCWD,1,general,corona,Useful,C_32_U,16,"In public settings where other social distancing measures are difficult to maintain (e.g., grocery stores and pharmacies).",The CDC recommend people wear cloth masks in what situations?
A3LCVXMW2COCWD,1,general,corona,Useful,C_51_U,16,Nasal or orab swab or a sample of sputum,What sort of specimen is needed to test for the new coronavirus? 
A3LCVXMW2COCWD,1,general,general,Not useful,NC_03_NU,12,Red River,"What name is shared by the rivers that run through Denison, TX and Hanoi, Vietnam?"
A3LCVXMW2COCWD,1,general,general,Not useful,NC_04_NU,4,Edward Albee,"Who wrote ""Who's Afraid of Virginia Woolf?"""
A3LCVXMW2COCWD,1,general,general,Not useful,NC_11_NU,4,Endeavour,What is the name of the ship that carried Captain Cook to Australia?
A3LCVXMW2COCWD,1,general,general,Not useful,NC_15_NU,4,Albert Einstein,Who beat out FDR and Gandhi to be named Time's Person of the Century in 1999?
A3LCVXMW2COCWD,1,general,general,Not useful,NC_18_NU,8,A truce,What was put in place by the Ancient Greeks before and during all Olympic festivals?
A3LCVXMW2COCWD,1,general,general,Not useful,NC_20_NU,8,Russia,Which country has the most public libraries?
A3LCVXMW2COCWD,1,general,general,Useful,NC_39_U,8,"At least $2,467 according to current research",How much money should I keep as an emergency fund?
A3LCVXMW2COCWD,1,general,general,Useful,NC_40_U,4,Squint your eyes,How do you make your smile look more genuine in photographs?
A3LCVXMW2COCWD,1,general,general,Useful,NC_43_U,8,Between 105 and 54 days before the scheduled trip.,How far in advance of a trip is the most cost effective time to purchase a plane ticket? 
A3LCVXMW2COCWD,1,general,general,Useful,NC_51_U,4,White vinegar,What salad dressing ingredient is also an efficient weed killer?
A3LCVXMW2COCWD,1,general,third,MTurk,TB_24_MT,16,"Deep sea creatures must survive in extremely harsh conditions. They include the giant spider crab, frilled shark, and the atlantic wolffish",Which creatures live in deep sea?
A3LCVXMW2COCWD,1,general,third,MTurk,TB_28_MT,8,"Futurist Diamandis argues that due to improved powers of computation we are likely to see AI, improved medicine, and new ways of communicating.",What is to happen ten years from now?
A3LCVXMW2COCWD,1,general,third,MTurk,TB_32_MT,4,Sophisticated equipment is either lowered to the sea bottom or directly attached to submersible buoys and transmits to a research vessel that is equipped with state-of-the-art navigational instruments.,What are undersea researchers doing to explore the ocean floor?
A3LCVXMW2COCWD,1,general,third,Trivia,TB_12_TR,8,It sits beside the Finger Lakes,"Why is Oneida Lake, near Syracuse, New York, sometimes called ""the thumb""?"
A3LCVXMW2COCWD,1,general,third,Trivia,TB_13_TR,4,Java,On what namesake Asian island are the first Homo erectus fossils found?
A3LCVXMW2COCWD,1,general,third,Trivia,TB_18_TR,12,Orville Wright,Who was flying the plane in which the first US airplane fatality occurred?
