PID,sess,firstBlock,block,type,questionId,wait_duration,answer,question
A3LLAS4WXA8SKJ,1,general,corona,Not useful,C_05_NU,4,University of Washington,Which was the first US University to cancel classes becuase of the new coronavirus?
A3LLAS4WXA8SKJ,1,general,corona,Not useful,C_06_NU,8,Gwyneth Paltrow,"Which celebrity said about the new coronavirus ""I've already been in this movie""?"
A3LLAS4WXA8SKJ,1,general,corona,Not useful,C_12_NU,8,Diamond Princess,What was the name of the British cruise ship that was quarantined in Japanese waters?
A3LLAS4WXA8SKJ,1,general,corona,Not useful,C_15_NU,8,7.5 days,"In the early stages of the new coronavirus, the number of new cases doubled approximately every how many days?"
A3LLAS4WXA8SKJ,1,general,corona,Not useful,C_26_NU,12,Severe acute respiratory syndrome,The official name of the new coronavirus is SARS-CoV-2. What does SARS stand for?
A3LLAS4WXA8SKJ,1,general,corona,Useful,C_52_U,8,No. To protect yourself against the new coronavirus washing your hands is the best preventive measure.,Are hand dryers effective in killing the new coronavirus?
A3LLAS4WXA8SKJ,1,general,general,Not useful,NC_02_NU,12,Tiger Woods,"Who's the only two-time Sports Illustrated Sportsman of the Year, so named in 1996 and 2000?"
A3LLAS4WXA8SKJ,1,general,general,Not useful,NC_05_NU,16,Matthew,Which of the four biblical Gospels was written by a tax collector?
A3LLAS4WXA8SKJ,1,general,general,Not useful,NC_17_NU,4,Gilbert Van Camp,What Indianapolis grocer made his name by selling canned pork and beans to U.S. troops during the Civil War?
A3LLAS4WXA8SKJ,1,general,general,Not useful,NC_26_NU,12,Dark Side of the Moon,What album spent a record 741 weeks on Billboard's Top 200 Albums chart?
A3LLAS4WXA8SKJ,1,general,general,Useful,NC_34_U,8,"Pineapple, by planting the green leaves",What tropical fruit can be regrown from its scraps?
A3LLAS4WXA8SKJ,1,general,general,Useful,NC_41_U,8,"April 8th, 2024",When is the next total solar eclipse visible in North America projected to occur? 
A3LLAS4WXA8SKJ,1,general,third,Trivia,TB_07_TR,12,Tuxedo Club,What New York country club lent its name to the kind of dinner jacket first worn there in 1886?
A3LLAS4WXA8SKJ,1,general,third,Trivia,TB_09_TR,4,The first email,"What did Ray Tomlinson send in Cambridge, Massachusetts, in late 1971?"
A3LLAS4WXA8SKJ,1,general,third,Trivia,TB_14_TR,12,James Brown,"When asked to define ""cool,"" what two words did James Brown use?"
A3LLAS4WXA8SKJ,1,general,third,Trivia,TB_20_TR,8,Rafflesia (corpse lily),What is the largest flower in the world?
A3LLAS4WXA8SKJ,1,general,third,Trivia,TB_22_TR,16,Cheetah,Which is the only cat that cannot retract its claws?
A3LLAS4WXA8SKJ,1,general,third,Trivia,TB_23_TR,12,Tooth,What is the only part of the body that can't repair itself?
