PID,sess,firstBlock,block,type,questionId,wait_duration,answer,question
A3MEGTO8MPAH8D,1,general,corona,Not useful,C_16_NU,16,Bats and pangolins,What other animals have been found to have viruses with highly similar genome sequences as the current coronavirus?
A3MEGTO8MPAH8D,1,general,corona,Useful,C_52_U,4,No. To protect yourself against the new coronavirus washing your hands is the best preventive measure.,Are hand dryers effective in killing the new coronavirus?
A3MEGTO8MPAH8D,1,general,general,Useful,NC_36_U,12,Potatos: rub a cut potato over your windshield before a frost to prevent freezing,What vegetable can prevent your windshield from freezing over in winter?
A3MEGTO8MPAH8D,1,general,general,Useful,NC_41_U,8,"April 8th, 2024",When is the next total solar eclipse visible in North America projected to occur? 
A3MEGTO8MPAH8D,1,general,third,MTurk,TB_30_MT,8,"The ""no hair theorem"" states that a black hole has only three properties: electric charge, angular momentum, and mass.",What is the composition of a black hole?
A3MEGTO8MPAH8D,1,general,third,MTurk,TB_31_MT,16,Scientists estimate that at the moment it is not. But with global warming it might become more feasilbe later in the 21st century.,How feasible would it be to colonize Antarctica?
A3MEGTO8MPAH8D,1,general,third,MTurk,TB_43_MT,16,"Planets likely start off as grains of dust that then combine to form bigger rocks. They clear material from their path, leaving tracks of space empty but for fine dust.",How do planets form?
A3MEGTO8MPAH8D,1,general,third,Trivia,TB_23_TR,8,Tooth,What is the only part of the body that can't repair itself?
