PID,sess,firstBlock,block,type,questionId,wait_duration,answer,question
A3MZKZ5ZGOE4WK,1,general,corona,Not useful,C_08_NU,12,Lombardy,What is the name of the county in Italy that had the first coronavirus outbreak?
A3MZKZ5ZGOE4WK,1,general,corona,Not useful,C_10_NU,12,11 million people,"What is the population of Wuhan, the city in which coronavirus was first identified?"
A3MZKZ5ZGOE4WK,1,general,corona,Not useful,C_15_NU,12,7.5 days,"In the early stages of the new coronavirus, the number of new cases doubled approximately every how many days?"
A3MZKZ5ZGOE4WK,1,general,corona,Not useful,C_18_NU,4,They are able to filter out at least 95% of airborne particles,Why are N95 respirator face masks so named?
A3MZKZ5ZGOE4WK,1,general,corona,Not useful,C_21_NU,8,An epidemic that has spread around the world,An epidemic is the outbreak of a disease that affects many people at the same time. What does pandemic mean?
A3MZKZ5ZGOE4WK,1,general,corona,Useful,C_47_U,4,"Free of fever; no other symptoms, including cough; negative tests on at least two consecutive respiratory specimens at least 24 hours apart.",What are current Centers for Disease Control (CDC) guidelines for releasing someone from isolation?
A3MZKZ5ZGOE4WK,1,general,general,Not useful,NC_24_NU,16,State quarters,What's been released five times a year from January 1999 to fall 2008?
A3MZKZ5ZGOE4WK,1,general,general,Useful,NC_32_U,8,Take a picture of your fridge before leaving the house,What's a simple trick for telling whether your out of something when you're grocery shopping?
A3MZKZ5ZGOE4WK,1,general,general,Useful,NC_33_U,16,Below eye level,Where in the supermarket can you usually find the cheaper items?
A3MZKZ5ZGOE4WK,1,general,general,Useful,NC_40_U,16,Squint your eyes,How do you make your smile look more genuine in photographs?
A3MZKZ5ZGOE4WK,1,general,general,Useful,NC_41_U,12,"April 8th, 2024",When is the next total solar eclipse visible in North America projected to occur? 
A3MZKZ5ZGOE4WK,1,general,general,Useful,NC_51_U,16,White vinegar,What salad dressing ingredient is also an efficient weed killer?
A3MZKZ5ZGOE4WK,1,general,third,MTurk,TB_31_MT,12,Scientists estimate that at the moment it is not. But with global warming it might become more feasilbe later in the 21st century.,How feasible would it be to colonize Antarctica?
A3MZKZ5ZGOE4WK,1,general,third,MTurk,TB_32_MT,8,Sophisticated equipment is either lowered to the sea bottom or directly attached to submersible buoys and transmits to a research vessel that is equipped with state-of-the-art navigational instruments.,What are undersea researchers doing to explore the ocean floor?
A3MZKZ5ZGOE4WK,1,general,third,MTurk,TB_39_MT,8,"There is radio emission around black holes. Scientists created a network of telescopes, capturing an image of a black hole by improving upon a technique that allows for the imaging of far-away objects",How was the recent picture of a black hole made?
A3MZKZ5ZGOE4WK,1,general,third,Trivia,TB_02_TR,12,Ivory Coast's,"The world's largest church is Our Lady of Peace Basilica in Yamoussoukro, what nation's capital?"
A3MZKZ5ZGOE4WK,1,general,third,Trivia,TB_10_TR,8,George VI,Who was the last British Monarch to also be an emperor?
A3MZKZ5ZGOE4WK,1,general,third,Trivia,TB_22_TR,4,Cheetah,Which is the only cat that cannot retract its claws?
