PID,sess,firstBlock,block,type,questionId,wait_duration,answer,question
A3NQCQFCEMUSUO,1,general,corona,Not useful,C_10_NU,16,11 million people,"What is the population of Wuhan, the city in which coronavirus was first identified?"
A3NQCQFCEMUSUO,1,general,corona,Not useful,C_11_NU,8,The Chicago of China,"Wuhan, China, the city in which the coronavirus was first identified, is commonly referred to as the chinese version of what American city?"
A3NQCQFCEMUSUO,1,general,corona,Not useful,C_18_NU,12,They are able to filter out at least 95% of airborne particles,Why are N95 respirator face masks so named?
A3NQCQFCEMUSUO,1,general,corona,Useful,C_34_U,8,"The virus lives for up to a few days on surfaces, and so packages cannot transmit the virus.",Can the new coronavirus be transmitted on a package from an infected country?
A3NQCQFCEMUSUO,1,general,corona,Useful,C_35_U,16,"The virus spreads through coughs and sneezes, there are no reports of transmission through mosquito bites.",Can the new coronavirus be transmitted through mosquito bites?
A3NQCQFCEMUSUO,1,general,general,Not useful,NC_08_NU,4,The guppy,What common aquarium fish is named for the naturalist who discovered it in Trinidad in 1876?
A3NQCQFCEMUSUO,1,general,general,Not useful,NC_09_NU,8,Captain Cook,"Who christened Hawaii ""the Sandwich Islands"" in 1778?"
A3NQCQFCEMUSUO,1,general,general,Not useful,NC_14_NU,4,Rod Serling,What famed TV personality wrote the screenplay for 1968's Planet of the Apes?
A3NQCQFCEMUSUO,1,general,general,Not useful,NC_22_NU,4,Steamboat Geyser,"Which Yellowstone geyser, with eruptions 100 fee taller than Old Faithful's, is the world's tallest?"
A3NQCQFCEMUSUO,1,general,general,Not useful,NC_26_NU,4,Dark Side of the Moon,What album spent a record 741 weeks on Billboard's Top 200 Albums chart?
A3NQCQFCEMUSUO,1,general,general,Useful,NC_34_U,12,"Pineapple, by planting the green leaves",What tropical fruit can be regrown from its scraps?
A3NQCQFCEMUSUO,1,general,general,Useful,NC_45_U,8,"Grapes or raisins, onions, avocado","In addition to chocolate, what other foods can be very harmful to dogs? "
A3NQCQFCEMUSUO,1,general,general,Useful,NC_51_U,4,White vinegar,What salad dressing ingredient is also an efficient weed killer?
A3NQCQFCEMUSUO,1,general,third,MTurk,TB_31_MT,8,Scientists estimate that at the moment it is not. But with global warming it might become more feasilbe later in the 21st century.,How feasible would it be to colonize Antarctica?
A3NQCQFCEMUSUO,1,general,third,MTurk,TB_35_MT,16,Prototypes already exist. Technological estimates suggest that definitely within the next twenty years -- although the challenges are great.,When will we have flying cars?
A3NQCQFCEMUSUO,1,general,third,MTurk,TB_39_MT,4,"There is radio emission around black holes. Scientists created a network of telescopes, capturing an image of a black hole by improving upon a technique that allows for the imaging of far-away objects",How was the recent picture of a black hole made?
A3NQCQFCEMUSUO,1,general,third,Trivia,TB_01_TR,12,Canada,"What country is home to Roots, the company that outfits the U.S. Olympic team?"
A3NQCQFCEMUSUO,1,general,third,Trivia,TB_10_TR,12,George VI,Who was the last British Monarch to also be an emperor?
