PID,sess,firstBlock,block,type,questionId,wait_duration,answer,question
A3O5RZYTPV7FZF,1,corona,corona,Not useful,C_02_NU,4,Three ,How many pandemics were there in the 20th century?
A3O5RZYTPV7FZF,1,corona,corona,Not useful,C_16_NU,4,Bats and pangolins,What other animals have been found to have viruses with highly similar genome sequences as the current coronavirus?
A3O5RZYTPV7FZF,1,corona,corona,Not useful,C_17_NU,4,"Locations, people, or animals","The name for the new disease COVID-19 adheres to WHO best practices in disease naming, which include guidelines to not name disease after what?"
A3O5RZYTPV7FZF,1,corona,corona,Useful,C_28_U,4,"Yes, by boosting the immune system",Does sleep make you more resistant to coronavirus infections?
A3O5RZYTPV7FZF,1,corona,corona,Useful,C_35_U,4,"The virus spreads through coughs and sneezes, there are no reports of transmission through mosquito bites.",Can the new coronavirus be transmitted through mosquito bites?
A3O5RZYTPV7FZF,1,corona,corona,Useful,C_48_U,12,Reserves need to be saved for people who are infected and for healthcare professionals.,Why does the CDC currently recommend that healthy people do not wear N95 face masks?
A3O5RZYTPV7FZF,1,corona,corona,Useful,C_51_U,16,Nasal or orab swab or a sample of sputum,What sort of specimen is needed to test for the new coronavirus? 
A3O5RZYTPV7FZF,1,corona,general,Not useful,NC_13_NU,4,Bling bling,What term does rapper B.G. say he wishes he'd patented when he used it for the title of his massive 1999 hit?
A3O5RZYTPV7FZF,1,corona,general,Not useful,NC_18_NU,8,A truce,What was put in place by the Ancient Greeks before and during all Olympic festivals?
A3O5RZYTPV7FZF,1,corona,general,Not useful,NC_19_NU,8,Smoke,"in 1908, New York City passed the Sullivan Ordinance which made it illegal for women to do what in public?"
A3O5RZYTPV7FZF,1,corona,general,Not useful,NC_24_NU,4,State quarters,What's been released five times a year from January 1999 to fall 2008?
A3O5RZYTPV7FZF,1,corona,general,Useful,NC_27_U,12,White vinegar,What can you use instead of fabric softner to soften sheets and remove odours?
A3O5RZYTPV7FZF,1,corona,general,Useful,NC_34_U,8,"Pineapple, by planting the green leaves",What tropical fruit can be regrown from its scraps?
A3O5RZYTPV7FZF,1,corona,general,Useful,NC_40_U,16,Squint your eyes,How do you make your smile look more genuine in photographs?
A3O5RZYTPV7FZF,1,corona,general,Useful,NC_47_U,8,"Add baking soda, soak in advance, use a preassure cooker",What can you do to make dry beans cook faster?
A3O5RZYTPV7FZF,1,corona,third,MTurk,TB_27_MT,12,"We do not know, of course. Yet, it is important to realize that there is no scientific proof for God's existence.  ",Does God exist?
A3O5RZYTPV7FZF,1,corona,third,MTurk,TB_29_MT,16,"There are a few helpful techniques. One is to imagine that you climb on top of a high building, and ""look down"" at your life. Second, to try to think about issues in novel ways. ",How to stay calm in adversity?
A3O5RZYTPV7FZF,1,corona,third,MTurk,TB_31_MT,4,Scientists estimate that at the moment it is not. But with global warming it might become more feasilbe later in the 21st century.,How feasible would it be to colonize Antarctica?
A3O5RZYTPV7FZF,1,corona,third,MTurk,TB_37_MT,8,Engineers and architects agree that the answer is positive. Houses for the non-rich are much better built today than they were built 500 years ago.,Are houses built better than they used to be?
A3O5RZYTPV7FZF,1,corona,third,MTurk,TB_40_MT,4,"NASA plans another crewed mission to the Moon by 2024, followed by a sustained presence  by 2028.  Russia is planning to begin building a human colony by 2037.",When could a lunar base be established?
A3O5RZYTPV7FZF,1,corona,third,Trivia,TB_07_TR,4,Tuxedo Club,What New York country club lent its name to the kind of dinner jacket first worn there in 1886?
A3O5RZYTPV7FZF,1,corona,third,Trivia,TB_09_TR,12,The first email,"What did Ray Tomlinson send in Cambridge, Massachusetts, in late 1971?"
A3O5RZYTPV7FZF,1,corona,third,Trivia,TB_19_TR,4,Ketchup,The only vegetable ice cream ever produced was what flavor?
A3O5RZYTPV7FZF,1,corona,third,Trivia,TB_20_TR,12,Rafflesia (corpse lily),What is the largest flower in the world?
