PID,sess,firstBlock,block,type,questionId,wait_duration,answer,question
A3PN16CE38YXPR,1,general,corona,Not useful,C_15_NU,4,7.5 days,"In the early stages of the new coronavirus, the number of new cases doubled approximately every how many days?"
A3PN16CE38YXPR,1,general,corona,Not useful,C_19_NU,16,Strategic National Stockpile,What is the name of the repository of drugs and supplies the U.S. government is supposed to maintain in case of a public health emergency?
A3PN16CE38YXPR,1,general,corona,Not useful,C_22_NU,12,Contact tracing,What is the name of the process health authorities use to understand the sources of infection and to prevent further transmission?
A3PN16CE38YXPR,1,general,corona,Useful,C_31_U,12,"The virus is probably not sexually tansmissible, but infection does occurs when kissing.",Can the coronavirus be transmitted through sexual intercourse?
A3PN16CE38YXPR,1,general,corona,Useful,C_35_U,8,"The virus spreads through coughs and sneezes, there are no reports of transmission through mosquito bites.",Can the new coronavirus be transmitted through mosquito bites?
A3PN16CE38YXPR,1,general,general,Not useful,NC_18_NU,4,A truce,What was put in place by the Ancient Greeks before and during all Olympic festivals?
A3PN16CE38YXPR,1,general,general,Useful,NC_27_U,8,White vinegar,What can you use instead of fabric softner to soften sheets and remove odours?
A3PN16CE38YXPR,1,general,general,Useful,NC_37_U,16,"Over the past 150 year, real estate, if you rent it out",What's a better investment: stocks or real estate?
A3PN16CE38YXPR,1,general,general,Useful,NC_38_U,8,"Camu Camu, a cherry-like fruit from Brazil",What fruit has the highest content of vitamin C?
A3PN16CE38YXPR,1,general,general,Useful,NC_46_U,8,"Dish soap, peroxide, and baking soda","While tomato juice probably will not work, what does work to remove skunk odor? "
A3PN16CE38YXPR,1,general,third,MTurk,TB_43_MT,4,"Planets likely start off as grains of dust that then combine to form bigger rocks. They clear material from their path, leaving tracks of space empty but for fine dust.",How do planets form?
A3PN16CE38YXPR,1,general,third,Trivia,TB_04_TR,8,Phil Knight,"In 1964, who founded Blue Ribbon Sports, which later went on to become Nike?"
A3PN16CE38YXPR,1,general,third,Trivia,TB_06_TR,4,Xanadu,What 1980 film is named for the legendary square-shaped capital of Kublai Khan?
A3PN16CE38YXPR,1,general,third,Trivia,TB_10_TR,4,George VI,Who was the last British Monarch to also be an emperor?
A3PN16CE38YXPR,1,general,third,Trivia,TB_20_TR,8,Rafflesia (corpse lily),What is the largest flower in the world?
A3PN16CE38YXPR,1,general,third,Trivia,TB_23_TR,4,Tooth,What is the only part of the body that can't repair itself?
