PID,sess,firstBlock,block,type,questionId,wait_duration,answer,question
A3PRQ2GSU42718,1,corona,corona,Not useful,C_03_NU,4,"Fuburary 1st, 2020",When was the molecular structure of the coronovirus identfied?
A3PRQ2GSU42718,1,corona,corona,Not useful,C_09_NU,16,Hubei,What is the name of the province in China in which this new coronavirus was first discovered?
A3PRQ2GSU42718,1,corona,corona,Not useful,C_11_NU,8,The Chicago of China,"Wuhan, China, the city in which the coronavirus was first identified, is commonly referred to as the chinese version of what American city?"
A3PRQ2GSU42718,1,corona,corona,Not useful,C_14_NU,4,"January 30, 2020",On what date did the World Health Organization declare the new coronavirus outbreak to be a Public Health Emergency of International Concern?
A3PRQ2GSU42718,1,corona,corona,Not useful,C_17_NU,8,"Locations, people, or animals","The name for the new disease COVID-19 adheres to WHO best practices in disease naming, which include guidelines to not name disease after what?"
A3PRQ2GSU42718,1,corona,corona,Useful,C_42_U,12,"Fever, cough, shortness of breath.",What are the most common symptoms of the new coronavirus?
A3PRQ2GSU42718,1,corona,general,Not useful,NC_07_NU,12,Salt Lake City,In what city could you see the Seagull Monument at Temple Square?
A3PRQ2GSU42718,1,corona,general,Not useful,NC_08_NU,4,The guppy,What common aquarium fish is named for the naturalist who discovered it in Trinidad in 1876?
A3PRQ2GSU42718,1,corona,general,Not useful,NC_18_NU,16,A truce,What was put in place by the Ancient Greeks before and during all Olympic festivals?
A3PRQ2GSU42718,1,corona,general,Not useful,NC_21_NU,12,The Pieta,Which was the only one of his sculptures that Michelangelo signed?
A3PRQ2GSU42718,1,corona,general,Useful,NC_27_U,8,White vinegar,What can you use instead of fabric softner to soften sheets and remove odours?
A3PRQ2GSU42718,1,corona,general,Useful,NC_35_U,16,Wrap a wet paper towel around the bottle and put in the fridge,How can you cool beverages more quickly?
A3PRQ2GSU42718,1,corona,general,Useful,NC_39_U,4,"At least $2,467 according to current research",How much money should I keep as an emergency fund?
A3PRQ2GSU42718,1,corona,general,Useful,NC_48_U,8,"Drop it from a 3 inch height. If it bounces, it's dead.",How can you tell if a battery is dead without using any tools?
A3PRQ2GSU42718,1,corona,third,MTurk,TB_28_MT,12,"Futurist Diamandis argues that due to improved powers of computation we are likely to see AI, improved medicine, and new ways of communicating.",What is to happen ten years from now?
A3PRQ2GSU42718,1,corona,third,MTurk,TB_36_MT,4,"For two reasons. One, they are too heavy. For example, the Space Shuttle weighed 2 thousand tons, yet a Boeing can only carry about 120 tons. Second, the thrust is likely to be too strong.",Why don't space rockets take off from a plane already in the air?
A3PRQ2GSU42718,1,corona,third,MTurk,TB_45_MT,8,"The amygdala (from Greek, 'almond') is one of two almond-shaped clusters of nuclei located deep and medially within the temporal lobes of the brain in complex vertebrates, including humans.",What is the amygdala?
A3PRQ2GSU42718,1,corona,third,Trivia,TB_05_TR,4,Hong Kong,What city's harbor is overlooked by Victoria Peak?
A3PRQ2GSU42718,1,corona,third,Trivia,TB_13_TR,12,Java,On what namesake Asian island are the first Homo erectus fossils found?
