PID,sess,firstBlock,block,type,questionId,wait_duration,answer,question
A3PUU1XU4C1A3V,1,corona,corona,Not useful,C_06_NU,4,Gwyneth Paltrow,"Which celebrity said about the new coronavirus ""I've already been in this movie""?"
A3PUU1XU4C1A3V,1,corona,corona,Not useful,C_10_NU,4,11 million people,"What is the population of Wuhan, the city in which coronavirus was first identified?"
A3PUU1XU4C1A3V,1,corona,corona,Not useful,C_12_NU,4,Diamond Princess,What was the name of the British cruise ship that was quarantined in Japanese waters?
A3PUU1XU4C1A3V,1,corona,corona,Not useful,C_18_NU,12,They are able to filter out at least 95% of airborne particles,Why are N95 respirator face masks so named?
A3PUU1XU4C1A3V,1,corona,corona,Not useful,C_23_NU,12,They falsely claimed to cure or prevent coronavirus,"At the end of February, Amazon banned over a million products because of what?"
A3PUU1XU4C1A3V,1,corona,corona,Useful,C_30_U,4,More similar to the symptoms of the ful,"Are the new coronavirus symptoms more similar to the symptoms of flu, or of seasonal allergies?"
A3PUU1XU4C1A3V,1,corona,corona,Useful,C_40_U,8,"The incubation period - the time between catching the virus and beginning to have symptoms of the disease - is estimated to range from 1-14 days, most commonly around five days.",How long is the incubation period for the new coronavirus?
A3PUU1XU4C1A3V,1,corona,corona,Useful,C_43_U,12,Quarantine themselves for 14 days to make sure they are not infected.,"Currently, people who  may have been in contact with someone with the new coronavirus are recommended to do what?"
A3PUU1XU4C1A3V,1,corona,corona,Useful,C_45_U,12,"Pre-existing health conditions, including cardiovascular diseases and diabetes.",What did 75% of the people who have died from the new coronavirus have?
A3PUU1XU4C1A3V,1,corona,corona,Useful,C_46_U,16,Remdesivir,"Which drug, which has been used as a treatment for the Ebola and Marburg viruses, might be promising as a treatment for this new coronavirus?"
A3PUU1XU4C1A3V,1,corona,general,Not useful,NC_01_NU,12,Mike Powell,"In 1991, who finally broke Bob Beamon's decades-old long jump record?"
A3PUU1XU4C1A3V,1,corona,general,Not useful,NC_04_NU,4,Edward Albee,"Who wrote ""Who's Afraid of Virginia Woolf?"""
A3PUU1XU4C1A3V,1,corona,general,Not useful,NC_06_NU,8,David Livingstone,Who discovered the Victoria Falls?
A3PUU1XU4C1A3V,1,corona,general,Not useful,NC_15_NU,16,Albert Einstein,Who beat out FDR and Gandhi to be named Time's Person of the Century in 1999?
A3PUU1XU4C1A3V,1,corona,general,Not useful,NC_16_NU,12,Newborns,The apgar score is used to measure the color and condition of what?
A3PUU1XU4C1A3V,1,corona,general,Not useful,NC_23_NU,8,The Netherlands,In 1568 the Catholic Church sentenced the entire population of which nation to death as heretics?
A3PUU1XU4C1A3V,1,corona,general,Useful,NC_35_U,4,Wrap a wet paper towel around the bottle and put in the fridge,How can you cool beverages more quickly?
A3PUU1XU4C1A3V,1,corona,general,Useful,NC_38_U,8,"Camu Camu, a cherry-like fruit from Brazil",What fruit has the highest content of vitamin C?
A3PUU1XU4C1A3V,1,corona,general,Useful,NC_40_U,12,Squint your eyes,How do you make your smile look more genuine in photographs?
A3PUU1XU4C1A3V,1,corona,general,Useful,NC_47_U,4,"Add baking soda, soak in advance, use a preassure cooker",What can you do to make dry beans cook faster?
A3PUU1XU4C1A3V,1,corona,third,MTurk,TB_25_MT,12,"Scientists estimate that we are likely to see flying cars, and that computers may be able to read people's thoughts and emotions ",What will be the new technologies of future?
A3PUU1XU4C1A3V,1,corona,third,MTurk,TB_26_MT,4,"Sometimes, it is easy to know, but science revealed that self-insight is prblematic. It is often very helpful to ask friends and family ",How do you know if you're happy?
A3PUU1XU4C1A3V,1,corona,third,MTurk,TB_36_MT,12,"For two reasons. One, they are too heavy. For example, the Space Shuttle weighed 2 thousand tons, yet a Boeing can only carry about 120 tons. Second, the thrust is likely to be too strong.",Why don't space rockets take off from a plane already in the air?
A3PUU1XU4C1A3V,1,corona,third,MTurk,TB_44_MT,16,"In all U.S states, same-sex marriage is now legal. Also, the number of kids per family has decreased and so ""middle"" childreen, between the eldest and youngest, are getting rarer. ",How have families changed over time?
A3PUU1XU4C1A3V,1,corona,third,Trivia,TB_03_TR,8,Mrs. Doubtfire's,What 1993 film's title character has the first name Euphegenia?
A3PUU1XU4C1A3V,1,corona,third,Trivia,TB_05_TR,12,Hong Kong,What city's harbor is overlooked by Victoria Peak?
A3PUU1XU4C1A3V,1,corona,third,Trivia,TB_21_TR,12,New York,Which state has the zip code 12345?
A3PUU1XU4C1A3V,1,corona,third,Trivia,TB_22_TR,4,Cheetah,Which is the only cat that cannot retract its claws?
