PID,sess,firstBlock,block,type,questionId,wait_duration,answer,question
A3SY53CHCJK411,1,corona,corona,Not useful,C_13_NU,16,"The initial cases of the disease are thought to have been among people with a connection to a seafood wholesale market, which also sold live animals","Why is the virus believed to have zoonotic origin, i.e., to have potentially come from animals?"
A3SY53CHCJK411,1,corona,corona,Not useful,C_15_NU,16,7.5 days,"In the early stages of the new coronavirus, the number of new cases doubled approximately every how many days?"
A3SY53CHCJK411,1,corona,corona,Not useful,C_16_NU,4,Bats and pangolins,What other animals have been found to have viruses with highly similar genome sequences as the current coronavirus?
A3SY53CHCJK411,1,corona,corona,Useful,C_27_U,16,Washing your hands frequently,What is the most effective measure to prevent infection with the coronavirus?
A3SY53CHCJK411,1,corona,corona,Useful,C_36_U,16,No. There is no evidence that regularly rinsing the nose with saline has protected people from infection with the new coronavirus.,Can regularly rinsing your nose with saline help prevent infection with the new coronavirus?
A3SY53CHCJK411,1,corona,corona,Useful,C_41_U,8,Studies suggest that coronaviruses (including preliminary information on the new virus) may persist on surfaces for a few hours or up to several days.,How long does the new coronavirus survive on surfaces?
A3SY53CHCJK411,1,corona,general,Not useful,NC_03_NU,4,Red River,"What name is shared by the rivers that run through Denison, TX and Hanoi, Vietnam?"
A3SY53CHCJK411,1,corona,general,Not useful,NC_04_NU,4,Edward Albee,"Who wrote ""Who's Afraid of Virginia Woolf?"""
A3SY53CHCJK411,1,corona,general,Not useful,NC_08_NU,4,The guppy,What common aquarium fish is named for the naturalist who discovered it in Trinidad in 1876?
A3SY53CHCJK411,1,corona,general,Useful,NC_29_U,4,"Freeze before chopping, or hold a piece of bread in your mouth, half sticking out",How to chop an onion without crying?
A3SY53CHCJK411,1,corona,general,Useful,NC_30_U,8,Floormats - put them under the wheels for traction,What item that can be found in any car can help you extract your car from mud or snow?
A3SY53CHCJK411,1,corona,general,Useful,NC_45_U,12,"Grapes or raisins, onions, avocado","In addition to chocolate, what other foods can be very harmful to dogs? "
A3SY53CHCJK411,1,corona,third,MTurk,TB_24_MT,16,"Deep sea creatures must survive in extremely harsh conditions. They include the giant spider crab, frilled shark, and the atlantic wolffish",Which creatures live in deep sea?
A3SY53CHCJK411,1,corona,third,MTurk,TB_26_MT,4,"Sometimes, it is easy to know, but science revealed that self-insight is prblematic. It is often very helpful to ask friends and family ",How do you know if you're happy?
A3SY53CHCJK411,1,corona,third,MTurk,TB_28_MT,4,"Futurist Diamandis argues that due to improved powers of computation we are likely to see AI, improved medicine, and new ways of communicating.",What is to happen ten years from now?
A3SY53CHCJK411,1,corona,third,MTurk,TB_45_MT,12,"The amygdala (from Greek, 'almond') is one of two almond-shaped clusters of nuclei located deep and medially within the temporal lobes of the brain in complex vertebrates, including humans.",What is the amygdala?
A3SY53CHCJK411,1,corona,third,Trivia,TB_01_TR,8,Canada,"What country is home to Roots, the company that outfits the U.S. Olympic team?"
A3SY53CHCJK411,1,corona,third,Trivia,TB_03_TR,4,Mrs. Doubtfire's,What 1993 film's title character has the first name Euphegenia?
A3SY53CHCJK411,1,corona,third,Trivia,TB_05_TR,4,Hong Kong,What city's harbor is overlooked by Victoria Peak?
A3SY53CHCJK411,1,corona,third,Trivia,TB_07_TR,8,Tuxedo Club,What New York country club lent its name to the kind of dinner jacket first worn there in 1886?
