PID,sess,firstBlock,block,type,questionId,wait_duration,answer,question
A3TD4VJPN33IWZ,1,general,corona,Not useful,C_22_NU,16,Contact tracing,What is the name of the process health authorities use to understand the sources of infection and to prevent further transmission?
A3TD4VJPN33IWZ,1,general,corona,Not useful,C_23_NU,4,They falsely claimed to cure or prevent coronavirus,"At the end of February, Amazon banned over a million products because of what?"
A3TD4VJPN33IWZ,1,general,corona,Useful,C_33_U,16,Soft surfaces are less likely to transmit the virus than hard surfaces.,Can the new coronavirus be transmitted by touching a soft surface like carpets or fabric?
A3TD4VJPN33IWZ,1,general,general,Not useful,NC_19_NU,8,Smoke,"in 1908, New York City passed the Sullivan Ordinance which made it illegal for women to do what in public?"
A3TD4VJPN33IWZ,1,general,general,Not useful,NC_20_NU,8,Russia,Which country has the most public libraries?
A3TD4VJPN33IWZ,1,general,general,Useful,NC_27_U,4,White vinegar,What can you use instead of fabric softner to soften sheets and remove odours?
A3TD4VJPN33IWZ,1,general,general,Useful,NC_32_U,12,Take a picture of your fridge before leaving the house,What's a simple trick for telling whether your out of something when you're grocery shopping?
A3TD4VJPN33IWZ,1,general,general,Useful,NC_35_U,12,Wrap a wet paper towel around the bottle and put in the fridge,How can you cool beverages more quickly?
A3TD4VJPN33IWZ,1,general,general,Useful,NC_38_U,8,"Camu Camu, a cherry-like fruit from Brazil",What fruit has the highest content of vitamin C?
A3TD4VJPN33IWZ,1,general,general,Useful,NC_48_U,12,"Drop it from a 3 inch height. If it bounces, it's dead.",How can you tell if a battery is dead without using any tools?
A3TD4VJPN33IWZ,1,general,third,MTurk,TB_27_MT,4,"We do not know, of course. Yet, it is important to realize that there is no scientific proof for God's existence.  ",Does God exist?
A3TD4VJPN33IWZ,1,general,third,Trivia,TB_03_TR,16,Mrs. Doubtfire's,What 1993 film's title character has the first name Euphegenia?
A3TD4VJPN33IWZ,1,general,third,Trivia,TB_11_TR,8,Mung beans,What kind of bean produces the Asian-style bean sprouts in the produce section of supermarkets?
A3TD4VJPN33IWZ,1,general,third,Trivia,TB_12_TR,12,It sits beside the Finger Lakes,"Why is Oneida Lake, near Syracuse, New York, sometimes called ""the thumb""?"
A3TD4VJPN33IWZ,1,general,third,Trivia,TB_13_TR,8,Java,On what namesake Asian island are the first Homo erectus fossils found?
