PID,sess,firstBlock,block,type,questionId,wait_duration,answer,question
A3TGKFMTI19Z59,1,general,corona,Not useful,C_13_NU,4,"The initial cases of the disease are thought to have been among people with a connection to a seafood wholesale market, which also sold live animals","Why is the virus believed to have zoonotic origin, i.e., to have potentially come from animals?"
A3TGKFMTI19Z59,1,general,corona,Useful,C_34_U,12,"The virus lives for up to a few days on surfaces, and so packages cannot transmit the virus.",Can the new coronavirus be transmitted on a package from an infected country?
A3TGKFMTI19Z59,1,general,general,Not useful,NC_04_NU,8,Edward Albee,"Who wrote ""Who's Afraid of Virginia Woolf?"""
A3TGKFMTI19Z59,1,general,general,Not useful,NC_16_NU,16,Newborns,The apgar score is used to measure the color and condition of what?
A3TGKFMTI19Z59,1,general,general,Not useful,NC_21_NU,12,The Pieta,Which was the only one of his sculptures that Michelangelo signed?
A3TGKFMTI19Z59,1,general,general,Not useful,NC_26_NU,4,Dark Side of the Moon,What album spent a record 741 weeks on Billboard's Top 200 Albums chart?
A3TGKFMTI19Z59,1,general,third,MTurk,TB_45_MT,8,"The amygdala (from Greek, 'almond') is one of two almond-shaped clusters of nuclei located deep and medially within the temporal lobes of the brain in complex vertebrates, including humans.",What is the amygdala?
A3TGKFMTI19Z59,1,general,third,Trivia,TB_07_TR,8,Tuxedo Club,What New York country club lent its name to the kind of dinner jacket first worn there in 1886?
A3TGKFMTI19Z59,1,general,third,Trivia,TB_22_TR,12,Cheetah,Which is the only cat that cannot retract its claws?
