PID,sess,firstBlock,block,type,questionId,wait_duration,answer,question
A3UD7T1L80TCR3,1,general,corona,Not useful,C_05_NU,16,University of Washington,Which was the first US University to cancel classes becuase of the new coronavirus?
A3UD7T1L80TCR3,1,general,corona,Not useful,C_08_NU,4,Lombardy,What is the name of the county in Italy that had the first coronavirus outbreak?
A3UD7T1L80TCR3,1,general,general,Not useful,NC_05_NU,16,Matthew,Which of the four biblical Gospels was written by a tax collector?
A3UD7T1L80TCR3,1,general,general,Useful,NC_40_U,8,Squint your eyes,How do you make your smile look more genuine in photographs?
A3UD7T1L80TCR3,1,general,general,Useful,NC_50_U,4,Spread beeswax over them and then blow dry until you can't see the beeswax anymore,What's an easy way to waterproof canvas shoes?
A3UD7T1L80TCR3,1,general,third,Trivia,TB_01_TR,12,Canada,"What country is home to Roots, the company that outfits the U.S. Olympic team?"
A3UD7T1L80TCR3,1,general,third,Trivia,TB_02_TR,8,Ivory Coast's,"The world's largest church is Our Lady of Peace Basilica in Yamoussoukro, what nation's capital?"
A3UD7T1L80TCR3,1,general,third,Trivia,TB_09_TR,16,The first email,"What did Ray Tomlinson send in Cambridge, Massachusetts, in late 1971?"
A3UD7T1L80TCR3,1,general,third,Trivia,TB_15_TR,4,Portia,The United States' first law school for woman was named for what cross-dressing Shakespearean character?
A3UD7T1L80TCR3,1,general,third,Trivia,TB_18_TR,12,Orville Wright,Who was flying the plane in which the first US airplane fatality occurred?
A3UD7T1L80TCR3,1,general,third,Trivia,TB_21_TR,4,New York,Which state has the zip code 12345?
