PID,sess,firstBlock,block,type,questionId,wait_duration,answer,question
A3VTOW7WLPTBRR,1,corona,corona,Not useful,C_05_NU,16,University of Washington,Which was the first US University to cancel classes becuase of the new coronavirus?
A3VTOW7WLPTBRR,1,corona,corona,Not useful,C_10_NU,12,11 million people,"What is the population of Wuhan, the city in which coronavirus was first identified?"
A3VTOW7WLPTBRR,1,corona,corona,Not useful,C_19_NU,8,Strategic National Stockpile,What is the name of the repository of drugs and supplies the U.S. government is supposed to maintain in case of a public health emergency?
A3VTOW7WLPTBRR,1,corona,corona,Not useful,C_22_NU,4,Contact tracing,What is the name of the process health authorities use to understand the sources of infection and to prevent further transmission?
A3VTOW7WLPTBRR,1,corona,corona,Not useful,C_23_NU,4,They falsely claimed to cure or prevent coronavirus,"At the end of February, Amazon banned over a million products because of what?"
A3VTOW7WLPTBRR,1,corona,corona,Useful,C_45_U,8,"Pre-existing health conditions, including cardiovascular diseases and diabetes.",What did 75% of the people who have died from the new coronavirus have?
A3VTOW7WLPTBRR,1,corona,corona,Useful,C_48_U,16,"Regular face masks are not considered effective, and reserves need to be saved for people who are infected and for healthcare professionals.",Why does the CDC currently recommend that healthy people do not wear face masks?
A3VTOW7WLPTBRR,1,corona,corona,Useful,C_49_U,12,"Approved filtering facemask respirators, such as the N95 respirator.","It is recommended that healthcare professionals who may be working in contact with people with the virus wear what, in addition to personal protective equipment on their hands and bodies?"
A3VTOW7WLPTBRR,1,corona,corona,Useful,C_50_U,8,Washington,The first US death from the new coronavirus occurred in which state?
A3VTOW7WLPTBRR,1,corona,general,Not useful,NC_01_NU,12,Mike Powell,"In 1991, who finally broke Bob Beamon's decades-old long jump record?"
A3VTOW7WLPTBRR,1,corona,general,Not useful,NC_10_NU,12,K.D. Lang,What Canadian singer appeared on the first cover of Entertainment Weekly?
A3VTOW7WLPTBRR,1,corona,general,Not useful,NC_15_NU,16,Albert Einstein,Who beat out FDR and Gandhi to be named Time's Person of the Century in 1999?
A3VTOW7WLPTBRR,1,corona,general,Not useful,NC_18_NU,12,A truce,What was put in place by the Ancient Greeks before and during all Olympic festivals?
A3VTOW7WLPTBRR,1,corona,general,Useful,NC_33_U,12,Below eye level,Where in the supermarket can you usually find the cheaper items?
A3VTOW7WLPTBRR,1,corona,general,Useful,NC_39_U,8,"At least $2,467 according to current research",How much money should I keep as an emergency fund?
A3VTOW7WLPTBRR,1,corona,general,Useful,NC_45_U,12,"Grapes or raisins, onions, avocado","In addition to chocolate, what other foods can be very harmful to dogs? "
A3VTOW7WLPTBRR,1,corona,general,Useful,NC_48_U,8,"Drop it from a 3 inch height. If it bounces, it's dead.",How can you tell if a battery is dead without using any tools?
A3VTOW7WLPTBRR,1,corona,third,MTurk,TB_31_MT,4,Scientists estimate that at the moment it is not. But with global warming it might become more feasilbe later in the 21st century.,How feasible would it be to colonize Antarctica?
A3VTOW7WLPTBRR,1,corona,third,MTurk,TB_33_MT,12,"For SpaceX — the cheapest of NASA's new carriers — each pound costs approximately $27,000. So an average person of 160 pounds costs over $4,320,000.",How much does it cost to launch a person into space?
A3VTOW7WLPTBRR,1,corona,third,MTurk,TB_38_MT,16,"As a rule, yes. Restaurants have to cover rent, salaries and taxes. These are all included in the prices.",Is it really cheaper to cook at home vs. eating out?
A3VTOW7WLPTBRR,1,corona,third,MTurk,TB_39_MT,16,"There is radio emission around black holes. Scientists created a network of telescopes, capturing an image of a black hole by improving upon a technique that allows for the imaging of far-away objects",How was the recent picture of a black hole made?
A3VTOW7WLPTBRR,1,corona,third,MTurk,TB_45_MT,8,"The amygdala (from Greek, 'almond') is one of two almond-shaped clusters of nuclei located deep and medially within the temporal lobes of the brain in complex vertebrates, including humans.",What is the amygdala?
A3VTOW7WLPTBRR,1,corona,third,Trivia,TB_04_TR,12,Phil Knight,"In 1964, who founded Blue Ribbon Sports, which later went on to become Nike?"
A3VTOW7WLPTBRR,1,corona,third,Trivia,TB_17_TR,16,"Third finger, left hand",What part of his body did Keith Richards insure for a million pounds?
A3VTOW7WLPTBRR,1,corona,third,Trivia,TB_23_TR,8,Tooth,What is the only part of the body that can't repair itself?
