PID,sess,firstBlock,block,type,questionId,wait_duration,answer,question
A49HPQ9P5AHU4,1,corona,corona,Not useful,C_01_NU,12,"Animals, probably bats",What is the source of coronavirus in humans?
A49HPQ9P5AHU4,1,corona,corona,Not useful,C_03_NU,4,"Fuburary 1st, 2020",When was the molecular structure of the coronovirus identfied?
A49HPQ9P5AHU4,1,corona,corona,Not useful,C_05_NU,8,University of Washington,Which was the first US University to cancel classes becuase of the new coronavirus?
A49HPQ9P5AHU4,1,corona,corona,Not useful,C_06_NU,8,Gwyneth Paltrow,"Which celebrity said about the new coronavirus ""I've already been in this movie""?"
A49HPQ9P5AHU4,1,corona,corona,Not useful,C_17_NU,8,"Locations, people, or animals","The name for the new disease COVID-19 adheres to WHO best practices in disease naming, which include guidelines to not name disease after what?"
A49HPQ9P5AHU4,1,corona,corona,Not useful,C_20_NU,4,"Rear Adm. Ziemer led the global health security team, responsible for leading the US response to pandemics.","In May 2018, Rear Admiral Timothy Ziemer left the White House staff and was not replaced. What was Rear Adm. Ziemer's responsibility in the White House?"
A49HPQ9P5AHU4,1,corona,corona,Useful,C_31_U,8,"The virus is probably not sexually tansmissible, but infection does occurs when kissing.",Can the coronavirus be transmitted through sexual intercourse?
A49HPQ9P5AHU4,1,corona,corona,Useful,C_33_U,4,Soft surfaces are less likely to transmit the virus than hard surfaces.,Can the new coronavirus be transmitted by touching a soft surface like carpets or fabric?
A49HPQ9P5AHU4,1,corona,corona,Useful,C_48_U,12,Reserves need to be saved for people who are infected and for healthcare professionals.,Why does the CDC currently recommend that healthy people do not wear N95 face masks?
A49HPQ9P5AHU4,1,corona,corona,Useful,C_49_U,4,"Approved filtering facemask respirators, such as the N95 respirator.","It is recommended that healthcare professionals who may be working in contact with people with the virus wear what, in addition to personal protective equipment on their hands and bodies?"
A49HPQ9P5AHU4,1,corona,general,Not useful,NC_14_NU,8,Rod Serling,What famed TV personality wrote the screenplay for 1968's Planet of the Apes?
A49HPQ9P5AHU4,1,corona,general,Not useful,NC_17_NU,4,Gilbert Van Camp,What Indianapolis grocer made his name by selling canned pork and beans to U.S. troops during the Civil War?
A49HPQ9P5AHU4,1,corona,general,Not useful,NC_23_NU,12,The Netherlands,In 1568 the Catholic Church sentenced the entire population of which nation to death as heretics?
A49HPQ9P5AHU4,1,corona,general,Not useful,NC_26_NU,4,Dark Side of the Moon,What album spent a record 741 weeks on Billboard's Top 200 Albums chart?
A49HPQ9P5AHU4,1,corona,general,Useful,NC_28_U,4,Microwave next to a glass of water,How can you soften brown sugar that has hardened into a lump?
A49HPQ9P5AHU4,1,corona,general,Useful,NC_30_U,16,Floormats - put them under the wheels for traction,What item that can be found in any car can help you extract your car from mud or snow?
A49HPQ9P5AHU4,1,corona,general,Useful,NC_35_U,16,Wrap a wet paper towel around the bottle and put in the fridge,How can you cool beverages more quickly?
A49HPQ9P5AHU4,1,corona,general,Useful,NC_45_U,8,"Grapes or raisins, onions, avocado","In addition to chocolate, what other foods can be very harmful to dogs? "
A49HPQ9P5AHU4,1,corona,third,MTurk,TB_24_MT,12,"Deep sea creatures must survive in extremely harsh conditions. They include the giant spider crab, frilled shark, and the atlantic wolffish",Which creatures live in deep sea?
A49HPQ9P5AHU4,1,corona,third,MTurk,TB_27_MT,4,"We do not know, of course. Yet, it is important to realize that there is no scientific proof for God's existence.  ",Does God exist?
A49HPQ9P5AHU4,1,corona,third,MTurk,TB_30_MT,16,"The ""no hair theorem"" states that a black hole has only three properties: electric charge, angular momentum, and mass.",What is the composition of a black hole?
A49HPQ9P5AHU4,1,corona,third,MTurk,TB_45_MT,8,"The amygdala (from Greek, 'almond') is one of two almond-shaped clusters of nuclei located deep and medially within the temporal lobes of the brain in complex vertebrates, including humans.",What is the amygdala?
A49HPQ9P5AHU4,1,corona,third,Trivia,TB_13_TR,4,Java,On what namesake Asian island are the first Homo erectus fossils found?
A49HPQ9P5AHU4,1,corona,third,Trivia,TB_20_TR,16,Rafflesia (corpse lily),What is the largest flower in the world?
A49HPQ9P5AHU4,1,corona,third,Trivia,TB_23_TR,8,Tooth,What is the only part of the body that can't repair itself?
