PID,sess,firstBlock,block,type,questionId,wait_duration,answer,question
A4IX0UUC3A3GY,1,general,corona,Not useful,C_03_NU,4,"Fuburary 1st, 2020",When was the molecular structure of the coronovirus identfied?
A4IX0UUC3A3GY,1,general,corona,Not useful,C_05_NU,16,University of Washington,Which was the first US University to cancel classes becuase of the new coronavirus?
A4IX0UUC3A3GY,1,general,corona,Not useful,C_10_NU,4,11 million people,"What is the population of Wuhan, the city in which coronavirus was first identified?"
A4IX0UUC3A3GY,1,general,corona,Not useful,C_16_NU,12,Bats and pangolins,What other animals have been found to have viruses with highly similar genome sequences as the current coronavirus?
A4IX0UUC3A3GY,1,general,corona,Not useful,C_18_NU,4,They are able to filter out at least 95% of airborne particles,Why are N95 respirator face masks so named?
A4IX0UUC3A3GY,1,general,corona,Useful,C_30_U,4,More similar to the symptoms of the ful,"Are the new coronavirus symptoms more similar to the symptoms of flu, or of seasonal allergies?"
A4IX0UUC3A3GY,1,general,corona,Useful,C_35_U,8,"The virus spreads through coughs and sneezes, there are no reports of transmission through mosquito bites.",Can the new coronavirus be transmitted through mosquito bites?
A4IX0UUC3A3GY,1,general,general,Not useful,NC_03_NU,4,Red River,"What name is shared by the rivers that run through Denison, TX and Hanoi, Vietnam?"
A4IX0UUC3A3GY,1,general,general,Not useful,NC_05_NU,16,Matthew,Which of the four biblical Gospels was written by a tax collector?
A4IX0UUC3A3GY,1,general,general,Not useful,NC_09_NU,4,Captain Cook,"Who christened Hawaii ""the Sandwich Islands"" in 1778?"
A4IX0UUC3A3GY,1,general,general,Not useful,NC_12_NU,4,Come by her,"The title of the song ""Kumbaya"" is actually a distortion of what three-word phrase?"
A4IX0UUC3A3GY,1,general,general,Useful,NC_41_U,8,"April 8th, 2024",When is the next total solar eclipse visible in North America projected to occur? 
A4IX0UUC3A3GY,1,general,general,Useful,NC_46_U,16,"Dish soap, peroxide, and baking soda","While tomato juice probably will not work, what does work to remove skunk odor? "
A4IX0UUC3A3GY,1,general,general,Useful,NC_47_U,4,"Add baking soda, soak in advance, use a preassure cooker",What can you do to make dry beans cook faster?
A4IX0UUC3A3GY,1,general,third,MTurk,TB_24_MT,16,"Deep sea creatures must survive in extremely harsh conditions. They include the giant spider crab, frilled shark, and the atlantic wolffish",Which creatures live in deep sea?
A4IX0UUC3A3GY,1,general,third,MTurk,TB_30_MT,8,"The ""no hair theorem"" states that a black hole has only three properties: electric charge, angular momentum, and mass.",What is the composition of a black hole?
A4IX0UUC3A3GY,1,general,third,Trivia,TB_01_TR,4,Canada,"What country is home to Roots, the company that outfits the U.S. Olympic team?"
A4IX0UUC3A3GY,1,general,third,Trivia,TB_09_TR,4,The first email,"What did Ray Tomlinson send in Cambridge, Massachusetts, in late 1971?"
A4IX0UUC3A3GY,1,general,third,Trivia,TB_16_TR,8,Jim Lovell,Alan Shepard was scheduled to command the ill-fated Apollo 13 before switching missions with what astronaut?
A4IX0UUC3A3GY,1,general,third,Trivia,TB_18_TR,16,Orville Wright,Who was flying the plane in which the first US airplane fatality occurred?
A4IX0UUC3A3GY,1,general,third,Trivia,TB_19_TR,12,Ketchup,The only vegetable ice cream ever produced was what flavor?
