PID,sess,firstBlock,block,type,questionId,wait_duration,answer,question
A5KH93VVQ3YYR,1,corona,corona,Not useful,C_04_NU,16,"It stands for ""COronaVIrus Disease 2019""","Why is the new coronavirus called ""COVID-19""? "
A5KH93VVQ3YYR,1,corona,corona,Not useful,C_11_NU,12,The Chicago of China,"Wuhan, China, the city in which the coronavirus was first identified, is commonly referred to as the chinese version of what American city?"
A5KH93VVQ3YYR,1,corona,corona,Not useful,C_18_NU,8,They are able to filter out at least 95% of airborne particles,Why are N95 respirator face masks so named?
A5KH93VVQ3YYR,1,corona,corona,Useful,C_27_U,8,Washing your hands frequently,What is the most effective measure to prevent infection with the coronavirus?
A5KH93VVQ3YYR,1,corona,corona,Useful,C_29_U,16,Not for at least several months from now,How soon is a vaccine for the new coronavirus likely to be available?
A5KH93VVQ3YYR,1,corona,corona,Useful,C_32_U,8,"Healthcare professionals treating patients, in-home caregivers, and those who are already sick with the new coronavirus",Which three groups of people does the CDC recommend masks for?
A5KH93VVQ3YYR,1,corona,corona,Useful,C_40_U,16,"The incubation period - the time between catching the virus and beginning to have symptoms of the disease - is estimated to range from 1-14 days, most commonly around five days.",How long is the incubation period for the new coronavirus?
A5KH93VVQ3YYR,1,corona,general,Not useful,NC_20_NU,12,Russia,Which country has the most public libraries?
A5KH93VVQ3YYR,1,corona,general,Not useful,NC_23_NU,12,The Netherlands,In 1568 the Catholic Church sentenced the entire population of which nation to death as heretics?
A5KH93VVQ3YYR,1,corona,general,Useful,NC_48_U,16,"Drop it from a 3 inch height. If it bounces, it's dead.",How can you tell if a battery is dead without using any tools?
A5KH93VVQ3YYR,1,corona,general,Useful,NC_49_U,12,"Roll it along its long side. If it stops immediately, it's raw.",How can you tell if an egg is cooked without breaking it?
A5KH93VVQ3YYR,1,corona,third,MTurk,TB_24_MT,4,"Deep sea creatures must survive in extremely harsh conditions. They include the giant spider crab, frilled shark, and the atlantic wolffish",Which creatures live in deep sea?
A5KH93VVQ3YYR,1,corona,third,MTurk,TB_31_MT,12,Scientists estimate that at the moment it is not. But with global warming it might become more feasilbe later in the 21st century.,How feasible would it be to colonize Antarctica?
A5KH93VVQ3YYR,1,corona,third,MTurk,TB_36_MT,8,"For two reasons. One, they are too heavy. For example, the Space Shuttle weighed 2 thousand tons, yet a Boeing can only carry about 120 tons. Second, the thrust is likely to be too strong.",Why don't space rockets take off from a plane already in the air?
A5KH93VVQ3YYR,1,corona,third,MTurk,TB_38_MT,4,"As a rule, yes. Restaurants have to cover rent, salaries and taxes. These are all included in the prices.",Is it really cheaper to cook at home vs. eating out?
A5KH93VVQ3YYR,1,corona,third,MTurk,TB_45_MT,16,"The amygdala (from Greek, 'almond') is one of two almond-shaped clusters of nuclei located deep and medially within the temporal lobes of the brain in complex vertebrates, including humans.",What is the amygdala?
A5KH93VVQ3YYR,1,corona,third,Trivia,TB_11_TR,12,Mung beans,What kind of bean produces the Asian-style bean sprouts in the produce section of supermarkets?
A5KH93VVQ3YYR,1,corona,third,Trivia,TB_19_TR,12,Ketchup,The only vegetable ice cream ever produced was what flavor?
