PID,sess,firstBlock,block,type,questionId,wait_duration,answer,question
A6V8L0I5Z4XNU,1,general,corona,Not useful,C_10_NU,4,11 million people,"What is the population of Wuhan, the city in which coronavirus was first identified?"
A6V8L0I5Z4XNU,1,general,corona,Not useful,C_11_NU,4,The Chicago of China,"Wuhan, China, the city in which the coronavirus was first identified, is commonly referred to as the chinese version of what American city?"
A6V8L0I5Z4XNU,1,general,corona,Not useful,C_12_NU,4,Diamond Princess,What was the name of the British cruise ship that was quarantined in Japanese waters?
A6V8L0I5Z4XNU,1,general,corona,Useful,C_29_U,4,Not for at least several months from now,How soon is a vaccine for the new coronavirus likely to be available?
A6V8L0I5Z4XNU,1,general,corona,Useful,C_38_U,12,People of all ages can be infected by the new coronavirus. Older people appear to be more vulnerable to becoming severely ill with the virus.,"Does the new coronavirus affect older people, or are younger people also susceptible?"
A6V8L0I5Z4XNU,1,general,corona,Useful,C_47_U,16,"Free of fever; no other symptoms, including cough; negative tests on at least two consecutive respiratory specimens at least 24 hours apart.",What are current Centers for Disease Control (CDC) guidelines for releasing someone from isolation?
A6V8L0I5Z4XNU,1,general,third,Trivia,TB_13_TR,4,Java,On what namesake Asian island are the first Homo erectus fossils found?
