PID,sess,firstBlock,block,type,questionId,wait_duration,answer,question
A7C6O7C42HU7Q,1,general,corona,Not useful,C_18_NU,12,They are able to filter out at least 95% of airborne particles,Why are N95 respirator face masks so named?
A7C6O7C42HU7Q,1,general,corona,Not useful,C_23_NU,12,They falsely claimed to cure or prevent coronavirus,"At the end of February, Amazon banned over a million products because of what?"
A7C6O7C42HU7Q,1,general,corona,Useful,C_31_U,12,"The virus is probably not sexually tansmissible, but infection does occurs when kissing.",Can the coronavirus be transmitted through sexual intercourse?
A7C6O7C42HU7Q,1,general,corona,Useful,C_48_U,8,Reserves need to be saved for people who are infected and for healthcare professionals.,Why does the CDC currently recommend that healthy people do not wear N95 face masks?
A7C6O7C42HU7Q,1,general,general,Not useful,NC_12_NU,8,Come by her,"The title of the song ""Kumbaya"" is actually a distortion of what three-word phrase?"
A7C6O7C42HU7Q,1,general,general,Useful,NC_33_U,8,Below eye level,Where in the supermarket can you usually find the cheaper items?
A7C6O7C42HU7Q,1,general,general,Useful,NC_35_U,8,Wrap a wet paper towel around the bottle and put in the fridge,How can you cool beverages more quickly?
A7C6O7C42HU7Q,1,general,general,Useful,NC_36_U,16,Potatos: rub a cut potato over your windshield before a frost to prevent freezing,What vegetable can prevent your windshield from freezing over in winter?
A7C6O7C42HU7Q,1,general,general,Useful,NC_40_U,16,Squint your eyes,How do you make your smile look more genuine in photographs?
A7C6O7C42HU7Q,1,general,general,Useful,NC_44_U,4,Doritos,What popular snack food is effective to use as kindling to start a fire?
A7C6O7C42HU7Q,1,general,third,MTurk,TB_28_MT,4,"Futurist Diamandis argues that due to improved powers of computation we are likely to see AI, improved medicine, and new ways of communicating.",What is to happen ten years from now?
A7C6O7C42HU7Q,1,general,third,MTurk,TB_31_MT,4,Scientists estimate that at the moment it is not. But with global warming it might become more feasilbe later in the 21st century.,How feasible would it be to colonize Antarctica?
A7C6O7C42HU7Q,1,general,third,MTurk,TB_34_MT,8,Evolution is usually very slow. Think about the similarities between apes and people. Future people are going to be as similar to us as we are to apes. ,What will future humans look like?
A7C6O7C42HU7Q,1,general,third,MTurk,TB_38_MT,4,"As a rule, yes. Restaurants have to cover rent, salaries and taxes. These are all included in the prices.",Is it really cheaper to cook at home vs. eating out?
A7C6O7C42HU7Q,1,general,third,Trivia,TB_19_TR,8,Ketchup,The only vegetable ice cream ever produced was what flavor?
A7C6O7C42HU7Q,1,general,third,Trivia,TB_21_TR,12,New York,Which state has the zip code 12345?
