PID,sess,firstBlock,block,type,questionId,wait_duration,answer,question
A8028AFBBS29G,1,corona,corona,Not useful,C_03_NU,8,"Fuburary 1st, 2020",When was the molecular structure of the coronovirus identfied?
A8028AFBBS29G,1,corona,corona,Not useful,C_12_NU,4,Diamond Princess,What was the name of the British cruise ship that was quarantined in Japanese waters?
A8028AFBBS29G,1,corona,corona,Not useful,C_22_NU,4,Contact tracing,What is the name of the process health authorities use to understand the sources of infection and to prevent further transmission?
A8028AFBBS29G,1,corona,corona,Useful,C_28_U,4,"Yes, by boosting the immune system",Does sleep make you more resistant to coronavirus infections?
A8028AFBBS29G,1,corona,corona,Useful,C_31_U,8,"The virus is probably not sexually tansmissible, but infection does occurs when kissing.",Can the coronavirus be transmitted through sexual intercourse?
A8028AFBBS29G,1,corona,corona,Useful,C_32_U,4,"In public settings where other social distancing measures are difficult to maintain (e.g., grocery stores and pharmacies).",The CDC recommend people wear cloth masks in what situations?
A8028AFBBS29G,1,corona,corona,Useful,C_52_U,12,No. To protect yourself against the new coronavirus washing your hands is the best preventive measure.,Are hand dryers effective in killing the new coronavirus?
A8028AFBBS29G,1,corona,general,Not useful,NC_12_NU,12,Come by her,"The title of the song ""Kumbaya"" is actually a distortion of what three-word phrase?"
A8028AFBBS29G,1,corona,general,Not useful,NC_17_NU,16,Gilbert Van Camp,What Indianapolis grocer made his name by selling canned pork and beans to U.S. troops during the Civil War?
A8028AFBBS29G,1,corona,general,Not useful,NC_24_NU,16,State quarters,What's been released five times a year from January 1999 to fall 2008?
A8028AFBBS29G,1,corona,general,Useful,NC_29_U,16,"Freeze before chopping, or hold a piece of bread in your mouth, half sticking out",How to chop an onion without crying?
A8028AFBBS29G,1,corona,general,Useful,NC_33_U,8,Below eye level,Where in the supermarket can you usually find the cheaper items?
A8028AFBBS29G,1,corona,general,Useful,NC_43_U,16,Between 105 and 54 days before the scheduled trip.,How far in advance of a trip is the most cost effective time to purchase a plane ticket? 
A8028AFBBS29G,1,corona,third,MTurk,TB_25_MT,16,"Scientists estimate that we are likely to see flying cars, and that computers may be able to read people's thoughts and emotions ",What will be the new technologies of future?
A8028AFBBS29G,1,corona,third,MTurk,TB_32_MT,12,Sophisticated equipment is either lowered to the sea bottom or directly attached to submersible buoys and transmits to a research vessel that is equipped with state-of-the-art navigational instruments.,What are undersea researchers doing to explore the ocean floor?
A8028AFBBS29G,1,corona,third,MTurk,TB_33_MT,8,"For SpaceX — the cheapest of NASA's new carriers — each pound costs approximately $27,000. So an average person of 160 pounds costs over $4,320,000.",How much does it cost to launch a person into space?
A8028AFBBS29G,1,corona,third,MTurk,TB_43_MT,8,"Planets likely start off as grains of dust that then combine to form bigger rocks. They clear material from their path, leaving tracks of space empty but for fine dust.",How do planets form?
A8028AFBBS29G,1,corona,third,Trivia,TB_12_TR,4,It sits beside the Finger Lakes,"Why is Oneida Lake, near Syracuse, New York, sometimes called ""the thumb""?"
A8028AFBBS29G,1,corona,third,Trivia,TB_19_TR,16,Ketchup,The only vegetable ice cream ever produced was what flavor?
A8028AFBBS29G,1,corona,third,Trivia,TB_22_TR,16,Cheetah,Which is the only cat that cannot retract its claws?
