PID,sess,firstBlock,block,type,questionId,wait_duration,answer,question
A8FUMDQFBKMXR,1,general,corona,Not useful,C_11_NU,8,The Chicago of China,"Wuhan, China, the city in which the coronavirus was first identified, is commonly referred to as the chinese version of what American city?"
A8FUMDQFBKMXR,1,general,corona,Not useful,C_19_NU,4,Strategic National Stockpile,What is the name of the repository of drugs and supplies the U.S. government is supposed to maintain in case of a public health emergency?
A8FUMDQFBKMXR,1,general,corona,Useful,C_29_U,16,Not for at least several months from now,How soon is a vaccine for the new coronavirus likely to be available?
A8FUMDQFBKMXR,1,general,corona,Useful,C_44_U,4,People over age 60,Approximately 80% of deaths attributed to the new coronavirus were among people of what age?
A8FUMDQFBKMXR,1,general,general,Not useful,NC_03_NU,12,Red River,"What name is shared by the rivers that run through Denison, TX and Hanoi, Vietnam?"
A8FUMDQFBKMXR,1,general,general,Not useful,NC_15_NU,8,Albert Einstein,Who beat out FDR and Gandhi to be named Time's Person of the Century in 1999?
A8FUMDQFBKMXR,1,general,general,Not useful,NC_26_NU,4,Dark Side of the Moon,What album spent a record 741 weeks on Billboard's Top 200 Albums chart?
A8FUMDQFBKMXR,1,general,general,Useful,NC_34_U,16,"Pineapple, by planting the green leaves",What tropical fruit can be regrown from its scraps?
A8FUMDQFBKMXR,1,general,general,Useful,NC_38_U,4,"Camu Camu, a cherry-like fruit from Brazil",What fruit has the highest content of vitamin C?
A8FUMDQFBKMXR,1,general,general,Useful,NC_42_U,16,"Deprive it of oxygen by covering, pouring baking soda if the fire is small, or using a fire extinguisher if it's large.",How do you put out a grease fire? 
A8FUMDQFBKMXR,1,general,general,Useful,NC_45_U,4,"Grapes or raisins, onions, avocado","In addition to chocolate, what other foods can be very harmful to dogs? "
A8FUMDQFBKMXR,1,general,third,MTurk,TB_24_MT,8,"Deep sea creatures must survive in extremely harsh conditions. They include the giant spider crab, frilled shark, and the atlantic wolffish",Which creatures live in deep sea?
A8FUMDQFBKMXR,1,general,third,MTurk,TB_27_MT,12,"We do not know, of course. Yet, it is important to realize that there is no scientific proof for God's existence.  ",Does God exist?
A8FUMDQFBKMXR,1,general,third,MTurk,TB_38_MT,12,"As a rule, yes. Restaurants have to cover rent, salaries and taxes. These are all included in the prices.",Is it really cheaper to cook at home vs. eating out?
A8FUMDQFBKMXR,1,general,third,MTurk,TB_43_MT,4,"Planets likely start off as grains of dust that then combine to form bigger rocks. They clear material from their path, leaving tracks of space empty but for fine dust.",How do planets form?
A8FUMDQFBKMXR,1,general,third,MTurk,TB_46_MT,4,"Scientists are still figuring it out. It seems that passive use is slightly bad, but active use is not.",How does social media influence our mental health?
A8FUMDQFBKMXR,1,general,third,Trivia,TB_17_TR,4,"Third finger, left hand",What part of his body did Keith Richards insure for a million pounds?
