PID,sess,firstBlock,block,type,questionId,wait_duration,answer,question
A8YX4HGKYOEYG,1,corona,corona,Not useful,C_15_NU,8,7.5 days,"In the early stages of the new coronavirus, the number of new cases doubled approximately every how many days?"
A8YX4HGKYOEYG,1,corona,corona,Not useful,C_21_NU,16,An epidemic that has spread around the world,An epidemic is the outbreak of a disease that affects many people at the same time. What does pandemic mean?
A8YX4HGKYOEYG,1,corona,general,Not useful,NC_24_NU,12,State quarters,What's been released five times a year from January 1999 to fall 2008?
A8YX4HGKYOEYG,1,corona,general,Useful,NC_33_U,8,Below eye level,Where in the supermarket can you usually find the cheaper items?
A8YX4HGKYOEYG,1,corona,third,MTurk,TB_24_MT,4,"Deep sea creatures must survive in extremely harsh conditions. They include the giant spider crab, frilled shark, and the atlantic wolffish",Which creatures live in deep sea?
