PID,sess,firstBlock,block,type,questionId,wait_duration,answer,question
A90T7I7KQIZQA,1,corona,corona,Not useful,C_03_NU,16,"Fuburary 1st, 2020",When was the molecular structure of the coronovirus identfied?
A90T7I7KQIZQA,1,corona,corona,Not useful,C_05_NU,4,University of Washington,Which was the first US University to cancel classes becuase of the new coronavirus?
A90T7I7KQIZQA,1,corona,corona,Not useful,C_20_NU,12,"Rear Adm. Ziemer led the global health security team, responsible for leading the US response to pandemics.","In May 2018, Rear Admiral Timothy Ziemer left the White House staff and was not replaced. What was Rear Adm. Ziemer's responsibility in the White House?"
A90T7I7KQIZQA,1,corona,corona,Useful,C_28_U,12,"Yes, by boosting the immune system",Does sleep make you more resistant to coronavirus infections?
A90T7I7KQIZQA,1,corona,corona,Useful,C_32_U,4,"In public settings where other social distancing measures are difficult to maintain (e.g., grocery stores and pharmacies).",The CDC recommend people wear cloth masks in what situations?
A90T7I7KQIZQA,1,corona,corona,Useful,C_41_U,16,Studies suggest that coronaviruses (including preliminary information on the new virus) may persist on surfaces for a few hours or up to several days.,How long does the new coronavirus survive on surfaces?
A90T7I7KQIZQA,1,corona,general,Not useful,NC_06_NU,8,David Livingstone,Who discovered the Victoria Falls?
A90T7I7KQIZQA,1,corona,general,Not useful,NC_08_NU,8,The guppy,What common aquarium fish is named for the naturalist who discovered it in Trinidad in 1876?
A90T7I7KQIZQA,1,corona,general,Not useful,NC_16_NU,8,Newborns,The apgar score is used to measure the color and condition of what?
A90T7I7KQIZQA,1,corona,general,Not useful,NC_24_NU,8,State quarters,What's been released five times a year from January 1999 to fall 2008?
A90T7I7KQIZQA,1,corona,general,Not useful,NC_25_NU,8,Shark,"What animal is thought to be immune to most all diseases, including cancer?"
A90T7I7KQIZQA,1,corona,general,Not useful,NC_26_NU,12,Dark Side of the Moon,What album spent a record 741 weeks on Billboard's Top 200 Albums chart?
A90T7I7KQIZQA,1,corona,general,Useful,NC_43_U,4,Between 105 and 54 days before the scheduled trip.,How far in advance of a trip is the most cost effective time to purchase a plane ticket? 
A90T7I7KQIZQA,1,corona,general,Useful,NC_47_U,12,"Add baking soda, soak in advance, use a preassure cooker",What can you do to make dry beans cook faster?
A90T7I7KQIZQA,1,corona,third,MTurk,TB_33_MT,12,"For SpaceX — the cheapest of NASA's new carriers — each pound costs approximately $27,000. So an average person of 160 pounds costs over $4,320,000.",How much does it cost to launch a person into space?
A90T7I7KQIZQA,1,corona,third,Trivia,TB_01_TR,4,Canada,"What country is home to Roots, the company that outfits the U.S. Olympic team?"
A90T7I7KQIZQA,1,corona,third,Trivia,TB_08_TR,12,Library of Congress,"In 1802, John Beckley became the librarian of what collection containing 740 books at the time?"
A90T7I7KQIZQA,1,corona,third,Trivia,TB_13_TR,12,Java,On what namesake Asian island are the first Homo erectus fossils found?
A90T7I7KQIZQA,1,corona,third,Trivia,TB_15_TR,12,Portia,The United States' first law school for woman was named for what cross-dressing Shakespearean character?
A90T7I7KQIZQA,1,corona,third,Trivia,TB_20_TR,16,Rafflesia (corpse lily),What is the largest flower in the world?
