PID,sess,firstBlock,block,type,questionId,wait_duration,answer,question
AADADWJIFVSB1,1,general,corona,Not useful,C_02_NU,16,Three ,How many pandemics were there in the 20th century?
AADADWJIFVSB1,1,general,corona,Not useful,C_12_NU,12,Diamond Princess,What was the name of the British cruise ship that was quarantined in Japanese waters?
AADADWJIFVSB1,1,general,corona,Not useful,C_18_NU,4,They are able to filter out at least 95% of airborne particles,Why are N95 respirator face masks so named?
AADADWJIFVSB1,1,general,corona,Not useful,C_22_NU,4,Contact tracing,What is the name of the process health authorities use to understand the sources of infection and to prevent further transmission?
AADADWJIFVSB1,1,general,corona,Useful,C_39_U,4,"No, antibiotics do not work against viruses, only bacteria.",Are antibiotics effective in preventing and treating the new coronavirus?
AADADWJIFVSB1,1,general,general,Not useful,NC_07_NU,4,Salt Lake City,In what city could you see the Seagull Monument at Temple Square?
AADADWJIFVSB1,1,general,general,Not useful,NC_21_NU,16,The Pieta,Which was the only one of his sculptures that Michelangelo signed?
AADADWJIFVSB1,1,general,third,MTurk,TB_24_MT,8,"Deep sea creatures must survive in extremely harsh conditions. They include the giant spider crab, frilled shark, and the atlantic wolffish",Which creatures live in deep sea?
AADADWJIFVSB1,1,general,third,MTurk,TB_30_MT,16,"The ""no hair theorem"" states that a black hole has only three properties: electric charge, angular momentum, and mass.",What is the composition of a black hole?
AADADWJIFVSB1,1,general,third,Trivia,TB_18_TR,12,Orville Wright,Who was flying the plane in which the first US airplane fatality occurred?
AADADWJIFVSB1,1,general,third,Trivia,TB_23_TR,12,Tooth,What is the only part of the body that can't repair itself?
