PID,sess,firstBlock,block,type,questionId,wait_duration,answer,question
AAS0V105QISPM,1,general,corona,Not useful,C_12_NU,4,Diamond Princess,What was the name of the British cruise ship that was quarantined in Japanese waters?
AAS0V105QISPM,1,general,corona,Not useful,C_13_NU,8,"The initial cases of the disease are thought to have been among people with a connection to a seafood wholesale market, which also sold live animals","Why is the virus believed to have zoonotic origin, i.e., to have potentially come from animals?"
AAS0V105QISPM,1,general,general,Not useful,NC_01_NU,4,Mike Powell,"In 1991, who finally broke Bob Beamon's decades-old long jump record?"
AAS0V105QISPM,1,general,general,Not useful,NC_06_NU,4,David Livingstone,Who discovered the Victoria Falls?
AAS0V105QISPM,1,general,general,Not useful,NC_18_NU,8,A truce,What was put in place by the Ancient Greeks before and during all Olympic festivals?
AAS0V105QISPM,1,general,general,Not useful,NC_22_NU,8,Steamboat Geyser,"Which Yellowstone geyser, with eruptions 100 fee taller than Old Faithful's, is the world's tallest?"
AAS0V105QISPM,1,general,general,Not useful,NC_25_NU,8,Shark,"What animal is thought to be immune to most all diseases, including cancer?"
AAS0V105QISPM,1,general,third,Trivia,TB_10_TR,8,George VI,Who was the last British Monarch to also be an emperor?
AAS0V105QISPM,1,general,third,Trivia,TB_14_TR,4,James Brown,"When asked to define ""cool,"" what two words did James Brown use?"
AAS0V105QISPM,1,general,third,Trivia,TB_18_TR,4,Orville Wright,Who was flying the plane in which the first US airplane fatality occurred?
AAS0V105QISPM,1,general,third,Trivia,TB_20_TR,4,Rafflesia (corpse lily),What is the largest flower in the world?
