PID,sess,firstBlock,block,type,questionId,wait_duration,answer,question
ACRTRQ23XH20E,1,general,corona,Not useful,C_01_NU,4,"Animals, probably bats",What is the source of coronavirus in humans?
ACRTRQ23XH20E,1,general,corona,Not useful,C_11_NU,12,The Chicago of China,"Wuhan, China, the city in which the coronavirus was first identified, is commonly referred to as the chinese version of what American city?"
ACRTRQ23XH20E,1,general,corona,Useful,C_48_U,4,"Regular face masks are not considered effective, and reserves need to be saved for people who are infected and for healthcare professionals.",Why does the CDC currently recommend that healthy people do not wear face masks?
ACRTRQ23XH20E,1,general,general,Not useful,NC_05_NU,16,Matthew,Which of the four biblical Gospels was written by a tax collector?
ACRTRQ23XH20E,1,general,general,Not useful,NC_14_NU,4,Rod Serling,What famed TV personality wrote the screenplay for 1968's Planet of the Apes?
ACRTRQ23XH20E,1,general,third,MTurk,TB_25_MT,4,"Scientists estimate that we are likely to see flying cars, and that computers may be able to read people's thoughts and emotions ",What will be the new technologies of future?
ACRTRQ23XH20E,1,general,third,MTurk,TB_32_MT,4,Sophisticated equipment is either lowered to the sea bottom or directly attached to submersible buoys and transmits to a research vessel that is equipped with state-of-the-art navigational instruments.,What are undersea researchers doing to explore the ocean floor?
ACRTRQ23XH20E,1,general,third,Trivia,TB_23_TR,12,Tooth,What is the only part of the body that can't repair itself?
