PID,sess,firstBlock,block,type,questionId,wait_duration,answer,question
AD1FDB9A61LMS,1,corona,corona,Not useful,C_14_NU,4,"January 30, 2020",On what date did the World Health Organization declare the new coronavirus outbreak to be a Public Health Emergency of International Concern?
AD1FDB9A61LMS,1,corona,corona,Useful,C_39_U,4,"No, antibiotics do not work against viruses, only bacteria.",Are antibiotics effective in preventing and treating the new coronavirus?
AD1FDB9A61LMS,1,corona,corona,Useful,C_41_U,16,Studies suggest that coronaviruses (including preliminary information on the new virus) may persist on surfaces for a few hours or up to several days.,How long does the new coronavirus survive on surfaces?
AD1FDB9A61LMS,1,corona,corona,Useful,C_47_U,16,"Free of fever; no other symptoms, including cough; negative tests on at least two consecutive respiratory specimens at least 24 hours apart.",What are current Centers for Disease Control (CDC) guidelines for releasing someone from isolation?
AD1FDB9A61LMS,1,corona,general,Not useful,NC_12_NU,12,Come by her,"The title of the song ""Kumbaya"" is actually a distortion of what three-word phrase?"
AD1FDB9A61LMS,1,corona,general,Not useful,NC_14_NU,4,Rod Serling,What famed TV personality wrote the screenplay for 1968's Planet of the Apes?
AD1FDB9A61LMS,1,corona,general,Not useful,NC_24_NU,4,State quarters,What's been released five times a year from January 1999 to fall 2008?
AD1FDB9A61LMS,1,corona,general,Useful,NC_27_U,8,White vinegar,What can you use instead of fabric softner to soften sheets and remove odours?
AD1FDB9A61LMS,1,corona,general,Useful,NC_38_U,4,"Camu Camu, a cherry-like fruit from Brazil",What fruit has the highest content of vitamin C?
AD1FDB9A61LMS,1,corona,general,Useful,NC_44_U,8,Doritos,What popular snack food is effective to use as kindling to start a fire?
AD1FDB9A61LMS,1,corona,general,Useful,NC_52_U,12,"Tie your hair into a tight ponytail at the front of your head, and cut it.",How can you give yourself a layered haircut?
AD1FDB9A61LMS,1,corona,third,MTurk,TB_25_MT,12,"Scientists estimate that we are likely to see flying cars, and that computers may be able to read people's thoughts and emotions ",What will be the new technologies of future?
AD1FDB9A61LMS,1,corona,third,MTurk,TB_36_MT,12,"For two reasons. One, they are too heavy. For example, the Space Shuttle weighed 2 thousand tons, yet a Boeing can only carry about 120 tons. Second, the thrust is likely to be too strong.",Why don't space rockets take off from a plane already in the air?
AD1FDB9A61LMS,1,corona,third,MTurk,TB_40_MT,4,"NASA plans another crewed mission to the Moon by 2024, followed by a sustained presence  by 2028.  Russia is planning to begin building a human colony by 2037.",When could a lunar base be established?
AD1FDB9A61LMS,1,corona,third,Trivia,TB_17_TR,8,"Third finger, left hand",What part of his body did Keith Richards insure for a million pounds?
AD1FDB9A61LMS,1,corona,third,Trivia,TB_21_TR,16,New York,Which state has the zip code 12345?
AD1FDB9A61LMS,1,corona,third,Trivia,TB_23_TR,16,Tooth,What is the only part of the body that can't repair itself?
