PID,sess,firstBlock,block,type,questionId,wait_duration,answer,question
ADD5IHZ1P6TLH,1,corona,corona,Not useful,C_06_NU,8,Gwyneth Paltrow,"Which celebrity said about the new coronavirus ""I've already been in this movie""?"
ADD5IHZ1P6TLH,1,corona,corona,Not useful,C_08_NU,12,Lombardy,What is the name of the county in Italy that had the first coronavirus outbreak?
ADD5IHZ1P6TLH,1,corona,corona,Not useful,C_15_NU,8,7.5 days,"In the early stages of the new coronavirus, the number of new cases doubled approximately every how many days?"
ADD5IHZ1P6TLH,1,corona,corona,Not useful,C_23_NU,4,They falsely claimed to cure or prevent coronavirus,"At the end of February, Amazon banned over a million products because of what?"
ADD5IHZ1P6TLH,1,corona,corona,Useful,C_44_U,8,People over age 60,Approximately 80% of deaths attributed to the new coronavirus were among people of what age?
ADD5IHZ1P6TLH,1,corona,corona,Useful,C_47_U,8,"Free of fever; no other symptoms, including cough; negative tests on at least two consecutive respiratory specimens at least 24 hours apart.",What are current Centers for Disease Control (CDC) guidelines for releasing someone from isolation?
ADD5IHZ1P6TLH,1,corona,general,Not useful,NC_12_NU,4,Come by her,"The title of the song ""Kumbaya"" is actually a distortion of what three-word phrase?"
ADD5IHZ1P6TLH,1,corona,general,Not useful,NC_19_NU,4,Smoke,"in 1908, New York City passed the Sullivan Ordinance which made it illegal for women to do what in public?"
ADD5IHZ1P6TLH,1,corona,general,Not useful,NC_20_NU,4,Russia,Which country has the most public libraries?
ADD5IHZ1P6TLH,1,corona,general,Not useful,NC_24_NU,8,State quarters,What's been released five times a year from January 1999 to fall 2008?
ADD5IHZ1P6TLH,1,corona,general,Useful,NC_37_U,4,"Over the past 150 year, real estate, if you rent it out",What's a better investment: stocks or real estate?
ADD5IHZ1P6TLH,1,corona,general,Useful,NC_43_U,16,Between 105 and 54 days before the scheduled trip.,How far in advance of a trip is the most cost effective time to purchase a plane ticket? 
ADD5IHZ1P6TLH,1,corona,third,MTurk,TB_33_MT,4,"For SpaceX — the cheapest of NASA's new carriers — each pound costs approximately $27,000. So an average person of 160 pounds costs over $4,320,000.",How much does it cost to launch a person into space?
ADD5IHZ1P6TLH,1,corona,third,MTurk,TB_42_MT,4,"Galaxy formation occured in the aftermath of the Big Bang. Clustering and merging allows galaxies to accumulate mass, determining both their shape and structure. ",How do galaxies form?
ADD5IHZ1P6TLH,1,corona,third,MTurk,TB_45_MT,8,"The amygdala (from Greek, 'almond') is one of two almond-shaped clusters of nuclei located deep and medially within the temporal lobes of the brain in complex vertebrates, including humans.",What is the amygdala?
ADD5IHZ1P6TLH,1,corona,third,Trivia,TB_18_TR,16,Orville Wright,Who was flying the plane in which the first US airplane fatality occurred?
ADD5IHZ1P6TLH,1,corona,third,Trivia,TB_21_TR,8,New York,Which state has the zip code 12345?
