PID,sess,firstBlock,block,type,questionId,wait_duration,answer,question
A1A1A9UHNQCI9Y,1,corona,corona,Not useful,C_01_NU,4,"Animals, probably bats",What is the source of coronavirus in humans?
A1A1A9UHNQCI9Y,1,corona,corona,Not useful,C_02_NU,8,Three ,How many pandemics were there in the 20th century?
A1A1A9UHNQCI9Y,1,corona,corona,Not useful,C_08_NU,4,Lombardy,What is the name of the county in Italy that had the first coronavirus outbreak?
A1A1A9UHNQCI9Y,1,corona,corona,Not useful,C_13_NU,4,"The initial cases of the disease are thought to have been among people with a connection to a seafood wholesale market, which also sold live animals","Why is the virus believed to have zoonotic origin, i.e., to have potentially come from animals?"
A1A1A9UHNQCI9Y,1,corona,corona,Not useful,C_25_NU,4,The viruses have spikes on their outer surface that look like a crown (or corona in Latin),What is the supposed origin of the name coronavirus?
A1A1A9UHNQCI9Y,1,corona,corona,Useful,C_28_U,8,"Yes, by boosting the immune system",Does sleep help prevent coronavirus infections?
A1A1A9UHNQCI9Y,1,corona,corona,Useful,C_41_U,8,Studies suggest that coronaviruses (including preliminary information on the new virus) may persist on surfaces for a few hours or up to several days.,How long does the new coronavirus survive on surfaces?
A1A1A9UHNQCI9Y,1,corona,corona,Useful,C_45_U,8,"Pre-existing health conditions, including cardiovascular diseases and diabetes.",What did 75% of the people who have died from the new coronavirus have?
A1A1A9UHNQCI9Y,1,corona,corona,Useful,C_52_U,8,No. To protect yourself against the new coronavirus washing your hands is the best preventive measure.,Are hand dryers effective in killing the new coronavirus?
A1A1A9UHNQCI9Y,1,corona,general,Not useful,NC_10_NU,8,K.D. Lang,What Canadian singer appeared on the first cover of Entertainment Weekly?
A1A1A9UHNQCI9Y,1,corona,general,Useful,NC_27_U,16,White vinegar,What can you use instead of fabric softner to soften sheets and remove odours?
A1A1A9UHNQCI9Y,1,corona,general,Useful,NC_31_U,16,Sign up for a free USAA membership,How can people under 25 rent a car without paying extra fees?
A1A1A9UHNQCI9Y,1,corona,general,Useful,NC_35_U,8,Wrap a wet paper towel around the bottle and put in the fridge,How can you cool beverages more quickly?
A1A1A9UHNQCI9Y,1,corona,general,Useful,NC_36_U,4,Potatos: rub a cut potato over your windshield before a frost to prevent freezing,What vegetable can prevent your windshield from freezing over in winter?
A1A1A9UHNQCI9Y,1,corona,general,Useful,NC_45_U,8,"Grapes or raisins, onions, avocado","In addition to chocolate, what other foods can be very harmful to dogs? "
A1A1A9UHNQCI9Y,1,corona,third,MTurk,TB_26_MT,12,"Sometimes, it is easy to know, but science revealed that self-insight is prblematic. It is often very helpful to ask friends and family ",How do you know if you're happy?
A1A1A9UHNQCI9Y,1,corona,third,MTurk,TB_28_MT,4,"Futurist Diamandis argues that due to improved powers of computation we are likely to see AI, improved medicine, and new ways of communicating.",What is to happen ten years from now?
A1A1A9UHNQCI9Y,1,corona,third,Trivia,TB_01_TR,12,Canada,"What country is home to Roots, the company that outfits the U.S. Olympic team?"
A1A1A9UHNQCI9Y,1,corona,third,Trivia,TB_20_TR,8,Rafflesia (corpse lily),What is the largest flower in the world?
A1A1A9UHNQCI9Y,1,corona,third,Trivia,TB_23_TR,4,Tooth,What is the only part of the body that can't repair itself?
