PID,sess,firstBlock,block,type,questionId,wait_duration,answer,question
ADVLWU71PC7Q6,1,general,corona,Useful,C_32_U,8,"Healthcare professionals treating patients, in-home caregivers, and those who are already sick with the new coronavirus",Which three groups of people does the CDC recommend masks for?
ADVLWU71PC7Q6,1,general,general,Not useful,NC_08_NU,8,The guppy,What common aquarium fish is named for the naturalist who discovered it in Trinidad in 1876?
ADVLWU71PC7Q6,1,general,general,Not useful,NC_16_NU,16,Newborns,The apgar score is used to measure the color and condition of what?
ADVLWU71PC7Q6,1,general,general,Not useful,NC_24_NU,4,State quarters,What's been released five times a year from January 1999 to fall 2008?
ADVLWU71PC7Q6,1,general,general,Useful,NC_46_U,12,"Dish soap, peroxide, and baking soda","While tomato juice probably will not work, what does work to remove skunk odor? "
ADVLWU71PC7Q6,1,general,third,Trivia,TB_02_TR,4,Ivory Coast's,"The world's largest church is Our Lady of Peace Basilica in Yamoussoukro, what nation's capital?"
ADVLWU71PC7Q6,1,general,third,Trivia,TB_04_TR,16,Phil Knight,"In 1964, who founded Blue Ribbon Sports, which later went on to become Nike?"
ADVLWU71PC7Q6,1,general,third,Trivia,TB_07_TR,4,Tuxedo Club,What New York country club lent its name to the kind of dinner jacket first worn there in 1886?
