PID,sess,firstBlock,block,type,questionId,wait_duration,answer,question
AE298K1SUDSPK,1,general,corona,Not useful,C_03_NU,4,"Fuburary 1st, 2020",When was the molecular structure of the coronovirus identfied?
AE298K1SUDSPK,1,general,corona,Not useful,C_21_NU,16,An epidemic that has spread around the world,An epidemic is the outbreak of a disease that affects many people at the same time. What does pandemic mean?
AE298K1SUDSPK,1,general,corona,Useful,C_41_U,4,Studies suggest that coronaviruses (including preliminary information on the new virus) may persist on surfaces for a few hours or up to several days.,How long does the new coronavirus survive on surfaces?
AE298K1SUDSPK,1,general,corona,Useful,C_48_U,8,Reserves need to be saved for people who are infected and for healthcare professionals.,Why does the CDC currently recommend that healthy people do not wear N95 face masks?
AE298K1SUDSPK,1,general,corona,Useful,C_49_U,16,"Approved filtering facemask respirators, such as the N95 respirator.","It is recommended that healthcare professionals who may be working in contact with people with the virus wear what, in addition to personal protective equipment on their hands and bodies?"
AE298K1SUDSPK,1,general,general,Not useful,NC_20_NU,4,Russia,Which country has the most public libraries?
AE298K1SUDSPK,1,general,general,Useful,NC_32_U,8,Take a picture of your fridge before leaving the house,What's a simple trick for telling whether your out of something when you're grocery shopping?
AE298K1SUDSPK,1,general,general,Useful,NC_38_U,12,"Camu Camu, a cherry-like fruit from Brazil",What fruit has the highest content of vitamin C?
AE298K1SUDSPK,1,general,general,Useful,NC_40_U,8,Squint your eyes,How do you make your smile look more genuine in photographs?
AE298K1SUDSPK,1,general,general,Useful,NC_41_U,16,"April 8th, 2024",When is the next total solar eclipse visible in North America projected to occur? 
AE298K1SUDSPK,1,general,general,Useful,NC_51_U,8,White vinegar,What salad dressing ingredient is also an efficient weed killer?
AE298K1SUDSPK,1,general,third,MTurk,TB_36_MT,8,"For two reasons. One, they are too heavy. For example, the Space Shuttle weighed 2 thousand tons, yet a Boeing can only carry about 120 tons. Second, the thrust is likely to be too strong.",Why don't space rockets take off from a plane already in the air?
AE298K1SUDSPK,1,general,third,MTurk,TB_42_MT,8,"Galaxy formation occured in the aftermath of the Big Bang. Clustering and merging allows galaxies to accumulate mass, determining both their shape and structure. ",How do galaxies form?
AE298K1SUDSPK,1,general,third,MTurk,TB_46_MT,16,"Scientists are still figuring it out. It seems that passive use is slightly bad, but active use is not.",How does social media influence our mental health?
AE298K1SUDSPK,1,general,third,Trivia,TB_07_TR,8,Tuxedo Club,What New York country club lent its name to the kind of dinner jacket first worn there in 1886?
AE298K1SUDSPK,1,general,third,Trivia,TB_12_TR,4,It sits beside the Finger Lakes,"Why is Oneida Lake, near Syracuse, New York, sometimes called ""the thumb""?"
