PID,sess,firstBlock,block,type,questionId,wait_duration,answer,question
AEBPLRRXRLDY6,1,general,corona,Not useful,C_04_NU,4,"It stands for ""COronaVIrus Disease 2019""","Why is the new coronavirus called ""COVID-19""? "
AEBPLRRXRLDY6,1,general,corona,Not useful,C_09_NU,16,Hubei,What is the name of the province in China in which this new coronavirus was first discovered?
AEBPLRRXRLDY6,1,general,corona,Useful,C_37_U,8,There is no evidence from the current outbreak that eating garlic has protected people from the new coronavirus.,Can eating garlic help prevent infection with the new coronavirus?
AEBPLRRXRLDY6,1,general,corona,Useful,C_38_U,16,People of all ages can be infected by the new coronavirus. Older people appear to be more vulnerable to becoming severely ill with the virus.,"Does the new coronavirus affect older people, or are younger people also susceptible?"
AEBPLRRXRLDY6,1,general,corona,Useful,C_44_U,4,People over age 60,Approximately 80% of deaths attributed to the new coronavirus were among people of what age?
AEBPLRRXRLDY6,1,general,corona,Useful,C_47_U,12,"Free of fever; no other symptoms, including cough; negative tests on at least two consecutive respiratory specimens at least 24 hours apart.",What are current Centers for Disease Control (CDC) guidelines for releasing someone from isolation?
AEBPLRRXRLDY6,1,general,corona,Useful,C_51_U,12,Nasal or orab swab or a sample of sputum,What sort of specimen is needed to test for the new coronavirus? 
AEBPLRRXRLDY6,1,general,general,Not useful,NC_01_NU,12,Mike Powell,"In 1991, who finally broke Bob Beamon's decades-old long jump record?"
AEBPLRRXRLDY6,1,general,general,Not useful,NC_03_NU,4,Red River,"What name is shared by the rivers that run through Denison, TX and Hanoi, Vietnam?"
AEBPLRRXRLDY6,1,general,general,Not useful,NC_20_NU,12,Russia,Which country has the most public libraries?
AEBPLRRXRLDY6,1,general,general,Not useful,NC_22_NU,16,Steamboat Geyser,"Which Yellowstone geyser, with eruptions 100 fee taller than Old Faithful's, is the world's tallest?"
AEBPLRRXRLDY6,1,general,general,Not useful,NC_26_NU,4,Dark Side of the Moon,What album spent a record 741 weeks on Billboard's Top 200 Albums chart?
AEBPLRRXRLDY6,1,general,general,Useful,NC_27_U,8,White vinegar,What can you use instead of fabric softner to soften sheets and remove odours?
AEBPLRRXRLDY6,1,general,third,MTurk,TB_44_MT,4,"In all U.S states, same-sex marriage is now legal. Also, the number of kids per family has decreased and so ""middle"" childreen, between the eldest and youngest, are getting rarer. ",How have families changed over time?
AEBPLRRXRLDY6,1,general,third,MTurk,TB_45_MT,12,"The amygdala (from Greek, 'almond') is one of two almond-shaped clusters of nuclei located deep and medially within the temporal lobes of the brain in complex vertebrates, including humans.",What is the amygdala?
AEBPLRRXRLDY6,1,general,third,MTurk,TB_46_MT,16,"Scientists are still figuring it out. It seems that passive use is slightly bad, but active use is not.",How does social media influence our mental health?
AEBPLRRXRLDY6,1,general,third,Trivia,TB_12_TR,16,It sits beside the Finger Lakes,"Why is Oneida Lake, near Syracuse, New York, sometimes called ""the thumb""?"
AEBPLRRXRLDY6,1,general,third,Trivia,TB_16_TR,12,Jim Lovell,Alan Shepard was scheduled to command the ill-fated Apollo 13 before switching missions with what astronaut?
