PID,sess,firstBlock,block,type,questionId,wait_duration,answer,question
AECA0YXYZ6A0K,1,corona,corona,Not useful,C_25_NU,4,The viruses have spikes on their outer surface that look like a crown (or corona in Latin),What is the supposed origin of the name coronavirus?
AECA0YXYZ6A0K,1,corona,corona,Not useful,C_26_NU,16,Severe acute respiratory syndrome,The official name of the new coronavirus is SARS-CoV-2. What does SARS stand for?
AECA0YXYZ6A0K,1,corona,corona,Useful,C_29_U,8,Not for at least several months from now,How soon is a vaccine for the new coronavirus likely to be available?
AECA0YXYZ6A0K,1,corona,corona,Useful,C_40_U,16,"The incubation period - the time between catching the virus and beginning to have symptoms of the disease - is estimated to range from 1-14 days, most commonly around five days.",How long is the incubation period for the new coronavirus?
AECA0YXYZ6A0K,1,corona,corona,Useful,C_41_U,12,Studies suggest that coronaviruses (including preliminary information on the new virus) may persist on surfaces for a few hours or up to several days.,How long does the new coronavirus survive on surfaces?
AECA0YXYZ6A0K,1,corona,corona,Useful,C_47_U,4,"Free of fever; no other symptoms, including cough; negative tests on at least two consecutive respiratory specimens at least 24 hours apart.",What are current Centers for Disease Control (CDC) guidelines for releasing someone from isolation?
