PID,sess,firstBlock,block,type,questionId,wait_duration,answer,question
AF2SSFUQ7Z7MU,1,general,corona,Not useful,C_12_NU,8,Diamond Princess,What was the name of the British cruise ship that was quarantined in Japanese waters?
AF2SSFUQ7Z7MU,1,general,corona,Useful,C_28_U,4,"Yes, by boosting the immune system",Does sleep make you more resistant to coronavirus infections?
AF2SSFUQ7Z7MU,1,general,corona,Useful,C_40_U,8,"The incubation period - the time between catching the virus and beginning to have symptoms of the disease - is estimated to range from 1-14 days, most commonly around five days.",How long is the incubation period for the new coronavirus?
AF2SSFUQ7Z7MU,1,general,third,MTurk,TB_36_MT,12,"For two reasons. One, they are too heavy. For example, the Space Shuttle weighed 2 thousand tons, yet a Boeing can only carry about 120 tons. Second, the thrust is likely to be too strong.",Why don't space rockets take off from a plane already in the air?
AF2SSFUQ7Z7MU,1,general,third,MTurk,TB_42_MT,16,"Galaxy formation occured in the aftermath of the Big Bang. Clustering and merging allows galaxies to accumulate mass, determining both their shape and structure. ",How do galaxies form?
AF2SSFUQ7Z7MU,1,general,third,MTurk,TB_44_MT,12,"In all U.S states, same-sex marriage is now legal. Also, the number of kids per family has decreased and so ""middle"" childreen, between the eldest and youngest, are getting rarer. ",How have families changed over time?
AF2SSFUQ7Z7MU,1,general,third,Trivia,TB_01_TR,8,Canada,"What country is home to Roots, the company that outfits the U.S. Olympic team?"
AF2SSFUQ7Z7MU,1,general,third,Trivia,TB_02_TR,4,Ivory Coast's,"The world's largest church is Our Lady of Peace Basilica in Yamoussoukro, what nation's capital?"
AF2SSFUQ7Z7MU,1,general,third,Trivia,TB_12_TR,4,It sits beside the Finger Lakes,"Why is Oneida Lake, near Syracuse, New York, sometimes called ""the thumb""?"
AF2SSFUQ7Z7MU,1,general,third,Trivia,TB_13_TR,16,Java,On what namesake Asian island are the first Homo erectus fossils found?
AF2SSFUQ7Z7MU,1,general,third,Trivia,TB_19_TR,16,Ketchup,The only vegetable ice cream ever produced was what flavor?
