PID,sess,firstBlock,block,type,questionId,wait_duration,answer,question
AFHVS240K4M3L,1,general,corona,Not useful,C_10_NU,4,11 million people,"What is the population of Wuhan, the city in which coronavirus was first identified?"
AFHVS240K4M3L,1,general,corona,Not useful,C_13_NU,8,"The initial cases of the disease are thought to have been among people with a connection to a seafood wholesale market, which also sold live animals","Why is the virus believed to have zoonotic origin, i.e., to have potentially come from animals?"
AFHVS240K4M3L,1,general,corona,Not useful,C_21_NU,12,An epidemic that has spread around the world,An epidemic is the outbreak of a disease that affects many people at the same time. What does pandemic mean?
AFHVS240K4M3L,1,general,corona,Not useful,C_24_NU,12,Contagion,"According to media reports, which 2011 movie has seen a large increase in popularity in the wake of the new coronavirus?"
AFHVS240K4M3L,1,general,corona,Not useful,C_26_NU,4,Severe acute respiratory syndrome,The official name of the new coronavirus is SARS-CoV-2. What does SARS stand for?
AFHVS240K4M3L,1,general,corona,Useful,C_27_U,4,Washing your hands frequently,What is the most effective measure to prevent infection with the coronavirus?
AFHVS240K4M3L,1,general,corona,Useful,C_31_U,4,"The virus is probably not sexually tansmissible, but infection does occurs when kissing.",Can the coronavirus be transmitted through sexual intercourse?
AFHVS240K4M3L,1,general,corona,Useful,C_33_U,4,Soft surfaces are less likely to transmit the virus than hard surfaces.,Can the new coronavirus be transmitted by touching a soft surface like carpets or fabric?
AFHVS240K4M3L,1,general,general,Not useful,NC_03_NU,4,Red River,"What name is shared by the rivers that run through Denison, TX and Hanoi, Vietnam?"
AFHVS240K4M3L,1,general,general,Not useful,NC_10_NU,16,K.D. Lang,What Canadian singer appeared on the first cover of Entertainment Weekly?
AFHVS240K4M3L,1,general,general,Not useful,NC_12_NU,12,Come by her,"The title of the song ""Kumbaya"" is actually a distortion of what three-word phrase?"
AFHVS240K4M3L,1,general,general,Not useful,NC_25_NU,4,Shark,"What animal is thought to be immune to most all diseases, including cancer?"
AFHVS240K4M3L,1,general,general,Useful,NC_37_U,12,"Over the past 150 year, real estate, if you rent it out",What's a better investment: stocks or real estate?
AFHVS240K4M3L,1,general,general,Useful,NC_38_U,8,"Camu Camu, a cherry-like fruit from Brazil",What fruit has the highest content of vitamin C?
AFHVS240K4M3L,1,general,general,Useful,NC_41_U,8,"April 8th, 2024",When is the next total solar eclipse visible in North America projected to occur? 
AFHVS240K4M3L,1,general,general,Useful,NC_51_U,4,White vinegar,What salad dressing ingredient is also an efficient weed killer?
AFHVS240K4M3L,1,general,third,MTurk,TB_27_MT,16,"We do not know, of course. Yet, it is important to realize that there is no scientific proof for God's existence.  ",Does God exist?
AFHVS240K4M3L,1,general,third,MTurk,TB_29_MT,8,"There are a few helpful techniques. One is to imagine that you climb on top of a high building, and ""look down"" at your life. Second, to try to think about issues in novel ways. ",How to stay calm in adversity?
AFHVS240K4M3L,1,general,third,MTurk,TB_35_MT,4,Prototypes already exist. Technological estimates suggest that definitely within the next twenty years -- although the challenges are great.,When will we have flying cars?
AFHVS240K4M3L,1,general,third,MTurk,TB_36_MT,12,"For two reasons. One, they are too heavy. For example, the Space Shuttle weighed 2 thousand tons, yet a Boeing can only carry about 120 tons. Second, the thrust is likely to be too strong.",Why don't space rockets take off from a plane already in the air?
AFHVS240K4M3L,1,general,third,MTurk,TB_41_MT,8,"Deep learning-based machines, that can process unparalleled amount of information will allow AI to accomplish goals that were unimaginable until very recently. ",What are the most recent developments in artificial intelligence?
AFHVS240K4M3L,1,general,third,Trivia,TB_06_TR,8,Xanadu,What 1980 film is named for the legendary square-shaped capital of Kublai Khan?
AFHVS240K4M3L,1,general,third,Trivia,TB_18_TR,12,Orville Wright,Who was flying the plane in which the first US airplane fatality occurred?
AFHVS240K4M3L,1,general,third,Trivia,TB_19_TR,12,Ketchup,The only vegetable ice cream ever produced was what flavor?
