PID,sess,firstBlock,block,type,questionId,wait_duration,answer,question
AG6WV3WODQ7IN,1,corona,corona,Not useful,C_07_NU,4,Pink,What color latex gloves did Naomi Campbell wear to protect herself from coronavirus?
AG6WV3WODQ7IN,1,corona,corona,Not useful,C_11_NU,12,The Chicago of China,"Wuhan, China, the city in which the coronavirus was first identified, is commonly referred to as the chinese version of what American city?"
AG6WV3WODQ7IN,1,corona,corona,Not useful,C_15_NU,8,7.5 days,"In the early stages of the new coronavirus, the number of new cases doubled approximately every how many days?"
AG6WV3WODQ7IN,1,corona,corona,Not useful,C_19_NU,8,Strategic National Stockpile,What is the name of the repository of drugs and supplies the U.S. government is supposed to maintain in case of a public health emergency?
AG6WV3WODQ7IN,1,corona,general,Not useful,NC_19_NU,16,Smoke,"in 1908, New York City passed the Sullivan Ordinance which made it illegal for women to do what in public?"
AG6WV3WODQ7IN,1,corona,general,Useful,NC_29_U,8,"Freeze before chopping, or hold a piece of bread in your mouth, half sticking out",How to chop an onion without crying?
AG6WV3WODQ7IN,1,corona,general,Useful,NC_32_U,8,Take a picture of your fridge before leaving the house,What's a simple trick for telling whether your out of something when you're grocery shopping?
AG6WV3WODQ7IN,1,corona,general,Useful,NC_36_U,8,Potatos: rub a cut potato over your windshield before a frost to prevent freezing,What vegetable can prevent your windshield from freezing over in winter?
AG6WV3WODQ7IN,1,corona,third,MTurk,TB_35_MT,4,Prototypes already exist. Technological estimates suggest that definitely within the next twenty years -- although the challenges are great.,When will we have flying cars?
AG6WV3WODQ7IN,1,corona,third,MTurk,TB_41_MT,4,"Deep learning-based machines, that can process unparalleled amount of information will allow AI to accomplish goals that were unimaginable until very recently. ",What are the most recent developments in artificial intelligence?
AG6WV3WODQ7IN,1,corona,third,Trivia,TB_10_TR,4,George VI,Who was the last British Monarch to also be an emperor?
AG6WV3WODQ7IN,1,corona,third,Trivia,TB_12_TR,4,It sits beside the Finger Lakes,"Why is Oneida Lake, near Syracuse, New York, sometimes called ""the thumb""?"
