PID,sess,firstBlock,block,type,questionId,wait_duration,answer,question
AGBCI77TO20G7,1,corona,corona,Not useful,C_07_NU,8,Pink,What color latex gloves did Naomi Campbell wear to protect herself from coronavirus?
AGBCI77TO20G7,1,corona,corona,Not useful,C_16_NU,4,Bats and pangolins,What other animals have been found to have viruses with highly similar genome sequences as the current coronavirus?
AGBCI77TO20G7,1,corona,corona,Not useful,C_19_NU,8,Strategic National Stockpile,What is the name of the repository of drugs and supplies the U.S. government is supposed to maintain in case of a public health emergency?
AGBCI77TO20G7,1,corona,corona,Not useful,C_22_NU,4,Contact tracing,What is the name of the process health authorities use to understand the sources of infection and to prevent further transmission?
AGBCI77TO20G7,1,corona,corona,Useful,C_30_U,4,More similar to the symptoms of the ful,"Are the new coronavirus symptoms more similar to the symptoms of flu, or of seasonal allergies?"
AGBCI77TO20G7,1,corona,corona,Useful,C_33_U,8,Soft surfaces are less likely to transmit the virus than hard surfaces.,Can the new coronavirus be transmitted by touching a soft surface like carpets or fabric?
AGBCI77TO20G7,1,corona,corona,Useful,C_36_U,16,No. There is no evidence that regularly rinsing the nose with saline has protected people from infection with the new coronavirus.,Can regularly rinsing your nose with saline help prevent infection with the new coronavirus?
AGBCI77TO20G7,1,corona,corona,Useful,C_51_U,16,Nasal or orab swab or a sample of sputum,What sort of specimen is needed to test for the new coronavirus? 
AGBCI77TO20G7,1,corona,general,Not useful,NC_01_NU,8,Mike Powell,"In 1991, who finally broke Bob Beamon's decades-old long jump record?"
AGBCI77TO20G7,1,corona,general,Not useful,NC_03_NU,8,Red River,"What name is shared by the rivers that run through Denison, TX and Hanoi, Vietnam?"
AGBCI77TO20G7,1,corona,general,Not useful,NC_18_NU,16,A truce,What was put in place by the Ancient Greeks before and during all Olympic festivals?
AGBCI77TO20G7,1,corona,general,Not useful,NC_24_NU,12,State quarters,What's been released five times a year from January 1999 to fall 2008?
AGBCI77TO20G7,1,corona,general,Not useful,NC_25_NU,16,Shark,"What animal is thought to be immune to most all diseases, including cancer?"
AGBCI77TO20G7,1,corona,general,Useful,NC_31_U,12,Sign up for a free USAA membership,How can people under 25 rent a car without paying extra fees?
AGBCI77TO20G7,1,corona,general,Useful,NC_44_U,8,Doritos,What popular snack food is effective to use as kindling to start a fire?
AGBCI77TO20G7,1,corona,general,Useful,NC_45_U,12,"Grapes or raisins, onions, avocado","In addition to chocolate, what other foods can be very harmful to dogs? "
AGBCI77TO20G7,1,corona,third,MTurk,TB_37_MT,8,Engineers and architects agree that the answer is positive. Houses for the non-rich are much better built today than they were built 500 years ago.,Are houses built better than they used to be?
AGBCI77TO20G7,1,corona,third,MTurk,TB_38_MT,12,"As a rule, yes. Restaurants have to cover rent, salaries and taxes. These are all included in the prices.",Is it really cheaper to cook at home vs. eating out?
AGBCI77TO20G7,1,corona,third,Trivia,TB_01_TR,12,Canada,"What country is home to Roots, the company that outfits the U.S. Olympic team?"
AGBCI77TO20G7,1,corona,third,Trivia,TB_09_TR,16,The first email,"What did Ray Tomlinson send in Cambridge, Massachusetts, in late 1971?"
AGBCI77TO20G7,1,corona,third,Trivia,TB_12_TR,8,It sits beside the Finger Lakes,"Why is Oneida Lake, near Syracuse, New York, sometimes called ""the thumb""?"
AGBCI77TO20G7,1,corona,third,Trivia,TB_14_TR,12,James Brown,"When asked to define ""cool,"" what two words did James Brown use?"
AGBCI77TO20G7,1,corona,third,Trivia,TB_17_TR,4,"Third finger, left hand",What part of his body did Keith Richards insure for a million pounds?
AGBCI77TO20G7,1,corona,third,Trivia,TB_23_TR,8,Tooth,What is the only part of the body that can't repair itself?
