PID,sess,firstBlock,block,type,questionId,wait_duration,answer,question
AIHHRINW9IN1I,1,corona,corona,Not useful,C_01_NU,8,"Animals, probably bats",What is the source of coronavirus in humans?
AIHHRINW9IN1I,1,corona,corona,Not useful,C_04_NU,4,"It stands for ""COronaVIrus Disease 2019""","Why is the new coronavirus called ""COVID-19""? "
AIHHRINW9IN1I,1,corona,corona,Not useful,C_10_NU,12,11 million people,"What is the population of Wuhan, the city in which coronavirus was first identified?"
AIHHRINW9IN1I,1,corona,corona,Not useful,C_13_NU,12,"The initial cases of the disease are thought to have been among people with a connection to a seafood wholesale market, which also sold live animals","Why is the virus believed to have zoonotic origin, i.e., to have potentially come from animals?"
AIHHRINW9IN1I,1,corona,corona,Not useful,C_25_NU,4,The viruses have spikes on their outer surface that look like a crown (or corona in Latin),What is the supposed origin of the name coronavirus?
AIHHRINW9IN1I,1,corona,corona,Useful,C_28_U,12,"Yes, by boosting the immune system",Does sleep make you more resistant to coronavirus infections?
AIHHRINW9IN1I,1,corona,corona,Useful,C_34_U,8,"The virus lives for up to a few days on surfaces, and so packages cannot transmit the virus.",Can the new coronavirus be transmitted on a package from an infected country?
AIHHRINW9IN1I,1,corona,corona,Useful,C_45_U,8,"Pre-existing health conditions, including cardiovascular diseases and diabetes.",What did 75% of the people who have died from the new coronavirus have?
AIHHRINW9IN1I,1,corona,corona,Useful,C_48_U,12,"Regular face masks are not considered effective, and reserves need to be saved for people who are infected and for healthcare professionals.",Why does the CDC currently recommend that healthy people do not wear face masks?
AIHHRINW9IN1I,1,corona,corona,Useful,C_52_U,4,No. To protect yourself against the new coronavirus washing your hands is the best preventive measure.,Are hand dryers effective in killing the new coronavirus?
AIHHRINW9IN1I,1,corona,general,Not useful,NC_05_NU,12,Matthew,Which of the four biblical Gospels was written by a tax collector?
AIHHRINW9IN1I,1,corona,general,Not useful,NC_15_NU,4,Albert Einstein,Who beat out FDR and Gandhi to be named Time's Person of the Century in 1999?
AIHHRINW9IN1I,1,corona,general,Not useful,NC_21_NU,8,The Pieta,Which was the only one of his sculptures that Michelangelo signed?
AIHHRINW9IN1I,1,corona,general,Not useful,NC_22_NU,12,Steamboat Geyser,"Which Yellowstone geyser, with eruptions 100 fee taller than Old Faithful's, is the world's tallest?"
AIHHRINW9IN1I,1,corona,general,Not useful,NC_25_NU,12,Shark,"What animal is thought to be immune to most all diseases, including cancer?"
AIHHRINW9IN1I,1,corona,general,Useful,NC_29_U,4,"Freeze before chopping, or hold a piece of bread in your mouth, half sticking out",How to chop an onion without crying?
AIHHRINW9IN1I,1,corona,general,Useful,NC_35_U,8,Wrap a wet paper towel around the bottle and put in the fridge,How can you cool beverages more quickly?
AIHHRINW9IN1I,1,corona,general,Useful,NC_39_U,12,"At least $2,467 according to current research",How much money should I keep as an emergency fund?
AIHHRINW9IN1I,1,corona,general,Useful,NC_40_U,16,Squint your eyes,How do you make your smile look more genuine in photographs?
AIHHRINW9IN1I,1,corona,third,MTurk,TB_25_MT,12,"Scientists estimate that we are likely to see flying cars, and that computers may be able to read people's thoughts and emotions ",What will be the new technologies of future?
AIHHRINW9IN1I,1,corona,third,MTurk,TB_31_MT,8,Scientists estimate that at the moment it is not. But with global warming it might become more feasilbe later in the 21st century.,How feasible would it be to colonize Antarctica?
AIHHRINW9IN1I,1,corona,third,MTurk,TB_34_MT,8,Evolution is usually very slow. Think about the similarities between apes and people. Future people are going to be as similar to us as we are to apes. ,What will future humans look like?
AIHHRINW9IN1I,1,corona,third,MTurk,TB_38_MT,4,"As a rule, yes. Restaurants have to cover rent, salaries and taxes. These are all included in the prices.",Is it really cheaper to cook at home vs. eating out?
AIHHRINW9IN1I,1,corona,third,Trivia,TB_06_TR,8,Xanadu,What 1980 film is named for the legendary square-shaped capital of Kublai Khan?
AIHHRINW9IN1I,1,corona,third,Trivia,TB_09_TR,12,The first email,"What did Ray Tomlinson send in Cambridge, Massachusetts, in late 1971?"
AIHHRINW9IN1I,1,corona,third,Trivia,TB_12_TR,16,It sits beside the Finger Lakes,"Why is Oneida Lake, near Syracuse, New York, sometimes called ""the thumb""?"
AIHHRINW9IN1I,1,corona,third,Trivia,TB_17_TR,12,"Third finger, left hand",What part of his body did Keith Richards insure for a million pounds?
