PID,sess,firstBlock,block,type,questionId,wait_duration,answer,question
AIZ4C8S4DW2WG,1,corona,corona,Not useful,C_05_NU,4,University of Washington,Which was the first US University to cancel classes becuase of the new coronavirus?
AIZ4C8S4DW2WG,1,corona,corona,Not useful,C_22_NU,12,Contact tracing,What is the name of the process health authorities use to understand the sources of infection and to prevent further transmission?
AIZ4C8S4DW2WG,1,corona,corona,Useful,C_41_U,12,Studies suggest that coronaviruses (including preliminary information on the new virus) may persist on surfaces for a few hours or up to several days.,How long does the new coronavirus survive on surfaces?
AIZ4C8S4DW2WG,1,corona,general,Not useful,NC_18_NU,12,A truce,What was put in place by the Ancient Greeks before and during all Olympic festivals?
AIZ4C8S4DW2WG,1,corona,general,Useful,NC_36_U,8,Potatos: rub a cut potato over your windshield before a frost to prevent freezing,What vegetable can prevent your windshield from freezing over in winter?
AIZ4C8S4DW2WG,1,corona,general,Useful,NC_41_U,12,"April 8th, 2024",When is the next total solar eclipse visible in North America projected to occur? 
AIZ4C8S4DW2WG,1,corona,general,Useful,NC_50_U,16,Spread beeswax over them and then blow dry until you can't see the beeswax anymore,What's an easy way to waterproof canvas shoes?
AIZ4C8S4DW2WG,1,corona,general,Useful,NC_51_U,16,White vinegar,What salad dressing ingredient is also an efficient weed killer?
AIZ4C8S4DW2WG,1,corona,third,MTurk,TB_32_MT,12,Sophisticated equipment is either lowered to the sea bottom or directly attached to submersible buoys and transmits to a research vessel that is equipped with state-of-the-art navigational instruments.,What are undersea researchers doing to explore the ocean floor?
AIZ4C8S4DW2WG,1,corona,third,MTurk,TB_36_MT,12,"For two reasons. One, they are too heavy. For example, the Space Shuttle weighed 2 thousand tons, yet a Boeing can only carry about 120 tons. Second, the thrust is likely to be too strong.",Why don't space rockets take off from a plane already in the air?
AIZ4C8S4DW2WG,1,corona,third,Trivia,TB_06_TR,16,Xanadu,What 1980 film is named for the legendary square-shaped capital of Kublai Khan?
AIZ4C8S4DW2WG,1,corona,third,Trivia,TB_09_TR,8,The first email,"What did Ray Tomlinson send in Cambridge, Massachusetts, in late 1971?"
AIZ4C8S4DW2WG,1,corona,third,Trivia,TB_13_TR,12,Java,On what namesake Asian island are the first Homo erectus fossils found?
AIZ4C8S4DW2WG,1,corona,third,Trivia,TB_21_TR,8,New York,Which state has the zip code 12345?
