PID,sess,firstBlock,block,type,questionId,wait_duration,answer,question
AJD8XK7GDFPO4,1,general,corona,Useful,C_33_U,12,Soft surfaces are less likely to transmit the virus than hard surfaces.,Can the new coronavirus be transmitted by touching a soft surface like carpets or fabric?
AJD8XK7GDFPO4,1,general,corona,Useful,C_42_U,4,"Fever, cough, shortness of breath.",What are the most common symptoms of the new coronavirus?
AJD8XK7GDFPO4,1,general,corona,Useful,C_46_U,12,Remdesivir,"Which drug, which has been used as a treatment for the Ebola and Marburg viruses, might be promising as a treatment for this new coronavirus?"
AJD8XK7GDFPO4,1,general,general,Not useful,NC_19_NU,4,Smoke,"in 1908, New York City passed the Sullivan Ordinance which made it illegal for women to do what in public?"
AJD8XK7GDFPO4,1,general,general,Not useful,NC_23_NU,16,The Netherlands,In 1568 the Catholic Church sentenced the entire population of which nation to death as heretics?
AJD8XK7GDFPO4,1,general,general,Not useful,NC_24_NU,16,State quarters,What's been released five times a year from January 1999 to fall 2008?
AJD8XK7GDFPO4,1,general,third,MTurk,TB_44_MT,4,"In all U.S states, same-sex marriage is now legal. Also, the number of kids per family has decreased and so ""middle"" childreen, between the eldest and youngest, are getting rarer. ",How have families changed over time?
AJD8XK7GDFPO4,1,general,third,MTurk,TB_46_MT,12,"Scientists are still figuring it out. It seems that passive use is slightly bad, but active use is not.",How does social media influence our mental health?
