PID,sess,firstBlock,block,type,questionId,wait_duration,answer,question
AJQ71YIGY01HZ,1,general,corona,Useful,C_36_U,4,No. There is no evidence that regularly rinsing the nose with saline has protected people from infection with the new coronavirus.,Can regularly rinsing your nose with saline help prevent infection with the new coronavirus?
AJQ71YIGY01HZ,1,general,corona,Useful,C_45_U,12,"Pre-existing health conditions, including cardiovascular diseases and diabetes.",What did 75% of the people who have died from the new coronavirus have?
AJQ71YIGY01HZ,1,general,third,MTurk,TB_30_MT,8,"The ""no hair theorem"" states that a black hole has only three properties: electric charge, angular momentum, and mass.",What is the composition of a black hole?
AJQ71YIGY01HZ,1,general,third,MTurk,TB_42_MT,8,"Galaxy formation occured in the aftermath of the Big Bang. Clustering and merging allows galaxies to accumulate mass, determining both their shape and structure. ",How do galaxies form?
AJQ71YIGY01HZ,1,general,third,MTurk,TB_45_MT,8,"The amygdala (from Greek, 'almond') is one of two almond-shaped clusters of nuclei located deep and medially within the temporal lobes of the brain in complex vertebrates, including humans.",What is the amygdala?
AJQ71YIGY01HZ,1,general,third,Trivia,TB_09_TR,12,The first email,"What did Ray Tomlinson send in Cambridge, Massachusetts, in late 1971?"
