PID,sess,firstBlock,block,type,questionId,wait_duration,answer,question
AKC9H6IX5YCG4,1,corona,corona,Not useful,C_02_NU,4,Three ,How many pandemics were there in the 20th century?
AKC9H6IX5YCG4,1,corona,corona,Not useful,C_10_NU,12,11 million people,"What is the population of Wuhan, the city in which coronavirus was first identified?"
AKC9H6IX5YCG4,1,corona,corona,Not useful,C_16_NU,12,Bats and pangolins,What other animals have been found to have viruses with highly similar genome sequences as the current coronavirus?
AKC9H6IX5YCG4,1,corona,corona,Not useful,C_25_NU,8,The viruses have spikes on their outer surface that look like a crown (or corona in Latin),What is the supposed origin of the name coronavirus?
AKC9H6IX5YCG4,1,corona,corona,Useful,C_31_U,12,"The virus is probably not sexually tansmissible, but infection does occurs when kissing.",Can the coronavirus be transmitted through sexual intercourse?
AKC9H6IX5YCG4,1,corona,corona,Useful,C_41_U,8,Studies suggest that coronaviruses (including preliminary information on the new virus) may persist on surfaces for a few hours or up to several days.,How long does the new coronavirus survive on surfaces?
AKC9H6IX5YCG4,1,corona,corona,Useful,C_51_U,12,Nasal or orab swab or a sample of sputum,What sort of specimen is needed to test for the new coronavirus? 
AKC9H6IX5YCG4,1,corona,general,Not useful,NC_02_NU,8,Tiger Woods,"Who's the only two-time Sports Illustrated Sportsman of the Year, so named in 1996 and 2000?"
AKC9H6IX5YCG4,1,corona,general,Not useful,NC_12_NU,12,Come by her,"The title of the song ""Kumbaya"" is actually a distortion of what three-word phrase?"
AKC9H6IX5YCG4,1,corona,general,Not useful,NC_16_NU,4,Newborns,The apgar score is used to measure the color and condition of what?
AKC9H6IX5YCG4,1,corona,general,Not useful,NC_25_NU,16,Shark,"What animal is thought to be immune to most all diseases, including cancer?"
AKC9H6IX5YCG4,1,corona,general,Not useful,NC_26_NU,16,Dark Side of the Moon,What album spent a record 741 weeks on Billboard's Top 200 Albums chart?
AKC9H6IX5YCG4,1,corona,general,Useful,NC_41_U,4,"April 8th, 2024",When is the next total solar eclipse visible in North America projected to occur? 
AKC9H6IX5YCG4,1,corona,general,Useful,NC_51_U,12,White vinegar,What salad dressing ingredient is also an efficient weed killer?
AKC9H6IX5YCG4,1,corona,third,MTurk,TB_30_MT,8,"The ""no hair theorem"" states that a black hole has only three properties: electric charge, angular momentum, and mass.",What is the composition of a black hole?
AKC9H6IX5YCG4,1,corona,third,MTurk,TB_42_MT,16,"Galaxy formation occured in the aftermath of the Big Bang. Clustering and merging allows galaxies to accumulate mass, determining both their shape and structure. ",How do galaxies form?
AKC9H6IX5YCG4,1,corona,third,MTurk,TB_43_MT,16,"Planets likely start off as grains of dust that then combine to form bigger rocks. They clear material from their path, leaving tracks of space empty but for fine dust.",How do planets form?
AKC9H6IX5YCG4,1,corona,third,MTurk,TB_44_MT,4,"In all U.S states, same-sex marriage is now legal. Also, the number of kids per family has decreased and so ""middle"" childreen, between the eldest and youngest, are getting rarer. ",How have families changed over time?
AKC9H6IX5YCG4,1,corona,third,Trivia,TB_06_TR,8,Xanadu,What 1980 film is named for the legendary square-shaped capital of Kublai Khan?
AKC9H6IX5YCG4,1,corona,third,Trivia,TB_23_TR,12,Tooth,What is the only part of the body that can't repair itself?
