PID,sess,firstBlock,block,type,questionId,wait_duration,answer,question
AMA4SXSYNC35I,1,general,corona,Not useful,C_06_NU,12,Gwyneth Paltrow,"Which celebrity said about the new coronavirus ""I've already been in this movie""?"
AMA4SXSYNC35I,1,general,corona,Not useful,C_11_NU,8,The Chicago of China,"Wuhan, China, the city in which the coronavirus was first identified, is commonly referred to as the chinese version of what American city?"
AMA4SXSYNC35I,1,general,corona,Not useful,C_13_NU,12,"The initial cases of the disease are thought to have been among people with a connection to a seafood wholesale market, which also sold live animals","Why is the virus believed to have zoonotic origin, i.e., to have potentially come from animals?"
AMA4SXSYNC35I,1,general,corona,Not useful,C_21_NU,12,An epidemic that has spread around the world,An epidemic is the outbreak of a disease that affects many people at the same time. What does pandemic mean?
AMA4SXSYNC35I,1,general,corona,Not useful,C_25_NU,16,The viruses have spikes on their outer surface that look like a crown (or corona in Latin),What is the supposed origin of the name coronavirus?
AMA4SXSYNC35I,1,general,corona,Useful,C_50_U,12,Washington,The first US death from the new coronavirus occurred in which state?
AMA4SXSYNC35I,1,general,general,Not useful,NC_08_NU,12,The guppy,What common aquarium fish is named for the naturalist who discovered it in Trinidad in 1876?
AMA4SXSYNC35I,1,general,general,Not useful,NC_11_NU,8,Endeavour,What is the name of the ship that carried Captain Cook to Australia?
AMA4SXSYNC35I,1,general,general,Not useful,NC_12_NU,12,Come by her,"The title of the song ""Kumbaya"" is actually a distortion of what three-word phrase?"
AMA4SXSYNC35I,1,general,general,Not useful,NC_20_NU,8,Russia,Which country has the most public libraries?
AMA4SXSYNC35I,1,general,general,Not useful,NC_21_NU,4,The Pieta,Which was the only one of his sculptures that Michelangelo signed?
AMA4SXSYNC35I,1,general,general,Useful,NC_34_U,4,"Pineapple, by planting the green leaves",What tropical fruit can be regrown from its scraps?
AMA4SXSYNC35I,1,general,general,Useful,NC_36_U,4,Potatos: rub a cut potato over your windshield before a frost to prevent freezing,What vegetable can prevent your windshield from freezing over in winter?
AMA4SXSYNC35I,1,general,general,Useful,NC_44_U,16,Doritos,What popular snack food is effective to use as kindling to start a fire?
AMA4SXSYNC35I,1,general,third,MTurk,TB_26_MT,12,"Sometimes, it is easy to know, but science revealed that self-insight is prblematic. It is often very helpful to ask friends and family ",How do you know if you're happy?
AMA4SXSYNC35I,1,general,third,MTurk,TB_34_MT,16,Evolution is usually very slow. Think about the similarities between apes and people. Future people are going to be as similar to us as we are to apes. ,What will future humans look like?
AMA4SXSYNC35I,1,general,third,Trivia,TB_11_TR,16,Mung beans,What kind of bean produces the Asian-style bean sprouts in the produce section of supermarkets?
AMA4SXSYNC35I,1,general,third,Trivia,TB_12_TR,8,It sits beside the Finger Lakes,"Why is Oneida Lake, near Syracuse, New York, sometimes called ""the thumb""?"
