PID,sess,firstBlock,block,type,questionId,wait_duration,answer,question
AMFKTJY2YWY5P,1,general,corona,Not useful,C_03_NU,12,"Fuburary 1st, 2020",When was the molecular structure of the coronovirus identfied?
AMFKTJY2YWY5P,1,general,corona,Not useful,C_06_NU,4,Gwyneth Paltrow,"Which celebrity said about the new coronavirus ""I've already been in this movie""?"
AMFKTJY2YWY5P,1,general,corona,Not useful,C_08_NU,4,Lombardy,What is the name of the county in Italy that had the first coronavirus outbreak?
AMFKTJY2YWY5P,1,general,corona,Not useful,C_16_NU,4,Bats and pangolins,What other animals have been found to have viruses with highly similar genome sequences as the current coronavirus?
AMFKTJY2YWY5P,1,general,corona,Not useful,C_18_NU,8,They are able to filter out at least 95% of airborne particles,Why are N95 respirator face masks so named?
AMFKTJY2YWY5P,1,general,corona,Not useful,C_26_NU,8,Severe acute respiratory syndrome,The official name of the new coronavirus is SARS-CoV-2. What does SARS stand for?
AMFKTJY2YWY5P,1,general,corona,Useful,C_36_U,4,No. There is no evidence that regularly rinsing the nose with saline has protected people from infection with the new coronavirus.,Can regularly rinsing your nose with saline help prevent infection with the new coronavirus?
AMFKTJY2YWY5P,1,general,general,Not useful,NC_06_NU,12,David Livingstone,Who discovered the Victoria Falls?
AMFKTJY2YWY5P,1,general,general,Not useful,NC_07_NU,8,Salt Lake City,In what city could you see the Seagull Monument at Temple Square?
AMFKTJY2YWY5P,1,general,general,Not useful,NC_12_NU,8,Come by her,"The title of the song ""Kumbaya"" is actually a distortion of what three-word phrase?"
AMFKTJY2YWY5P,1,general,general,Not useful,NC_21_NU,8,The Pieta,Which was the only one of his sculptures that Michelangelo signed?
AMFKTJY2YWY5P,1,general,general,Useful,NC_34_U,4,"Pineapple, by planting the green leaves",What tropical fruit can be regrown from its scraps?
AMFKTJY2YWY5P,1,general,general,Useful,NC_35_U,8,Wrap a wet paper towel around the bottle and put in the fridge,How can you cool beverages more quickly?
AMFKTJY2YWY5P,1,general,general,Useful,NC_36_U,12,Potatos: rub a cut potato over your windshield before a frost to prevent freezing,What vegetable can prevent your windshield from freezing over in winter?
AMFKTJY2YWY5P,1,general,general,Useful,NC_43_U,4,Between 105 and 54 days before the scheduled trip.,How far in advance of a trip is the most cost effective time to purchase a plane ticket? 
AMFKTJY2YWY5P,1,general,general,Useful,NC_52_U,8,"Tie your hair into a tight ponytail at the front of your head, and cut it.",How can you give yourself a layered haircut?
AMFKTJY2YWY5P,1,general,third,MTurk,TB_25_MT,8,"Scientists estimate that we are likely to see flying cars, and that computers may be able to read people's thoughts and emotions ",What will be the new technologies of future?
AMFKTJY2YWY5P,1,general,third,MTurk,TB_28_MT,8,"Futurist Diamandis argues that due to improved powers of computation we are likely to see AI, improved medicine, and new ways of communicating.",What is to happen ten years from now?
AMFKTJY2YWY5P,1,general,third,MTurk,TB_42_MT,8,"Galaxy formation occured in the aftermath of the Big Bang. Clustering and merging allows galaxies to accumulate mass, determining both their shape and structure. ",How do galaxies form?
AMFKTJY2YWY5P,1,general,third,Trivia,TB_04_TR,16,Phil Knight,"In 1964, who founded Blue Ribbon Sports, which later went on to become Nike?"
AMFKTJY2YWY5P,1,general,third,Trivia,TB_05_TR,12,Hong Kong,What city's harbor is overlooked by Victoria Peak?
AMFKTJY2YWY5P,1,general,third,Trivia,TB_08_TR,12,Library of Congress,"In 1802, John Beckley became the librarian of what collection containing 740 books at the time?"
AMFKTJY2YWY5P,1,general,third,Trivia,TB_10_TR,4,George VI,Who was the last British Monarch to also be an emperor?
AMFKTJY2YWY5P,1,general,third,Trivia,TB_12_TR,4,It sits beside the Finger Lakes,"Why is Oneida Lake, near Syracuse, New York, sometimes called ""the thumb""?"
