PID,sess,firstBlock,block,type,questionId,wait_duration,answer,question
ANCDBBNNGEQBO,1,general,corona,Not useful,C_08_NU,4,Lombardy,What is the name of the county in Italy that had the first coronavirus outbreak?
ANCDBBNNGEQBO,1,general,corona,Not useful,C_11_NU,16,The Chicago of China,"Wuhan, China, the city in which the coronavirus was first identified, is commonly referred to as the chinese version of what American city?"
ANCDBBNNGEQBO,1,general,corona,Not useful,C_16_NU,8,Bats and pangolins,What other animals have been found to have viruses with highly similar genome sequences as the current coronavirus?
ANCDBBNNGEQBO,1,general,corona,Useful,C_43_U,4,Quarantine themselves for 14 days to make sure they are not infected.,"Currently, people who  may have been in contact with someone with the new coronavirus are recommended to do what?"
ANCDBBNNGEQBO,1,general,corona,Useful,C_44_U,12,People over age 60,Approximately 80% of deaths attributed to the new coronavirus were among people of what age?
ANCDBBNNGEQBO,1,general,corona,Useful,C_51_U,8,Nasal or orab swab or a sample of sputum,What sort of specimen is needed to test for the new coronavirus? 
ANCDBBNNGEQBO,1,general,general,Not useful,NC_05_NU,12,Matthew,Which of the four biblical Gospels was written by a tax collector?
ANCDBBNNGEQBO,1,general,general,Not useful,NC_08_NU,16,The guppy,What common aquarium fish is named for the naturalist who discovered it in Trinidad in 1876?
ANCDBBNNGEQBO,1,general,general,Useful,NC_27_U,8,White vinegar,What can you use instead of fabric softner to soften sheets and remove odours?
ANCDBBNNGEQBO,1,general,general,Useful,NC_30_U,12,Floormats - put them under the wheels for traction,What item that can be found in any car can help you extract your car from mud or snow?
ANCDBBNNGEQBO,1,general,general,Useful,NC_48_U,8,"Drop it from a 3 inch height. If it bounces, it's dead.",How can you tell if a battery is dead without using any tools?
ANCDBBNNGEQBO,1,general,general,Useful,NC_50_U,16,Spread beeswax over them and then blow dry until you can't see the beeswax anymore,What's an easy way to waterproof canvas shoes?
ANCDBBNNGEQBO,1,general,third,MTurk,TB_37_MT,12,Engineers and architects agree that the answer is positive. Houses for the non-rich are much better built today than they were built 500 years ago.,Are houses built better than they used to be?
ANCDBBNNGEQBO,1,general,third,MTurk,TB_39_MT,8,"There is radio emission around black holes. Scientists created a network of telescopes, capturing an image of a black hole by improving upon a technique that allows for the imaging of far-away objects",How was the recent picture of a black hole made?
ANCDBBNNGEQBO,1,general,third,MTurk,TB_41_MT,4,"Deep learning-based machines, that can process unparalleled amount of information will allow AI to accomplish goals that were unimaginable until very recently. ",What are the most recent developments in artificial intelligence?
ANCDBBNNGEQBO,1,general,third,Trivia,TB_08_TR,4,Library of Congress,"In 1802, John Beckley became the librarian of what collection containing 740 books at the time?"
ANCDBBNNGEQBO,1,general,third,Trivia,TB_13_TR,16,Java,On what namesake Asian island are the first Homo erectus fossils found?
ANCDBBNNGEQBO,1,general,third,Trivia,TB_18_TR,12,Orville Wright,Who was flying the plane in which the first US airplane fatality occurred?
ANCDBBNNGEQBO,1,general,third,Trivia,TB_20_TR,16,Rafflesia (corpse lily),What is the largest flower in the world?
