PID,sess,firstBlock,block,type,questionId,wait_duration,answer,question
ANDO6KXVSCY08,1,general,corona,Not useful,C_23_NU,8,They falsely claimed to cure or prevent coronavirus,"At the end of February, Amazon banned over a million products because of what?"
ANDO6KXVSCY08,1,general,corona,Useful,C_31_U,12,"The virus is probably not sexually tansmissible, but infection does occurs when kissing.",Can the coronavirus be transmitted through sexual intercourse?
ANDO6KXVSCY08,1,general,general,Not useful,NC_25_NU,4,Shark,"What animal is thought to be immune to most all diseases, including cancer?"
ANDO6KXVSCY08,1,general,general,Useful,NC_29_U,4,"Freeze before chopping, or hold a piece of bread in your mouth, half sticking out",How to chop an onion without crying?
ANDO6KXVSCY08,1,general,general,Useful,NC_47_U,4,"Add baking soda, soak in advance, use a preassure cooker",What can you do to make dry beans cook faster?
ANDO6KXVSCY08,1,general,third,MTurk,TB_35_MT,4,Prototypes already exist. Technological estimates suggest that definitely within the next twenty years -- although the challenges are great.,When will we have flying cars?
