PID,sess,firstBlock,block,type,questionId,wait_duration,answer,question
APU8QVDVUZB3Y,1,general,corona,Not useful,C_02_NU,8,Three ,How many pandemics were there in the 20th century?
APU8QVDVUZB3Y,1,general,corona,Not useful,C_05_NU,16,University of Washington,Which was the first US University to cancel classes becuase of the new coronavirus?
APU8QVDVUZB3Y,1,general,corona,Not useful,C_10_NU,4,11 million people,"What is the population of Wuhan, the city in which coronavirus was first identified?"
APU8QVDVUZB3Y,1,general,corona,Not useful,C_23_NU,8,They falsely claimed to cure or prevent coronavirus,"At the end of February, Amazon banned over a million products because of what?"
APU8QVDVUZB3Y,1,general,corona,Useful,C_33_U,4,Soft surfaces are less likely to transmit the virus than hard surfaces.,Can the new coronavirus be transmitted by touching a soft surface like carpets or fabric?
APU8QVDVUZB3Y,1,general,corona,Useful,C_48_U,8,Reserves need to be saved for people who are infected and for healthcare professionals.,Why does the CDC currently recommend that healthy people do not wear N95 face masks?
APU8QVDVUZB3Y,1,general,general,Not useful,NC_08_NU,4,The guppy,What common aquarium fish is named for the naturalist who discovered it in Trinidad in 1876?
APU8QVDVUZB3Y,1,general,general,Not useful,NC_14_NU,8,Rod Serling,What famed TV personality wrote the screenplay for 1968's Planet of the Apes?
APU8QVDVUZB3Y,1,general,general,Not useful,NC_15_NU,8,Albert Einstein,Who beat out FDR and Gandhi to be named Time's Person of the Century in 1999?
APU8QVDVUZB3Y,1,general,general,Not useful,NC_17_NU,8,Gilbert Van Camp,What Indianapolis grocer made his name by selling canned pork and beans to U.S. troops during the Civil War?
APU8QVDVUZB3Y,1,general,general,Not useful,NC_25_NU,4,Shark,"What animal is thought to be immune to most all diseases, including cancer?"
APU8QVDVUZB3Y,1,general,general,Useful,NC_31_U,4,Sign up for a free USAA membership,How can people under 25 rent a car without paying extra fees?
APU8QVDVUZB3Y,1,general,general,Useful,NC_39_U,4,"At least $2,467 according to current research",How much money should I keep as an emergency fund?
APU8QVDVUZB3Y,1,general,general,Useful,NC_50_U,8,Spread beeswax over them and then blow dry until you can't see the beeswax anymore,What's an easy way to waterproof canvas shoes?
APU8QVDVUZB3Y,1,general,general,Useful,NC_52_U,12,"Tie your hair into a tight ponytail at the front of your head, and cut it.",How can you give yourself a layered haircut?
APU8QVDVUZB3Y,1,general,third,MTurk,TB_36_MT,4,"For two reasons. One, they are too heavy. For example, the Space Shuttle weighed 2 thousand tons, yet a Boeing can only carry about 120 tons. Second, the thrust is likely to be too strong.",Why don't space rockets take off from a plane already in the air?
APU8QVDVUZB3Y,1,general,third,MTurk,TB_43_MT,12,"Planets likely start off as grains of dust that then combine to form bigger rocks. They clear material from their path, leaving tracks of space empty but for fine dust.",How do planets form?
APU8QVDVUZB3Y,1,general,third,Trivia,TB_04_TR,16,Phil Knight,"In 1964, who founded Blue Ribbon Sports, which later went on to become Nike?"
APU8QVDVUZB3Y,1,general,third,Trivia,TB_10_TR,12,George VI,Who was the last British Monarch to also be an emperor?
APU8QVDVUZB3Y,1,general,third,Trivia,TB_16_TR,12,Jim Lovell,Alan Shepard was scheduled to command the ill-fated Apollo 13 before switching missions with what astronaut?
APU8QVDVUZB3Y,1,general,third,Trivia,TB_19_TR,16,Ketchup,The only vegetable ice cream ever produced was what flavor?
APU8QVDVUZB3Y,1,general,third,Trivia,TB_20_TR,4,Rafflesia (corpse lily),What is the largest flower in the world?
