PID,sess,firstBlock,block,type,questionId,wait_duration,answer,question
AQYW6CV7F14MF,1,general,corona,Not useful,C_03_NU,12,"Fuburary 1st, 2020",When was the molecular structure of the coronovirus identfied?
AQYW6CV7F14MF,1,general,corona,Not useful,C_06_NU,8,Gwyneth Paltrow,"Which celebrity said about the new coronavirus ""I've already been in this movie""?"
AQYW6CV7F14MF,1,general,corona,Not useful,C_14_NU,12,"January 30, 2020",On what date did the World Health Organization declare the new coronavirus outbreak to be a Public Health Emergency of International Concern?
AQYW6CV7F14MF,1,general,general,Not useful,NC_09_NU,4,Captain Cook,"Who christened Hawaii ""the Sandwich Islands"" in 1778?"
AQYW6CV7F14MF,1,general,general,Not useful,NC_13_NU,4,Bling bling,What term does rapper B.G. say he wishes he'd patented when he used it for the title of his massive 1999 hit?
AQYW6CV7F14MF,1,general,general,Not useful,NC_14_NU,4,Rod Serling,What famed TV personality wrote the screenplay for 1968's Planet of the Apes?
AQYW6CV7F14MF,1,general,general,Useful,NC_41_U,4,"April 8th, 2024",When is the next total solar eclipse visible in North America projected to occur? 
AQYW6CV7F14MF,1,general,general,Useful,NC_48_U,12,"Drop it from a 3 inch height. If it bounces, it's dead.",How can you tell if a battery is dead without using any tools?
AQYW6CV7F14MF,1,general,general,Useful,NC_52_U,16,"Tie your hair into a tight ponytail at the front of your head, and cut it.",How can you give yourself a layered haircut?
AQYW6CV7F14MF,1,general,third,MTurk,TB_26_MT,4,"Sometimes, it is easy to know, but science revealed that self-insight is prblematic. It is often very helpful to ask friends and family ",How do you know if you're happy?
AQYW6CV7F14MF,1,general,third,MTurk,TB_28_MT,12,"Futurist Diamandis argues that due to improved powers of computation we are likely to see AI, improved medicine, and new ways of communicating.",What is to happen ten years from now?
AQYW6CV7F14MF,1,general,third,MTurk,TB_35_MT,8,Prototypes already exist. Technological estimates suggest that definitely within the next twenty years -- although the challenges are great.,When will we have flying cars?
AQYW6CV7F14MF,1,general,third,Trivia,TB_09_TR,16,The first email,"What did Ray Tomlinson send in Cambridge, Massachusetts, in late 1971?"
AQYW6CV7F14MF,1,general,third,Trivia,TB_11_TR,12,Mung beans,What kind of bean produces the Asian-style bean sprouts in the produce section of supermarkets?
