PID,sess,firstBlock,block,type,questionId,wait_duration,answer,question
ARFQ8FJRKCUZ6,1,corona,corona,Not useful,C_03_NU,16,"Fuburary 1st, 2020",When was the molecular structure of the coronovirus identfied?
ARFQ8FJRKCUZ6,1,corona,corona,Not useful,C_07_NU,12,Pink,What color latex gloves did Naomi Campbell wear to protect herself from coronavirus?
ARFQ8FJRKCUZ6,1,corona,corona,Not useful,C_09_NU,8,Hubei,What is the name of the province in China in which this new coronavirus was first discovered?
ARFQ8FJRKCUZ6,1,corona,corona,Not useful,C_10_NU,4,11 million people,"What is the population of Wuhan, the city in which coronavirus was first identified?"
ARFQ8FJRKCUZ6,1,corona,corona,Not useful,C_14_NU,16,"January 30, 2020",On what date did the World Health Organization declare the new coronavirus outbreak to be a Public Health Emergency of International Concern?
ARFQ8FJRKCUZ6,1,corona,corona,Not useful,C_15_NU,4,7.5 days,"In the early stages of the new coronavirus, the number of new cases doubled approximately every how many days?"
ARFQ8FJRKCUZ6,1,corona,corona,Useful,C_42_U,16,"Fever, cough, shortness of breath.",What are the most common symptoms of the new coronavirus?
ARFQ8FJRKCUZ6,1,corona,corona,Useful,C_47_U,8,"Free of fever; no other symptoms, including cough; negative tests on at least two consecutive respiratory specimens at least 24 hours apart.",What are current Centers for Disease Control (CDC) guidelines for releasing someone from isolation?
ARFQ8FJRKCUZ6,1,corona,corona,Useful,C_50_U,16,Washington,The first US death from the new coronavirus occurred in which state?
ARFQ8FJRKCUZ6,1,corona,general,Not useful,NC_05_NU,16,Matthew,Which of the four biblical Gospels was written by a tax collector?
ARFQ8FJRKCUZ6,1,corona,general,Not useful,NC_14_NU,12,Rod Serling,What famed TV personality wrote the screenplay for 1968's Planet of the Apes?
ARFQ8FJRKCUZ6,1,corona,general,Not useful,NC_20_NU,16,Russia,Which country has the most public libraries?
ARFQ8FJRKCUZ6,1,corona,general,Useful,NC_27_U,16,White vinegar,What can you use instead of fabric softner to soften sheets and remove odours?
ARFQ8FJRKCUZ6,1,corona,general,Useful,NC_31_U,8,Sign up for a free USAA membership,How can people under 25 rent a car without paying extra fees?
ARFQ8FJRKCUZ6,1,corona,general,Useful,NC_33_U,4,Below eye level,Where in the supermarket can you usually find the cheaper items?
ARFQ8FJRKCUZ6,1,corona,general,Useful,NC_48_U,12,"Drop it from a 3 inch height. If it bounces, it's dead.",How can you tell if a battery is dead without using any tools?
ARFQ8FJRKCUZ6,1,corona,third,MTurk,TB_32_MT,16,Sophisticated equipment is either lowered to the sea bottom or directly attached to submersible buoys and transmits to a research vessel that is equipped with state-of-the-art navigational instruments.,What are undersea researchers doing to explore the ocean floor?
ARFQ8FJRKCUZ6,1,corona,third,MTurk,TB_45_MT,16,"The amygdala (from Greek, 'almond') is one of two almond-shaped clusters of nuclei located deep and medially within the temporal lobes of the brain in complex vertebrates, including humans.",What is the amygdala?
ARFQ8FJRKCUZ6,1,corona,third,MTurk,TB_46_MT,12,"Scientists are still figuring it out. It seems that passive use is slightly bad, but active use is not.",How does social media influence our mental health?
ARFQ8FJRKCUZ6,1,corona,third,Trivia,TB_04_TR,8,Phil Knight,"In 1964, who founded Blue Ribbon Sports, which later went on to become Nike?"
ARFQ8FJRKCUZ6,1,corona,third,Trivia,TB_22_TR,16,Cheetah,Which is the only cat that cannot retract its claws?
