PID,sess,firstBlock,block,type,questionId,wait_duration,answer,question
ARSIEY2IWLDX5,1,corona,corona,Not useful,C_12_NU,4,Diamond Princess,What was the name of the British cruise ship that was quarantined in Japanese waters?
ARSIEY2IWLDX5,1,corona,corona,Useful,C_28_U,16,"Yes, by boosting the immune system",Does sleep make you more resistant to coronavirus infections?
ARSIEY2IWLDX5,1,corona,corona,Useful,C_51_U,8,Nasal or orab swab or a sample of sputum,What sort of specimen is needed to test for the new coronavirus? 
ARSIEY2IWLDX5,1,corona,general,Not useful,NC_04_NU,8,Edward Albee,"Who wrote ""Who's Afraid of Virginia Woolf?"""
ARSIEY2IWLDX5,1,corona,general,Not useful,NC_12_NU,12,Come by her,"The title of the song ""Kumbaya"" is actually a distortion of what three-word phrase?"
ARSIEY2IWLDX5,1,corona,general,Not useful,NC_19_NU,8,Smoke,"in 1908, New York City passed the Sullivan Ordinance which made it illegal for women to do what in public?"
ARSIEY2IWLDX5,1,corona,general,Not useful,NC_25_NU,12,Shark,"What animal is thought to be immune to most all diseases, including cancer?"
ARSIEY2IWLDX5,1,corona,third,Trivia,TB_03_TR,16,Mrs. Doubtfire's,What 1993 film's title character has the first name Euphegenia?
ARSIEY2IWLDX5,1,corona,third,Trivia,TB_21_TR,8,New York,Which state has the zip code 12345?
