PID,sess,firstBlock,block,type,questionId,wait_duration,answer,question
ARXON28XQQFJ5,1,general,corona,Not useful,C_03_NU,16,"Fuburary 1st, 2020",When was the molecular structure of the coronovirus identfied?
ARXON28XQQFJ5,1,general,corona,Not useful,C_10_NU,16,11 million people,"What is the population of Wuhan, the city in which coronavirus was first identified?"
ARXON28XQQFJ5,1,general,corona,Not useful,C_12_NU,12,Diamond Princess,What was the name of the British cruise ship that was quarantined in Japanese waters?
ARXON28XQQFJ5,1,general,corona,Useful,C_27_U,16,Washing your hands frequently,What is the most effective measure to prevent infection with the coronavirus?
ARXON28XQQFJ5,1,general,corona,Useful,C_31_U,4,"The virus is probably not sexually tansmissible, but infection does occurs when kissing.",Can the coronavirus be transmitted through sexual intercourse?
ARXON28XQQFJ5,1,general,corona,Useful,C_45_U,4,"Pre-existing health conditions, including cardiovascular diseases and diabetes.",What did 75% of the people who have died from the new coronavirus have?
ARXON28XQQFJ5,1,general,general,Not useful,NC_12_NU,16,Come by her,"The title of the song ""Kumbaya"" is actually a distortion of what three-word phrase?"
ARXON28XQQFJ5,1,general,general,Not useful,NC_18_NU,4,A truce,What was put in place by the Ancient Greeks before and during all Olympic festivals?
ARXON28XQQFJ5,1,general,general,Not useful,NC_19_NU,4,Smoke,"in 1908, New York City passed the Sullivan Ordinance which made it illegal for women to do what in public?"
ARXON28XQQFJ5,1,general,general,Not useful,NC_24_NU,8,State quarters,What's been released five times a year from January 1999 to fall 2008?
ARXON28XQQFJ5,1,general,general,Not useful,NC_26_NU,8,Dark Side of the Moon,What album spent a record 741 weeks on Billboard's Top 200 Albums chart?
ARXON28XQQFJ5,1,general,general,Useful,NC_43_U,16,Between 105 and 54 days before the scheduled trip.,How far in advance of a trip is the most cost effective time to purchase a plane ticket? 
ARXON28XQQFJ5,1,general,general,Useful,NC_46_U,4,"Dish soap, peroxide, and baking soda","While tomato juice probably will not work, what does work to remove skunk odor? "
ARXON28XQQFJ5,1,general,general,Useful,NC_49_U,4,"Roll it along its long side. If it stops immediately, it's raw.",How can you tell if an egg is cooked without breaking it?
ARXON28XQQFJ5,1,general,third,MTurk,TB_25_MT,8,"Scientists estimate that we are likely to see flying cars, and that computers may be able to read people's thoughts and emotions ",What will be the new technologies of future?
ARXON28XQQFJ5,1,general,third,MTurk,TB_33_MT,4,"For SpaceX — the cheapest of NASA's new carriers — each pound costs approximately $27,000. So an average person of 160 pounds costs over $4,320,000.",How much does it cost to launch a person into space?
ARXON28XQQFJ5,1,general,third,MTurk,TB_34_MT,4,Evolution is usually very slow. Think about the similarities between apes and people. Future people are going to be as similar to us as we are to apes. ,What will future humans look like?
ARXON28XQQFJ5,1,general,third,MTurk,TB_41_MT,4,"Deep learning-based machines, that can process unparalleled amount of information will allow AI to accomplish goals that were unimaginable until very recently. ",What are the most recent developments in artificial intelligence?
ARXON28XQQFJ5,1,general,third,Trivia,TB_07_TR,12,Tuxedo Club,What New York country club lent its name to the kind of dinner jacket first worn there in 1886?
ARXON28XQQFJ5,1,general,third,Trivia,TB_20_TR,16,Rafflesia (corpse lily),What is the largest flower in the world?
ARXON28XQQFJ5,1,general,third,Trivia,TB_23_TR,8,Tooth,What is the only part of the body that can't repair itself?
