PID,sess,firstBlock,block,type,questionId,wait_duration,answer,question
AS2WTWYVRW9BV,1,general,corona,Not useful,C_12_NU,8,Diamond Princess,What was the name of the British cruise ship that was quarantined in Japanese waters?
AS2WTWYVRW9BV,1,general,corona,Not useful,C_13_NU,16,"The initial cases of the disease are thought to have been among people with a connection to a seafood wholesale market, which also sold live animals","Why is the virus believed to have zoonotic origin, i.e., to have potentially come from animals?"
AS2WTWYVRW9BV,1,general,corona,Not useful,C_23_NU,8,They falsely claimed to cure or prevent coronavirus,"At the end of February, Amazon banned over a million products because of what?"
AS2WTWYVRW9BV,1,general,corona,Not useful,C_25_NU,4,The viruses have spikes on their outer surface that look like a crown (or corona in Latin),What is the supposed origin of the name coronavirus?
AS2WTWYVRW9BV,1,general,corona,Useful,C_30_U,12,More similar to the symptoms of the ful,"Are the new coronavirus symptoms more similar to the symptoms of flu, or of seasonal allergies?"
AS2WTWYVRW9BV,1,general,corona,Useful,C_42_U,16,"Fever, cough, shortness of breath.",What are the most common symptoms of the new coronavirus?
AS2WTWYVRW9BV,1,general,corona,Useful,C_50_U,16,Washington,The first US death from the new coronavirus occurred in which state?
AS2WTWYVRW9BV,1,general,general,Not useful,NC_04_NU,8,Edward Albee,"Who wrote ""Who's Afraid of Virginia Woolf?"""
AS2WTWYVRW9BV,1,general,general,Not useful,NC_11_NU,8,Endeavour,What is the name of the ship that carried Captain Cook to Australia?
AS2WTWYVRW9BV,1,general,general,Not useful,NC_20_NU,16,Russia,Which country has the most public libraries?
AS2WTWYVRW9BV,1,general,general,Useful,NC_36_U,12,Potatos: rub a cut potato over your windshield before a frost to prevent freezing,What vegetable can prevent your windshield from freezing over in winter?
AS2WTWYVRW9BV,1,general,general,Useful,NC_40_U,12,Squint your eyes,How do you make your smile look more genuine in photographs?
AS2WTWYVRW9BV,1,general,general,Useful,NC_43_U,16,Between 105 and 54 days before the scheduled trip.,How far in advance of a trip is the most cost effective time to purchase a plane ticket? 
AS2WTWYVRW9BV,1,general,general,Useful,NC_46_U,8,"Dish soap, peroxide, and baking soda","While tomato juice probably will not work, what does work to remove skunk odor? "
AS2WTWYVRW9BV,1,general,general,Useful,NC_48_U,8,"Drop it from a 3 inch height. If it bounces, it's dead.",How can you tell if a battery is dead without using any tools?
AS2WTWYVRW9BV,1,general,general,Useful,NC_50_U,12,Spread beeswax over them and then blow dry until you can't see the beeswax anymore,What's an easy way to waterproof canvas shoes?
AS2WTWYVRW9BV,1,general,third,MTurk,TB_29_MT,12,"There are a few helpful techniques. One is to imagine that you climb on top of a high building, and ""look down"" at your life. Second, to try to think about issues in novel ways. ",How to stay calm in adversity?
AS2WTWYVRW9BV,1,general,third,MTurk,TB_31_MT,8,Scientists estimate that at the moment it is not. But with global warming it might become more feasilbe later in the 21st century.,How feasible would it be to colonize Antarctica?
AS2WTWYVRW9BV,1,general,third,MTurk,TB_34_MT,4,Evolution is usually very slow. Think about the similarities between apes and people. Future people are going to be as similar to us as we are to apes. ,What will future humans look like?
AS2WTWYVRW9BV,1,general,third,MTurk,TB_42_MT,16,"Galaxy formation occured in the aftermath of the Big Bang. Clustering and merging allows galaxies to accumulate mass, determining both their shape and structure. ",How do galaxies form?
AS2WTWYVRW9BV,1,general,third,MTurk,TB_45_MT,8,"The amygdala (from Greek, 'almond') is one of two almond-shaped clusters of nuclei located deep and medially within the temporal lobes of the brain in complex vertebrates, including humans.",What is the amygdala?
AS2WTWYVRW9BV,1,general,third,Trivia,TB_05_TR,4,Hong Kong,What city's harbor is overlooked by Victoria Peak?
AS2WTWYVRW9BV,1,general,third,Trivia,TB_09_TR,4,The first email,"What did Ray Tomlinson send in Cambridge, Massachusetts, in late 1971?"
AS2WTWYVRW9BV,1,general,third,Trivia,TB_16_TR,16,Jim Lovell,Alan Shepard was scheduled to command the ill-fated Apollo 13 before switching missions with what astronaut?
AS2WTWYVRW9BV,1,general,third,Trivia,TB_21_TR,8,New York,Which state has the zip code 12345?
