PID,sess,firstBlock,block,type,questionId,wait_duration,answer,question
ATV65PFDODC08,1,corona,corona,Not useful,C_01_NU,16,"Animals, probably bats",What is the source of coronavirus in humans?
ATV65PFDODC08,1,corona,corona,Not useful,C_11_NU,4,The Chicago of China,"Wuhan, China, the city in which the coronavirus was first identified, is commonly referred to as the chinese version of what American city?"
ATV65PFDODC08,1,corona,corona,Useful,C_31_U,8,"The virus is probably not sexually tansmissible, but infection does occurs when kissing.",Can the coronavirus be transmitted through sexual intercourse?
ATV65PFDODC08,1,corona,corona,Useful,C_35_U,4,"The virus spreads through coughs and sneezes, there are no reports of transmission through mosquito bites.",Can the new coronavirus be transmitted through mosquito bites?
ATV65PFDODC08,1,corona,corona,Useful,C_39_U,4,"No, antibiotics do not work against viruses, only bacteria.",Are antibiotics effective in preventing and treating the new coronavirus?
ATV65PFDODC08,1,corona,corona,Useful,C_41_U,8,Studies suggest that coronaviruses (including preliminary information on the new virus) may persist on surfaces for a few hours or up to several days.,How long does the new coronavirus survive on surfaces?
ATV65PFDODC08,1,corona,corona,Useful,C_51_U,12,Nasal or orab swab or a sample of sputum,What sort of specimen is needed to test for the new coronavirus? 
ATV65PFDODC08,1,corona,corona,Useful,C_52_U,8,No. To protect yourself against the new coronavirus washing your hands is the best preventive measure.,Are hand dryers effective in killing the new coronavirus?
ATV65PFDODC08,1,corona,general,Not useful,NC_04_NU,12,Edward Albee,"Who wrote ""Who's Afraid of Virginia Woolf?"""
ATV65PFDODC08,1,corona,general,Not useful,NC_14_NU,8,Rod Serling,What famed TV personality wrote the screenplay for 1968's Planet of the Apes?
ATV65PFDODC08,1,corona,general,Not useful,NC_23_NU,16,The Netherlands,In 1568 the Catholic Church sentenced the entire population of which nation to death as heretics?
ATV65PFDODC08,1,corona,general,Useful,NC_30_U,16,Floormats - put them under the wheels for traction,What item that can be found in any car can help you extract your car from mud or snow?
ATV65PFDODC08,1,corona,general,Useful,NC_40_U,8,Squint your eyes,How do you make your smile look more genuine in photographs?
ATV65PFDODC08,1,corona,general,Useful,NC_44_U,12,Doritos,What popular snack food is effective to use as kindling to start a fire?
ATV65PFDODC08,1,corona,third,MTurk,TB_37_MT,16,Engineers and architects agree that the answer is positive. Houses for the non-rich are much better built today than they were built 500 years ago.,Are houses built better than they used to be?
ATV65PFDODC08,1,corona,third,MTurk,TB_45_MT,12,"The amygdala (from Greek, 'almond') is one of two almond-shaped clusters of nuclei located deep and medially within the temporal lobes of the brain in complex vertebrates, including humans.",What is the amygdala?
ATV65PFDODC08,1,corona,third,Trivia,TB_06_TR,16,Xanadu,What 1980 film is named for the legendary square-shaped capital of Kublai Khan?
ATV65PFDODC08,1,corona,third,Trivia,TB_07_TR,8,Tuxedo Club,What New York country club lent its name to the kind of dinner jacket first worn there in 1886?
ATV65PFDODC08,1,corona,third,Trivia,TB_18_TR,12,Orville Wright,Who was flying the plane in which the first US airplane fatality occurred?
ATV65PFDODC08,1,corona,third,Trivia,TB_21_TR,16,New York,Which state has the zip code 12345?
