PID,sess,firstBlock,block,type,questionId,wait_duration,answer,question
AU76BTADWVVT0,1,corona,corona,Not useful,C_07_NU,8,Pink,What color latex gloves did Naomi Campbell wear to protect herself from coronavirus?
AU76BTADWVVT0,1,corona,corona,Not useful,C_09_NU,4,Hubei,What is the name of the province in China in which this new coronavirus was first discovered?
AU76BTADWVVT0,1,corona,corona,Not useful,C_11_NU,16,The Chicago of China,"Wuhan, China, the city in which the coronavirus was first identified, is commonly referred to as the chinese version of what American city?"
AU76BTADWVVT0,1,corona,corona,Not useful,C_18_NU,8,They are able to filter out at least 95% of airborne particles,Why are N95 respirator face masks so named?
AU76BTADWVVT0,1,corona,corona,Not useful,C_23_NU,4,They falsely claimed to cure or prevent coronavirus,"At the end of February, Amazon banned over a million products because of what?"
AU76BTADWVVT0,1,corona,corona,Useful,C_41_U,12,Studies suggest that coronaviruses (including preliminary information on the new virus) may persist on surfaces for a few hours or up to several days.,How long does the new coronavirus survive on surfaces?
AU76BTADWVVT0,1,corona,corona,Useful,C_47_U,4,"Free of fever; no other symptoms, including cough; negative tests on at least two consecutive respiratory specimens at least 24 hours apart.",What are current Centers for Disease Control (CDC) guidelines for releasing someone from isolation?
AU76BTADWVVT0,1,corona,corona,Useful,C_50_U,4,Washington,The first US death from the new coronavirus occurred in which state?
AU76BTADWVVT0,1,corona,general,Not useful,NC_03_NU,12,Red River,"What name is shared by the rivers that run through Denison, TX and Hanoi, Vietnam?"
AU76BTADWVVT0,1,corona,general,Not useful,NC_07_NU,4,Salt Lake City,In what city could you see the Seagull Monument at Temple Square?
AU76BTADWVVT0,1,corona,general,Useful,NC_34_U,4,"Pineapple, by planting the green leaves",What tropical fruit can be regrown from its scraps?
AU76BTADWVVT0,1,corona,general,Useful,NC_39_U,12,"At least $2,467 according to current research",How much money should I keep as an emergency fund?
AU76BTADWVVT0,1,corona,general,Useful,NC_40_U,12,Squint your eyes,How do you make your smile look more genuine in photographs?
AU76BTADWVVT0,1,corona,general,Useful,NC_52_U,4,"Tie your hair into a tight ponytail at the front of your head, and cut it.",How can you give yourself a layered haircut?
AU76BTADWVVT0,1,corona,third,MTurk,TB_30_MT,16,"The ""no hair theorem"" states that a black hole has only three properties: electric charge, angular momentum, and mass.",What is the composition of a black hole?
AU76BTADWVVT0,1,corona,third,MTurk,TB_31_MT,8,Scientists estimate that at the moment it is not. But with global warming it might become more feasilbe later in the 21st century.,How feasible would it be to colonize Antarctica?
AU76BTADWVVT0,1,corona,third,MTurk,TB_39_MT,16,"There is radio emission around black holes. Scientists created a network of telescopes, capturing an image of a black hole by improving upon a technique that allows for the imaging of far-away objects",How was the recent picture of a black hole made?
AU76BTADWVVT0,1,corona,third,Trivia,TB_02_TR,4,Ivory Coast's,"The world's largest church is Our Lady of Peace Basilica in Yamoussoukro, what nation's capital?"
AU76BTADWVVT0,1,corona,third,Trivia,TB_05_TR,4,Hong Kong,What city's harbor is overlooked by Victoria Peak?
AU76BTADWVVT0,1,corona,third,Trivia,TB_09_TR,8,The first email,"What did Ray Tomlinson send in Cambridge, Massachusetts, in late 1971?"
AU76BTADWVVT0,1,corona,third,Trivia,TB_13_TR,12,Java,On what namesake Asian island are the first Homo erectus fossils found?
