PID,sess,firstBlock,block,type,questionId,wait_duration,answer,question
AUREFQ6XFS87J,1,general,corona,Not useful,C_03_NU,8,"Fuburary 1st, 2020",When was the molecular structure of the coronovirus identfied?
AUREFQ6XFS87J,1,general,corona,Not useful,C_16_NU,8,Bats and pangolins,What other animals have been found to have viruses with highly similar genome sequences as the current coronavirus?
AUREFQ6XFS87J,1,general,corona,Not useful,C_18_NU,12,They are able to filter out at least 95% of airborne particles,Why are N95 respirator face masks so named?
AUREFQ6XFS87J,1,general,corona,Not useful,C_24_NU,4,Contagion,"According to media reports, which 2011 movie has seen a large increase in popularity in the wake of the new coronavirus?"
AUREFQ6XFS87J,1,general,corona,Useful,C_29_U,4,Not for at least several months from now,How soon is a vaccine for the new coronavirus likely to be available?
AUREFQ6XFS87J,1,general,corona,Useful,C_37_U,4,There is no evidence from the current outbreak that eating garlic has protected people from the new coronavirus.,Can eating garlic help prevent infection with the new coronavirus?
AUREFQ6XFS87J,1,general,corona,Useful,C_44_U,16,People over age 60,Approximately 80% of deaths attributed to the new coronavirus were among people of what age?
AUREFQ6XFS87J,1,general,corona,Useful,C_50_U,12,Washington,The first US death from the new coronavirus occurred in which state?
AUREFQ6XFS87J,1,general,general,Not useful,NC_18_NU,12,A truce,What was put in place by the Ancient Greeks before and during all Olympic festivals?
AUREFQ6XFS87J,1,general,general,Not useful,NC_19_NU,12,Smoke,"in 1908, New York City passed the Sullivan Ordinance which made it illegal for women to do what in public?"
AUREFQ6XFS87J,1,general,general,Not useful,NC_22_NU,8,Steamboat Geyser,"Which Yellowstone geyser, with eruptions 100 fee taller than Old Faithful's, is the world's tallest?"
AUREFQ6XFS87J,1,general,general,Useful,NC_36_U,16,Potatos: rub a cut potato over your windshield before a frost to prevent freezing,What vegetable can prevent your windshield from freezing over in winter?
AUREFQ6XFS87J,1,general,general,Useful,NC_40_U,12,Squint your eyes,How do you make your smile look more genuine in photographs?
AUREFQ6XFS87J,1,general,general,Useful,NC_42_U,16,"Deprive it of oxygen by covering, pouring baking soda if the fire is small, or using a fire extinguisher if it's large.",How do you put out a grease fire? 
AUREFQ6XFS87J,1,general,third,MTurk,TB_33_MT,12,"For SpaceX — the cheapest of NASA's new carriers — each pound costs approximately $27,000. So an average person of 160 pounds costs over $4,320,000.",How much does it cost to launch a person into space?
AUREFQ6XFS87J,1,general,third,MTurk,TB_37_MT,4,Engineers and architects agree that the answer is positive. Houses for the non-rich are much better built today than they were built 500 years ago.,Are houses built better than they used to be?
AUREFQ6XFS87J,1,general,third,MTurk,TB_41_MT,4,"Deep learning-based machines, that can process unparalleled amount of information will allow AI to accomplish goals that were unimaginable until very recently. ",What are the most recent developments in artificial intelligence?
AUREFQ6XFS87J,1,general,third,MTurk,TB_45_MT,8,"The amygdala (from Greek, 'almond') is one of two almond-shaped clusters of nuclei located deep and medially within the temporal lobes of the brain in complex vertebrates, including humans.",What is the amygdala?
AUREFQ6XFS87J,1,general,third,Trivia,TB_04_TR,8,Phil Knight,"In 1964, who founded Blue Ribbon Sports, which later went on to become Nike?"
AUREFQ6XFS87J,1,general,third,Trivia,TB_17_TR,16,"Third finger, left hand",What part of his body did Keith Richards insure for a million pounds?
AUREFQ6XFS87J,1,general,third,Trivia,TB_20_TR,8,Rafflesia (corpse lily),What is the largest flower in the world?
AUREFQ6XFS87J,1,general,third,Trivia,TB_23_TR,4,Tooth,What is the only part of the body that can't repair itself?
