PID,sess,firstBlock,block,type,questionId,wait_duration,answer,question
AV30KMIUKDG,1,general,general,Not useful,NC_05_NU,12,Matthew,Which of the four biblical Gospels was written by a tax collector?
AV30KMIUKDG,1,general,general,Not useful,NC_12_NU,4,Come by her,"The title of the song ""Kumbaya"" is actually a distortion of what three-word phrase?"
AV30KMIUKDG,1,general,general,Not useful,NC_17_NU,4,Gilbert Van Camp,What Indianapolis grocer made his name by selling canned pork and beans to U.S. troops during the Civil War?
AV30KMIUKDG,1,general,general,Useful,NC_40_U,8,Squint your eyes,How do you make your smile look more genuine in photographs?
AV30KMIUKDG,1,general,general,Useful,NC_51_U,16,White vinegar,What salad dressing ingredient is also an efficient weed killer?
