PID,sess,firstBlock,block,type,questionId,wait_duration,answer,question
AV6NBDW2FRR3W,1,corona,corona,Not useful,C_04_NU,12,"It stands for ""COronaVIrus Disease 2019""","Why is the new coronavirus called ""COVID-19""? "
AV6NBDW2FRR3W,1,corona,corona,Not useful,C_08_NU,4,Lombardy,What is the name of the county in Italy that had the first coronavirus outbreak?
AV6NBDW2FRR3W,1,corona,corona,Not useful,C_12_NU,4,Diamond Princess,What was the name of the British cruise ship that was quarantined in Japanese waters?
AV6NBDW2FRR3W,1,corona,corona,Useful,C_28_U,4,"Yes, by boosting the immune system",Does sleep make you more resistant to coronavirus infections?
AV6NBDW2FRR3W,1,corona,corona,Useful,C_49_U,8,"Approved filtering facemask respirators, such as the N95 respirator.","It is recommended that healthcare professionals who may be working in contact with people with the virus wear what, in addition to personal protective equipment on their hands and bodies?"
AV6NBDW2FRR3W,1,corona,corona,Useful,C_52_U,16,No. To protect yourself against the new coronavirus washing your hands is the best preventive measure.,Are hand dryers effective in killing the new coronavirus?
AV6NBDW2FRR3W,1,corona,general,Not useful,NC_03_NU,16,Red River,"What name is shared by the rivers that run through Denison, TX and Hanoi, Vietnam?"
AV6NBDW2FRR3W,1,corona,general,Not useful,NC_16_NU,12,Newborns,The apgar score is used to measure the color and condition of what?
AV6NBDW2FRR3W,1,corona,general,Not useful,NC_17_NU,4,Gilbert Van Camp,What Indianapolis grocer made his name by selling canned pork and beans to U.S. troops during the Civil War?
AV6NBDW2FRR3W,1,corona,general,Not useful,NC_19_NU,12,Smoke,"in 1908, New York City passed the Sullivan Ordinance which made it illegal for women to do what in public?"
AV6NBDW2FRR3W,1,corona,general,Not useful,NC_21_NU,8,The Pieta,Which was the only one of his sculptures that Michelangelo signed?
AV6NBDW2FRR3W,1,corona,general,Useful,NC_40_U,16,Squint your eyes,How do you make your smile look more genuine in photographs?
AV6NBDW2FRR3W,1,corona,general,Useful,NC_50_U,8,Spread beeswax over them and then blow dry until you can't see the beeswax anymore,What's an easy way to waterproof canvas shoes?
AV6NBDW2FRR3W,1,corona,third,MTurk,TB_36_MT,4,"For two reasons. One, they are too heavy. For example, the Space Shuttle weighed 2 thousand tons, yet a Boeing can only carry about 120 tons. Second, the thrust is likely to be too strong.",Why don't space rockets take off from a plane already in the air?
AV6NBDW2FRR3W,1,corona,third,MTurk,TB_38_MT,12,"As a rule, yes. Restaurants have to cover rent, salaries and taxes. These are all included in the prices.",Is it really cheaper to cook at home vs. eating out?
AV6NBDW2FRR3W,1,corona,third,MTurk,TB_43_MT,16,"Planets likely start off as grains of dust that then combine to form bigger rocks. They clear material from their path, leaving tracks of space empty but for fine dust.",How do planets form?
AV6NBDW2FRR3W,1,corona,third,MTurk,TB_45_MT,4,"The amygdala (from Greek, 'almond') is one of two almond-shaped clusters of nuclei located deep and medially within the temporal lobes of the brain in complex vertebrates, including humans.",What is the amygdala?
AV6NBDW2FRR3W,1,corona,third,Trivia,TB_01_TR,8,Canada,"What country is home to Roots, the company that outfits the U.S. Olympic team?"
AV6NBDW2FRR3W,1,corona,third,Trivia,TB_05_TR,8,Hong Kong,What city's harbor is overlooked by Victoria Peak?
AV6NBDW2FRR3W,1,corona,third,Trivia,TB_08_TR,4,Library of Congress,"In 1802, John Beckley became the librarian of what collection containing 740 books at the time?"
AV6NBDW2FRR3W,1,corona,third,Trivia,TB_10_TR,8,George VI,Who was the last British Monarch to also be an emperor?
AV6NBDW2FRR3W,1,corona,third,Trivia,TB_13_TR,4,Java,On what namesake Asian island are the first Homo erectus fossils found?
