PID,sess,firstBlock,block,type,questionId,wait_duration,answer,question
AVL8NX27320P,1,corona,corona,Not useful,C_01_NU,16,"Animals, probably bats",What is the source of coronavirus in humans?
AVL8NX27320P,1,corona,corona,Not useful,C_06_NU,12,Gwyneth Paltrow,"Which celebrity said about the new coronavirus ""I've already been in this movie""?"
AVL8NX27320P,1,corona,corona,Not useful,C_07_NU,16,Pink,What color latex gloves did Naomi Campbell wear to protect herself from coronavirus?
AVL8NX27320P,1,corona,corona,Not useful,C_14_NU,8,"January 30, 2020",On what date did the World Health Organization declare the new coronavirus outbreak to be a Public Health Emergency of International Concern?
AVL8NX27320P,1,corona,corona,Not useful,C_25_NU,4,The viruses have spikes on their outer surface that look like a crown (or corona in Latin),What is the supposed origin of the name coronavirus?
AVL8NX27320P,1,corona,corona,Useful,C_31_U,8,"The virus is probably not sexually tansmissible, but infection does occurs when kissing.",Can the coronavirus be transmitted through sexual intercourse?
AVL8NX27320P,1,corona,corona,Useful,C_45_U,12,"Pre-existing health conditions, including cardiovascular diseases and diabetes.",What did 75% of the people who have died from the new coronavirus have?
AVL8NX27320P,1,corona,corona,Useful,C_46_U,8,Remdesivir,"Which drug, which has been used as a treatment for the Ebola and Marburg viruses, might be promising as a treatment for this new coronavirus?"
AVL8NX27320P,1,corona,corona,Useful,C_48_U,16,Reserves need to be saved for people who are infected and for healthcare professionals.,Why does the CDC currently recommend that healthy people do not wear N95 face masks?
AVL8NX27320P,1,corona,general,Not useful,NC_04_NU,4,Edward Albee,"Who wrote ""Who's Afraid of Virginia Woolf?"""
AVL8NX27320P,1,corona,general,Not useful,NC_10_NU,8,K.D. Lang,What Canadian singer appeared on the first cover of Entertainment Weekly?
AVL8NX27320P,1,corona,general,Not useful,NC_13_NU,8,Bling bling,What term does rapper B.G. say he wishes he'd patented when he used it for the title of his massive 1999 hit?
AVL8NX27320P,1,corona,general,Not useful,NC_14_NU,4,Rod Serling,What famed TV personality wrote the screenplay for 1968's Planet of the Apes?
AVL8NX27320P,1,corona,general,Not useful,NC_22_NU,12,Steamboat Geyser,"Which Yellowstone geyser, with eruptions 100 fee taller than Old Faithful's, is the world's tallest?"
AVL8NX27320P,1,corona,general,Useful,NC_28_U,8,Microwave next to a glass of water,How can you soften brown sugar that has hardened into a lump?
AVL8NX27320P,1,corona,general,Useful,NC_34_U,8,"Pineapple, by planting the green leaves",What tropical fruit can be regrown from its scraps?
AVL8NX27320P,1,corona,general,Useful,NC_35_U,8,Wrap a wet paper towel around the bottle and put in the fridge,How can you cool beverages more quickly?
AVL8NX27320P,1,corona,general,Useful,NC_43_U,8,Between 105 and 54 days before the scheduled trip.,How far in advance of a trip is the most cost effective time to purchase a plane ticket? 
AVL8NX27320P,1,corona,general,Useful,NC_50_U,8,Spread beeswax over them and then blow dry until you can't see the beeswax anymore,What's an easy way to waterproof canvas shoes?
AVL8NX27320P,1,corona,third,MTurk,TB_34_MT,12,Evolution is usually very slow. Think about the similarities between apes and people. Future people are going to be as similar to us as we are to apes. ,What will future humans look like?
AVL8NX27320P,1,corona,third,MTurk,TB_37_MT,16,Engineers and architects agree that the answer is positive. Houses for the non-rich are much better built today than they were built 500 years ago.,Are houses built better than they used to be?
AVL8NX27320P,1,corona,third,MTurk,TB_44_MT,4,"In all U.S states, same-sex marriage is now legal. Also, the number of kids per family has decreased and so ""middle"" childreen, between the eldest and youngest, are getting rarer. ",How have families changed over time?
AVL8NX27320P,1,corona,third,Trivia,TB_03_TR,4,Mrs. Doubtfire's,What 1993 film's title character has the first name Euphegenia?
AVL8NX27320P,1,corona,third,Trivia,TB_11_TR,16,Mung beans,What kind of bean produces the Asian-style bean sprouts in the produce section of supermarkets?
AVL8NX27320P,1,corona,third,Trivia,TB_14_TR,8,James Brown,"When asked to define ""cool,"" what two words did James Brown use?"
AVL8NX27320P,1,corona,third,Trivia,TB_17_TR,12,"Third finger, left hand",What part of his body did Keith Richards insure for a million pounds?
