PID,sess,firstBlock,block,type,questionId,wait_duration,answer,question
AWK7ZVF05VMXA,1,corona,corona,Not useful,C_06_NU,16,Gwyneth Paltrow,"Which celebrity said about the new coronavirus ""I've already been in this movie""?"
AWK7ZVF05VMXA,1,corona,corona,Not useful,C_20_NU,16,"Rear Adm. Ziemer led the global health security team, responsible for leading the US response to pandemics.","In May 2018, Rear Admiral Timothy Ziemer left the White House staff and was not replaced. What was Rear Adm. Ziemer's responsibility in the White House?"
AWK7ZVF05VMXA,1,corona,corona,Not useful,C_24_NU,12,Contagion,"According to media reports, which 2011 movie has seen a large increase in popularity in the wake of the new coronavirus?"
AWK7ZVF05VMXA,1,corona,general,Not useful,NC_05_NU,4,Matthew,Which of the four biblical Gospels was written by a tax collector?
AWK7ZVF05VMXA,1,corona,general,Not useful,NC_16_NU,8,Newborns,The apgar score is used to measure the color and condition of what?
AWK7ZVF05VMXA,1,corona,general,Not useful,NC_24_NU,8,State quarters,What's been released five times a year from January 1999 to fall 2008?
AWK7ZVF05VMXA,1,corona,general,Useful,NC_44_U,4,Doritos,What popular snack food is effective to use as kindling to start a fire?
AWK7ZVF05VMXA,1,corona,general,Useful,NC_46_U,4,"Dish soap, peroxide, and baking soda","While tomato juice probably will not work, what does work to remove skunk odor? "
AWK7ZVF05VMXA,1,corona,general,Useful,NC_51_U,8,White vinegar,What salad dressing ingredient is also an efficient weed killer?
AWK7ZVF05VMXA,1,corona,third,MTurk,TB_34_MT,12,Evolution is usually very slow. Think about the similarities between apes and people. Future people are going to be as similar to us as we are to apes. ,What will future humans look like?
