PID,sess,firstBlock,block,type,questionId,wait_duration,answer,question
AX3EXSGDXF9ZJ,1,general,corona,Not useful,C_26_NU,8,Severe acute respiratory syndrome,The official name of the new coronavirus is SARS-CoV-2. What does SARS stand for?
AX3EXSGDXF9ZJ,1,general,corona,Useful,C_30_U,8,More similar to the symptoms of the ful,"Are the new coronavirus symptoms more similar to the symptoms of flu, or of seasonal allergies?"
AX3EXSGDXF9ZJ,1,general,corona,Useful,C_34_U,12,"The virus lives for up to a few days on surfaces, and so packages cannot transmit the virus.",Can the new coronavirus be transmitted on a package from an infected country?
AX3EXSGDXF9ZJ,1,general,corona,Useful,C_46_U,16,Remdesivir,"Which drug, which has been used as a treatment for the Ebola and Marburg viruses, might be promising as a treatment for this new coronavirus?"
AX3EXSGDXF9ZJ,1,general,corona,Useful,C_51_U,8,Nasal or orab swab or a sample of sputum,What sort of specimen is needed to test for the new coronavirus? 
AX3EXSGDXF9ZJ,1,general,general,Not useful,NC_03_NU,12,Red River,"What name is shared by the rivers that run through Denison, TX and Hanoi, Vietnam?"
AX3EXSGDXF9ZJ,1,general,general,Not useful,NC_05_NU,16,Matthew,Which of the four biblical Gospels was written by a tax collector?
AX3EXSGDXF9ZJ,1,general,general,Not useful,NC_14_NU,4,Rod Serling,What famed TV personality wrote the screenplay for 1968's Planet of the Apes?
AX3EXSGDXF9ZJ,1,general,general,Not useful,NC_21_NU,4,The Pieta,Which was the only one of his sculptures that Michelangelo signed?
AX3EXSGDXF9ZJ,1,general,general,Useful,NC_27_U,12,White vinegar,What can you use instead of fabric softner to soften sheets and remove odours?
AX3EXSGDXF9ZJ,1,general,general,Useful,NC_38_U,8,"Camu Camu, a cherry-like fruit from Brazil",What fruit has the highest content of vitamin C?
AX3EXSGDXF9ZJ,1,general,general,Useful,NC_42_U,16,"Deprive it of oxygen by covering, pouring baking soda if the fire is small, or using a fire extinguisher if it's large.",How do you put out a grease fire? 
AX3EXSGDXF9ZJ,1,general,general,Useful,NC_45_U,8,"Grapes or raisins, onions, avocado","In addition to chocolate, what other foods can be very harmful to dogs? "
AX3EXSGDXF9ZJ,1,general,general,Useful,NC_47_U,12,"Add baking soda, soak in advance, use a preassure cooker",What can you do to make dry beans cook faster?
AX3EXSGDXF9ZJ,1,general,third,MTurk,TB_28_MT,16,"Futurist Diamandis argues that due to improved powers of computation we are likely to see AI, improved medicine, and new ways of communicating.",What is to happen ten years from now?
AX3EXSGDXF9ZJ,1,general,third,MTurk,TB_30_MT,4,"The ""no hair theorem"" states that a black hole has only three properties: electric charge, angular momentum, and mass.",What is the composition of a black hole?
AX3EXSGDXF9ZJ,1,general,third,MTurk,TB_34_MT,8,Evolution is usually very slow. Think about the similarities between apes and people. Future people are going to be as similar to us as we are to apes. ,What will future humans look like?
AX3EXSGDXF9ZJ,1,general,third,MTurk,TB_37_MT,16,Engineers and architects agree that the answer is positive. Houses for the non-rich are much better built today than they were built 500 years ago.,Are houses built better than they used to be?
AX3EXSGDXF9ZJ,1,general,third,MTurk,TB_40_MT,4,"NASA plans another crewed mission to the Moon by 2024, followed by a sustained presence  by 2028.  Russia is planning to begin building a human colony by 2037.",When could a lunar base be established?
AX3EXSGDXF9ZJ,1,general,third,Trivia,TB_16_TR,8,Jim Lovell,Alan Shepard was scheduled to command the ill-fated Apollo 13 before switching missions with what astronaut?
