PID,sess,firstBlock,block,type,questionId,wait_duration,answer,question
AYDILOZLKOAS8,1,corona,corona,Not useful,C_11_NU,16,The Chicago of China,"Wuhan, China, the city in which the coronavirus was first identified, is commonly referred to as the chinese version of what American city?"
AYDILOZLKOAS8,1,corona,corona,Not useful,C_12_NU,8,Diamond Princess,What was the name of the British cruise ship that was quarantined in Japanese waters?
AYDILOZLKOAS8,1,corona,corona,Not useful,C_18_NU,16,They are able to filter out at least 95% of airborne particles,Why are N95 respirator face masks so named?
AYDILOZLKOAS8,1,corona,corona,Not useful,C_25_NU,12,The viruses have spikes on their outer surface that look like a crown (or corona in Latin),What is the supposed origin of the name coronavirus?
AYDILOZLKOAS8,1,corona,corona,Useful,C_34_U,8,"The virus lives for up to a few days on surfaces, and so packages cannot transmit the virus.",Can the new coronavirus be transmitted on a package from an infected country?
AYDILOZLKOAS8,1,corona,corona,Useful,C_41_U,12,Studies suggest that coronaviruses (including preliminary information on the new virus) may persist on surfaces for a few hours or up to several days.,How long does the new coronavirus survive on surfaces?
AYDILOZLKOAS8,1,corona,corona,Useful,C_43_U,16,Quarantine themselves for 14 days to make sure they are not infected.,"Currently, people who  may have been in contact with someone with the new coronavirus are recommended to do what?"
AYDILOZLKOAS8,1,corona,corona,Useful,C_45_U,4,"Pre-existing health conditions, including cardiovascular diseases and diabetes.",What did 75% of the people who have died from the new coronavirus have?
AYDILOZLKOAS8,1,corona,corona,Useful,C_52_U,4,No. To protect yourself against the new coronavirus washing your hands is the best preventive measure.,Are hand dryers effective in killing the new coronavirus?
AYDILOZLKOAS8,1,corona,general,Not useful,NC_03_NU,8,Red River,"What name is shared by the rivers that run through Denison, TX and Hanoi, Vietnam?"
AYDILOZLKOAS8,1,corona,general,Not useful,NC_21_NU,4,The Pieta,Which was the only one of his sculptures that Michelangelo signed?
AYDILOZLKOAS8,1,corona,general,Not useful,NC_23_NU,4,The Netherlands,In 1568 the Catholic Church sentenced the entire population of which nation to death as heretics?
AYDILOZLKOAS8,1,corona,general,Not useful,NC_26_NU,8,Dark Side of the Moon,What album spent a record 741 weeks on Billboard's Top 200 Albums chart?
AYDILOZLKOAS8,1,corona,general,Useful,NC_29_U,16,"Freeze before chopping, or hold a piece of bread in your mouth, half sticking out",How to chop an onion without crying?
AYDILOZLKOAS8,1,corona,general,Useful,NC_34_U,12,"Pineapple, by planting the green leaves",What tropical fruit can be regrown from its scraps?
AYDILOZLKOAS8,1,corona,general,Useful,NC_42_U,4,"Deprive it of oxygen by covering, pouring baking soda if the fire is small, or using a fire extinguisher if it's large.",How do you put out a grease fire? 
AYDILOZLKOAS8,1,corona,general,Useful,NC_43_U,16,Between 105 and 54 days before the scheduled trip.,How far in advance of a trip is the most cost effective time to purchase a plane ticket? 
AYDILOZLKOAS8,1,corona,third,MTurk,TB_33_MT,16,"For SpaceX — the cheapest of NASA's new carriers — each pound costs approximately $27,000. So an average person of 160 pounds costs over $4,320,000.",How much does it cost to launch a person into space?
AYDILOZLKOAS8,1,corona,third,MTurk,TB_34_MT,12,Evolution is usually very slow. Think about the similarities between apes and people. Future people are going to be as similar to us as we are to apes. ,What will future humans look like?
AYDILOZLKOAS8,1,corona,third,MTurk,TB_35_MT,12,Prototypes already exist. Technological estimates suggest that definitely within the next twenty years -- although the challenges are great.,When will we have flying cars?
AYDILOZLKOAS8,1,corona,third,Trivia,TB_04_TR,16,Phil Knight,"In 1964, who founded Blue Ribbon Sports, which later went on to become Nike?"
AYDILOZLKOAS8,1,corona,third,Trivia,TB_09_TR,12,The first email,"What did Ray Tomlinson send in Cambridge, Massachusetts, in late 1971?"
AYDILOZLKOAS8,1,corona,third,Trivia,TB_19_TR,12,Ketchup,The only vegetable ice cream ever produced was what flavor?
AYDILOZLKOAS8,1,corona,third,Trivia,TB_22_TR,8,Cheetah,Which is the only cat that cannot retract its claws?
AYDILOZLKOAS8,1,corona,third,Trivia,TB_23_TR,16,Tooth,What is the only part of the body that can't repair itself?
