PID,sess,firstBlock,block,type,questionId,wait_duration,answer,question
AYR1UT32659T0,1,general,corona,Not useful,C_02_NU,16,Three ,How many pandemics were there in the 20th century?
AYR1UT32659T0,1,general,corona,Not useful,C_13_NU,8,"The initial cases of the disease are thought to have been among people with a connection to a seafood wholesale market, which also sold live animals","Why is the virus believed to have zoonotic origin, i.e., to have potentially come from animals?"
AYR1UT32659T0,1,general,corona,Useful,C_33_U,12,Soft surfaces are less likely to transmit the virus than hard surfaces.,Can the new coronavirus be transmitted by touching a soft surface like carpets or fabric?
AYR1UT32659T0,1,general,corona,Useful,C_37_U,12,There is no evidence from the current outbreak that eating garlic has protected people from the new coronavirus.,Can eating garlic help prevent infection with the new coronavirus?
AYR1UT32659T0,1,general,corona,Useful,C_45_U,8,"Pre-existing health conditions, including cardiovascular diseases and diabetes.",What did 75% of the people who have died from the new coronavirus have?
AYR1UT32659T0,1,general,corona,Useful,C_47_U,4,"Free of fever; no other symptoms, including cough; negative tests on at least two consecutive respiratory specimens at least 24 hours apart.",What are current Centers for Disease Control (CDC) guidelines for releasing someone from isolation?
AYR1UT32659T0,1,general,general,Not useful,NC_04_NU,8,Edward Albee,"Who wrote ""Who's Afraid of Virginia Woolf?"""
AYR1UT32659T0,1,general,general,Not useful,NC_09_NU,4,Captain Cook,"Who christened Hawaii ""the Sandwich Islands"" in 1778?"
AYR1UT32659T0,1,general,general,Not useful,NC_11_NU,12,Endeavour,What is the name of the ship that carried Captain Cook to Australia?
AYR1UT32659T0,1,general,general,Not useful,NC_23_NU,12,The Netherlands,In 1568 the Catholic Church sentenced the entire population of which nation to death as heretics?
AYR1UT32659T0,1,general,general,Not useful,NC_25_NU,4,Shark,"What animal is thought to be immune to most all diseases, including cancer?"
AYR1UT32659T0,1,general,general,Useful,NC_37_U,8,"Over the past 150 year, real estate, if you rent it out",What's a better investment: stocks or real estate?
AYR1UT32659T0,1,general,general,Useful,NC_40_U,4,Squint your eyes,How do you make your smile look more genuine in photographs?
AYR1UT32659T0,1,general,general,Useful,NC_43_U,12,Between 105 and 54 days before the scheduled trip.,How far in advance of a trip is the most cost effective time to purchase a plane ticket? 
AYR1UT32659T0,1,general,third,MTurk,TB_28_MT,12,"Futurist Diamandis argues that due to improved powers of computation we are likely to see AI, improved medicine, and new ways of communicating.",What is to happen ten years from now?
AYR1UT32659T0,1,general,third,MTurk,TB_46_MT,8,"Scientists are still figuring it out. It seems that passive use is slightly bad, but active use is not.",How does social media influence our mental health?
AYR1UT32659T0,1,general,third,Trivia,TB_07_TR,8,Tuxedo Club,What New York country club lent its name to the kind of dinner jacket first worn there in 1886?
AYR1UT32659T0,1,general,third,Trivia,TB_08_TR,4,Library of Congress,"In 1802, John Beckley became the librarian of what collection containing 740 books at the time?"
AYR1UT32659T0,1,general,third,Trivia,TB_19_TR,4,Ketchup,The only vegetable ice cream ever produced was what flavor?
AYR1UT32659T0,1,general,third,Trivia,TB_20_TR,12,Rafflesia (corpse lily),What is the largest flower in the world?
