PID,sess,firstBlock,block,type,questionId,wait_duration,answer,question
AZ1UHQFEEL3WE,1,corona,corona,Not useful,C_03_NU,4,"Fuburary 1st, 2020",When was the molecular structure of the coronovirus identfied?
AZ1UHQFEEL3WE,1,corona,corona,Not useful,C_06_NU,16,Gwyneth Paltrow,"Which celebrity said about the new coronavirus ""I've already been in this movie""?"
AZ1UHQFEEL3WE,1,corona,corona,Not useful,C_09_NU,12,Hubei,What is the name of the province in China in which this new coronavirus was first discovered?
AZ1UHQFEEL3WE,1,corona,corona,Not useful,C_11_NU,4,The Chicago of China,"Wuhan, China, the city in which the coronavirus was first identified, is commonly referred to as the chinese version of what American city?"
AZ1UHQFEEL3WE,1,corona,corona,Not useful,C_25_NU,4,The viruses have spikes on their outer surface that look like a crown (or corona in Latin),What is the supposed origin of the name coronavirus?
AZ1UHQFEEL3WE,1,corona,corona,Useful,C_40_U,8,"The incubation period - the time between catching the virus and beginning to have symptoms of the disease - is estimated to range from 1-14 days, most commonly around five days.",How long is the incubation period for the new coronavirus?
AZ1UHQFEEL3WE,1,corona,corona,Useful,C_45_U,16,"Pre-existing health conditions, including cardiovascular diseases and diabetes.",What did 75% of the people who have died from the new coronavirus have?
AZ1UHQFEEL3WE,1,corona,corona,Useful,C_48_U,8,Reserves need to be saved for people who are infected and for healthcare professionals.,Why does the CDC currently recommend that healthy people do not wear N95 face masks?
AZ1UHQFEEL3WE,1,corona,corona,Useful,C_50_U,12,Washington,The first US death from the new coronavirus occurred in which state?
AZ1UHQFEEL3WE,1,corona,general,Not useful,NC_10_NU,4,K.D. Lang,What Canadian singer appeared on the first cover of Entertainment Weekly?
AZ1UHQFEEL3WE,1,corona,general,Not useful,NC_11_NU,8,Endeavour,What is the name of the ship that carried Captain Cook to Australia?
AZ1UHQFEEL3WE,1,corona,general,Not useful,NC_12_NU,4,Come by her,"The title of the song ""Kumbaya"" is actually a distortion of what three-word phrase?"
AZ1UHQFEEL3WE,1,corona,general,Not useful,NC_21_NU,16,The Pieta,Which was the only one of his sculptures that Michelangelo signed?
AZ1UHQFEEL3WE,1,corona,general,Not useful,NC_26_NU,12,Dark Side of the Moon,What album spent a record 741 weeks on Billboard's Top 200 Albums chart?
AZ1UHQFEEL3WE,1,corona,general,Useful,NC_31_U,4,Sign up for a free USAA membership,How can people under 25 rent a car without paying extra fees?
AZ1UHQFEEL3WE,1,corona,general,Useful,NC_32_U,8,Take a picture of your fridge before leaving the house,What's a simple trick for telling whether your out of something when you're grocery shopping?
AZ1UHQFEEL3WE,1,corona,general,Useful,NC_43_U,12,Between 105 and 54 days before the scheduled trip.,How far in advance of a trip is the most cost effective time to purchase a plane ticket? 
AZ1UHQFEEL3WE,1,corona,general,Useful,NC_46_U,8,"Dish soap, peroxide, and baking soda","While tomato juice probably will not work, what does work to remove skunk odor? "
AZ1UHQFEEL3WE,1,corona,third,MTurk,TB_28_MT,12,"Futurist Diamandis argues that due to improved powers of computation we are likely to see AI, improved medicine, and new ways of communicating.",What is to happen ten years from now?
AZ1UHQFEEL3WE,1,corona,third,MTurk,TB_29_MT,16,"There are a few helpful techniques. One is to imagine that you climb on top of a high building, and ""look down"" at your life. Second, to try to think about issues in novel ways. ",How to stay calm in adversity?
AZ1UHQFEEL3WE,1,corona,third,MTurk,TB_30_MT,4,"The ""no hair theorem"" states that a black hole has only three properties: electric charge, angular momentum, and mass.",What is the composition of a black hole?
AZ1UHQFEEL3WE,1,corona,third,MTurk,TB_32_MT,12,Sophisticated equipment is either lowered to the sea bottom or directly attached to submersible buoys and transmits to a research vessel that is equipped with state-of-the-art navigational instruments.,What are undersea researchers doing to explore the ocean floor?
AZ1UHQFEEL3WE,1,corona,third,MTurk,TB_45_MT,12,"The amygdala (from Greek, 'almond') is one of two almond-shaped clusters of nuclei located deep and medially within the temporal lobes of the brain in complex vertebrates, including humans.",What is the amygdala?
AZ1UHQFEEL3WE,1,corona,third,Trivia,TB_02_TR,8,Ivory Coast's,"The world's largest church is Our Lady of Peace Basilica in Yamoussoukro, what nation's capital?"
AZ1UHQFEEL3WE,1,corona,third,Trivia,TB_06_TR,16,Xanadu,What 1980 film is named for the legendary square-shaped capital of Kublai Khan?
AZ1UHQFEEL3WE,1,corona,third,Trivia,TB_09_TR,8,The first email,"What did Ray Tomlinson send in Cambridge, Massachusetts, in late 1971?"
