PID,sess,firstBlock,block,type,questionId,wait_duration,answer,question
AZIAQJWXTSFUX,1,corona,corona,Not useful,C_02_NU,4,Three ,How many pandemics were there in the 20th century?
AZIAQJWXTSFUX,1,corona,corona,Not useful,C_07_NU,4,Pink,What color latex gloves did Naomi Campbell wear to protect herself from coronavirus?
AZIAQJWXTSFUX,1,corona,corona,Not useful,C_12_NU,4,Diamond Princess,What was the name of the British cruise ship that was quarantined in Japanese waters?
AZIAQJWXTSFUX,1,corona,corona,Not useful,C_20_NU,8,"Rear Adm. Ziemer led the global health security team, responsible for leading the US response to pandemics.","In May 2018, Rear Admiral Timothy Ziemer left the White House staff and was not replaced. What was Rear Adm. Ziemer's responsibility in the White House?"
AZIAQJWXTSFUX,1,corona,corona,Not useful,C_24_NU,4,Contagion,"According to media reports, which 2011 movie has seen a large increase in popularity in the wake of the new coronavirus?"
AZIAQJWXTSFUX,1,corona,general,Not useful,NC_03_NU,4,Red River,"What name is shared by the rivers that run through Denison, TX and Hanoi, Vietnam?"
AZIAQJWXTSFUX,1,corona,general,Not useful,NC_20_NU,4,Russia,Which country has the most public libraries?
AZIAQJWXTSFUX,1,corona,general,Not useful,NC_23_NU,4,The Netherlands,In 1568 the Catholic Church sentenced the entire population of which nation to death as heretics?
AZIAQJWXTSFUX,1,corona,general,Not useful,NC_25_NU,12,Shark,"What animal is thought to be immune to most all diseases, including cancer?"
AZIAQJWXTSFUX,1,corona,general,Useful,NC_29_U,4,"Freeze before chopping, or hold a piece of bread in your mouth, half sticking out",How to chop an onion without crying?
AZIAQJWXTSFUX,1,corona,general,Useful,NC_30_U,4,Floormats - put them under the wheels for traction,What item that can be found in any car can help you extract your car from mud or snow?
AZIAQJWXTSFUX,1,corona,general,Useful,NC_35_U,12,Wrap a wet paper towel around the bottle and put in the fridge,How can you cool beverages more quickly?
AZIAQJWXTSFUX,1,corona,general,Useful,NC_38_U,8,"Camu Camu, a cherry-like fruit from Brazil",What fruit has the highest content of vitamin C?
AZIAQJWXTSFUX,1,corona,third,MTurk,TB_26_MT,12,"Sometimes, it is easy to know, but science revealed that self-insight is prblematic. It is often very helpful to ask friends and family ",How do you know if you're happy?
AZIAQJWXTSFUX,1,corona,third,MTurk,TB_32_MT,4,Sophisticated equipment is either lowered to the sea bottom or directly attached to submersible buoys and transmits to a research vessel that is equipped with state-of-the-art navigational instruments.,What are undersea researchers doing to explore the ocean floor?
AZIAQJWXTSFUX,1,corona,third,MTurk,TB_34_MT,8,Evolution is usually very slow. Think about the similarities between apes and people. Future people are going to be as similar to us as we are to apes. ,What will future humans look like?
AZIAQJWXTSFUX,1,corona,third,MTurk,TB_40_MT,16,"NASA plans another crewed mission to the Moon by 2024, followed by a sustained presence  by 2028.  Russia is planning to begin building a human colony by 2037.",When could a lunar base be established?
AZIAQJWXTSFUX,1,corona,third,MTurk,TB_43_MT,8,"Planets likely start off as grains of dust that then combine to form bigger rocks. They clear material from their path, leaving tracks of space empty but for fine dust.",How do planets form?
AZIAQJWXTSFUX,1,corona,third,Trivia,TB_17_TR,4,"Third finger, left hand",What part of his body did Keith Richards insure for a million pounds?
