PID,sess,firstBlock,block,type,questionId,wait_duration,answer,question
AZTYIBLLB60V8,1,corona,corona,Not useful,C_03_NU,16,"Fuburary 1st, 2020",When was the molecular structure of the coronovirus identfied?
AZTYIBLLB60V8,1,corona,corona,Not useful,C_05_NU,12,University of Washington,Which was the first US University to cancel classes becuase of the new coronavirus?
AZTYIBLLB60V8,1,corona,corona,Not useful,C_19_NU,4,Strategic National Stockpile,What is the name of the repository of drugs and supplies the U.S. government is supposed to maintain in case of a public health emergency?
AZTYIBLLB60V8,1,corona,corona,Not useful,C_20_NU,16,"Rear Adm. Ziemer led the global health security team, responsible for leading the US response to pandemics.","In May 2018, Rear Admiral Timothy Ziemer left the White House staff and was not replaced. What was Rear Adm. Ziemer's responsibility in the White House?"
AZTYIBLLB60V8,1,corona,corona,Not useful,C_23_NU,16,They falsely claimed to cure or prevent coronavirus,"At the end of February, Amazon banned over a million products because of what?"
AZTYIBLLB60V8,1,corona,corona,Not useful,C_24_NU,4,Contagion,"According to media reports, which 2011 movie has seen a large increase in popularity in the wake of the new coronavirus?"
AZTYIBLLB60V8,1,corona,corona,Useful,C_46_U,4,Remdesivir,"Which drug, which has been used as a treatment for the Ebola and Marburg viruses, might be promising as a treatment for this new coronavirus?"
AZTYIBLLB60V8,1,corona,general,Not useful,NC_11_NU,12,Endeavour,What is the name of the ship that carried Captain Cook to Australia?
AZTYIBLLB60V8,1,corona,general,Not useful,NC_13_NU,4,Bling bling,What term does rapper B.G. say he wishes he'd patented when he used it for the title of his massive 1999 hit?
AZTYIBLLB60V8,1,corona,general,Not useful,NC_14_NU,8,Rod Serling,What famed TV personality wrote the screenplay for 1968's Planet of the Apes?
AZTYIBLLB60V8,1,corona,general,Not useful,NC_15_NU,16,Albert Einstein,Who beat out FDR and Gandhi to be named Time's Person of the Century in 1999?
AZTYIBLLB60V8,1,corona,general,Not useful,NC_24_NU,12,State quarters,What's been released five times a year from January 1999 to fall 2008?
AZTYIBLLB60V8,1,corona,general,Useful,NC_34_U,16,"Pineapple, by planting the green leaves",What tropical fruit can be regrown from its scraps?
AZTYIBLLB60V8,1,corona,general,Useful,NC_43_U,4,Between 105 and 54 days before the scheduled trip.,How far in advance of a trip is the most cost effective time to purchase a plane ticket? 
AZTYIBLLB60V8,1,corona,general,Useful,NC_46_U,12,"Dish soap, peroxide, and baking soda","While tomato juice probably will not work, what does work to remove skunk odor? "
AZTYIBLLB60V8,1,corona,third,MTurk,TB_34_MT,12,Evolution is usually very slow. Think about the similarities between apes and people. Future people are going to be as similar to us as we are to apes. ,What will future humans look like?
AZTYIBLLB60V8,1,corona,third,MTurk,TB_37_MT,4,Engineers and architects agree that the answer is positive. Houses for the non-rich are much better built today than they were built 500 years ago.,Are houses built better than they used to be?
AZTYIBLLB60V8,1,corona,third,Trivia,TB_01_TR,4,Canada,"What country is home to Roots, the company that outfits the U.S. Olympic team?"
AZTYIBLLB60V8,1,corona,third,Trivia,TB_07_TR,8,Tuxedo Club,What New York country club lent its name to the kind of dinner jacket first worn there in 1886?
AZTYIBLLB60V8,1,corona,third,Trivia,TB_08_TR,12,Library of Congress,"In 1802, John Beckley became the librarian of what collection containing 740 books at the time?"
AZTYIBLLB60V8,1,corona,third,Trivia,TB_13_TR,4,Java,On what namesake Asian island are the first Homo erectus fossils found?
AZTYIBLLB60V8,1,corona,third,Trivia,TB_21_TR,16,New York,Which state has the zip code 12345?
