PID,sess,firstBlock,block,type,questionId,wait_duration,answer,question
AZXG2N87ERWCV,1,general,corona,Not useful,C_01_NU,12,"Animals, probably bats",What is the source of coronavirus in humans?
AZXG2N87ERWCV,1,general,corona,Useful,C_43_U,12,Quarantine themselves for 14 days to make sure they are not infected.,"Currently, people who  may have been in contact with someone with the new coronavirus are recommended to do what?"
AZXG2N87ERWCV,1,general,corona,Useful,C_45_U,4,"Pre-existing health conditions, including cardiovascular diseases and diabetes.",What did 75% of the people who have died from the new coronavirus have?
AZXG2N87ERWCV,1,general,general,Not useful,NC_01_NU,16,Mike Powell,"In 1991, who finally broke Bob Beamon's decades-old long jump record?"
AZXG2N87ERWCV,1,general,general,Not useful,NC_11_NU,4,Endeavour,What is the name of the ship that carried Captain Cook to Australia?
AZXG2N87ERWCV,1,general,general,Not useful,NC_19_NU,4,Smoke,"in 1908, New York City passed the Sullivan Ordinance which made it illegal for women to do what in public?"
AZXG2N87ERWCV,1,general,general,Useful,NC_31_U,4,Sign up for a free USAA membership,How can people under 25 rent a car without paying extra fees?
AZXG2N87ERWCV,1,general,general,Useful,NC_40_U,16,Squint your eyes,How do you make your smile look more genuine in photographs?
AZXG2N87ERWCV,1,general,third,Trivia,TB_19_TR,16,Ketchup,The only vegetable ice cream ever produced was what flavor?
